wjdguswkd**|여름에 입기 딱!! 좋은것 같아용~~ 얇고 시원하구!! 소재도 진짜 왕 부드러워영 ㅎㅎ 처음에 딱 받았을땐 구김이 좀 있었지만 이정도는 뭐~ 좋아영 얼른 살빼서 이쁜옷 많이 입고싶네용 제 몸에도 이렇게 이쁜 옷을 입을수 있다니 감격적이에용~~
myalla10**|사진으로 보이는거랑 거의 비슷하긴 해요다만 끈부분이 헐렁거려서 그게 좀 불편하네요디자인 귀엽고 괜찮구요허벅지부분이 그렇게 널널한편은 아니에요 참고하세요!나머진 다 마음에 들어요길이도 적당해요허벅지두께가 좀 있는 분들 빼고는 크게사실 필요 없을것 같네요
chw9**|사진에선 색이 잘 안보이는데 정말 파랑이구요 기여워요 근데 좀 아쉬운점은 바지가 좀 너무 무겁네요..그리고 약간 더운감도 있고 방수가 되니까 정말 바람통풍안될거같아요그래도 잘 입어야죠.. 땀나면 달라붙을거같은 그런재질 . 참고하세요
knr09**|배송 빨라서 좋았고 사이즈는 M 샀는데 허리도  맞고 길이도 짧지도않고 딱 적당하고 좋아요 활동하기에도 편하고 좋네요 색도 예뻐요~
chw9**|파파야 자수반티삿는데 너무 기여운거같아요ㅠㅠ 선인장이티는 생각 보다 조금 두껍고 길어서 더 이쁘고 기여워용 키가작아서 사진에선 바지에 넣고 입었는데 빼서 입어도 기여울거 같아요그리고 배색반티라서 더 독특하고 이쁨이쁨 ~. ~ !!
may2**|연핑크라서 마음에 들어용 얇아서 폭염와도 압어드 될것같네용 청바지나 등등 바지 아무거나 다 잘어울리구 치마에도 다 잘어울리는 색사잉에요 길이감도 너무길지도않고 짤지도 않아서 좋은 것 같네요 질도 나쁘지않고 괭춘 해요 다른 색상도 다이쁘네ㅕ
beautieyel**|레이스티와 펀칭티를 좋아해서 샀습니다. 레이스티와 펀칭티를 좋아해서 샀습니다. 레이스티와 펀칭티를 좋아해서 샀습니다. 레이스티와 펀칭티를 좋아해서 샀습니다. 레이스티와 펀칭티를 좋아해서 샀습니다. 레이스티와 펀칭티를 좋아해서 샀습니다. 레이스티와 펀칭티를 좋아해서 샀습니다.
choil8**|알리바바!!!!! 이번에 벌써 3번입고 나갔어욬ㅋㅋㅋㅋㅋㅋㅋ 회색이라 걱정하고 샀는데 짱이였습니다. 무난하게 이것저것 받쳐입기도 좋고 알리바바도 귀여워요 ㅋㅋㅋㅋㅋ 자수라서 코팅벗겨질 염려도 없다는게 좋구요!! 길이도 안 깁니다!!
choil8**|전에 이 비슷한 디자인에 가오리를 입었다가 망했는데 이번에는 성공한 것 같아요... 햄볶....☆ 길이감도 적당하고 옷두께도 적당하고 디자인도 다 좋아요 잘 산것같아서 좋습니다!!!!!!! 흰색이랑 회색고민하다 흰색샀는데 잘한 것 같네요!
choil8**|베이지색 무지로 하나 필요했었는데 생각 그 이상으로 짱짱이였습니다... 이번에 다시 하나더 사둘려고요 짱좋아요 진짜..... 가격대비 짱짱 길이감도 좋고 진짜 좋아요 색은 약간 짙은 베이지기는 한데 괜찮아요 좋아요 진짜로!!!!!
choil8**|사실 카키색이 잘 어울리는 타입이 아니긴한데 흰치마를 사서 위에 받쳐입을 옷이 필요했거든요 ㅜㅜ 근데 이제 너무 킥킥한 카키일까봐 걱정하고 샀는데 생각보다 굿굿 받쳐입기 딱 좋아요 ㅜㅜ 기장도 별로 안 길고 그래서 키작은 저에겐 딱 입니다.
jenniferk**|분홍색 색이 되게 진해요! 이쁨무난
jenniferk**|음이건약간 엄청얇은 슬랙스재질느낌...? 신축성은전혀없고 핏은사진같아요! 카키가더이쁠듯
hons**|배송도 빠르고 스판면도 매우 만족해요 ! 처음 이 쇼핑몰 시켜봤는데 반품,환불 과정도 되게 체계적으로 되는걸 택배물보고 알았어요 . 왜 고고싱이 인기가 많은지 알겠더군요 전 하이웨스트 청바지랑 입으니까 되게 잘어울린다고 생각했어요~다른 상품도 사고싶단 생각이 드네요
jenniferk**|무지펀함,
jenniferk**|음 그냥사진이랑ㅇ같아요 재질이 니트재질이에요
jenniferk**|이거진짜니뻐뇨 제일기대안햇는데 재질도좋음
jenniferk**|이뻐요 허리쫌큼
jenniferk**|이거 이쁜데 한번빨앗더니목이좀늘어낫어요ㅠ 글자색 완전남색이에요
jenniferk**|젛아요 목도안ㄴ,ㅇ어낭
jenniferk**|짱이쁨
jenniferk**|스판기진짜 없어요ㅠㅠㅠㅠ 168 54 라지시켯는데 꽉끼네요
jiwon11**|길이가 길긴 하지만 사이즈두 널널하구 활동하기 엄청 편해여!! 색깔두 무난하구 디자인두 예뻐서 아무때나 입어두 좋을거같아여!! 가격도 엄청싸구 가격대비 진짜 짱짱!! 너무좋아요ㅠㅠㅠㅠ 배송두 너무빠르고 엄청 만족합니다!!!
jiwon11**|깔끔하구 색깔두 예쁘고 레터링들어간것두 너무예뻐요!!! 가격두 너무저렴하고 가성비 짱짱!!!!!!! 사이즈두 널널해서 편해용!! 커플티루두 완전예쁠거같아여!! 강추!! 배송두 너무 빠르구 고고싱 너무좋아요~~~~♥♥
thgus4567**|후라이스라운드 5부티 검정색이예요!! 원피스안에 입으려고 구매했어요 ㅎㅎ 왜 21차 입고인지를 알게해주는 티예요 ㅠㅠ!! 5부기장인데 막 길다고 별로불편하지도 않고 붙는옷이라서 안거슬리고 딱좋아요!! 스판끼도 잇어서 정말좋앗습니다 ㅎㅎ 저렴한가격에 하나쯤 잇어도 좋을법한 옷이예요!
thgus4567**|흰색 착용샷이예요! 원피스안에 받쳐입으려고 구매햇는데 딱달라붙어서 정말 맘에들어요 ㅎㅎㅎㅎ 길이도 5부길이라 다른옷들에 비해서 특이하구 이쁘네요!! 따로 이거랑 청스키니진이랑 입어두 되게 이쁠것같아요 ㅎㅎ 기본템이라 어디에든 잘어울려요!! 구매하길 정말 잘햇다고 생각하는옷중에 하나입니다..♡♡
thgus4567**|후기에서 봐도 작게나왔다고 하더라구요 ㅠㅠ m삿는데 제가 하비라서 허벅지랑 종아리부분이 잘안들어가더라구요 ㅠ.ㅠ 종아리에 알잇으신분은 구매하시면 안될것같아요... 흑흑 스판이 아예없어서 입기도 힘들엇구요 ㅠㅠ 얇으신분께 추천합니닷.. 배기로 구매하시는분들은 정사이즈로 사지 마시구 한치수 큰걸로 사세요!! L살껄 후회중입니다 ㅠㅠ
thgus03**|굽도 높고 푹신푹신해서 좋아요 ㅎㅎ  올여름은 이 샌들 자주 신을라고요 ㅎㅎㅎ오래신다보니 자국이 좀 남긴하지만 그래도 신을만해요 ㅎㅎ무엇보다 가격이 저렴하니깐 정말 좋은거 같아요 ㅎ검은색도이쁘고 흰색도 이쁠꺼같애요ㅎㅎ!!!!
bubble**|진짜 고고싱 칼배송 짱이예요!옷이 너무이뻐보여서 살까말까했다가 바로질렀는데 옷은정말이뻐요!근데 더 살뺴고 입으면 이쁠것같아요 ㅎㅎ 핏정말이쁘구 디자인정말이뻐요~가격대비좋아요 ㅋㅋㅎ!!정말맘에들어요 비침도없고 소재도 괜찮은거같아요!감사합니당 ><
thgus4567**|브이넥티 찾고있었는데 눈에띄어서 구매했어요! 브이넥부분 짱짱하구요! 잘안늘어날것같아요 ㅎㅎ 별로 비치치도 않고 무난해서 어디에든 잘어울릴것같네요 ^^~ 브이넥이 조금많이 파여있어서 (제기준) 아주약간 아쉽긴하지만 이가격에 정말 잘샀다고 생각하구 자주손이갈것같아요 ㅎㅎ!!
funny99**|미듐 품절나서 라지시켜입고 보정안되서 미듐으로 다시 주문했어요배송빠르고 보정 잘되네요번창하세요
wyoungm**|분명 구피를 사려고 샀던건데 장바구니 확인을 제대로 안하고 사서 이게왔네요 그래도 귀엽고 좋아요 그냥 사고 싶으시면 별고민없이 사셔도 될것같아요ㅎㅎ 두루두루 잘어울리실것같아요 옷색도 이뻐요 추천합니다ㅎㅎ 근데 목이 살짝 잘늘어날것같아요
dbsk99**|싸고 좋은 벨트 두께가 좀얇지만 그래도 이뻐요
dbsk99**|핑크색을 시켯는데 어두운 핑크색이와서 놀랏지만 그래도 잘입을께요 이뻐요
dbsk99**|사이즈 크게나왓데서 그래도 그냥 m 삿더니 크긴크네요 .. 그래도 밸트차고 나니까 갠찬은거같아요 바지 싸고 제가원하는스타일 헤짐도 잘되어잇어서 좋아요
wyoungm**|생각보다 별로였어요ㅠㅠ 팔통이나 품이커서 약간 환자복같아요..ㅠㅠ색이 분홍색이라그런건지 제일 기대했던 옷인데 밑에 뭘입어야할지도 모르겠네요ㅠㅠ 브이넥은 많이 안파여서 좋은데 사실때 사이즈 잘생각해보시고 사야할것같아요
coqls09**|그레이로구입했어요 산지하루만에도착해서엄청놀랐어요 사스가 고고싱 색도 이뿌고 슬라브라서그런지 얇아요 제가 더위를 많이타는편이라 얇은옷을원했는데 제가원하는 딱 그런 옷이 왔네요 여튼 옷 잘입겠습니다 자주 이용할게요~~~
dbsk99**|진짜완전좋아요 그냥 입고나가도델듯 ! 저는 이거입고 남방입을려구요 짱이에요
wyoungm**|다른 후기들처럼 사이즈는 약간 크게 나온것같아요. 바지자체는 이쁘고 청반바지 입을게 없었는데 잘 마련한것같네요. 사이즈만 잘보고 사시면 만족할수있을것같아요 바지질도 나쁘지 않습니다.바지도 하이웨스트라 다리도 길어보여요 추천해용
wldnwkd4**|시원하고 얇아서 땀도 금방 빠져나가고 어떤 바지에든 잘어올리는거 같아요 팔도 얇아보이고 목도 길어보이는 효과도 잇어요1!추천해드려요!
cjsk83**|우선 배송은 정말 빨랐어요 하지만 가격 탓인지 속바지 밑단이 엉망이고 실밥도 다 터져있는게 와버렸네요 ㅠ ㅠ 속상하네요 이거만 반품할수 없어 그냥 입으려고는 하는데 흰색이라 속옷이 다 비쳐서 속바지 입으나 마나네요 ㅠ 주문한 다른상품들은 마음에 들었는데 옥에 티가 되어서 아쉽네요..ㅠ
hio0**|생각했던 베이지색보다는 좀 어두운 편이였어요! 옷자체는 굉장히 이뻐요 근데 이렇게 폭염에 입기엔 좀 두꺼웠요 옷자체가 크게 나왔고 쫌 길어서 몸집이 작으신분이 입으면 이쁠거같아요 옷이 길어서 꼭바지 넣고 입어야할거같다는.. 살까 말까하시는 분들은 사라고 추천해드리고싶어요 !
wldnwkd4**|생각보다 딱 맞고 별로 짧지도 않고 스판도 잘되있어서 좋아요!무난한 티에도 잘어올리고 소재가 얇아서 여름에 입기좋구 딱 달라붙어서 다리도 길어보이고 얇아보이게하는 효과가 있는거 같아요!! 그렇다고 붙긴한데 스판이라 별로 움직이는데는 지장없어요!
sin98**|제가 바지를 검은색이랑 아이보리색 두개 샀는데 검은색바지 뒤에 있는게 같은 L사이즈인 아이보리바지인데 아이보리 바지가 확연히 더커요. 그래서 사이즈를 재서 원래사이즈랑 비교해봤는데 아이보리는 1~2센치가더컸고 검정색은 원래사이즈보다 작았어요 검정색 환불가능한가요?
rica**|깔별로 스커트 좋아요 !기본 치마가 없어서 블랙을 샀는데 너무이쁘네요 스판기는 허니진? 그것보다는 부족한 것 같아보이지만 솔직히 에이치라인은 너무 스판있는것보다도 몸을 좀 잡아주는게 이쁘다고 보기 때문에추천이요 !그리고 생각보다 약간 얇은 재질이어서 참고해주시면 좋을 것 같아요 !치마 길이도 적당해서 하이웨스트로 입기 참 좋은 것 같구요 기본적으로 하나쯤 있으면 좋을 것 같은 치마예요 다른 쇼핑몰에서는 보통 M입어도 편한경우가 많았는데 이 치마는 엘 시켰는데 딱 맞더라구요 허리만 살짝 크고 그만큼 완전 H라인 치마이기때문에 신중히 사이즈 결정하시는 게 좋을 것 같아요 !
nalin1**|평소 27사이즈에서 28입어서 m주문 했는대길이는 맞는데 허리가....ㅠㅠㅠㅠㅠ허리가 쫀쫀해요ㅠㅠㅠ 그래서 안맞아요ㅠㅠㅠㅠ 결국 동생 줬어요 이건 한사이즈 크게 시켜야 좋을것 같아요하지만 디자인은 만족스럽네요 허리만 조금..아쉽네요그래도 고고싱 좋아요!!!
apple0**|저는 연청 s사이즈 샀는데요 색깔도 화면 그대로구 진짜 이쁨요!!!사이즈도 딱 제가원하던 사이즈고 핏도 딱맞아여 근데 배송이 쫌 늦어서 아쉬운 점이 있었지만 좋아요!!!! 안에 아무색깔 티 입어도 이쁘고 주머니 넘 귀엽ㅜㅗㅜ 암튼 잘 입겠습니닥
rica**|안녕하세여 ! 고고싱 첫구매인데 ,,너무 좋은 것 같애요 ! 특히 롤업슬라부 칠부티 완전 추천입니다 !일단 색감이 너무 예쁜 , 티셔츠에요 베이지색하면 은 보통찜방 색 느낌나는것 도 있는데 , 고고싱꺼는 진짜 은은한 베이지색이라서 더욱 이쁜 것 같네요 !그리고 두번째는 길이예요, 보통 칠부티면 여름에도 입지만 가을에도 활용할 수 있는데짧은 여름티가 많더라구요 , 근데 이거는 엉덩이를 딱 가리니까 가을에 청바지에 입어도 예쁠 것 같아요 세번째로는 서비스 입니다 ! 택배오는 것도 배송완료까지 문자가 계속 오고 쿠폰발송이니 뭐니 이런 상세한 것들의 메모가 잘 설명되어있어서 너무좋았어요 ! 쇼핑몰 하면 고객관리가 중요하다고 보는데 고고싱최고에요!
lhj11**|이상품 처음에 딱 보자마자 장바구니 넣어놈ㅠㅠㅠㅠㅠ 존예에요 근데 생각보다 길이가 짧아서 음 길이가 상체에서 2cm 정도 밖에 안가려지는정도? 그냥 거의 상체만가리는정도라고생각하시면 될것같네요! 그래서 반바지랑입으면 괜찮은데 긴바지랑입으면 뭔가 어정쩡한느낌ㅁ.. 근데또 치마랑은잘어울림ㅋㅋㅋㅋㅋㅋ 좋아용
tjdud60**|생각했던것 보다 예뻐요!!! 줄무늬여서 뚱뚱해 보일까봐 걱정했는데 훨씬 날씬해보여요!!
ac966990**|-매트글로스 선글라스 후기-선글라스사기전에 후기보는데 기스나있었다거나 장난감같다거나 한것들이 좀 많이보여서 고민하다가 가격이너무착해서 그냥한번 사보자 하고 삿는데 후회안해요ㅠㅠㅠ정말 너무 이쁘고 장난감같지않은거같아요!!
lhj11**|..대박입니다ㅠㅠㅠㅠㅜㅠㅜㅠㅜㅠㅜ 짱임!!.. 이번에 산 옷 거의다 좋아요 완전좋음 색도 밝아서 엄청 환해보임!! 디자이니도 이뻐요 근데 처음받고 뜯었을때 실밥이 좀 나와있었어요 치마밑부분에 실이 길게 늘어져있었다는ㄴ... 그래도 이뻐서 좋았습니당
khs15**|청스커트처음사보았는데생각보다괜찮네요 ㅎㅎ엄청쫀쫀해서더맘에들었어요!!사이즈s시켜서좀입기힘들긴하지만입다보면괜찮을것같아요 ㅎㅎ색상도생각했던것처럼맘에들고위에기본티랑매치해서입어두괜찮네요 추천합니다~적립금부탁드려요
sonia8**|구매하기전에 우산소재같다, 치마가 짧다, 끊이 짧다, 벗을때불편하다 이런얘기가 많아서 다른원피스로 살까하다가 땡땡이가 마음에 들어서 주문하였는데 소재는 여름에 시원하게 입을수 있어서 좋을것 같구요 치마는 키가 156인데 안짧아요 딱맞네여! 그리고 끈도 적당하고 벗을때도 그렇게 불편하지는 않아요!! 너무마음에 드네요! 감사합니다! ㅎㅎㅎ 항상 고고싱에서만 옷사는데 빠른배송감사합니다! 더운데 수고하세요!^^
khs15**|저번에무지반티흰색구입하구나서괜찮아서검정색도구입하였는데역시기본으로매치해서입기편해서좋아요 ㅎㅎ면도부드럽고여름에기본티로입기좋을것같습니다!이가격에잘구입한것같아요~~추천합니다 길장길이는좀애매해서안에넣어서입는게이쁜것같아요잘입겠습니다 적립금부탁드려요
lhj11**|애프터에잇 반티 저는 아이보리 샀는데 왕이쁨 그레이랑 아잉보리랑 둘다 이뻐서 뭐살까 계속고민하다가 아이보리샀는데 이뻐요!!! 근데 왠지 세탁하면 줄어들거같은 느낌..ㅠㅠㅠ 그래도 면 부들부들해서 좋습니당 멜빵이랑도 잘어울려요 ㅎㅅㅎ
ac966990**|처음에 블랙살까고민하다 핑크로 입어보고싶어서 핑크사가지고 친구한테 말했더니 자신있냐고 말해서 색이 좀 튀거나하진않을까 걱정하긴했는데 그럴필요가없엇네요ㅋㅋㅋㅋㅋㅋ색이정말 이쁘고 사이즈도 적당한거같아요ㅎ원래s 입는데 혹시몰라서 m시켯더니 옷넣어입고하니까 딱맞아요! 옷이 약간 꾸깃해서 와가지고 사진에서 옷주름이 별로 안이뻐보일수도 있어요ㅠㅠ 꾸깃한거피니까 너무이뻐요♥♥♥
lhj11**|아.. 이거 오자마자 입어봤는데 발목넘어가는거조차힘들어요.. 스판이 진짜 아예 하나도 없음.. 참고해서 사시길.. 전 이정도로 없을줄 몰랐어요..ㅠㅠㅠㅠㅠ 게다가 단추도 잘안되요..ㅠㅜㅠㅜ 디자인은 그럭저럭 괜찮은데 스판성이너무없어서 좀 많이 아쉽네요..ㅠ!
sin98**|아이보리 바지 처음샀는데 되게 만족스러웠습니다. 처음에는 조금 꼈는데 계속입다보니 늘어나서 아주 편했습니다. 정말 잘 늘어납니다! 근데 좀 얇아서 겨울에는 입기 힘들것같습니다. 그래도 얇으니깐 여름에 시원하게 잘 입을수 있을것 같아요~ 근데 살짝 비치긴합니다. 그래도 처음 산 치고 되게 짱이요!! 많이 애용할게요♡♡
dlsgp17**|사진은 좀기찬아서막찍엇구요 54 키로라서 엠이맞을가안맞을가햇는데 딱 적당한사이즈엿어요 색깔도이쁘구 실물로보면 대게갠차나요 만족입니다!
thgml23**|저는 아이보리로 샀는데요. 생각보다 너무 얇아서 속옷이 뒤에서 비췄어요ㅠㅠ그래도 많이 비추지 않아서 조금 다행이긴 하지만 조금 비추는편이에요!!!그래도 얇고 시원해서 진짜 오늘같은날 입으면 굿!!!!!!!!같이 코디되어있는 반팔티랑 입었는데 정말 예뻐요
wi04**|잘늘어나고 핏도 좋아욧~
leah6**|가격에 비해 제질 별로에요그래도 무난해서 그냥 씁니다....근데.. 이거 살바에 오프라인에서 오천원짜리사는게 더 나아요. 그게 더 재질이 좋은거같아요...그냥 한철만 쓰고 버려야할것같습니다.차라리 돈 더내고 재질이 더 좋은걸 사세요~
lhj11**|"20수베이직 반티 ""고고싱 베이직라인"" 이상품 진짜 좋아요 짱좋음 갈이도 엄청길어서 반바지입고 입으면 하의실종될정도.. 면도 부들부들 해서 좋고 진짜 딱 흰색이라 무슨색이랑 입어도 다 잘어울림 bb! 가격대비도 짱이인듯! 청바지든 치마든 바지든 슬랙스든 다 잘어울릴거같음ㅋㅋㅋㅋ 좋아요"
wi04**|진짜 좋은거같아요- 키, 몸무게 160, 65-착용사이즈 xl-착용후느낌은?(좋은점/나쁜점)30입는데 l살려니 너무 딱붙을꺼 같아서 xl샀는데 적당하게 붙고 잘늘어나고 좋아요
thgml23**|같이 코디 되어있는 바지도 같이 구입해서 입었는데요 정말 예뻐요!제가 체구가 작아서 그런지 팔꿈치를 덮는 길이였는데 그래두 예뻤어요!빼서 입으면 너무 클것같아 항상 안으로 넣어서 입어야 하는건 좀 아쉽지만그래도 예쁘고 생각보다 너무 얇은것두 아니라서 초가을까지 입을수있을것같아요!
dlsgp17**|딱보자마자 대게사고싶엇어요 사진이너무이쁘길래그래서 29일에세일하길래 싼가격에 살수잇엇어요천이제가 대게좋아하는천이에요 맘에 들어요 짧은건감안하고 검은반바지밑에입을거생각하고 샀어요 여튼대게 만족이에요!
lny29**|반바지 미니슬랙스랑 같이 주문했는데택배도 꽤 빨리 왔고 만족해요!!산지 쪼금 됬는데 무난하게 잘입고 다녀요!!근데 많이 빨지 않았는데 모양이 조금 흐트러지더라구요그런 거 빼고는 잘 입고 다닙니다+!
leah6**|진짜 별루에요....최악이에요.... 별 하나 주기도 아까움..쇼핑몰에서 이때까지샀던 옷들 중 가장 최악이에요플리츠는 주름이 생명인데. 이건 뭐 배송오자마자 구겨져서오고 주름 다 이상하게 잡혀져있고, 배송오자마자 입고나가야 해서 그때는 너무 급해서 다리미로 다려서 어찌어찌 입었지만, 그래도 주름이 정상적이진 않네요.... 싼이유를 알겟어요. 차라리 오천원 더 주고 더 비싼걸 사는게 나은거 같아요. 쇼핑몰 이름걸고 자체제작하는건데 좀 더 신경써서 만드셨으면 좋겠습니다. 그냥 이번 한철만 입고 버릴려구요.
ac966990**|[허니진] 짱기럭지 하이스키니 연청 구매후기!!옷받고나서 제일먼저 입어봣어요!!사이즈를 s로 시켯는데 약간 쪼여가지고 손으로 조금 늘려줬더니 그다음에 입을때부턴 괜찮은거같아요ㅎㅎ기대한만큼 옷도이쁘고 색도맘에들어요!이쁘게입고다닐게요~ 고고싱짱♥
lny29**|산지 쫌 됬는데 후기 지금올려요ㅠㅠ딱 입자마자 시원하다고 느꼈어요!다만 바지 아래부분이 실밥이 조금 나와있고구겨진(?) 부분이 있는데 빨아도 안없어지네요..그런거 빼고는 다 좋아요! 편해요!!!
lhj11**|올화이트 통굽단화 보자마자 뭔가 확 이건사야된다싶어서 샀는데 이뻐요 bb!! 근데 흰색신발이라 조심히신어야될듯.. 때엄청잘탓듯..!! 저는 평소에 240 신는데 신발신고 걸을때 뒷꿈치가 헐렁거려요ㅠㅠㅠ 하지만장점은 저거신으면 키가좀커진다는 점ㅎㅎ.. 전체적으로 좋아요 !
lny29**|완전좋아요!산지 꽤 됬는데 이제서야 올리네요!!많이짧지도 않고 ..허벅지가 두껍고 다리가 짧은편이라 M시켜서작을 줄 알았는데 다행히 딱맞았어요!!!지금도 잘 입고 다닙니다~
leah6**|너무너무 좋아요 솔도 부드럽고 완전 만족합니다!코 모공 위주로 쓸려고 샀는데아무래도 크기가 크다보니 그냥 얼굴 전체적으로 쓰고있어요저녁에만 쓰고있는데 소링 많다보니 잘 마르진 않아요전체적으로 만족합니다. 후회없네요!!!!
kws**|키가 작아서 길이가 쫌 많이 기네요 .. 길이 좀 자르면 좋을꺼같아요! 안에 속치마가 있을줄은 상상도 못했는데 검은색으로 있어서 안에 비침현상이 전혀 안생길수 있어서 정말 좋은것 같아요! 무늬도 정말 예쁘고 안에 티를 검은색을 입어도 흰색을 입어도 괜찮은것같아요 옷도 되게 가볍고 얇아서 좋아요
bci37**|너무커서 동생한테 줬어요
ac966990**|이번에 고고싱에서 두번째구매하는건데 정말좋고 배송도너무빨라서 더좋은거같아요♥흰색이라 약간비침이 잇긴한데 그래도 옷이 이쁘고 해가지고 괜찮은거같아용!!!!잘입고다니고 앞으로도 고고싱 자주이용하겟습니당~~~~~
bci37**|두껍고 길이도 길고 입을만해요
lhj11**|[허니진] 세미배기핏 면팬츠 이상품 모델언니처럼 핏안나올줄알았는데 모델언니처럼만큼은 아니지만 그래도 생각보다 존예임 그리고 엄청 편해요!!! 진짜 가격대비 good !!!! 진짜이뻐요ㅠㅠㅠㅜㅜ 아아 근데 좀 작은 단점하나있다면 더울때입으면 검정색이라그런진모르겠는데 좀 더워요 ㅠ 그거뺴곤 다좋아요!
bci37**|생각보다 두꺼워서 이날씨에 입기엔 매우 더워서 땀범벅이 됩니다 절대 못입는데 이뻐요ㄹ가을되면 입어야겠어용 이건 봄이나 가을에 입기에 좋은옷입니다 이가격에 만족해욯ㅎㅎ아 어떻게 리뷰를 100자를 다채우죠?ㅋㅋ너무 많은거 같애유ㅜ
beast18**|여기서 산 5부 티랑 같이 입는데 예뻐요 ~~ 여리여리하고 길이도 너무 짧지 않아서 좋아요 원피스 자주 입는 편 아닌데 입어보니까 너무 편해요ㅋㅋㅋㅋ 저보다 키 더 크신 분들도 입으실 수 있을거같아요 고민하고 계시면 바로 사세요 완전 만족합니다 ~
lhj11**|점프앤 수트슬랙스 이거 진짜 그닥 많이 기대안하고 사실 디자인보고산거였는데 받고 입어봤는데 진짜 이건 무슨 말도못함 완전이뻐요.. 정말.. 사진에는 실물보다 핏이 덜 나왔는데(?) 이거 진짜 실물 존예임.. 여름에입어도 안더울듯 배송도 빨리와서 좋았어요 !
www313**|스커트를 즐겨 입지는 않지만 모델 착샷 보자마자 반해서 바로 구입했는데 신축성도 좋고 편해요! 엉덩이랑 허벅지가 좀 있어서 평소 옷 입을 때 태가 안 나는게 스트레스였는데, 가벼운 소재는 아니지만 자연스럽게 퍼지는 스커트가 하체에 대한 컴플렉스를 어느정도 커버해줘서 마음에 드네요ㅎㅎ 요 스커트에 베이직한 티셔츠 한 장 대충 매치해줘도 신경 쓴듯 안 쓴듯 예쁘게 잘 어울려서 올 여름 자주 입고 다닐 것 같아요ㅎㅎ
