wjdguswkd**|여름에 입기 딱!! 좋은것 같아용~~ 얇고 시원하구!! 소재도 진짜 왕 부드러워영 ㅎㅎ 처음에 딱 받았을땐 구김이 좀 있었지만 이정도는 뭐~ 좋아영 얼른 살빼서 이쁜옷 많이 입고싶네용 제 몸에도 이렇게 이쁜 옷을 입을수 있다니 감격적이에용~~
tpdud64**|제가 수요일저녁에 입금했는데 오늘왔네용 배송진짜 빨라요 ㅠㅠ 옷도 완전시원하고 근데 바지쪽이 너무 헐렁해서 속바지나뭐나 입어야겠네요 .. 가격에비해 좋습니당 ! 사진도 올릴려고 다찍어놨는데 사진추가 클릭이안되네요 폰이라그런가 ㅠ 어쨌든 이뻐요 잘입을게요 !
bogie5**|L샀는데 생각보다 넉넉해서 좋았어요 이뻐요♡
big85**|후기보고 s가 딱맞을꺼같았는데 진짜로 딱맞아요 대신 입을 때 골반쪽이 살짝 걸이지만 그래도 이쁘네요
skdnskdn3**|가격대비 좋은 옷!! 재질도 맘에들고 더운 여름에 입기 딱 좋아요!!! 슬랙스에 입을 흰 티를 찾고 있었는데 이게 딱 눈에 띄더라구요ㅎㅎ 원래 데일리한 옷 자주 애용해서 그런지 저한테는 완전 만족스러운 제품!!!! 평소엔 배송이 좀 늦었는데 이번은 꽤 일찍 도착한거 같으네요ㅎㅎ
big85**|사진에 나온 것 처럼 똑같아여배송도 빠른편이고
skdnskdn3**|핑크 색상으로 구매했는데 여리여리해 보이는게 진짜 이쁜것 같아요!! 완전만족!!!ㅎㅎ 데일리한 옷으로 하의를 어떤걸로 맞출지 걱정을 덜어주는 옷 같아요ㅎㅎㅎ 재질도 부드럽고 지금 입기 딱 좋은듯!! 다음에 다른 색상으로 한번 더 사려구용~~
skdnskdn3**|라인이 돋보여서 이쁜것 같아요!!ㅎㅎ 이번에 아이보리 색상도 입고 됬다고해서 또 주문하려구요~~
yh9702**|지금도 입고있는데 완전편하고 짱예뻐요♡
soso**|검은색으로 구매했는데 예뻐요 ㅎㅎㅎ얇지도 않고 딱 좋은 것 같아요! 여름에 필요한 기본 아이템!검정색말고 다른 색으로도 사려구요~~  목있는 부분이 늘어날까봐 걱정되긴 하지만 이 가격에 괜찮은 것 같아요! 그리고 무엇보다 배송이 진짜 빨라서 너무 좋아요 ㅜㅜ
dg65**|엄청 이뻐요 가격도 싸고 !!!!!! 길이도 마음에 들고 배달도 엄청 빠르고 다음에 또 살려고요 ㅋㅋㅋㅋ 가격대비좋은거같아요 ㅠ!!!ㅎㅎㅎ 올여름에 계속 입을거 가ㄷ아용~ ㅃ 허리가 커요 ㅜㅜㅜ 그거빼고 최고이 듯 !!!!!!!!
jisoo33**|적당한 기장에 깜직한 바트까지 정말 맘에들어요재질이 두꺼울까봐 조금 걱정하기도 했는데 얇고 팔기장도 딱맞아서 다른 색도 살까 생각중입니다친구들도 다 이쁘다고 어디샀냐고 질문받은것만 두번이에요~박시핏이라서 제 뱃살도 가려줘서 좋아요~
soso**|생각했던 재질과는 좀 다른데 전 오히려 부들부들하고 얇고 너무 좋았어요! 여름에 입기 딱인 것 같아요 ㅎㅎㅎ 많이 비칠까봐 걱정했었는데 검정색이라서 그런지 비침이 심하지 않아서 좋아요!!! 그리고 무엇보다 배송이 빨라서 굳굳~~너무 좋아요~
wjddk18**|완전 쫀쫀하고 질이 완전 완전 조아용!!!!!!!!!!!!!!!!!!!!!!!!!!!색도 이쁘고 바지에 입으면 완전 좋을꺼 같아요역시 고고싱 티는 정말 질이 좋은것 같아용감사해용 정말 잘입을께영!!!!!!!!!!!!!!!
ghkddmsr**|포토후기1등입니다~일단 배송도 빨리왔구 가격에 비해 품질이 좋은거 같애요! 생각보다 얇아서 회색임에도 불구하고 좀 비치더라구요ㅠㅠ엄마가 입으신다고 샀는데 옷 오신거 보구 마음에 든다고 하시더라구요!회색말구 다른색도 이쁠거 같애요!!
wjddk18**|완전 쫀쫀하고 질이 완전 완전 조아용!!!!!!!!!!!!!!!!!!!!!!!!!!!색도 이쁘고 바지에 입으면 완전 좋을꺼 같아요역시 고고싱 티는 정말 질이 좋은것 같아용감사해용 정말 잘입을께영!!!!!!!!!!!!!!!
wjddk18**|완전 쫀쫀하고 질이 완전 완전 조아용!!!!!!!!!!!!!!!!!!!!!!!!!!!색도 이쁘고 바지에 입으면 완전 좋을꺼 같아요역시 고고싱 티는 정말 질이 좋은것 같아용감사해용 정말 잘입을께영!!!!!!!!!!!!!!!
wjddk18**|완전 쫀쫀하고 질이 완전 완전 조아용!!!!!!!!!!!!!!!!!!!!!!!!!!!색도 이쁘고 바지에 입으면 완전 좋을꺼 같아요역시 고고싱 티는 정말 질이 좋은것 같아용감사해용 정말 잘입을께영!!!!!!!!!!!!!!!
hyerim3**|수요일에 주문하고 입금하고 좀 전에 택배 받았어요 ~연청반바지를 새로 사서 그 위에 뭐 입을지 보다가 데일리브이 반티 구매했어요! 제가 생각한 분홍색은 아닌데 예쁘긴 해요ㅎㅎ 어디에나 무난하게 걸쳐 입을수 있을거같아요 만족합니당 좋아요!
codpwls02**|이뻐요 사진이랑 비슷한거같아요! 후회 안하고 있어용ㅎㅎ색도 예쁘고 길이도 적당해요.
dudtlf**|카메라의 문제가 있어서 사진은 아쉽게도 올리지 못했어요~배송은 이틀만에 왔네요! 정말 빨라요 첫 배송을 실망시키지 않았어요! 생각했던 것 보단 색이 그리 진하지 않아요! 이점 참고해주세요! 약간 진청인데 연청느낌이 살짝 섞인듯한?? L사이즈 주문했는데 허리가 많이 크더라구요 제가 완벽한 하체비만이라서 허벅지에 널널하도록했는데 허리가 컸어요! 그렇지만 전체적으로 만족! 예쁘게 입을께요!
hyerim3**|수요일 오후에 입금하고 좀 전에 택배 받았어요 ~슬라브소재인 티가 없어서 하나 사려고 생각하고 있었는데 가격도 괜찮고 브이트임이 포인트가 되는 거 같아서 이걸로 구매했어요! 진짜 좋고 짱짱 편해요 다음에 블랙도 사고 싶을 정도에요ㅎㅎ 만족합니당
topaz05**|출산하고 맞는 옷이 없었는데 이 바지는 너무 편하고 신축성도 좋고 정말 짱이네요블랙xl구매했는데 블루xl도 구매하고싶지만 재고가 없나봐요.. 블랙으로 xl 하나더 구매할예정입니다. 15000원에 이런 옷을 득템하다니 고고싱 짱!
gs072**|평소에도 헨리넥 좋아해서 검정색 샀는데 팔도 꽤 길고 비치지 않아서 좋은 것 같음.가격에 비해 질도 괜찮은 거 같고 핏도 모델핏이랑 거의 비슷함ㅇㅇ 그냥 편하게 입고 다니기 위한 기본템정도로 생각하면 될듯.배송은 조금 걸렸는데 전체적으로 괜찮음
kbom**|블랙 화이트 2개 샀어요.봄 여름 가을 전부 다 잘 입을거같아요.아무 옷에나 잘 어울릴거 갇고키가 165인데 기장도 길고 편하게 잘입을거같아요.다른 색도 갖고 싶을 정도로!!흰색은 좀 얇아서 비칠 것 같지만비치지는 않은거같아요~!
doo14**|제가h라인면스커트찾고있었는데.스판끼가좋아서입기도편해요.m샀는데허리가좀큰것같아요.걸어갈때마다치마가슥슥올라가드라구요.그래도디자인은이뻐요면스커트처음샀는데만족해요❤❤다른색도다음에구입하려구요.
hyerim3**|좀 전에 택배 와서 받았는데 진짜 너무 예뻐요ㅠㅠ 만원 같지 않은 그런 퀄리티ㅜ 짱 좋아요
ciye**|화이트 구매했는데요 디자인이 잘 나온거같아요ㅎㅎ생각보다 질도 좋고 오래입었는데도 늘어남이런것도 많지 않구요. 비침은 조금 있으니까 이너입고 입으셔야 될 것 같아요.아무튼 이가격에 이정도 옷이면 잘 산거 같아요.다른 미키마우스 시리즈도 궁금하네영ㅎ
ciye**|이거 진짜 디자인이 귀여워요ㅎㅎ팔이 좀 긴편인데 원래 완전 반팔보다 이정도 기장을 찾고 있어서 저한테는 딱 좋은거 같아요.완전 얇진 않지만 약간 비침은 있어서 이너는 착용해줘야되요. 디자인도 귀엽고 그래서 산 이후로 쭉 잘 입고 있어요ㅎㅎ
ciye**|루즈하늬 가디건 그레이 구매했어요!소매도 길고 품도 적당해서 좋네요ㅎㅎ에어컨때문에 추울때 잠깐 걸쳤는데 원피스랑 입었을때가 더 잘어울리더라구요.버튼은 없는데 있어도 오픈해 입는게 더 이쁜 거 같아요.다른색도 사고 싶은데 품절이네여ㅠㅠㅠㅠ암튼 기장이랑 전체적인 색상이나 이런거 더 맘에 들어요~가을쯤되면 더 자주 입게 될 갓 같네용ㅎㅎㅎㅎ
qorgh05**|저는 흰색샀는데 이거 살바에는 옆에있는 다른 나시사는걸 추천해요...ㅎ어짜피 옷안에입을꺼라 상관없는데 싼티가 많이나네요ㅋㅋㅋㅋ그래도 자주입을꺼같아요!몇백원더주고 옆에다른 끈나시 사시는거 저는 추천할께요!이쁘게 잘입겠습니당
doo14**|이거리뷰평이되게좋아서구입했어요.제생각에는무난하게이뻤어요.적당히비치기도하고,치마나바지에입어도 어울렸어요.나시는필수인것같구요.원단이여름에입기좋아서시원해요구매잘한것같아요.앞으로도계속고고싱이용할께요❤
wjddk18**|티가 너무너무 귀여워용ㅎㅎㅎㅎㅎㅎ완전 귀엽고 질도 쫀쫀하고요 ㅎㅎㅎ대 만족입니당ㅎㅎㅎㅎㅎㅎㅎㅎㅎㅎㅎㅎㅎ고고싱에서 산 바지랑 입으면 엄청나게 좋을것 같아요이쁘게 잘입겠습니당!!!!!!!!!!!!!!!!!!!!!!!!!!!!!!
ikyung04**|ㅎㅎㅎㅎㅎㅎㅎㅎ이거 아무데나 다 잘어울리구요 완전 귀여워요 꼭사요 꼭 꼭 꼭 꼭 꼭 꼭ㅎㅎㅎㅎㅎㅎㅎㅎㅎㅎㅎㅎㅎㅎㅎㅎ끈은 그냥 매듭지으면 되요!!!!!!!!!!!!!!!!!!!!!!!!!!!!!!!!!!!!!
ghkddmsr**|포토후기 2등입니다~배송이 빨리 왔고 그냥 치마든 바지든 어느옷에 바쳐입어도 잘어울리는 기본티인거 같애요! 정말 이쁘고 가격에 비해 퀄리티 짱인거 같애요 진짜!!얇고 브이넥이라서 되게 시원할거 같애요!얇아도 검정색이라 비치지는 않아요! 잘산거같애요!!
ikyung04**|ㅎㅎㅎㅎㅎㅎㅎㅎㅎㅎㅎㅎㅎㅎㅎㅎㅎㅎㅎㅎㅎㅎㅎ이뻐요ㅎㅎㅎㅎㅎㅎㅎㅎㅎㅎㅎㅎㅎㅎㅎㅎㅎㅎㅎ저한테는 안 어울려여ㅎㅎㅎㅎㅎㅎㅎㅎ길이는 허벅지 반이요 ㅎㅎㅎㅎㅎㅎㅎㅎㅎ꼭사세요ㅎㅎㅎㅎㅎㅎㅎㅎㅎㅎㅎㅎㅎㅎㅎㅎㅎㅎㅎㅎㅎㅎㅎㅎㅎ
dlwldus110**|이쁜 블라우스 같은 옷이 필요햇는데 찾다가 역시 제가 당골인 고고싱에서 구매하길 잘한것 같네오 근데 아직 옷을 빨아서 입어보지 못해서 그런지 어깨뽕이 주름따문에 장난이 아니네요. 일단 빨아서 입어봐야 할 것 같아요! 키는 156정도 되는데 그렇게 크지는 않아요!
wjddk18**|바지사이즈가 쫌 마니 크긴하지만 색도 엄청이쁘고 완전 대 만족이에용!!!완전완전 조아용!!!!!!!!!!!!!!!!사이즈가 있었더라면 엄청 좋았을텐데 아쉽긴하지만질이 좋고 색이 이뻐서 만족입니다연청도 사이즈가 있으면 더 사고싶어요
sukyeong**|이거아주물건이에요 질도좋고 귀엽기도하고 데일리고 자주자주입고있어요 다른디즈니제품들도 사고싶어지네요!!!고고싱너무조아용ㅋㅋㅋㅋㅋㅋㅋㅋㅋ 요즘고고싱에서만 맨날옷사고있어요 31일까지 무료배송이라니 저는또쇼핑하러갑니다!
doo14**|이거리뷰가좋아서되게기대하고있었는데처음에냄새가....뭐세탁하면되니까이번에산것중에는 가장별로였던것같아요.제가원래붙는걸안좋아하는편인데그래도이거라인이이쁘게빠지는것같아요.붙는거좋아하시는분한테는
kjh052**|저번부터 너무 사고싶었는데 품절이 되서 기다리다 기다리다 드디어 샀어요ㅠㅠ 제가 허리에비해 골반이 넓은 편이라 고민하다가 s로 샀는데 허리는 맞는데 골반이 껴서 지퍼가 겨우겨우 올라가더라고요.. 허벅지랑 허리는 딱 맞는데ㅠㅠ울면서 사이즈m으로 교환받았습니다.. 허리는 역시나 조금 크지만 밸트 예쁜거 살 예정이라서 괜찮아요 ㅎㅎ 바지는 너무 예뻐서 진짜 매일매일 입을 것같아요 편하구요!! 강추입니당
sukyeong**|색도이쁘고 다맘에들었지만 끈이.......아주약하더군요 ㅜㅠㅠ 안쪽에 박음질을한번밖에 안해주셔서 길가는중에 끊어져버렷어요 ㅠㅠ크기도 색도 다좋았는데 박음질에 조금만더 신경써주셨으면 하는생각을했어요 ㅎㅎㅎ그거말곤만족입니당
dlwldus110**|수수한 옷이면서도 집앞에서 누구 만날때 이쁘게 입을 수 잇는 옷이 필요했는데 이제야 찾앗네요!! 정말 맘에 들어요! 저는 회색 구매 햇는데 청반바지랑 입어도 이쁘고 그냥 치마랑 입어도 이뻐요! 역시 고고싱에서 옷사기 잘한것 같니요 다음에도 또 다른 옷 구매할게요!
roze12**|화이트 정말 좋습니다!!!!!특히나 비침이 없어서 더욱 좋습니다!!!!!비치면 안에 민소매나 껴입어야 하거나 아무리 스킨색 속옷입어도 좀 부담스러운데,비치지 않구 브이넥이라 시원해보이고편안하게 입을 수 있어서 좋습니다~~~~~
sukyeong**|일단 길이가 제~~~~~~~~일 맘에듭니다 키가작아서 길이맞는원피스찾기가 아주 하늘의별따기거든요 허리도 잘록해보이고 안에 모델분처럼 흰티받쳐입으면 이뻐요 ㅎㅎㅎ ㄷㅔ일리룩으로 입기로는 좀 무리수가있지만 휴가갈때입으면 이쁠거같아요 ㅎㅎㅎ
doo14**|연청반바지찾고있었는데이게이뻐서샀는데m사이즈샀는데좀큰데그래도나름괜찮았어요.헤짐도이쁘고색도이뻐요.제가찾던스타일이였던것같아요.이제계속고고싱에서옷구입하려구요.이번에옷5개샀는데다마음에들었어요.
qqtt03**|매번사고싶어서 망설였는데 핏도이쁘고 더울줄알았는데 그런점은전혀없고 시원하면서도 예뻐보여요좋은것같애요 망설였던점이 후회가될만큼 후회없는 선택을한것같아서 좋아요ㅎ
roze12**|핑크랑 블랙이랑 각각 하나씩 주문했는데요블랙도 무난하게 부담없이 일상생활에서 입을 수 있어서 좋아요바지가 오히려 종아리까지 쫙 달라붙어서 치마가 더 편한데정장치마는 부담스럽구 밴드는 핏이 안돼서 아쉬웠는데딱 맞는 치마를 찾은 것 같아요~~~~~
sukyeong**|검은색이라서 많이덥진않을까 걱정좀했는데 생각보다 괜찮구요 넉넉한사이즈 아주맘에듭니당^.^ 제가 체구가 좀 작은데 큰사이즈 좋아하거든욬ㅋㅋㅋㅋㅋㅋㅋㅋㅋㅋ 깜찍하니 아주이뻐요!!! 여기에 치마입어도이쁘고 반바지입어도이뻐요
kjh052**|마음에 들어요!! 통도 딱 좋구요 팔길이도 딱 맞구요ㅎㅎ 길이도 딱 좋은 길이인것 같아요. 단점이 있다면.. 생각보다 비치는 게 있는데 비치는거는 싫지 않으니까 상관없었구요... 문제는 재질이 화면에 보이는 것보다 안좋아요 보푸라기 잘 일어날 것 같고 잘 늘어날 것 같아요.. 일년밖에 못입을 것 같네요..ㅎㅎ 그래도 미키 자수도 예쁘고 편하게 입을 수 있을것 같아요 !
kbom**|일단 기장이 길어서 좋아요.블랙은 블랙이지만 먼가 다른 블랙보다 좀더 진한거같은 블랙이고요.짧아서 편함이 불편할까..했는데 길어서 매일매일 입을수있을거갇아요~키가 160이 넘는 사람은 기장에 만족을 하실같아요!추천합니다
tjdud6**|바지 재질이 스판이라서 청바지임에도 불구하고 편하게 활동 할 수 있을 것 같아요:) 또 무엇보다 배송도 빨라서 주문한 다음날 바로 받을 수 있어 좋았던 것 같네요. 부담 없이 같이 입을 수 있는 색이라 그런지 어느 옷이든 잘 어울려서 더 좋은 것 같네요.
dkssus**|평소27을 입는데 m을 살지 L을 살지 엄청난고민끝에 L을 쵸이스ㅋㅋ슬랙스니까 딱맞는거보단 큰게더 날거같아서 한치수더크게 주문하라는 말대로했습니당이슬랙스는 무엇보다 멜빵이 탈부착이여서 좋은거같아요두가지 스타일을낼수있으니ㅋㅋ 굿bb그런데 한치수큰거해서 그런지 허리가커서 멜빵안하면 좀흘러내리네요ㅠㅠ 허리만줄여 입으면 이쁠것같아요그리고멜빵하면 흘러내리지도않고 좋습니당 이뻐요!!맨날 스키니만입다가 슬랙스처음인데 핏도예상대로 이쁘고 좋아요 허리좀큰것만빼고 만족만족b고고싱두번째구매도 만족하고가요 이쁜옷감사합니다~
roze12**|정말 제가 원하던 핑크 색상이에요!!!!!너무 진한 색깔두 아니구 가끔가다 너무 연해서아이보리인지 구분이 잘 안 가는 경우도 있는데딱 봤을 때 연핑크 색상이라 여리여리하고,핏도 잘 잡혀요~~~~~바침도 없어서 편하게 입을 수 있을 것습니다~~~~~
ghkddmsr**|포토후기 3등입니다!이건 고고싱에 있는 다른 청치마와 달리 몸에 그렇게 착 달라붙는거 같지가 않아요!그래서 그점이 마음에 들고 사이즈도 딱 적당한거 같애요! 그리고 할인받아서 저렴하게 샀는데 진짜진짜 잘산거같애요!!너무 이뻐요 고민하고 있으신분은 사셔도 후회안하실거 같애요!!역시 고고싱짱짱
qqtt03**|색깔이 너무이쁘고 슬랙스나 청바지에 입기가 편해요!
sukyeong**|일단 제가키가작은데 끈조절길이구멍이 3개나있어서 그게너무 맘ㅇㅔ들었어요!! 색도이쁘고 귀여워요 ㅋㅋㅋㅋ남자친구가 아주좋아하던데요?? 키작으신분들도 저처럼 롤업해서입으시면 무난하게 자주자주 찾으실꺼같아요 강추입니당
kbom**|화이트를 사고 블랙도 샀습니다.ㅋㅋ기장도 허리둘레도 넉넉하니 좋습니다.일단 기장이 길어서 편하고 어떤 옷에도 잘어울립다.색깔별로 나오면 좋겠어요!뒤에 고무라서 좀 더 조이는 부분은 있지만 너무 헐렁한거보다 낫다고 생각해요.
qqtt03**|핏이 너무이쁘고 시원하고 좋아요!
kjh052**|포토후기 3등!!예쁜회색이라 정말 마음에 들고요 ! 알리바바 문구랑 캐릭터랑 새겨진게 너무 귀여워서 진짜 마음에 듭니다 ㅎㅎ 길이도 너무길지않고 적당한 길이라서 넣어 입어도 예쁘고 빼서 입어도 예뻐요 ㅎㅎ 통도 적당해서 여리여리하게 보이구요 ㅎㅎ 정말 마음에 듭니다! 잘 입겠습니다~~
roze12**|무난한 색상으로 검정색을 주문했습니다~~~~~정말 부담없이 입을 수 있어서 좋습니다~~~~~핏도 잡혀지고 그렇다고 너무 꽉 끼지도 않구,편안하게 입을 수 있어서 좋습니다!!!!!다른 색상으로 주문하고 싶은 정도로 만족합니다~~~~~
roze12**|집엔는 검정색상이 많아서 이번에는 화이트 색상을 주문했어요면이라서 안에 색상 있는 속옷을 입어도잘 비치지 않는 답니다!!!!껴입는 걸 싫어해서 화이트 색상을 살 때 항상 많이 비치는지 안 비치는지 확인하는데 잘 비치지도 않구 좋습니당!!
heenami**|후기가많은 만큼 믿고기대해서 시켰는데 괜찮은것 같아요!! 하얀색시켰는데 좀 많이비치는거 같아요. 좀 어깨넓어보이는건 어쩔수없는것같아요 ㅎㅎㅎ 그래도 가격대비 괜찮은상품이에요 덥지도않고!소장하면 유용한 제품인것 같아욯ㅎ
evelyn**|그전부터 튜브탑사고싶엇는뎅 뭔가 돈아까워서 못사구잇다가 싸길래 속는셈치고사봣어요 처음에왓을때 디게신기햇어요 근데 가격에비해 재질도은근괜찮구 쫀쫀해서 자기몸에 답답하지않을정도로 알아서 맞쳐주니깐 좋앗어용 길이도 적당한것같아여!!
kjh052**|사이즈 235 흰색으로 샀는데 마음에 듭니다!! ㅎㅎ 푹신푹신하진 않지만 부들부들해서 괜찮구요! 발목부분이 신발에 조금 쓸려서 불편한 감은 있는데 그래도 가격대비해서 잘 산것같아요ㅎㅎ 생각보다 신발 발볼이 커서 좀 통통하게 보이구요 신발 잠그는 부분이 자꾸풀려서.. 좀 불편하지만 가격을 생각하면 그정도는 감수하고 신을 수 있는것 같아요 ㅎㅎ잘신겠습니다.
psa01**|ㅎㅎ편함?
psa01**|깔별루다있어요두개더사서ㅎ
psa01**|두개더사서깔별루다있어용ㅎ
uji22**|좀말라서 항상 치마나 바지살때 커서반품하거나팔았는데 이번엔진짜제대로 산거같아요 ㅎㅎㅎㅎ처음에 뜯어보고 먼가안맞겠더싶었는데 바류입어봤는디 진짜 쫙붙도 너무이뻐요ㅠㅠㅠㅠㅠㅠㅠㅠㅠ 진짜 너무이뻐요 스판끼도 장난아니고 잘늘어나고 편해요 ~예쁘게잘입겠습니당 고고싱 짱 !!!
evelyn**|처음에딱와서 봣는데 생각보다쫌많이 커서놀랫어요그건 바지에 넣어서입으면 괜찮아져요그리고 한쪽끝만 잘라져잇어서 불량품인줄알앗는데 그건아닌것같네요재질도좋고 디자인도이쁜데 한가지아쉬운점은 옷이 너무파인것같아여 점점늘어나서 돌아오질않네요ㅜㅜ
ikyung04**|이뻐요(키 157)- 키, 몸무게-착용사이즈-착용후느낌은?(좋은점/나쁜점)제 키는 157이구요 짧지도 않고 길지도 않고 적당했어요ㅎㅎㅎㅎㅎㅎㅎ ㅇ일단 원피스가 완전 이쁘구요 저한텐 안어울리는거같지만ㅎㅎㅎㅎㅎㅎㅎㅎㅎㅎ 길이는 허벅지반? 정도구요 윗부분을 꽉잡아줘서 탄탄한느낌?! 흰티랑입으면 귀여워요ㅎㅎㅎㅎㅎㅎㅎㅎㅎㅎㅎㅎ고민할시간이 아까우니까 어서 주문하기 누르세요ㅎㅎㅎㅎㅎㅎ
gototwo**|그냥 어디에다입어도 괜찮을거 같아서 샀는데 정말 좋아요! 다른색으로 하나더 사고 싶어요♥
doo14**|이거처음에보자마자바로샀는데기대별로안하고있었는데진짜이뻐요비침도적당하고길이도저한테딱맞아요.여름에입기좋아요엄마도진짜이쁘다고하네요.어느바지나치마이입어도다어울려서걱정없이코디할수있을것같아요.
kjh052**|흰색 주문했는데 정말 예쁜것 같아요!! 마음에 쏙 들구요. 신발이 푹신푹신해서 정말 편한 것 같아요 ㅎㅎ 이 가격에 이정도 퀄리티라니... 진짜 마음에 듭니다. 굽도 4센치 딱 적당하고요 여름에 맨날맨날 신고 다닐것같아요.. 바지에도 잘어울리고 치마에도 잘어울리고 정말마음에 듭니다!!ㅎㅎ
vpstjf**|바지 너무 예쁘고 좋은데 걸을때마다 오른쪽만 조금씩올라와서 좀 불편한감이 있네요 아무튼 옷자체는 이쁘고 좋아여!!
ppp70**|학교에서 입고다니기도좋고 평소에도 아무옷에나잘어울려서 입고다니기편해요
ppp70**|색깔도 훨씬이쁘고 심하게짧지도않아서 좋아요 속바지도있어서 입고다니기편하고요 이가격에 속바지도있고 재질도 좋아서 정말 좋은것같아요
evelyn**|세일해서 8400원인가하길래 샀는데 진짜이쁘고 좋은것같아여!!재질이 얇아서 여름에입아도 시원할거같구 비침이좀 심해서 안에 나시반드시입고입아야되요 그리고 거즈면원단이여서 좀많이꾸깃꾸깃해여 이건잘다려서 입으면될것같아여흰색이여서 모든옷에 무난하게잘입을수잇을것같네요
roti**|솔직하게 후기배송사의 문제로 하루 늦었지만 그래도 다른 쇼핑몰 보다 빨라서 좋았음.우선 새삼 느낀게 모델분 다리는 엄청나게 얇다는 것.....평소 바지 26~27 입는데 S는 역시 무리다 싶어서 M을 샀는데 많이 널널하지 않아서 슬픔..하비..근데 허리는 좀 남음 벨트 차면 될 듯함.그리고 가격대비 엄청 퀄리티 좋은듯 받고 놀람...인터넷에서 옷 처음 사봐도 별 기대 안했는데  오오ㅋㅋㅋㅋㅋ박음질 상태 개꿀임 이건 걱정 안하셔도 될듯요.근데 많이 두꺼워서 여름에 입으면 다리에서 워터슬라이드 타도 될듯함.살짝 무거움. 바지에서 냄새 난다고 하시는 분들 많으시던데 전 안났어요.제 키 166에 한번 접었는데 저정도 왔어요 참고하시고 다들 좋은 구매하세용
cac87**|제가 꼭 사고 싶엇던반바지 라서 기대를 많이했는데생각했던 핏은 아니었지만 정말 맘에 들어요재질도 부드러워서 좋고 사이즈도 넉넉하게 사서 좋고바지통부분이 넉넉해서 허리는 얇은대 허벅지가 두꺼우신분들은 잘맞을거같고 추천해여;요산거중에 제일 맘에드는 옷이애요
wjd990**|원피스 이뻐용~!!ㅎㅎ 제가생각한 찰랑찰랑거리는 천은아니네요ㅠㅠ 올때부터주름이 자글자글했지만 한번빨고 탈탈털어도 주름이 안없어져요ㅠㅠ 다려서입어야겠네용..ㅎㅎ그리고 옷이 엄청 쫀쫀해요!!! 특히나 가슴부분이 더 그래욥하하하 그래도 이뻐서 완전맘에듭니당~ㅎㅎ 많이 파세용~!!
kjh052**|흰색사려고했는데 잘못주문해서 카키받았다가 다시 흰색으로 교환했는데 카키보다 흰색이 더 예쁜것 같아요!! 흰색이 받쳐입을것도 많은것 같구요 ㅎㅎ 가격대비 재질이 좋아서 자주 입고다닐 것 같아요~ 두께도 적당히 얇아서 시원하게 잘입을 것같고 많이 비치지 않아서 좋은 것 같아요 ㅎㅎ강추입니당
