wjdguswkd**|여름에 입기 딱!! 좋은것 같아용~~ 얇고 시원하구!! 소재도 진짜 왕 부드러워영 ㅎㅎ 처음에 딱 받았을땐 구김이 좀 있었지만 이정도는 뭐~ 좋아영 얼른 살빼서 이쁜옷 많이 입고싶네용 제 몸에도 이렇게 이쁜 옷을 입을수 있다니 감격적이에용~~
leesjin10**|몸무게는 58~59이고, 보통바지를 28~30으로 입습니다. L사이즈 주문했고요! 원래 구매한지는 1년도 넘었는데 이제야 후기를 작성하네요ㅎㅎ  하뚱이라 걱정되서 L사이즈를 주문했었는데 종아리부분이 약간 끼는 느낌은 있었습니다. 못입거나 활동하기 불편할 정도로 끼는건 아니라서 괜찮았어요!사진으론 다리가 제다리보다 얇아보니게 나왔는데 정말ㅋㅋㅋ 실제론 매우 두껍습니다. 종아리에 비에 허벅지부분은 약간 퍼지는?넓은? 느낌이있는데요 아무래도 그부분까지 두꺼워보이는 느낌이 없잖아있습니다. 그래도 이뻐요ㅠㅠ 구매하고 지금까지 후회한적은 없는것 같네요!
alswl011**|별 기대안햇는데 사이즈도그렇고 질도그렇고 여태본 클러치중에제일 탄탄한거같애요!! 앞으로 아무옷에나잘들고다닐거같네용 #~~~~고고싱은진짜 실망시킨적이없는듯 ㅠㅠㅠㅠㅠ잘쓰겟습니당 크로스백으로메도이쁜 클러치백다들챙겨가세용 ㅎ
sangi**|안에 잠옷입고 입은거라 핏이 이상하지만 제대로 외출할땐 진짜 이쁠거같아요 가격에비해 너무 편하고 굿굿 후회없어요 짱짱 담에 또 사러올게요~~가격도부담스럽지 않고 가격에비해 옷이 안좋은것도 아니고 굿굿 너무 맘에듭니다~~~~~
rk96**|이뻐요굳굳
sangi**|실물이 훨씬이쁘고 재질도 좋아서 디즈니티 또 구입할까 생각중입니다 굿굿 사도 후회없어요 사진이 안에 잠옷입고 입은거라 돼지 같이 나왔지만 제대로 외출할때 입으면 너무 이쁠거같아요 담에 또 살거에뇨 구수수구ㅜ구수ㅜ수수숭굿굿굿굿구숛
jaehee08**|항상 거의 아이보리 옷만 구입해서 그런지 베이지 색깔의 옷을 사니까 색다른 느낌이 들어요.옷이 심플하면서도 이쁜 것 같아요~!민무늬 베이지 티 보단 나은 것 같아요.괜찮은 티라서 자주자주 입게 될 것 같네요!!!!ㅎㅎㅎ추천합니다~
leesh**|목부분이 많이 늘어난있엇습니다 U자로 너무 심하게 늘어나져있었는데 입으니까 그나마 나은거 같아요  티셔츠 로고가 너무 귀여워서 구매했는데 역시 실망시키지는 않네요~ 직접입었을때 정말이쁘고 청반바지랑 코디했을떄 어울리는 것같아요
sangi**|가격도 싸고 좋아요 질도 좋고 짱입니다
sjtvxq**|착용감 좋고 핏이 예뻐요 ㅎㅎ비침이 좀 있는데  그래서 좀 더 예쁜거 같아요 ㅎㅎ그리고 기장은 저한텐 좀 짧은거 같아요 ㅠㅠ두께감도 살~짝 있구용 ㅎㅎ하이웨스트 반바지랑 입으니까 짱짱!다른 컬러도 살려고요 재구매 의사 백퍼!!!!!!!
leeliast**|유후, 제일 마음에 들어요진심 이쁨 천도 부드럽고핏도 이쁘고 가녀림앤드여리여리함의 공존임진심 이쁨 청반바지에 잘 어울릴듯진심 이쁘고 만족자주입을거같음, 이거 이가격이면 진심 땡잡은거후회안할듯, 내가 왠만하면 후기적을때 단점꼭 적는데이건패스
s81186**|평소에 타입플리츠 스커트를 살때 다른 곳에서는 s허리도 크게나와서 실패했는데 고고싱꺼는 허리가 엄청 작은것 같아요 그냥입을때는 괜찮은데 옷을 넣어서 입을때 살짝 간당간당..ㅎ 후기에서 많은분들이 주름져서 온다고 했는데 빨고 다림질하니까 괜찮아요! 근데 핏이 생각이랑은 다른것같아요..ㅠㅠ 그래도 이뻐요 잘입을게용ㅎ.ㅎ
leesh**|바지밴딩부분이있었는데도 s입는데 많이 작았고요 단추부분도 잠구기조금 힘들었고 단추구멍이 단추보다 작아서 좀....그래도 길이랑 재질은 생각했던거보다 좋았어요~ 단추구멍은 조금늘리면 되는거니깐.. 괜찮은거 같습니다.
syw96**|가격에 비해서 완젼이뻐요ㅎㅎㅎ배송도 빠르고 좋았어요!! 카키색이랑 글씨도 마음에들고 엄마도 이쁘다고하셧어요~~~ 이쁘게 잘 입을께요 고고싱짱!!
sangi**|역시- 166-free-착용후느낌은? 좋아요 편하고 짱짱 가격에비해 너무 맘에 드네요!
leeliast**|디게 이쁘긴이쁜데딱 임산부스타일..그 마른임산부?스타일임팔부분 존..매우 쪼임..나 말랐다는 소리듣는데이건 마치 3살유아용플라스틱팔찌를 팔뚝에 끼우는기분못움직이겠음 터질까봐..근데 또 몸쪽은 엄청 큼근데 이상한게 이쁨..
dltpgml62**|친구랑 우정 팔찌로해도될디자인이다 정말이쁘고 손목얇은사람이든두꺼운사람이든 이팔찌는 자기손목에맞게낄수있어서좋다
jaehee08**|포토후기 1등이에요!66,77 인 옷인데 장점은 크니까 편한 것 같아요~~단점은 길이가 길다는 것? 근데 이건 안에 넣어 입으면 되니까 상관은 없을 것 같네요.사진으론 안 비친 것 같지만 약간 아이보리라서 비치는 게 있는 것 같아요,,ㅠ안 비친다고 아이보리 구입했는데.. 약간 후회가 되네요.그래도 티에 있는 영문 글씨는 귀여운 것 같아요!!
leeliast**|그냥 이뻐요진짜 아일렛이 인기있는이유가 있는듯엄청 청순해보이고 여리여리해보임그리고 박시핏?이여서 이쁜데 편하고치마, 바지 다 잘어울림여하튼 난 이렇게 똑같이 생긴블라우스 3개있다..ㅎ..그래도 후회는 안함 이쁘니까..
leesh**|미키마우스가 너무귀엽고요 팔길이도 조금 길어서 생각보다 괜찮은것 같아요~ 가격도 세일할떄구매해서 저렴하게 구매했습니다 입어보면 편하고 디즈니 정품이라서 괜찮은것 같습니다~~  조금츄리닝 같은 느낌이있지만 좋은상품인것 같아요
leeliast**|...딱히 뭐라할말이 없네여..모델언니들이 입고있는 치마의 핏을 바라지마세여제껀 주름이 꾸깃꾸깃..근데 모델언니들처럼 세로주름이 아닌가로주름..저뱃살없는데 엄청 뚱뚱해보여여..여하튼 여름용이여서 그런지 디게 흐물흐물한게좀그런데 가격이마음에들어요
trimo**|여름에 시원하게 입으려고 점프슈트 사느데 입엇을 때 시원하고 보기에도 디자인이 시원해 보여서 만족합니다 그런데 키가 큰사람의 경우에는 조금 짧거나 잘 안 맞을 수도 잇으니까 좀 염려해 두고 선택하는 것이 좋을 듯 합니다 그래도 흰티나 나시티 밑에 받쳐 입으니까 이뻐요
dbwls04**|기본티 찾다가 올ㅋ 하고 바로 장바구니에넣엇숩니다  그냥 어디든 어울리는 기본티에요 근데 포인트가있어서 예뻐여 사진하고 똑같고 생각보다 많이 넉넉하진않았어요 모델분이랑 제몸뚱아리따위와 다르니 당연한거겠죠ㅎㅎㅎ 근데 딱이쁜핏이에요 길이는 163인데 저정도 온답니다 질도좋아여 많이얇지도않고!!  분홍색도 참예쁜데 핑크한게 저따위랑 안어울려서..허허 바지는 참고로 다크진 하이숏 팬츠입니다 그냥 혹시 바ㅏ지도이쁜데 저바진뭘까?라고...생각....안하시겟죠 ....암튼 색깔별로있으면 잘입을거같아요 고고싱많이 이용하겠습니다아그리고 배송 겁나빨랐어요 하루만에배송온거 처음이에요><
leesh**|목부분 단추잠갔을떄 좀 쪼이네요 ㅜㅜ 그래도 가격이나 핏으로 봤을떄는 정말괜찮습니다~ 치마랑 코다하기도 좋고 반바지랑도 코디했을떄 이쁜것같아요길이도 생각보다 짧지않아서 잘입고 있습니다~~ 배송도 굿 가격도 굿 옷도 굿굿 입니다
s81186**|진짜 예뻐요!! 전부터 목까지오는 단가라티를 사고 싶었는데 어디서 살지 엄청 헤메다가 친언니가 입은거보고 예뻐서 어디서삿냐고 물어봤더니 고고싱에서 삿다고해서 바로 구매했어요♥️  재질도 좋은 것 같고 목부분도 이쁘고 암튼 매우 만족합니다 ❤️❤️
bibia**|사이즈 작다는 글들이 있어서 평소 M정도 구매하는데 L구매했더니 허리가 크네요. 그리고 바지 주머니 깊이가 깊지 않다는 것. 두개만 빼면 색감이나 스타일 모두 만족합니다! 특히 적당한 A라인이 예쁘네요. 잘 구매한 것 같아 마음에 들어요~
symoon**|저는 음 모델분 입으신건 귀여웠는데 실제로 받아서 보니까 패스트푸드점 알바생 같기도하고 반품하기 귀찮아서 안했지만  음 저 옷을 입을땐 코디를 좀 잘해야지 귀여워 보이는거 같아요 사진처럼  모자도 좀 써줘야 좋은 코디가 될것 같네요 저는 빨강 샀습니다 호호
swooyou**|하얀색이다보니 역시 바지가 무슨색이든지간에 잘어울려서 입기좋아요ㅎㅎ옷두께도 얇아서 더울떄입어도 시원하게 입을수있어요~!츄리닝바지에 입으면 캐쥬얼한스타일(?)이 되공 스키니나 반바지에 입으면 ㅌ티에 무늬가 별로없다보니 깔끔해보여서 짱좋아요!!
sk50**|산지는 꽤 되었지만 후기남겨요 아이보리색 이뻐요 무난하게 이너로 딱이에요 길이가 짧은감은있지만 입으면 이뻐요 검은색 바지랑 아이보리색티랑 입고 베이지색 가디건입고다녔었는데 이쁘더라구요 추천드려요 무난하게 잘입고다니실거에요!!
yeonju10**|M샀는데쫌크더라구여...그래도입을만하고엄청이뻐요!!!!쇼핑몰에서처음치마를사봤는데잘산것같아요가격대비짱짱!!
pja15**|생각했단거보다 더 괜찮은거 같아요물놀이 갈때 계속 찾게되는거 같아요
leesh**|이거는 정말싸게 구매잘한거같아요 슬랙스 사고싶었는데 저랑안어울려서 보다가 미니슬랙스있어서 구매했는데 잘어울리고 좋은거같아요~~ 모델분처럼 코디해서 입었는데 잘어울리더라고요~ 정말 여름에는 짦은 슬랙스 괜찮은거 같아요~
symoon**|양말 뭐 살까 고민하다가 샀는데 되게 단순해 보이는데 포인트 하나로 귀여워 보여서 샀는데 실제로 받아보니 너무 단조롭지 않게 줄무늬도 있고 양말도 넉넉하게 길어서 반바지에 입기 이쁜거 같아요 저는 핑크로 샀구요 줄무늬만 사다가 귀엽게 포인트 있는 양말있으니까 귀엽네요며
pja15**|사진과 다르게 푹신푹신해요발도 편하고 놀러갈때 편하게 신기 좋아요!
sk50**|산지는 꽤 되었지만 후기남겨요~!옷이뻐요!!!44입는분들이 입으시면 더 이쁠거같아요 저는 상체에 살집이 좀 있어서그런지 딱맞더라구요 모델분처럼 저렇게 헐렁하진않았어요 44분들은 저런핏나오실거같아요 간절기용으로딱이에요!
leesh**|s사이즈 구매 하였습니다 처음에 받고 허리가 너무 작아서 과연 맞을까했는데 살짝걸렸을뿐 허리까지 잘맞아서 다행이에요~ 옷도 이쁘고 가격도 괜찮았습니다 m 삿으면 너무 클뻔했어요~~ 언니랑 입고있는데 잘입구다니고 있어요!! 가격도 저렴해서 좋아요~
pja15**|평범한 트레이닝복이에요~아직입어보진않았지만 색깔도 맘에들고 좋아요다른색도 재구매 의사 있네요
symoon**|옷이 아주 이뻐요  목 부분이 조금 단조로운게 흠이지만 머리풀고 입으면 목걸이만 걸어도 더 이뻐보여서 더 좋은거 같구요 날씬한분들이나 통통하신분들이나 크기가 넉넉하고 사이즈도 잘 맞는것 같네요 사진으로 볼때보다 실제로 입었을때 무늬나 재질도 이뻐서 더 이쁜거 같아요
kjhlij6**|평소 연청을  좋아하긴했지만 별로 기대하지않은 바지였어서 더 이뻐보임ㅋㅋ 걍 이쁨 근데 약간 길이가 길어서 롤업해서 입고다니는데 롤업한게 더이쁜듯함! 색깔도 시원하고 걍 이뻐요! 고민말고 사세요ㅎㅎ
pja15**|휴가철 필요한 아이템이에요!
sk50**|옛날에 샀었는데 다른것들 산거 후기남기는김에 남겨요 옷은 진짜이뻐요 친구도이쁘다고그랬어요 근데 팔 소매가 좀 짧더라구요 그건 아쉬웠어요 그리구 생각보다 얇았어요 저는 꽤 두꺼운줄알았거든요 검은색바지랑 입고 저것만입어두 이뻐요 추천드려요
pja15**|생각했던거보다 이쁘고 좋아요!
trimo**|원래 쇼핑몰 같은데서 사면 잘 맞지않아서 바지나 하의 종류는 잘 사지않앗는데 너무 이쁘고 싸서 이번에 주문시켯어요 3일만에 배송왓는데 입어보니까 조금 허리가 크네요 그리고 밑단이 많이 짧아서 허벅지부분이 헐렁헐렁 할때는 조심히 활동해야 될 것 같아요
yeonju10**|여기서처음구매한옷인데입어보니깐너무이뻐요!!m샀는데살짝크긴하지만입으면핏도이쁘고잘산것같아여!
swooyou**|진짜 제가 찾던 반티중에 갑인듯싶네용 맨날 반티 찾다보면 소재가 너무얇거나 기장들이 길어서 사고도 후회한 적이 많은데 이번거는 후회도없고 마음에 쏙들어요!!기장도 적당하구 그렇게얇지도않고 두껍지도않은 적당한 두께!밑에 어떤걸입어도 잘어울려서 너무좋아요~~
famili**|흰색으로 구매했어요 긴팔은 니트식으로 집에있는데 반팔은 없고 다른건 언니꺼라 제 옷도 따로 가지고싶어서 샀는데 정말 이쁘고 잘산거같아요 배송도 정말 빨랐구요 흰색이라 때탈까봐 살짝 걱정되지만 그거외엔 예쁘고 무난하게 잘 입을수 있을거같네욯ㅎ
famili**|사고싶어서 샀는데 정말이쁜거같아요 유용하게 잘 입고 다니고있어요 ㅎㅎ 항상 기본으로 가지고있는옷이라해서 고민하다가 바로 샀는데 후회도없고 가족여행이랑 다른 여행다닐때 많이 입었어요 배송도 정말 빨랐고 저한테도 잘 어울리는 색상으로 사서 좋았습니당ㅎㅎ
sk50**|제가 살찐걸 망각하고 원래입던사이즈로 샀더니 작네요...교환하려다가 귀찮아서 살빼고입으려구요...입을수있겠죠?L할걸그랬나바욬ㅋㅋㅋ옷은 스판도 짱짱하고 좋아요 하이웨스트라그런지 배꼽까지올라오네요 살빼면 자주 애용할수있을거같아요 바지는이뻐요 제가 살을빼야죠
trimo**|지난번에도 사려고 주문햇는데 재고가 다 떨어져서 주문 못햇엇는데 이제야 주문하네요 주문하고 3일만에 받앗는데 금방 받앗는데 너무 좋고 따로 셀카봉 들고 다니지 않아도 셀카렌즈만 잇어도 될것 같아요 화질도 나쁘지 않고 언제어디서나 사용가능한 좋은 제품인 것같네요
misonuy61**|아이보리랑 블랙 두가지샀어요 ㅎㅎ 동생하나주고 저하나 입고 놀러갔는데 이쁘네요!ㅎㅎㅎ 적당히 루즈해서 더운여름엔 더 좋은것같아요 ㅎㅎ 흰색도 있었으면 좋았을탠디 아쉽네요 ㅠㅠ 그래도 편하고 이쁘게 잘 입을수 잇을것같아요 ^^
leesjin10**|요즘 헤어밴딩이나 와이어처럼 머리에 뭔가 꾸미는게 너무 이뻐보여서 하나둘 살까하는 마음에 구매하게되었는데 너무이뻐요ㅠㅠㅠ 저같은 경우는 머리를 풀고 하는것보단 묶고하는게 더이쁘더라고요! 고민하시는분 있으시면 구매하셔도 좋을것같습니다ㅎㅎ오늘 한 5~6시간정도를 밖에서 하고있었는데 아무래도 시간이 오래지나다보면 귀 뒤쪽부분이 아파오는 느낌도 있더라고요.밴딩이니 어쩔 수 없는 부분인것 같아요 참고해서 구매하세요!
sk50**|청반바지랑 일반티랑입으면 밋밋해보이길래 벨트의 필요성을 느끼고 다른 옷이랑 주문하는김에 주문했는데 만족스러워요 이뻐요 포인트도되고 사길잘한거같네요 이제 밋밋한건 사라지겠죠 다행이에요 기본티랑 바지랑 잘입을거같아요!!
trimo**|v평소에 클러치백 사야지 생각하고 무엇을 살 지 몰라 계속 고민하고 잇엇는데 고고싱ㅇ서 비싸지않고 심플하게 나와서 바로 주문햇더니 생각한 만큼 갠찬은것 같아요. 클러치백이라서 조금 작은 것과 많은 것을 담을 수는 없지만 심플하게 딱 지갑이랑 핸트폰 정도만 들고 다닐대 이쁠 것 같아요
sk50**|모델분이 입으신것처럼 핑크색티랑 입었는데 너무이뻐요 길이도 적당하구 첨에 배송와서 옷에서 냄새나는거빼곤 다 좋아요 옷도 이뻐요 엄마도 이쁘데요 인터넷에서 옷사면 별로라고 사지말라그랬었거든요 싸게잘샀대요 앞으로도 고고싱애용해야겠어용~
kjhlij6**|이쁜데..흰옷 특성상 금방 때가타네요흑흑ㅠ 그래도팔길이도 이쁘고 전체적인 길이도 적당한듯!올여름 자주 입고다니는 옷중 하나에요!비침이 살짝있지만 많이 티않나서 걱정 않하시고 주문 해도 될듯합니다! 쨋든 만족합니다
tlawndn**|후기를보고샀는데 후기랑 같이 가격에비해 질도 좋았고 사이즈도 사람들이 크게나왔다고했는데 그렇게 크게 나온거같지않고 딱 맞아서 좋았어요 불편한 것도 없었고 만족스러워요!!!!!!!!!!!! 항상 바지 살때는 사이즈 걱정을했었는데 괜찮았떤거같습니다
trimo**|처음으로 고고싱에서 반지를 사봣는데 처음에는 내 손가락에 안들어가면 어쩌나 조금 걱정햇지만 막상 반지를 손가락에 끼고ㄴ니까 누구나 낄수 잇을을 것 같고 그렇다고 해서 너무 크거나 작지도 안아서 정말로 만족합니다.  디자인도 제가 원하던 대로 작고 심플해서 이쁜것 같네요
ksh93162**|한눈에 반해 샀는데...사이즈 실패로 인해 ㅜㅜ 너무 허리가 딱 끼더라구요.어느새 이렇게 살이 쪘는지.. 다른분 드렸어요다른 사이즈로 다시 사려구요고고싱은 다좋은데.. 바지마다 같은 사이즈라도 허리 사이즈차가 좀 나는거 같아서... 어렵네요 ^^
dlgmlrud**|약간까실한 재질이라 그리두껍지않고 얇지않고 고무로 되있어서 편하게입기 좋은거같어요 검은색을 사서 아무 티나 입어도 되서 좋아요 슬랙스 처음 입어보는디 너무 편하고 좋은거같아요 낑김도 없고 너무 편한서같아서 너무 좋아요~~~~~
leesjin10**|아무래도 하뚱이라서 하이웨스트 반바지를 입어 다리가 길어보이는 착시효과를 보기위해 열심히찾다 이 바지를 구매했습니다. 몸무게는 57~59입니당! L사이즈로 구매했구요! 처음딱받고서 설레는 마음으로 입어봤었는데 와우. 정말로. 와. 짱이에요 진짜 임심10개월같다하는 제 뱃살을 바지가 이쁘게 잡아주는? 느낌이 들면서 정말이쁨니다ㅠㅠㅠ 정말 하이웨스트 바지 뭐입을까 고민하시는 분들 절대 고민하지마시고 바로구매하세요 정말로 후회안합니다.
tlawndn**|후기- 키, 몸무게 153, 42-착용사이즈 s-착용후느낌은?(좋은점/나쁜점) 후기들 보니까 다들 사이즈에 비해 크기가 크게나왔다고해서 s를삿는데 딱맞아서 좋았어요 지하상가나 이런곳가는것보다 훨씬 싸게 사서 좋아요재질도 가격에 비해 나쁘지않아요 !!!
dlgmlrud**|색상도 너무 마음에 들구 많이 비치는재질이아니라서 편하게 입을수있어서 너뮤마음에드는거같아요 목라인이 너무 파인것도아니고 적당히 파엿고 7부라 더좋은거같아요 폭도 너무넓지않고 붙는것도 아니라 더좋은거같아요 이런재질 옷 많이 들어오기해주세용~
godio**|어떤티에입어도이쁘구요샌들에 딱!!!남자친구가 너무사랑스러운옷 입었다구너무조아햇어여!!역시 핏도굿!!!
dbwls04**|먹으면 먹는대로 다리에 차곡차곡 쌓이는 하체비만이라 허리가맞으면 허벅지는 가슴과다르게 터질듯해서 사이즈고민 많이했는데 작으면 살빼고 입자는 마음으로 그냥s로 샀어요근데 딱 보고 m살걸....제 몸뚱아리를 잊고...근데 신축성덕분에 들어가긴해서 잘입고있어요 사진처럼 허벅지살이 자기주장이강한데 추할정도는아닌거같아서 (보기에 추하면 말고요...ㅠ) 색깔은 사진하고비슷해요 어두운청색! 핏만빼고 (이건내허벅지잘못) 제가딱 원하던 바지라서 너무 맘에들어요 색도이쁘고 고고싱에서 처음샀는데 바지 자주사야겠어요 암튼 잘입을게요  배송도하루만에왔서요!!굳
dlgmlrud**|깔끔하고 바지이 살짝넣어입으니까 너무 이쁜거같아요 심플하고 이쁘네요 다른색상도있어어도 이뻣을거같아요 붙는옷이 아니라서 바람통하고 땀이붙질않아서 좋은거같아요 다른색상나오면 꼭 살려구요 다른색상도 만들어주세요!!!!
nayuni**|옷 예뻐요!!ㅋㅋㅋ진작 살걸그랬어요8ㅅ8 그럼 자주 입고다녔을텐데ㅜ 길이도 적당하고 두께도 여름에 입고다니기 적당해서 마음에 듭니다b 연청이랑 중청 중에 고민하다가 가지고 있는 티셔츠들이랑은 중청이 더 잘 어울릴것같아서 샀는데 생각보다 더 예쁩니당!
godio**|스판도좋구 조아요~~핏도이쁩니당!!고고싱에서 사고 후회한적이한번도없어용정사이즈사는걸 추천!!!!
ehdqkd71**|이거진짜대박ㅋㅋㅋ허리가완전쏙!!!!!들어가요ㅋㅋㅋ배도홀쭉~~대신 입기는엄청힘들어요ㅋㅋㅋ붙는옷입을때 입으면 마법처럼뱃살을 잡아주는듯!!입을때만 괜찮으면 데일리로 입고싶은데 너무입을때 힘빠져서 ㅋㅋ 그래도 꼭하나쯤은가지고있어야할 아이템인듯 해요ㅎㅎㅎ
ocvb**|배송도 생각보다 빨리온 것 같아요 이틀정도 걸린 듯? 인터넷 쇼핑몰에서 처음 주문해봐서 좀 걱정했었는데 생각보다 옷 질도 괜찮고 실물도 좋았어요! 입었을 때 부해보일까봐 걱정도 했는데 주변 사람들이 더 날씬해보인다고 말해줬어욯ㅎㅎㅎㅎ 앞으로 고고싱에서 많이 사게 될 것 같네요
lkio2**|처음 바지 입었을 때 신축성이 꽤 좋은것 같다고 느꼈어요.다리도 조금 더 얇아보이는 느낌이고 좋아요.아무래도 여름이라 자주 입기는 힘들지만 그래도 입으니까 이뻐요색도 진짜 그냥 진청이구 사진하고 똑같아요가을이 오면 자주 입을 거 같아요ㅎㅎ
dlgmlrud**|생각보다 마니 안풍덩하고 라인이 맞춰진거같아서 너무좋아요 배기처음입어보는데 날좀풀리면 입으려구요 조금 두꺼워서 더운날은 못입을거같네요 사이즈도 딱맞고 허버지는 살짝붙고 많이 안찢어져서 더 이쁜거같아요 배기이뿐거같아요!!
dlgmlrud**|칠부라 여름에 입기 좋을거같아서 삿는데 생각보다 엄청두껍더라구요 더운날은 못입을거같어요..그래도 색도이뿌고 디자인도 이뿌고 박스티처럼 커서 펑퍼짐하기 입기 좋은거같어요 배송도 빠르고 너뮤너뮤조은거같어요 다른색상도 살꺼 생각중이에요
lkio2**|딱 봤을때 편해보여서 샀어요ㅎㅎ배송 왔을 때 입어보니 편하긴 했는데 제가 생각한 핏이나 느낌은이니었어요ㅜ 그게 조금 아쉬웠어용그래도 길이도 짧지 않은 편이고 편하게 입을수 있을 것 같아요흰색이라 때묻지 않게 잘 입어야겠어요ㅎㅎ
syvkd**|갑자기 문자로 10000원 적립금 쿠폰 와서 써서 샀는데 짱 시원하고 좋네요 근데 스판끼는 그렇게 좋지는 않은거같아요..ㅎㅎ 그 부분이 좀 아쉽긴 하지만 적립금 쿠폰 왜 갑자기 주신건지 궁금.. 저야 감사하지만ㅋㅋㅋㅋ 잘입을게요 감사합니다!
syvkd**|싸서 기대안했는데 질도좋고 이쁘네요 입으니까 여자된느낌?ㅋㅋㅋㅋㅋ 막이래 가격대비 짱이뻐요 다음에 주문할때 흰색도사려고요! 원래 상품평 잘 안남기는데 너무 마음에 들어서 남깁니다 많이 파세요~~~~~~~~~~~~ ^0^
kjhlij6**|일단 자주입을수있는 무난한티를 찾고있었는데 무난무난 하게 잘산듯해요 질은 약간 두꺼워서 더 좋았어요! 그렇다고 막 지금같은 한여름에 못입는두께도 아니고 적당한듯해요 .나가기전 입을꺼없으면 고민없이 입을수있는?그런 편한옷이에요! 잘산것 같아요:) 고고싱은 믿고 사도되는 그런 쇼핑몰인듯!
leesjin10**|포토후기2등!!이네요! 그냥 브이넥처럼 시원해보이는 블라우스를 찾다가 이걸 발견해서 바로 구매하게되었어요! 팔길이가 짧지도 길지도 않아서 약간 걸리적거리는? 느낌이 있지만 매우불편할 정도는 아니에요!(이쁘니까 용서해준다ㅎㅎ) 전체적인 길이는 약간 짧을 수도 있어요. 전 하이웨스트바지를 입어서 그런지 괜찮았어요! 옷안까지 심하게 보일정도는 아니라서 나시없이 입기에도 좋아요 시원시원~
