nn71**|배송은느렸지만완전좋아요!스판짱짱원하던핏도나와요ㅋㅋㄲ
kmjmar**|깨끗한 하얀색 맨투맨을 찾다가 고고싱을 알게되었네요. 평소 미키미니를 정말 좋아하는데 거기에다가 미키 엉덩이가 너무 귀여워서 바로 구입결정하였습니다. 시보리 처리가 잘 되어있어서 진짜 기분 좋구요 박시한 스타일은 아니니 참고하세요.엉덩이 조금 덮는기장이구요 전 제가 찾던 거라 좋네용!!완전 귀요미입니당
rlatngus9**|블랙색상 후기 남깁니다.ㅎㅎ너무 얇지도 두껍지도 않고, 니트가 촘촘?하게 짜여있어서 좋아요몇번입었는데 올이 풀리거나 보풀이 일어나지 않아서 좋습니다.!! 저한테는 팔길이가 조금 짧은게 아쉽긴하지만 만족스러워요ㅎㅎ 요즘 검정니트에 청바지나, 청치마 자주 입고 나갑니다.
rlatngus9**|핑크색상구매했습니다ㅎㅎㅎ후기 쓰는걸 까먹고 이제서야 늦은후기 적습니다ㅠㅠ생각보다 니트가 커서 부해보이는 감이 있어요그리고 비침이 있어서 아쉽습니다.하지만 요즘 날씨가 따뜻해져서 니트하나만 입고나가기 좋을것같아요!! 봄에 입기 좋은 두께인것같습니다.
dltnqls53**|원피스안에도, 치마에도, 청바지에도 어디든 잘 어울리는 것같아요여름에 쉬원하게 입을수 있고 봄,가을에도 겉에 겉옷만 걸치면 잘 입을 수 있을것같아용5부 반팔은 처음인데 뭔가 그냥 반팔보다 부담스럽지 않고몸매도 부각되면서 예뻐보이네용 ㅎㅎㅎ좋아요~~
dltnqls53**|여름에 편하게 입을 수 있는 나시원피스 너무너무 필요했거든용보자마자 샀어용!! 너무너무 예뻐용비칠까봐 걱정도 했는데 안에 속치마가 있어서 비치지도 않고쉬원한 소재로 되어있어서 여름에 편하게 입기 좋은것같아용길이도 짧지 않아서 정말 어디든지 편하게 입을 수 있는 원피스강츄츄입니다
vcxz110**|슬랙스 사고싶다 갖고싶다 하다가 결국 질렀어용!!ㅎㅎ 기본으로 검정색 슬랙스 ~여름에입어도 괜찮을거같아서 ㅎㅎ배송하루만에왔구요 옷 되게 깔끔시크 ㅋㅋㅋ 멋쟁이가된기분이랄까 핏도 엄청 제가 생각했던 딱 그핏이에요 입었을때 굉장히 예쁘게 핏 떨어지구요 슬랙스 필요하시다 하시는분들 요고 추천해드릴게용 ㅎㅎ  중간에 주름도 잡혀있어서 예뻐용 ㅎㅎ 두께도 적당히 얇고 좋아영 27사이즈입어서 m사이즈샀는데용 허리부분이 아주조금커용 신경거슬릴정도는아니구요 ㅎㅎ 성공적인 선택이였던거같아용 고고싱 많이 아낍니다 ㅎㅎ
dltnqls53**|잔꽃 나시원피스여름에 쉬원하게 입을수있는 나시원피스!!혹여나 많이 비칠까 걱정했는데안에 속치마도 있고 엄청 쉬원한 소재인거같아요 ㅎㅎ안에 하얀색 반팔티 입고 입으면정말정말 예뻐용!!!길이도 그렇게 짧지 않아서 편하게 입을 수 있는 원피스같아요ㅎㅎㅎㅎㅎㅎ배송도 하루만에 왔고완전 강츄츄츄
vcxz110**|블랙색상m사이즈로 주문해써용ㅎㅎ 배송은 하루만에와서 엄청좋구여 ~~ 기본으로 이제 날씨도더워지고해서 반바지 그냥 검정색 찾다가 봤는데 깔끔해서 샀어요 ㅎㅎ 딴 색깔도 예쁠거같아요!!사실 너무 기본색으로사서 조금 후회중..ㅋㅋ 분홍색도예쁠거같네영 그래도 사이즈 잘맞고 편해요 너무짧지도않은길이라서 적당한.반바지길이~ㅎㅎㅎ 조아요조아여 !! 핏도 되게 예쁜거같아요 괜히 다리가 더예뻐보이는 착시효과 ㅎㅎㅎ 조아여!
rlatngus9**|그레이 색상 구매했습니다!!!!!댓글에 옷 재질일 찰랑?거리고 부드럽다고 하셔서 구매했는데찰랑거리고 부드러운 재질이라 맘에듭니다 아쉬운점은 목부분이 조금답답해보인다는 거랑옷이 너무커서 부해보이는 감이 있네요 ㅠㅠ 그래도 세일할때 사서 나름 만족합니다
whguswls27**|비침이 심해서 좀 실망했어요 그리고 너무 파였고요 이거 한개만 입고 다니기 좀 그렇고 그위에 머 하나 걸쳐야 입을수 있을것같아요
whguswls27**|어깨에 매지않았을때 좀 작아보였는데 어깨에 매고나니깐 크기 적당했어요!!이뻐요
whguswls27**|첨에 그레이색 사고싶엇는데 오월초에온다해어 검정을삿는데 청바지에어울리고 너무 이뻤어용 사면후회않하실거에요!!
vcxz110**|M사이즈 화이트로 구입했어용 폴폴플리츠 스커트 이름 기욥ㅋㅋ 폴폴~ 배송은 어제시켰는데 오늘와서 좋았구요 얇은데 안에 속바지같이있어서 안비쳐용 ㅎㅎ 뭐랄까 화면으로보고 약간 두꺼운 면?이라생각했는데 받아보니까 얇더라구요 ㅎㅎ 여름에입어도 시원시원 할거같아용 !그리구 흠.. 주름은약간 실망이네여 ㅠㅠ뭐랄까 입었늘때 붕뜨는느낌이랄까..? 흠ㅋ 다리미로 촥촥펴보고 다시 입어봐야겠으용 ㅎㅎ 편하고 예뻐요 !흰색치마는 솔직히 비쳐서 걱정이 많은부분인데 안비치구 근데.속바지가 다리에 착감기는게아니라 편한잠옷같이 헐렁해용 ㅋㅋ 전체적으로는.만족합네다!!!
jojny**|제가 살이 있어서 그런지 모델 언니 핏만큼 나오질 않네요ㅜㅜㅜ그리고 ㄱㅅ 부분이 뜨니깐 옷이 부하게 뜨네요ㅜㅜㅜ위에 가디건이나 니트 입고 입으면 예쁘고 괜찮을것 같아요!!!
jojny**|처음 사봤는데 좋네요!압박 스타킹 신은듯이 압박감도 있고 괜찮네요그러나...엄청 압박되거나 그런건 아니네요...그냥 보통 레깅스보다 압박이 있는정도?이거 신고 다니면서 살이 빠졌으면 좋겠네요ㅎㅎㅎ
jojny**|스타킹이 없어서 구매했는데..생각보다 좋네요!매우 얇아서 잘찢어질 줄 알았는데 생각보다 올도 잘 안나가고 좋아요♥있는거 올 나가고 하면 다시 사야겠네요♥♥
rlatngus9**|베이지 색 구매했습니당!!배송은 이틀정도 걸린것같고,....비침은 슬라브티라 아주아주약간은 비치는데크게 신경쓰이지는않아요목부분이 조금많이 파인것 같지만..이정도면 가격대비 만족합니다 봄 여름에 잘입고 다닐것같습니다~
kan**|키 158 몸무게 50 주로입는 바지 사이즈는 27이에요!상의는 44도 가능한 상체 마르고 하체 튼실한 체형인데 s살까 m살까 고민하다 후기보고 m사이즈 질렀지만...저같은 체형은 보통 바지 사면 허리는 너무 크고 엉덩이랑 허벅지는 딱 맞는거 아실거에요ㅠㅠ그래서 역시나 허리는 너무 크고 허벅지랑 종아리는 좋은 핏이 나오네요ㅎㅎ...그리고 길이가 너무 길어요!161인 제 동생이 입어도 한단 접어야될 정도? 저는 물론 두단 접습니다 헷허리띠 구매해서 입으려구요! 모처럼 엉덩이 낭낭한 슬랙스 하나 장만했는데 동생 주기 아까워서ㅠ그래도 이만한 가격에 질 좋은 옷 장만해서 좋아요!역시 믿고 사는 고고싱!
wndud45**|소재도 너무좋고 여름에입기도 좋고 귀여운바니까지 그려져있는데 가격이.. 너무너무 싸서 더좋은 제품?? 저는 떡대가있는데도 괜찮아요^^ 그냥사보기 괜춘한듯요~
wndud45**|이거 너무 귀여워요 이제 맨투맨을 탈피하고 처음입었던 옷인데 너무이쁘고 맘에 쏙들어요!!^^
wndud45**|정말 꽉꽉 쪼여줘서 좋구요~^^ 잘모르고샀는데 다이어트?에도 효과있다고해서 더 잘써보려구요^^
gpqls81**|이뻐요!!이뻐 핏도 이쁘고 ㅎㅎㅎ고고싱 지금처럼 번창해라!!!ㅎㅎ♥️
gpqls81**|그렇게 많이 땡땡하지고 않고 이뻐요!!!
gpqls81**|지금도 입고 잇는데 편하고 좋아요ㅎㅎㅎ그래서 한개더 주문 할려고요!!쇼핑몰은 고고싱 젤 많이 이용하는데역시 실망시키지 않네요!!!
gpqls81**|완전 편해요!!! 불편함이 거의 업서요 티도 많이 안나고 엄청 좋아요♥️♥️
gydms22**|화이트로 구매했습니다청색깔 계열에 입으면 꾸미지않았는데도 이쁘게 입을수있어여소재도 굿b
gydms22**|핏감이뻐여!! 저는 회색구매했습니당ㅋㅋㅋ인기많아서 좀 오래걸렸지만그래도 기다린 보람이있어요 두툼하고 이뻐용
gydms22**|230으로 구매했어요 하얘서 조심해야겠지만그래두 무난하게 신기 딱좋고 이뻐요~
gydms22**|블랙으로 구매했는데 핏감이 너무 이쁘고 가볍게 걸칠때 좋아요!!!! 요즘같이 기변있는 날씨에 딱좋은듯
cjsrnrtjd**|이상하다고 생각 될수도 있는데 단추를 잠가지 않아도 되고 단추가 없음에도 단추가 있어서 난방처럼 보인다는게 너무 좋은거 같아요 덤으로 여리여리 해 보이기도 하구요 또 굳이 치마나 바지에 넣지않고 바지위에 입어도 이뻐요남자친구가 좋아해욯ㅎㅎㅎ
blackpin1**|제가 좀 찢어진 청바지 되게좋아하는데 여기 고고싱은 다 이뻐서 몇개나 샀는데 핏도 되게좋고 이뻐요!
blackpin1**|청바지에 이거하나 입어도 심플하고 되게 이뻐요 ㅎㅎ
blackpin1**|되게 편하고 겉에 집엎을 입던 셔츠를입던 스타일링 그냥 끝!
h028**|7부티 사고싶었는대 잘산거 같어요 편하게 입기도좋고 다른 색깔도 또 사고싶어요 그리고 길이가 쫌 길고 가격이 저렴한거에 비해 질도 좋고 괜찮고 이쁘네요 항상고고싱에서 구입하는데 후회하지않습니다!!!!!!!!!!!!!!!!!
jde93**|너무 귀여워요 아무옷에나 다 잘 어울리고제가 키가 작은편인데 딱 맞고 좋아요
h028**|정말이뼈요 요즘날씨에도 딱이고 여름에도딱이고 잘입을꺼같아요 하이라 입으면 많이짧아지긴하지만 여름에입으면되겟조 이뻐요!!!!!!!!!!!!!!!!!!!!!!!!!!!!!!!!!!!!!!!!!!!!!!
pdi12**|포토후기 1등이에요!!배송은 삼일정도 걸렸구요~아이보리색 가디건 필요했는데 진심 에뻐요ㅠㅜㅜㅜ디자인도 사진이랑 그대로구요ㅠㅠ통통한 체질이라서 걱정했는데 넉넉히 잘 맞아여ㅠㅠ어깨선이 아래에 있어서 귀여워보이는 것 같구요!!다른 색도 조만간 재구매 할 예정이예요!고고싱 옷은 거의 다 성공인것 같아요!ㅎㅎ 감사합니다~
h028**|색깔이 딱이 제가 원하능 색깔에 핏도정말이뻐요. 무릎에 구멍이없는줄알았는데  있어서 당황했지만 그래더 이뻐서 잘입을꺼같아요!!!!!!!!!!!!!!!!!!!!!!!!!!!!!!!!!!!!!!!!!!!!!!
cjsrnrtjd**|앞 뒤가 언밸런스 해서 굳이 바지에 집어넣어 입지 않아도 되서 좋은거 같아요 다만 통통한 언니들은 비추요 상체가 좀 부해보일 수 있어요. 대신에 마른 언니들은 진짜스키니랑 입으면 이쁠것 같아요. 저도 지금도 입긴 입는데 다이어트 마져 하고 자주 입고다니려구용
h028**|7부티 사고싶었는대 잘산거 같어요 편하게 입기도좋고 다른 색깔도 또 사고싶어요 그리고 길이가 쫌 길고 가격이 저렴한거에 비해 질도 좋고 괜찮고 이쁘네요 항상고고싱에서 구입하는데 후회하지않습니다!!!!!!!!!!!!!!!!!
cjsrnrtjd**|처음에 바지 입을 때 무릎 찢어진 부분에 발 들어가지 않게 조심하셔야 해요 저는 조심스럽게 입지 않아서 무릎부분이 더 찢어졌어요 스판기가 있어서 편한거 같아요 다만 다리 얇아보이고 싶으신 분들은 비추에욤.. 그래도 이쁜건 변함없어요.이쁘게 입을께욤
cjsrnrtjd**|좀더 살빼고 입으려구요 어깨 넓어보이는거 싫어하시는분은 비추입니다대신에 치마나 바지속에 넣어 입으면 훨씬 이쁠꺼 같아요저는 주로 치마속에 넣어 입는데 안에 나시를 입어야한다는불편함 빼고는 다 좋아요 색깔도 완전 뽀얀 하얀색이고마른 사람 추천이요
cjsrnrtjd**|요새 제일 자주입는 옷이에요일단 날씬해 보인다는게 첫번째이유입니다.두번째 이유는 진짜....시원해요왠만한 반팔보다 시원한듯자주애용할께욤!
cjsrnrtjd**|사이즈는 m 샀어요. 안쪽에 바지가 내장되어 있어서 속바지를 입을 필요도 없고 활동도 훨씬 자유로운거 같아요대신에 뱃살이 쫌 많다면 라지사이즈 추천해요핏은 이쁜거 같아요!!자주 이용할께요
sk82**|s
hd97k**|편안하게입기는좋아요 ㅎㅎ
hd97k**|쫌짧은거빼고는 괜차나여이뻐여 ㅎㅎㅎ
thekqls9**|비침도 없고 라인도 이뻐보여용
epslakd**|고고싱에서 처음 구매해봤는데~생각보다 면 재질이 좋네요가격에 비해 아주 고퀄이예요아쉬운점은 티셔츠 너비에 비해 길이가 너무 짧아요..너비가 더 좁등가길이가 더 길등가 하면 좋겠는데..비율이 참 아쉽네요.그래도 반바지 안에 티 넣고 입으면 감쪽같아요 ㅋ
dbsdld**|77.88한탠 딱 이쁘게 맞을듯..55사이즈인대 너무 큼..
ejqmf05**|포토후기 3등기본나시가 필요해서 그레이 색상으로 구입했어요일단 원단은 좋아요 쫀쫀해서 좋구요입었을 때도 이뻐서 좋은데 한가지 단점이 있다면팔 부분 어깨 부분이 쪼여요 제가 어깨가 좀 넓은 편이기도 하고팔이 두껍기도 한데요 그래서 인지 팔 부분이 쪼이는게 있어요조금 더 넓으면 좋긴 할텐데..뭐 이런 부분만 아니면 괜찮아요
eunjoo94**|야상과 항공점퍼중 고민하던 나에게 확들어온 옷!!! 입었을때도 이쁘고 너무 길지도 짧지도않은 길이감으로 입었을때 이쁘구요 안에는 아무옷이나 입어도 다 잘받쳐줘서 좋아요 다만 한 가지 아쉬운점은 박음질이 조금은 매끄럽게되있지않아서  당황할수있어여..
eunjoo94**|니트짜임이 도톰해서 요즘 같은날씨에 하나만입고다니기도 좋아여!! 자칫 밋밋할수도 있는데 브이가있어서 포인트가되서 이쁘고 입어도 몸에은근히 붙는핏이라서 청바지나 검정바지에 입어도 이뻐여 데일리 룩으로 짱짱 이쁘게 잘입을게요
jilleo03**|포토후기1등(?)이요!!! 제목을 어디에 써야할지 모르겠네요 ㅠㅠ 1등이라고 말한 분이 없길래 혹시나...ㅎㅎㅎ천이 두꺼운것도 아니고 많이 얇은 편도아니고 적당한 정도에요! 여름되기 전까지 잘 입을 수 있을 것 같아요~~제가 피부가 좀 까만 편이라 너무 하얀색이면 어쩌나 걱정했는데, 색깔이 완전 하얀색이 아니라 아이보리색에 체크무늬라서 좋아요!! 이쁘게 잘 입을게요 @^^@
al56**|기본티로굉장히좋고촉감도좋아요ㅎㅎ코디하기두편해요
al56**|기본티로원했는데굉장히편하고코디하기좋아요
al56**|허리가26인데허리가좀컷지만ㅜㅜㅜ그거빼곤다괜찮아요여름에시원히입을수있을것같아요
al56**|굉장히쫀쫀하고면이좋아요ㅎㅎㅎ잘입을께요ㅎㅎㅎ
ihappy04**|흰색운동화가 없어서 이번기회에 고고싱에서 주문했어요~ㅎㅎㅎ 제가 키가 큰 편이 아니라서 꼭 굽이 어느정도 이쓴 운동화를 신는데요, 우와 이건 3cm정도 되서 굽이 부담스럽지도않고 어느정도 키높이 효과를 적당히 주어서 너무좋아요!! 그리고 하얀색이라서 자주 빨아줘야 하지만 그래도 봄에 잘어울리고 특히 전 스커트에 잘 어울리는것 같아요! 이 가격에 이정도 품질이면 정말 좋은것같습니다^^ 전 230 정사이즈 샀는데 아주 잘맞아요 잘신겠씁니다!^^
al56**|저는검은색이랑흰색을샀는데굉장히쫀쫀하고편하고좋아요ㅎㅎㅎㅎ잘입을것같아요
ihappy04**|저는 베이지색이랑 핑크색 2개사서 각각 9900원에 득템했어요~~ 근데 사자마자 얼마 안있어서 날씨가 갑자기 더워져서 당황스럽긴 한데 ㅠㅠㅠ 옷 자체는 정말 너무이쁘고 품질도 좋은거같아요~^^ 만원치고는 잘 늘어나지도 않을거같아요 ㅎㅎㅎ 베이직해서 청에도 잘 어울리고 일반 면스커트에도 잘어울려요 ㅎㅎㅎ 특히 핑크니트도 칙칙한 핑크가 아니라 이쁜 딸기우유색이라서 봄에 입기에는 더욱 좋을거같아요!!^^ 개인적으로는 소라색도 사보고싶어요 ㅋㅋㅋㅋ
yang03**|굿굿 다른 색상은 잘모르겠지만 제가 이제품은 흰색상으로 구매해가지고 입어보니 비침감이 있더라구여. 팔통도 널널하다못해 커가지고 여름에 입기 정말 좋은 티인것 같구여 비침없는 옷을 사고싶으시다면 흰색 말구 다른새상으로 구매하세여~
ihappy04**|평소에 청치마가 갖고 싶어서 고고싱에 있는 여러 청치마들 비교해보면서 샀어요!!^^일단 저는 S사이즈 주문했어요 근데 다른 면스커트에 비해서 신축성은 확실히 떨어져서 똑같은 사이즈라도 청치마가 활동성은 더 불편한거같아요 ㅠㅠ 그래도 티에입어도 이쁘고 니트에 입어도 이쁘고 남방에 입어도 이뻐서 가지고있는 어떤 옷에도 매치가 잘 될거같아요^^사이즈 보고 잘 구매하셔서 다들이쁘게입으세요!!ㅋㅋㅋ
dbsgpwls**|지금 입기에 딱 좋습니다!다만 길이가 조금 짧아서 그것 빼고는완전 만족이에요!!!개인적으로 핑크색을 더 사고 싶네요 ㅠㅠㅠㅋㅋㅋ
yang03**|제가 발이 크고길어서 250신는데 디자인이 너무 마음에 들어서 다른쇼핑몰에서 저런신발 찾다가 여기서 보자마자 바로 사야겠다는 생각을해서 주문했어여. 제 발사이즈가 커서 신발이 처음에 되게 커보여서 ㅠㅠ했는데 신어보니 적당히 키도 커보이게해주고! 제가 흰신발 관리만 잘한다면.. 신기이쁘고 정말 좋아융!
mini46**|예쁘긴한대 약간 덩치있어보여서 고민이네요 ㅠㅠ
dbsgpwls**|역시 저는 하비라서 그런지.......허벅지가 살짝 끼네요 ㅠㅠ 편하게 입으려고 산건데 ㅠㅠ그래도 색깔이랑 예쁘고 디자인도 좋아요!
mini46**|완전 짱짱 하고 소재가 여름에도 시원할것같아서 좋아요!
dbsgpwls**|주문하고 바로 와서 너무 깜짝 놀랐네요!사실 비슷한 반스 단화는 225 신거든요...근데 혹시나 해서 230 시켰는데 ㅠㅠ 역시나 크네요 ㅠ이거는 발에 딱맞게 시켜야 될 듯해요@너무너무 예쁘고 굽도 너무 튀게 있지도 않아서 좋습니다!
chl**|그린색 샀는데 전 별로예요착용감이 좋긴한데너무 어려보인다해야하나제 나이대에는 아닌듯 ㅠㅠ다음에 캐주얼한 티 입고 도전해볼게요지금은 걍 집에 고이 모셔두는중길이감은 짧지 않아서 적당해서 좋아요다음기회에... 색 미스 ㅠㅠㅠ
mini46**|길이도 딱 적당하니 예쁘고 다리가 얇아보여서 좋아요 ㅎㅎ
mini46**|루즈한핏이 딱 제 스타일이엿어요! 짱짱
yang03**|입으면 몸이 커보일것같다는 생각이 들었지만 막상 입어보니 정말 크네여 ㅋㅋㅋㅋ 여름에 입기는 조금 덥고 답답할것같고 봄이나 가을에 입기 정말 좋을것 같아여. 모델분이 입었던 청치마로 코디하면 정말 이쁠것 같아서 저도 여기서 저 청치마와 함께 구매했습니당~
chl**|ㅠㅠ나시가 짧아서..바지 안에 넣어도 다시나오고..길이감이 안타깝네요
mini46**|쫀쫀하고 스판끼잇어서 너무편해요 ㅎㅎ핏도 좋고요 추천!@
chl**|이뻐요. 무난하고 !좀 풍덩하다 해야하나?근데 핏 이상하지 않고 캐주얼하고 여성스럽네요.요즘같은 날씨가 적당한거 같아요검정 스키니랑 입으면 너무 잘 어울려요암튼이뻐요데일리용으로 굿진짜 자주 입게되네요~~~~~~~~~~~~~~~~
yang03**|ㅋㅋㅋ진짜 이렇게 쫀쫀한 슬랙스 처음봤어여.. 제가 평상복처럼 늘어나는 슬랙스 찾고있었는데 친구가 이쇼핑몰 추천해줘서 그많은 슬랙스중에 제일 신축성이 많다는 이 바지로 구매했는데 오... 허리는좀 큰감이 있고 종아리쪽도 통이커서 조금 줄여입어야할듯해여 ㅠㅠ 전 타이트하면서 활동하기 정말편한 옷들 굉장히 찾는편이라.. 쨌든 바지자체는 정말 좋아여!!!!
yang03**|안맞을줄알았는뎈..제가 골반부터 다리전체적으로 비만이라 치마입으면 보기도안좋을것같고.. 그래서 안입으려다가 하나사봤는데 A라인치마라서 하체 더 두꺼워보지이않을까 싶었는데 괜찮은것같에여~ 허리밴딩이라서 그런지 잘늘어나고 여름에입기도 시원하고 좋습니당!
ejqmf05**|일단 이번에 배송이 제일 빨랐던거 같아요길이는 적당히 길어서 좋구요 근데옷이 너무 구겨져서 왔어요 원단이 조금 뻣뻣한 느낌이 있구요 옷은 이뻐요딱 지금 입기 좋은 두깨에요
ghkrla**|일주일쨰 배송전이네요 배송 왜 안해줘요?  까먹으신거 같은데 일처리 그렇게 하지 말아요 전화해도 걔속 안 받고 얼른 배송 해주세요.
yang03**|짱짱짱짱 제가 비치는듯 안비치는듯, 실크처럼 여름처럼 시원시원하게 입을만한 흰 와이셔츠찾고있었는데.. 이가격에 이옷이라니 정말 짱짱짱짱짱이에여 ㅠㅠ 근데 이 와이셔츠는 많이비춰서 안에 나시랑 속옷도 깔끔하게 신경써서 입어줘야한답니당!
yang03**|두꺼워서 여름에 입을수 있을까하는 걱정을 했었는데 모델분이 입은것처럼 코디해서 입어도 정말 좋을것같구 청이라서 그런가 다른 색상과 맞춰입기도 즐거워여~ 여름에 입기에도 좋은두끼인것 같고 입다보면 끝단에 실이 풀리지않을까 쪼금 염려는있습니당~
ejqmf05**|♥포토후기 1등♥ (포토후기 1등 찾아보니 없더라구요)제가 트레이닝 바지를 너무 사고 싶었는데딱 업데이트 된거 보고 고민끝에 바로 샀어요네이비 색으로 했는데 너무너무 이뻐요 상품 와서 딱 받아보고 사이즈가 너무 작아보였는데저한테 안맞는건 아니까 걱정하며 입어봣는데작아보여도 어떻게 저한테도 맞더라구요진짜 너무 이뻐서 후회안해요 > ㅡ < ㅎ품절 되기 전에 하나 더 구입할까 생각중이에용 강추에요 입었때도 너무 편하고 좋아요
ejqmf05**|포토후기 3등배송은 생각보다 빨리 왔구요그레이 색상으로 했는데 아이보리 색상으로 하나 더 주문할까 생각 중이에용~ㅎㅎ기본으로 입기 딱 좋구요 제가 덩치가 조금 있는 편인데도 사이즈가저한테 딱 좋아서 편하게 입을 수 있어서 더 좋은것 같아요이뻐용~잘입을게요
rssr1**|배송도 진짜 빨라요. 색상은 블랙으로 시켰고 허리가 고무줄 밴딩이라 진짜 편하고또 소재 자체도 얇고, 면이라 그런지 활동하기 편해요.깔끔하면서도 심플한데도 티셔츠 한장에다 입으면 예뻐요.편하게 나갈 때 입으려고 샀었는데 입고 나가니까 친구들이 예쁘다고 해줬어요. 여름에도 입을 만큼 얇은 소재라좋은 것 같아요. 앞으로 많이 파세요~
psoyo**|평소 27~28 정도 입는데 28주문했고 딱 맞네요!제가 하체살이 좀 있는 편인데 딱 달라붙어요ㅎㅎ맘에 듭니다! 허리도 정사이즈 좋네요!
moon91**|소매 부분이 큰거 까먹고 막다니다가 오염 묻을뻔햇어요ㅎㅎㅎㅎㅎㅎ 그거 외엔  이쁜 것 같아요 ㅎㅎㅎ나름 이가격에 좋은 티 하나 건진것 같네여
milktea**|치마 자체는 괜찮은 것같은데 사이즈가 너무 작게 나온 것 같습니다. 평소 입던 사이즈인 S 시켰는데 맞긴 하나 너무 불편하네요. 키가 작은 편인데 길이도 짧은 듯하고 입고 돌아다니기에 불편한 듯하여 사촌동생 주고 M으로 다시 구매하려고 합니다.
moon91**|흰색 주문 했는데 ㅠㅠ 그냥 카키 주문 할걸 그랬나봐요 뭔가 그냥 잠옷이 될 것만 같은 기분이에요이쁠줄 알았는데 프린팅 글씨도 조금 작은것 같고 근데 옷재질은 생각한것보단 좋았어요 ㅠㅠ여기서 산 티 중에 제일 실패작인것같애요ㅠㅠ
nyj08**|친구랑 트윈으로 입으려고 두개 주문했어용 배송도 다다음날인가? 바로오고 소재도 좋은거같아요!! 근데 뒤에 좀 주름이 잡혀왓어요 그래도 만족입니당 소매 넓어서 귀여워보여용
mz**|우선 배송은 당일배송으로 저녁에 입금해서다다음날 바로 도착했구요~~~옷은 진짜 이쁨!!! 소라색삿는데 색감 짱이쁨그린도 사고싶음되게 부해보이는데 팔통넓어서 좋고근데 바지안에 넣어있으면 짱이쁠듯가격대비 만족상품~~~~
moon91**|일단은 배송이 2일만에 왔구요 ㅎㅎ 입어보니까 스판끼도 좀 있는것 같아요. 근데 한반 빨아서 입어야 댈것같아요 물이 좀 빠지네요 ㅠㅠ길이감도 적당하고 스판기도 있고 저렴한 가격에 잘 산것 같네요ㅎㅎㅎㅎㅎㅎ
