rabbitjy**|진짜 딱맞고 핏도이쁘고 약간더 여리여리해보이기까지해서 너무이뻐요ㅜㅜㅜㅜ추천ㅜ
godqhr12**|금요일 점심이 입금햇는데 토요일에 바로오더라구여밑단에 허벅지에 딱 붙지는 않고 통이좀 잇더라구요 그건 아쉬웟어요..그래도 원하던 바지 잘산거같아서 좋아요 ㅎㅎ 약간 밑위가 짧은거같애서 불편햇엇어요ㅠㅠ하얀것도 잘 묻고
jzi032**|진짜..진짜 데일리제품.. 걍 막입어도 다어울려...하하..진짜..좋아요,, 엄마가 좋아해요..ㅎ
jzi032**|친구들이 어디서샀나요...물어봤어요...하하..고고싱 대박나세요..헤헷..♥
hyunjm**|차이나셔츠가 갖고 싶어서 샀는데 만족스러워요! 길이감도 적당하고 소재도 부들부들해서 가격대비 짱입니다! 테니스 스커트랑 자주 입는데 다들 이쁘다해서 잘샀다고 생각했어요ㅎㅎ 색이 조금더 다양한게 나오면 또 살것같아요!!ㅎㅎㅎ
jzi032**|재질진짜좋아요...the love
hyunjm**|항공점퍼랑 가장 많이 입습니다!! 코디 걱정도 없어요~ 적당한 두께여서 간절기에 입기도 좋고 추울때는 이너로도 좋은 것 같아요! 보풀도 딱히 없구 코디도 편해요~~ 특이한 니트찾는 분들에게 추천하고 싶어요! 가성비 짱이에요!ㅎㅎ
x0xw**|블랙하고 화이트 구매했어요블랙은 괜찮은데 화이트는 너무 얇아서 안이 살짝 비치네요주머니가 보여요..ㅎ반품할려고 했는데 시간이 나지 않아서 시기를 놓쳤네여..ㅜㅜ화이트 구매하실분들은 조금 고민하신후에 사셔야 할것 같아요!!
hyunjm**|저는 이 치마를 친구랑 각각 사서 입었는데 트윈룩으로 짱인 것 같습니다! 장점은 속바지가 있어서 정말 너무 편해요!!! 짧아서 걱정했는데 속바지 있어서 안심되구 핏도 엄청 이뻐요! 허리쪽이 조금 울어서 거슬리긴하는데 신경써서 입으면 커버됩니다!
x0xw**|무난무난하네요~정말 잘 입고 있어요!!!!!가디건 입을 때도 안에 받쳐입으면 편하고 정말 좋아요귀여운 무늬라서 자꾸 손이 가네요 너무 귀여워요깜찍한 매력이 있어여ㅋㅋㅋ기본티인데 너무 맘에 드네요 많이 구매해주세요 ㅎㅎㅎㅎㅎㅎ
hyunjm**|베이직하게 입을 수 있는 청자켓인것 같아요!!! 그래서 요즘 애용하고 있습니다ㅎㅎ 확실히 롤업해서 입는게 훨씬 더 이쁜것 같구요 긴바지랑 입는것보다는 치마나 반바지랑 입는게 훨씬 더 잘어울리는것같아요! 베이직한 아이템찾으시는 분들에게 추천드려요!
x0xw**|이건 너무 이쁜데살짝 비쳐서 당황했네요그래도 입으면 상당히 이쁠 것 같아요치마나 바지 둘다 상관없이 어디에 입어도정말 이쁜 스타일 인 것 같아요ㅎㅎ살짝 비치긴 해도 안에 나시같은 거 입고 입으면 상관없으니까 괜찮을 것 같아요 ㅎㅎㅎㅎㅎㅎㅎ
hayi**|핏이너무이쁜것가태용!!!!
x0xw**|면도 부드럽고 좋아요 가디건이나 얇은 걷옷 안에 받쳐입으면 이쁜 것 같아요ㅎㅎㅎㅎㅎ짱짱해서 오래입을 수 있을 것 같아요 이런 옷은 사계절 상관없이 입을 수 있으니까 고민하지 마시고 사셔도 될 것 같네요ㅎㅎㅎㅎ많이들 구매하세요~~~~~ㅎㅎ
x0xw**|아직 입어보진 않았는데 면도 좋은 것 같고 색깔도 사진상과 똑같아요ㅎㅎ안에 받쳐입어도 좋을 것 같고 여름에는 단품으로 입어도 이쁠 것 같네요ㅎㅎㅎ정말 맘에 들어요ㅎㅎ가격도 저렴하고 사두시면 유용하게 입으실 것 같네요ㅎㅎㅎㅎㅎㅎㅎㅎㅎ
x0xw**|너무 기여워요ㅎㅎㅎㅎ정말 사놓고 잘입고 다니는 것 같아요멜빵원피스 같은데에 입어도 되고편하게 트레이닝복에 입어도 되고 되게 활용도 높게 입고 있어요 저렴한 가격으로 사서 여러가지로 잘 쓰고 있네요ㅎㅎ감사합니당 많이 파세여~~ㅎㅎㅎ
x0xw**|생각보다 두꺼워서 지금날씨에는 입지 못하구요쌀쌀한 날씨나 가을쯤에 입으면 좋을 것 같아요색상도 무난하게 검정이라서 어디에나 어울릴 것 같구요넉넉하게 나와서 조금 부하신 분들도 입으셔도 될것 같네요ㅎㅎㅎㅎ생각보다 두꺼워서 놀랬어요 ㅎㅎ
x0xw**|진청 M으로 샀는데 정말 사길 잘한거 같아요너무 짧아보이지도 않고 딱 지금시즌부터 입기 시작하면 좋을 것 같아요~가격도 저렴하고 해서 고민하시는 분들은 사는 걸 추천해드려요^^ㅎ많이들 사세여ㅎㅎㅎ좋은 상품이네요정말정말정말로
overse**|재구매했는데 진짜 너무 좋아요 ㅠㅠㅠㅠ특히 촤르르하고 떨어지는 핏이 너무 이쁘네요 ㅎㅎ
x0xw**|블랙하고 화이트 구매했어요블랙은 괜찮은데 화이트는 너무 얇아서 안이 살짝 비치네요주머니가 보여요..ㅎ반품할려고 했는데 시간이 나지 않아서 시기를 놓쳤네여..ㅜㅜ화이트 구매하실분들은 조금 고민하신후에 사셔야 할것 같아요!!
thdus23**|편하고완전 좋아요!!
thdus23**|여리여리핏하고!너무 좋아요 이뻐요 !!
seola**|미키는 진짜귀여워요 ㅎㅎ재질도 보드랍고 괜찮긴한데~합성피혁 재질이엇으면 더 좋앗을꺼 같아요 ~~^^
gjygjy09**|산지는 꽤 됬는데 막상 입을날이 별로 없어서 후기를 못 올렸어요ㅎ생각보다 옷이 단추들 때문인지 무게감이 있어요입으면 모르겠지만..글구 소매 단추가 하나밖에 없는게 아쉽더라구요그래도 이뻤어요 편하게 캐주얼룩으로 입기에 좋은것 같아요ㅎ
juhea**|개인적으로 정말 맘에들었던 가디건!!다른색으로 하나더 주문할예정이구요 도톰하고 따뜻하고 폭신폭신거려요간편하게 걸치기도좋아요
dhkfyd**|사진이랑같아요~이뻐요.
parksery**|되게 깨끗하고 무난해요!청바지나 치마 다 어울려서봄철에 잘 활용하고있어요 ㅋㅋㅋ그냥 어디 갈데 별 생걱 없이 입어도 태가 난다고 해야되나 예뻐요!
dhkfyd**|이뻐요.
dhkfyd**|그림이랑같아요 ~이뻐요 요즘에 입으면 괜찬을듯.
juhea**|그렇게 짧지않아서 좋았던거 같아요치마입은것치고는 엄청편하고요 허리밴딩부분도잘되있어서 입기편한거같아요
dhkfyd**|사진이랑 똑같아요 이뻐요
dhkfyd**|사진이랑 똑같아요~^^근데 더우면 못입을듯ㅜㅜ
zkc**|짱짱이뻐요♡♡♡ 너무 맘에들어요ㅠㅠ 산지 일주일정도 됬는데 이제 올리지만ㅜㅜ 후기 처음올리는데 너무 좋네요!!!
zkc**|처음엔 그냥 큰기대없이샀는데 정말 착용하고 너무 놀랬네요ㅠㅠ 착용하고 옷입으면 핏이 장난아녜요..너무 좋아요 고맙습니다♡♡♡
ehdrmf**|배송오래전에받앗는데이제야후기를쓰네요ㅠㅠ힣...딴말필요없고치마정말정말이뽀요!!!따른색들도사고싶댜늉ㅠㅠㅠ돈만잇다면....저는진청삿는데진짜제가원하는치마길이이곻ㅎㅎㅎ여자여자한옷인거같아요!!잘입을게요~
wnal10**|제질도 괜찮구 색깔두 깔끔하고지금 날씨에 깔끔하게 딱입기 좋은거같아요
wnal10**|면도 짱짱하고 생각한거보다 상품이 좋은거같아요배송도 만족하고 상품상태도 좋아요
dhsskfeme**|포토후기2등바지가 신축성이 있어서 편하고 너무좋아요색깔도 중청이라서 봄에 입으면 좋을거 같아요디자인도 심플해서 이뻐요색깔도 인터넷 화면이랑 비슷해요잘입을게요~~!!!!
ehdrmf**|배송받은지한달좀안되서이제야후기를쓰네요ㅠㅠ옷이오버핏이라정말이뻐여!!!요즘이것만주구장창입고다닌다는...ㅎ정말정말맘에듭니당!!!!!!!가격대비니트질도정말조아요~~잘입겟슙니당!!
ehdrmf**|배송받은지오래됬는데이제야후기를쓰네요ㅠㅠ바지찢어진디자인너무이쁘고색깔도괜츊ㅎ다리도평소보다얇아보여요!!!ㅎㅎ배송도엄청빨리오고좋앗어욯ㅎ옷도정말이쁘고정말정말잘입을게요1!
gjygjy09**|하이웨스트 바지는 첨이라서 걱정 좀 많이했어요특히 바지는 인터넷으로 산것도 첨이라..사이즈 안밎을까봐 걱정 많이했는데..스판이 생각보다 많아서 완전 편했어요ㅜ상품받고 바로 입고 과외하러 갔다는ㅋㅋㅋ색상이 조금 어두운게 아쉬웠어요
ehdrmf**|배송받은지한참됬는데이제야후기를쓰네요ㅠㅠ배송와서딱포장지뜯자마자내가찾던옷이다생각했어욯ㅎ베이지샀는데막진한베이지가아니고좀연한베이지...?암튼색깔진짜맘에들구욯ㅎㅎ길이도딱적당해서좋아욯ㅎㅎ저는끈안하고입는데그래도이뻐여정말잘입을게요~~~
gms031**|카메라 싼 가격에 너무신기해서구입하게 되었는데 우선 작동하기 되게 편리하고 그냥 찍었을때보다 특별하게나와서 색다르게 찍고싶을때 좋을거같아요ㅎㅎㅎ싸게 잘사서 좋습니당
ehdrmf**|배송받은지한참있다가이제후기쓰네요ㅠㅠ저는아이보리색삿는데정말이뽀요ㅠㅠ!!!!길이가좀짧긴한데그래도안에입어서별로상관없구요이번에물품도많이시켰는데배송도빨리와서너무좋았어욯ㅎㅎ옷정말이뻐여!!!잘입겟쓤니댱~
gms031**|나시 진짜 장짱해요!! 늘어날까봐 걱정했는데절대 그럴걱정없을거같아요ㅎㅎㅎ 여름이니까 흰티안에무난하게입을수있을거같아요싸게 잘사서 좋습니당!
gms031**|바지 진짜 편해요!1 길이가 좀 짧긴한데이제 곧 날씨 더워지니까감안하고 입으려고요 ㅎㅎㅎ 회색 친구랑 같이 샀는데친구도 잘입고 다녀요 ㅎㅎㅎ 무난하고 이뻐요!
gms031**|속바지 우선 살색이라서 너무 좋구요 진짜 짱짱해요 ㅋㅋㅋㅋ 놀랄정도로 ㅋㅋㅋㅋ너무좋아요! 얇아서 좋은거같아욯ㅎㅎ
heewo**|하늘하늘 예뻐요 그냥 밴딩처리만되있어서 정말 편하고 좋았습니다색감도 이쁘고 아무곳에나 입을수있어서 좋어요
sky920**|늦었지만 후기 남깁니당ㅎㅎ겨울에잘입었구요 빨간색이 예쁜빨강?이에요ㅋㅋ 유사한옷이많지만 금장이 더이쁜듯!!털장식은 탈부착가능한데 붙이는게 더이쁘고 길이도 너무짧지않아 좋네용~~코트는보통 움직일때 불편한데 이옷은 불편함도 없고 편해요! 따뜻하고좋습니당!!!
mykim5**|어디든 잘어울려서 좋아요~~ 청치마나 멜빵치마 슬렉스 청바지 어디든 입어도 잘어울리는 옷이에요 자주 입고있어요ㅋㅋㅋ 제가 좋아하는 옷 중 하나이기도 하구요 고고싱을 자주 이용하는 편인데 정말 다른 쇼핑몰이랑 다르게 옷재질이나 이런게 좋은것같아요 가격두! 앞으로 자주이용할테니 좋은 옷 많이올려주세요 ㅎㅎ
fkfkdbwls**|부들부들 길이도 맘에들고 사이즈는 더더 맘에드네용
fkfkdbwls**|짱짱 부드럽고 넘좋네용
mykim5**|키 떄문에 길이를 걱정했는데 전혀 걱정하지 않아도 될것같구 하체비만인 저에게 별 탈없이 입을수 있어서 좋았어요 통이 생각보다 커서 편하고 좋아요 요즘 같은 봄날씨에 데이트하러 갈때나 놀러갈때 입으면 좋을것같아요! 정말 사길 잘한것 같습니당 ㅎㅎ
mykim5**|진짜 무난하면서 포인트가 들어가있기때문에 편하게 잘입고있습니당 하의를 뭘 입던간에 잘 어울리고 정말 맘에들어요ㅎㅎ 같이사는친구도 이쁘다고 제 옷 자주 입구 키가 있어서 길이감도 걱정했는데 정말 맘에들어요 ㅎㅎ! 고고싱 자주이용할게ㅕㅇ~
anwlro07**|완전 이뻐요!! 허리 밴딩이라 편하고 길이도 너무길지도 않아서 좋아요~
mykim5**|제가 하체비만이라서 그런지 좀 꽉맞았어여ㅠㅠ 좀 살을 빼고 입어야 할것같아용! 친구는 괜찮다고 했는데 제가 제 몸을 마음에 안들어해서 그런가봐여ㅠㅠ 그렇다고 안입고 다니진않구 잘 입고다니고 있습니당~! 유행도 안타는 청스커트 하나 갖고싶었는데 맘에 들어용ㅎㅎ
anwlro07**|딱맞아서 좋았고 길이기는 길지만 접어서 입으면 딱맞아요!!! 근데 물이 좀빠지네요ㅜㅜ
anwlro07**|키가 작아서 길까봐 걱정했는데 슬랙스라서 접어서 입으면 딱좋아요!! 가격대비 짱좋아요!!!
anwlro07**|허리도 딱맞고 길이도 딱좋아요!! 슬림해서 좋아요!!!!!
dpdms0**|간편하게 입고 나가고 싶을 때 좋을 것 같아서 샀어요.요새 날이 따뜻해서 자주 입을 것 같네요.길이가 조금만 더 길었으면 하는 아쉬움이 있습니다ㅜㅜ면이 매우 얇으니까 꼭 안에 나시나 면티 입으세요!디자인도 심플해서 좋아요(사진클릭하면 전신샷이에요!)
gjygjy09**|산지는 좀 지났는데 이제야 후기 올리네여ㅎ이때 기대없이 그냥 편한티 하나 사려고 구매한건데 후회는 안하네요데끼공법으로 처리된 옷은 처음이라 좀 만들다만 옷 같은 느낌 들어서 처음엔 좀 별로였는데...ㅋ지금은 완전 잘 입고있다는...짱 편해여
dpdms0**|원래 핑크색상 사려다가 베이지색으로 구매했습니다.후회는 안하고 있고요.만족하고 있습니다!아쉬운 점은 접혀 있던 부분의 자국이 선명하다는 것이요ㅜㅜㅜㅜㅜ 그래도 한 번 세탁하고 다림질해서 입으면 괜찮을 것 같아요!!! 추천합니다 (사진클릭하면 전신샷이에요! 얼굴빼고요)
kiuuu42**|생각했던것보단재질이그냥그러네요그래도이뻐요ㅎㅎㅎ짱
couniver**|유니크한게 너무 이뻐요!^^
couniver**|초록색하나 버건디 하나 샀는데 색깔이 너무 예쁘고 흰바지랑 입으니까 색감이 더 잘 사는거 같아요~^^
todghfk**|리뷰를 늦게 남깁니다!!!연한 바지가 없어서 진청 바지 하나 장만 했는데사이즈는 제일 작은거 샀구여!!!진짜 완전 편하고 색도 진짜 맘에 들어용!!!허리는 좀 많이 커용,,, 그래도 엄청 맘에 들어용또 사고 싶어용!!!!! 잘 입을게영>3<
couniver**|이뻐요~^^
wjdgus00**|와 진짜 짱!!!! 소라색 샀는데 색감이 진짜 이뻐요! 핏도 딱 원하던 핏!!! 약간 아방하면서도 박시한 느낌? 진짜 이뻐요! 바지나 치마에 넣어 입기에는 밑단이 넓어서 불편할거 같은데 반바지랑 입으면 조녜!! 다른색도 사고 싶어요 ㅠㅠ 하나 더 살껄 하나만 시켜서 11000원에 샀네요 ㅠㅠ 소라색 강추입니다!
couniver**|핏이 너무 예쁘고 색깔도 너무 이뻐요^^
wjdgus00**|우왕 진짜 좋아요! 부들부들해서 입으면 기분이 좋아지네요 ㅋㅋㅋㅋ 전 아이보리색 샀는데 많이 안 비치고 갠츈하네요아직 입고 나가본적은 없는데 좋을거 같아요~ 다만 잘늘어나게 생겨서 입을때란 세탁할때 주의해야겠어요 ㅠㅠ 이런 기본티가 뭐 다 그러니깐 ㅠㅠ 회색도 사고 싶네용 담에 기회되면 회색도 사야겠어요 ㅎㅎ
kimhyeji**|반팔도 너무 얇은것보단 살짝 두께감 있는걸 좋아하는데이거는 딱 두께감도 좋구 팔길이도 적당해요ㅎㅎ분홍색 색깔두 딸기우유색이라 예뻐요ㅎㅎㅎ추위를 잘타서 아직은 못입고 있지만금방 더워지면 자주 입을꺼같아요ㅎㅎ얼른 반바지랑 입고싶어요ㅋㅋ
wjdgus00**|베이직하고 좋네요! 목부분이 살짝 잘 늘어날거 같고 조금 옆으로 넓게 파여서 위에 겉옷 입거나 크로스 가방 매면 밑으로 파인거 처럼 되네요 ㅠㅠ 목부분에 힘이 조금 더 있었으면 좋았을텐데 ㅠㅠ 그래두 나름 이뻐요~~ 팔이 짧아서 여름에 단돗으로 입기도 좋을거 같아요! 그런데 면이 그렇게 좋은 면은 아닌거 같아서 조금 아쉽네요 ㅠㅠ
kimhyeji**|얇긴한데 무난하게 여기저기입기 좋을꺼같아요
kimhyeji**|제가 생각했던 핏은 아니네요ㅜㅜ목이 좀 늘어난 티처럼 헐렁해요ㅠㅠ흰색사서 무난하게 여기저기 입을수는 있을꺼같아요ㅋㅋ
hv02**|완전맘에들어요 딱 내가 찾던거!
wjdgus00**|얇고 좋네용 지금 안에 입기 딱 좋은 두께에요!저는 화면상으로 레드 색상이 참 이뻐서 레트 시켰는데 새빨간 레드라기 보다는 약간 와인색에 더 가까운 레드색이네요 ㅠㅠ 생각한 색상이랑 조금 다르기는한데 그래도 이뻐요!길이가 살짝 애매한거 같기도 해요 저는 개인적으로 바지에 넣어입는걸 안좋아해서 차라리 골반까지 딱 맞는 길이 이길바랬는데 골반을 좀 넘는 길이네요 ㅠㅠ 그래도 뭐!이 가격 치고는 싼티가 많이 안나서 좋네요! 세탁하면 줄어들까봐 걱정이긴 해요 ㅠ
wldbs80**|싼 가격에 사는 거라 별 기대 없이 받았는데 괜찮네요.정말 큰 기대없이 사면 괜찮아요 ㅋㅋㅋㅋㅋ그냥딱 그가격에 맞게 산 듯..일단 얇기는 많이 얇아요. 헐랭하고 얇은데...단점은 헐랭하다고 안에 두꺼운 니트입다가는 덩치가 산만해보일거에요.ㅋㅋㅋㅋㅋ 그런 가디건임.장점은 여성스러워 보인다는거? 원래 몸에 비해 팔 길이가 긴 편이라서 가디건 사도 딱 맞거나 그랬는데이건 소매가 손등을 살짝 덮는 길이라서 여성스럽고 여리해보임. 총 길이가 어정쩡해서 스키니나 슬랙스에 입기는 별로일 것 같고, 짧은 베이비돌 원피스, A형 스커트종류에 입으면 잘 어울리는 것 같아요.
dud2**|요즘 날씨가 좋아져서 가디건 찾던중에 너무나 저렴이로 나온 이 가디건을 샀어용! 제가 살집이 있고 통통한 편이라 항상 어두운색을 입는데요 너무예뻐요 핑크살까 고민했었는데 핑크도 하나 더 살까 고민중이예요 ㅎㅎ음 제가키가 큰편이아닌데  약간 기장은 짧은듯한 느낌이있는데 그래서 더이쁜거같아요 아.그리고 사진이랑 똑같아용!!!! 너무너무 맘에들어용
alswjd6**|길이도 제가 원하는길이에요 ㅠㅠ 좋아요!!! 배송도 빨리와서 만족했고 옷 두께도 딱 적당하고 길이가 길긴길지만 제가 딱 좋아하는길이에요 !!!! 만족만족 검정색도사고싶었지만 화이트만샀어요 품절이엇어서ㅠㅠ 고고싱에어 또 구매할게요!!!
jj7294**|뭔가... 좋은듯 안좋은듯 하네요. 딱 입었을때 가슴을 되게 잘 모아줘서 놀랐어요! 모아주는기능은 진짜 좋은것 같아요. 근데 딱 잡아주는 건 잘 못누끼겠어요 그래도 좋운거 같아요 운동할때 잘 입겠습니다~ 더이어트 성공 해랔ㅋㅋㅋㅋㅋ
jj7294**|사진으로 보고 막상 입으면 안이쁠것같았는데 엄청 편하고 색색깔 다 사고싶은 마음이 들정도로 마음에 쏙 듭니다. 정말 꾸민듯 안꾸민것처럼 입을수 있는 옷인거 같아요 . 이번여름 편하게 입고 다닐께요~ 앞으로도 이쁜옷 기대 많이 할께요~~~
jj7294**|생각 했던것보다 훨씬 이쁘네요. 사이즈도 그렇고 길이도 그렇고 적당해요!! 그냥 일상생활에서 편하게 입기 이쁜옷인거 같아요. 개별처리된물건이 제일 기대되는데 그것도 이 물품처럼 기대이상이겠죠? 빨리 보내주세요 입고싶어용. 수고하세요~
ysy9**|진짜이뻐요 지금날씨에 딱입기좋아요!!
ysy9**|진짜 편하고 계단올라갈때도 하나도 안불편해요!!!길이도적당하구요
ssomy86**|발목까지 쫘악ㅡ잡아주는 스키니!!! 조금아쉬운 면이 잇는것은 스판이 덜된다는점!! 제가 살쪄서 그런지 평소에는 27입어서 똑같이 샀는데 28을 살껄 그랬나봐요...ㅜㅠ 조금은 작은? 살짝 끼는 느낌이 잇네요... 입다보면 늘어나겠지 싶어서 딱 맞게입고싶으면 27!  늘어난다는거 감안하고도 딱맞으면서도 아주조금?편안하게 입을려면 28을 추천합니다~
ki09**|옷 너무귀여워요 배송도 하루만에왔어요'-'근데 바지가 약간 엉성한거같아요ㅜㅜ그래도 저렴한가격에사서 그냥입으려구요!
dlgmltn46**|심슨!!!쩡귀여워요ㅠㅠㅠ저번에도 고고싱에서 클러치백 삿는대 너무 좋아서 한번더 구입햇어요.근대 진짜좋아요!그리고 너무 귀여워욯ㅎㅎㅎㅎ박음질도 너무 잘되잇구요 재질도 젛아서 오래 쓸수 잇을거 같아요!다음에 또 이용할깨요!!
daa2**|- 키 168-착용사이즈 M평소 하의27 입는데 입었을 때 신축성 좋아서 편하네요 ㅋㅋ 핏도 예쁘게 나왔어요 만족합니다 ㅋㅋ니트나 남방하고 입어도 이쁘네요 추천합니다 ㅋㅋ
daa2**|같이 주문한 다른 상품의 입고 지연으로 일주일 넘게 기다려서 받았습니다아침 저녁으로 쌀쌀한 지금 입기에 딱인것 같아요 ㅋㅋ 색상은 모델사진보다 약간어둡지만 핏은 괜찮은것 같아요.그리고 소재가 부들부들한? 소재입니다.다른색상이있었으면 살뻔했네요 ㅋㅋ
jjm10**|스판끼도 되게좋고 싸고!!입으면 핏도이뻐요~~ 무난무난
care3**|처음에 입을때 너무 박시해보여서 뚱뚱해보이지 않을까 하고 생각했는데 생각보다 아담해보이고 어깨 그렇게 넓어보이진 않더라고요 그래도 저보다 마르신분들이 입으시면 괜찮을듯.. 길어서 작은분들이 입으시면 무릎까지 올거에요 조금 키크신분들이 입으면 이쁠거같아요
dusdk01**|와이즈반티 도 너무나 마음에  들어요 사이즈도 큰거도아니고 작은것도아니고 딱 좋아요  감사합니다 고고싱
care3**|너무예뻐요 :) 저희 어머니도 예쁘다고 잘샀다고 그러시고 이번에 옷살때 화이트 주문하려고요 ㅎㅎ 평소 학원갈때나 어디갈때 가볍게 책이나 짐챙겨서 다니기편하고 많이 흘러내리지도 않아서 좋은거 같아요 가격대비 퀄리티 짱짱 질도 좋고 ㅎㅎ
wndms7**|배송도 괜찮았고 옷도 좋아요!!! 처음에 배송 받아서 옷 뜯어 봤을 때 옷에 약간 실이 덜 짜진...?듯한 하자가 있었는데 흰 옷이라 별로 티도 안나고 입는 데 별로 무리가 없을 것 같아서 그냥 입으려고요.. 처음 뜯었을 땐 화났었는데 지금은 괜찮아요.. 옷은 진짜 이뻐요!! 고민하지 말고 사세요!!
dusdk01**|제가 구매한 미키미니 반티 너무나 마음에들고또사고싶을정도로 마음에들어요  제구매도 할께용감사합니다
star71**|재입고 시간 기다리느라 힘들었어요ㅠㅜㅠ인기많아요... 아이보리색 샀는데 안에 나시입고 입으면 이뻐요~ 약간 비쳐요!
care3**|제가 마른편은아니더라도 뚱뚱뚱한편은 아닌데 너무 작더라고요.. 제가 하체가 튼실한건지..ㅜㅠ 안맞아서 마른친구 주려고 합니다 체구 작으시거나 마른분들 추천!
star71**|회색샀는데 안에 나시하나입고 검정색바지랑같이입으면 잘 어울리고 이뻐요~ 모델언니처럼 소매걷어서입어도 좋고요!
star71**|인기 되게많더라고요... 그래도 기다려서 베이지색샀는데 이쁘고 오자마자 옷 다림질해서 잘입고있어요~
jhwlgus3**|저는 세일한때 이 옷을 삿는데 길이가 길줄알았는데 생각보다 짧았어요 그리고 옷에 뭐가 조금 뭍어있는데 심하지는 않았고요 핏은 그냥 적당한 핏? 박시하지는 않아요 두께도 딱 적당하고 세일할 때 사서 한 만원 정도에 샀는데 만족해요 검은색 바지에 잘 어울리고 전체적으로 예쁜거 같아요 그리고 색은 쥐색? 이예요※아 그리고 댓글 다는곳을 왜 이렇게 바꿧는지 모르겠어요 사진 올리기도 힘들고 괜히 바꾼게 아닌가...하는 생각이 드네요 하여튼 사진 올릴려고 고생하다가 사진도 못 올리고 후기를 마치네요
agh2003**|산 지 한참 된거같은데..이제서야 후기를 올리네요.일단 처음왔을때 헐..내가 입으면 터지는거 아냐? 생각했어욬ㅋㅋㅋㅋㅋㅋ근데 진짜 쫀쫀하고!!!! 색깔도 봄에 어울리는 예쁜 파스텔톤이라 봄에 무난무난하게 포인트로 잘 입을 수 있을거같아요~
chaewon6**|아 원래 이렇게 가운데에 자수로 캐릭터 들어간거 좋아해서고고싱에서 맨투맨 3장인가 샀었는데 반팔티도 성공~3개다 같은회사꺼라서 사이즈도 딱맞고 재질도 좋고 좋아요..♡ 근데 품이나 이런게 좀 크긴 하더라구요..ㅎ
yousun12**|평소 27정도 입는데 M시켰는데. 골반바지가 아니여서허리가좀 작네요 ㅋ 담엔  L시켜야겟어요 ㅠ
wjddm**|글쓰면예쁠거가타용ㅋㅋ
chaewon6**|일단 중청스키니 필요해서 샀었는데 색깔 이쁘네요~단추 똑딱이인것도 맘에들고 스판도 좋아요!!25~26 입는데 26샀는데 딱붙어요!!살빼서 이쁘게 입어야할..거울 깨져서 셀카봉으로 찍었어요ㅋㅋㅋ
thekqls9**|이뻐용
gofks**|진짜 먼가 말라보이고 핏 아주이뻐용 근데 한번 드라이클리닝 맡기고 입어야되겟어요 왜냐면 청바지에 뭍은 염색약이 제 손이랑 옷에 막 뭍어요
