akwjdfks**|소매부분이 폰인트되고 귀여운거 같아서 주문했는데 생각보단 별로였어요 ㅜㅜ길이가 좀 더 길었으면 하는바람도 있네요 재질도 살짝 까슬한 편이라 좀 아쉽긴해요 소매벌룬도 뭔가 좀 어정쩡해서 부해보인달까요 ㅜ그래도 할인가격에 너무 싸게 사서 편하게 잘 입으려구요
akwjdfks**|블랙 화이트 다 가지고 있긴한데 좀 얇은재질이라 주문했어요 기본티로 너무 좋아요 쫀쫀하고 치마나 원피스 어디에도 잘 어울리는 고퀄 니트에요! 이가격에 너무 좋아요 모두 사세용 ㅋㅋ
akwjdfks**|세가지 색상 다 주문했는데 블랙이 가장 쫀쫀했어요 생각보다 목부분이 많이 답답하단 생각을 했는데 그래도 너무 흐물거리는 재질보단 딱 잡아주는게 더 이쁘고 좋아서 맘에 들어요 퀄리티 굳이에요
hhjy66**|입어봤는데 조금 큰감이 없지않아 있지만 겨울이니까 껴입으면 될거 같아요 소매도 제가 좋아하는 스타일 이에요 길이도 딱 적당한거 같구요 앞으로 겨울은 따뜻할거 같습니다 감기조심하시고 감사합니다 ~ ♡
akwjdfks**|기본이너티로 이런색상 포인트로 하나 가지고 있으면 좋을거 같아서 주문했는데 너무 좋아요 재질은 화면에서 보는거와같이 말할것도 없이 좋구요 엄청 쫀쫀하고 부드럽고 짱!
akwjdfks**|재질도 생각보다 너무 좋고 사이즈도 불편하지않고 딱 맞아서 핏도 너무 이쁘고 맘에 들어요 언발길이가 포인트도 되고 여성스럽고 너무 이쁩니당^^블랙색상으로도 하나 더 사고싶어요
akwjdfks**|요즘 체크가 유행이라 보자마자 반했어요 ㅎㅎ체크 블랙색상으로 하나 가지고 있어서 브라운으로 주문했는데 와 생각보다 너무 이뻐서 너무 좋네용 ㅋㅋ화면에서 봤을때는 좀 끼일거 같다는 생각 했는데 입어보니 전혀 아니에요 딱 맞고 불편하지도 않고 너무 이뻐요 벨트포인트도 더 여성스럽게 만들어주네용 ㅋㅋ최고
akwjdfks**|제일 기대하고 주문했던 옷인데 생각보단 실망했어요 ㅜㅜ소매 리본은 포인트되서 여성스럽기도 하고 귀엽기도 하고 너무 맘에 드는데 받자마자 옷에서 기름냄새?같은게 좀 심해서 섬유유연제 뿌리긴 했는데 뭐 냄새는 조금씩 빠지겠죠 디자인 색상은 화면이랑 보는것과 같아요 재질이 부드러운편은 아니고 살짝 까슬한편인데 그래도 이쁘니깐 ㅎㅎ
akwjdfks**|기대를 많이 했던 옷인데 마감처리가 잘 안되있어서 조금 실망은 했어요, 그것만 빼면 두껍고 재질도 좋은거같고 따뜻하게 잘 입을거 같아요 색상은 화면이랑 똑같아요 이뻐요
akwjdfks**|화면에서는 좀 더 두껍게 보였는데 받아보니 생각보단 많이 얇았어요 그래서 그런지 많이 가볍구요, 뭐 겉옷입으면 되니깐 크게 상관은 없을거 같아요 브이넥이라 여리여리해보이고 이쁘네용
tmddus38**|제가 지금까지 원피스를 사본적이없어 이쁘기도하고 세일도 하길래 샀는데 진짜 너무 이쁘고 좋은데  생각한것보다 짧아요ㅠㅠ 짧아도 진짜 이뻐서 추천하고싶어요!! 정전이다 살짝있는데 그건 네이버에 정전기 없애는방법이라 치면 나오니깐 그걸보고 없애면되요!! 진짜 이쁘고 좋아요 진짜로!!
akwjdfks**|블라우스 말고 기본 흰색티에 코디했는데도 잘 어울렸어요!리본이 포인트라 귀엽기도 하고 여성스럽기도 하고 이뻐용 ㅎㅎ 흰셔츠에도 입으려구요 좋아요
tiko87**|와 진짜 이뻐요! 무난하게 블랙으로 구매했어요. 마른 편인데도 그리 붕 뜨지 않고 안감은 아니지만 소재 자체가 따뜻해서 그런지 낮에 입고 나가니 더웠네요 디자인도 무난하고 겨울에 잘 입고 다니겠어요!
akwjdfks**|블랙니트는 가지고 있지 않아서 주문한 옷인데ㅡ 브이넥이라 촘 추울수도 있는데 어차피 겉옷입고 입으니까 괜찮아요 블랙이라 뭔가 더 여리여리 무튼 이뻐용! 소매도 맘에 들고 생각보다 두껍고 질도 좋아요 굳굳
akwjdfks**|보자마자 너무 귀여워서 사고싶었던 옷인데 이제 곧 겨울이라 살까말까 고민했거든요 근데 고민했던게 말끔히 사라진 옷이에요! 브라운했다가 블랙으로 변경했는데 너무 맘에 들어요 생각보다 두껍고 따뜻해요 블랙티랑 코디했는데 너무 이쁘고 여성스럽기도하고 귀엽고 무튼 후회안해요 굳!
tmddus38**|제가 가디건을 진짜 진짜 사고싶어했는데 진짜 후회 1도안하고 제가 키가 있다보니깐 최소 72cm가 되야지 겨우 엉덩이를 가려서 쫌 많이 걱정했지만 걱정보단 막 완전 짧지않아 좋고 교복에도 너무 잘어울리고 무엇보다 색이 너무 이뻐요!!완전 잘샀어요 ♡♡
alsk09**|색이 진짜예뻐요!  박시한 체크셔츠에 입어도 잘어울리고 후드티에 입어도 잘어울려요!! S맞기는 한데 M샀으면 쪼금더 배가 편했을거같아요 ㅎ완전 추천합니다요!!
qkrdbwls8**|니트 할인 하길래 구매했는데 생각보다 얇아서 이너로 입기 좋을거 같아요~와인색 살려고 했는데 품절이라 블랙 삿는데 블랙도 이뿌고 좋네요~
ceng**|이쁘고 가디건도 같이 샀는데 점점 날씨가 추워지니깐 같이 입으면 엄청 이쁠거같아요 단지 조금 아쉬운건 안감이 없어서 약간은 비친다는거에요ㅠㅜ그래도 재봉한상태도 잘 마감되고 이뻤어요~^^
rlatmf05**|벨트랑 같이입으면 이뻐요! 에이라인이라 활동하기도편하구요ㅎㅎ 다만 벨트넣는구멍이 더많았으면 더 좋았을것같아요!잘입겠습니다~!
dngpqls**|검정이라 그런가 먼지가 잘붙어요 그리고 뒷쪽에 목부분이 올이 하나 나가있어요ㅜㅜ 바꾸기 귀찮아서 그냥 입을께요......정말 도톰해요 겨울에도 잘 입을수 있을꺼같아요 보들보들한게 느낌도 정말 좋아요
dngpqls**|후기 1등! 리뷰가 없어서 걱정이었는데옷자체는 정말 이뻐요 근데 허리 쪽은 괜찮은데 가슴부분이 진짜 크네요..여기 부분 붙을려먼 가슴이 정말 커야 하는건가..당황했어요 좀만 좁았으면 더 좋았을꺼 같아요 제가 말라서 그럴수도 있지만..ㅜ 그래도 보들 보들하고 좋아요
qkrtpgml1**|일단 배송이 엄청빨리와서 좋았어요 가방은 생각보다 튼튼하고 크기도 적당해서 마음에들고 아무옷에나 잘 어울리는편이어서 잘 매고다닐것같아요!
dngpqls**|실정리가조금안되있는거같아요 그리고 벨트가 접혀있네요 상태가별로인거같아요그래도 치마는 정말 이뻐요ㅎㅎ제가 허리가 좀 얇아서 전 넉넉한거같아요
538888816**|레이어드해서 입으려고 샀는데 후드티나 반집업 맨투맨 같은데에 레이어드해 입으면 예뻐요 가격도 착해서 좋은것 같은데 저한텐 팔이좀 짧네요ㅠ
rlatmf05**|위에 가디건걸쳐서 이쁘게 잘입고있습니다ㅎㅎ 딱 제가 좋아하는 핏이에요ㅎ 치마나 바지 뭐에입던 어울려서 코디하기도 쉽구요ㅎㅎ
qkrtpgml1**|생각보다 두툼해서 겨울에도 입을수있을거같아요!!길이도 마음에 들고 안에 셔츠랑 같이 입으니까 정말 이뻐요~~잘 입고다닐께요~~
538888816**|친구가 흑청을사서 제가 중청으로 트윈룩하려고 샀는데 정말 어깨각이 없어서 오히려 어깨가 넓어보이지 않고 부담스럽지 않게 코디하기 좋은것 같아요 너무맘에 들어오
baby02**|가을느낌나는 니트사고싶어서 찾다가 코코아색이 너무이뻐서 검정이랑 같이샀는데 너무이뻐요 목도 짱짱하고 따뜻하고 비침도 없고 길이도 딱 맞아요 !!!고민중이시라면 꼭사세요ㅠㅠ 진짜이뻐요
dpflf**|안에 아무거나 입고 가볍게 걸치기 좋아요. 검은색 샀는데 뭘입고 입어도 괜찮은 것 같아요. 키작녀한테 하나쯤 있으면 좋은 아이템 같아요. 세일해서 샀는데 가격대비 굿
kangse06**|할인해서 개이득으로 삿서요....예전후기들에 조금 얇은거같다 너무 큰거같다 그래서 베이지 아이보리 둘다사려다가 그냥 아이보리만 삿는데 입어보니 글케 얇지도않고 전혀크지도 않아요 여리여리하게 예쁘기만 한걸요 8ㅁ8 아이보리라 조오금 비치지만 다른 흰색니트들에비해 글케 많이 비치는것도 아니고 포인트도 너무 얘뻐요 사실 4500원이라는 점이 캐리한듯 베이지도 살래요❣
kangse06**|ㅜㅜ떡코 업뎃이 또 되벌여서 또 질러버렸는데 이건 또다른매력이있어요 업뎃된 다른떡코들은 핏이 박시하고 어벙벙해보이는데 요건 핏되보여서 샀어요! 그리고 입어봤는데 너무너무 얘뻐오ㅠㅁㅠ 어깨부터쭉 일자로 핏되서 내려오는데 진자 존예존귀롭습니다 넥부분 단추도 진자 사랑스러오요..♥️기장이 짧은게 조금 아쉽지만 귀엽게 나온거같아서 오히려 짧은기장이 더 어울린것같기도 ㅎㅅㅎ
baby02**|세일할때 14500원에 샀는데 아우터를 14500에 사는게 말이됩니까 ??!!?ㅠㅠ너무이뻐요 색깔도 완전 가을가을해서 진짜이쁘고 분위기짱이에요근데조금 얇은 감도있어서 지금입기좋을거같아요 주머니도 커서 넣을공간도많아서 좋아요 짱짱
kangse06**|다른 목도리들보다 가격대가 있어서 이걸살까말까하다가 진짜 딱 원하는 디자인에 재질이어서 구입했어요! 근데 가격값하는거같아요 배송받고선 맨날 입고있어요 ^ㅁ^꺄륵 보온도 꽤 되고 니트목도리보다 부하지도않아서 저는 겨울까지 쭉 낄것같아요~~!♥️
kangse06**|색도 예쁘고 두께도 있어서 쭉 입을것같아요^^~!~!단지 안에를 너무두껍게입으면 핏이 어벙벙해지는건 있어요ㅠㅠ 그래두 이가격에 이정도 퀄리티면 넘나리 잘산거같아요♥️ 떡코 업뎃이 많아서 통장털리는중
qhdbs62**|ㅋㅋㅋ진짜 이가격엔 중고로도못사요 너무너무잘삿고 도톰하고 팔부분 넘 귀엽습니당 ㅠㅠ 다른색도사고싶지만 품절... 이런이벤투 자주해주세영 ㅎㅎ
qhdbs62**|ㅋㅋㅋ스몰 허리단면이 30cm밖에안돼서 허리가 너무 작을거같아서 걱정했는데의외로 잘 맞아요 ㅋㅋ26입는기준ㅋㅋ 사이즈문의하니까 친절하게 잘 가르켜주시고 넘 좋았어요ㅠㅠㅠㅠ 키가 작은편이라 바지 맨날접어입고했는데 짤막한바지 양말 잔뜩보이며 입는거 넘좋은데 싼가격에 겟했어용 ㅠㅠ 키작녀들 고민말구사세요 ㅋ아이보리에 주황스티치 짱이에요... 키도커보이고 짱입니다!!
532231436**|양말 귀여워용 흘러내리지도 않고 사진이랑 색감 똑같아요! 교복이랑 입으니까 너무 귀엽네요 고민하시는 분들 사서 이쁘게 신고 다니세욧 ㅎㅎ
532231436**|학교에서 체육대회 할 때 썼는데 친구들 끼리 ㅂ맞추니까 너무 이뻤고 다른 헤어밴드보다 훨신 눈에 띄었어요! 색감 너무 이쁘고 불편하지 않으니 블루 꼭 사세요 짱짱
qhdbs62**|이거 코트... 대박임 아주보둘보들하고 낙낙.. 키작녀들 입기 딱좋은기장이에요 ㅋㅋㅋㅋ누빔잇고 울도 40프로나 들어가잇어서 엄청따실거같아요 ㅋㅋㅋㅋ 요즘넌추운데 입고다니면 넘 좋을듯 ㅎㅎ다들 구매해용 후회없음
baby02**|그냥 말이필요없어요 역시 믿고사는고고싱 예약판매여서 좀 기다리긴했는데 기다린보람이있는거같아요 일단 겉기모라서 기본셔츠보다 훨씬 따뜻하고 부드럽고 색깔도 사진이랑 똑같아요치마랑 입어도 이쁘고 바지랑 입어도이뻐서 너무좋아요 꼭사세요 ㅠㅠ!!!!!!
532231436**|양말 길이가 짧을까 걱정했는데 짧지 않아서 다행이네요 사진 그대로고요 너무 귀엽고 이뻐요 교복에 신으니까 잘 어울리네용ㅎㅎ
532231436**|양말 귀여워요 ~ 사진이랑 똑같습니다! 짧을까 걱정했는데 전혀 짧지 않아여 교복이나 귀엽게 코디했을때 신으면 딱이에용
qhdbs62**|ㅠㅠ이가격에 사다니 갈색도살걸그랫오요 완전도톰하니 단추가 왕귀여워요..    검정이라 어떤옷에든 입을수잇을둣 ㅋㅋㅋㅋ너무잘삿어요 이런이벤투 맨날해주세요
532231436**|가격이 싸서 별 기대 안하고 샀는데 후드나 맨투맨 안에 입기에는 딱이네요! 특히 반집업이랑 입으니까 너무 이뻐용 가성비 짱이에요 고민하시는분들 사세용ㅎㅎ
bimon**|입어봤는데 여리여리해보이고 일단 스웨이드 재질이라 두꺼워서 좋아요 가격도 괜찮고 좋네요 예쁘게 잘입을게요!! 물론 제가 예쁘지 않지만..
dlskgus1**|바지 엄청 맘에 들어요 ! 다른색깔이 있다면 또 사고싶을 정도로 이뻐고 엄청 편해요 싸이즈을 걱정했는데 딱 맞아서 좋았어요 ㅎㅎ
baby02**|고고싱 평소에도 많이 이용하는데 겨울이라 기본템인 목폴라사야되서 고고싱믿고샀는데 이 가격에 이 퀄 나올수가없어요 ... 너무한거아니에요??ㅠㅠㅠ너무좋아요 진짜 나만알고싶을정도 ㅎㅎ 목은 짱짱해서따뜻하고 불편한건 1도없고 두께도 괜찮고 비침도 없는것같고 그냥진짜 살까말까 고민중이면 꼭사세요 꼭
dlskgus1**|짱짱 이뻐요! 역시 고고싱은 가격에 비해서 옷 재질이 너무 좋은거 같아요! 엄청 잘입구 있습니다 데일리하게 입기 좋아요!!
shsmnh10**|찰랑찰랑하니 여성스럽구 너무 이뻐요 무늬도 너무이쁘고 모델분처럼입으면 진짜 난리날듯요ㅜㅜ사이즈도 넉넉해서 잘맞구 가격도 저렴하고 배송도 하루만에오고 짱입니다!!
jskem02**|배송 엄청 빨라요 ㄷㄷ 어제 오후3시에 결제하고 오늘 오후4시전에 받았습니다! 이런 칼배송해주는 고고싱 넘넘 사랑해요 ㅜㅜ~~! 두께는 두껍지는 않구요 브이넥부분이 잘...ㅎ 늘어날거 같기는 한데 여성스러움을 한껏 뿜뿜!해주게 하는거 같아요
jskem02**|배송 엄청 빠르네요 목요일 오후3시에 결제하고 오늘 오후4시전에 왔습니다 고고싱에서 롱패딩 ㅎ사려고 둘러보고 있다가 신상으로 떴길래 사 봤습니다 인터넷으로 패딩은 처음 사 본건데 가격대비 입을만 한거같아요 단지 몸에비해 너무 부해보인다는거 뺴곤 괜찮아영!
shsmnh10**|와인색인데 색상 개이뻐유ㅜㅠ 편하고 쫀쫀하고 날씬해보이고 너무 맘에들어요 배송도 하루만에 왔어요 진짜 짱입니다 꼭사세요!
ektha91**|니트가 좀 많이 얇아요 ㅠㅠ안에 옷 하나 더입고 입어야할거같아요 그거외에는 다 좋은거같아요핑크색도 구매하고싶네요!
ektha91**|세일하길래 구매했는데 잘 산거같네요.예전부터 구매하려고 눈독들이던건데크기도 넉넉해서 잘맞아요 편하고 좋네요~
ektha91**|예뻐요 부들부들하고 싼티안나는거같아요.근데 같이산 셔츠가 미스인거같아요 ㅠㅠ모델 입은거보고 세트로 샀는데 핏이 영...잘 입겠습니다 ~
ektha91**|셔츠가 상당히 크네요 아빠셔츠입은줄 ㅠㅠㅣ덩치작으신분들은 생각해보시고 사세요. 옷 진짜 좀 커요... ㅠㅠ 이쁘긴 이쁜데... 조끼랑 세트로 샀는데 약간 어벙해보여서 조끼랑 안어울리는거 같기도하고..아무튼 잘입을게요..
ttlha9**|옷 예뻤어요~도톰하고 색도 똑같았어요! 덕분에 데이트도 예쁘게 다녀왔네용 근데 어깨 쪽에 실밥이 좀 풀려서 왔어요 그거만 빼면 괜찮은거 같아용!♡
467204219**|우선 질이 너무 좋아서 깜짝 놀랐어요 사실 가격이 저렴해서 큰 기대는 안했는데 진짜 이가격대라고 안믿길 정도로 질이 너무 좋아요!!!핏더 역시 너무 이쁘고 길이감도 딱 종아리까지 와서 너무 적당하고 좋아요ㅠㅠ고고싱 배송도 바로 다음날 오고 너무 만족합니다ㅠㅠ
sejin24**|재질이 교복 마이같은 불편한 재질로 생각하고 있었는데아니어서 너무 좋았어욤 길이감도 적당히 귀엽게 짧아서 정말 맘에 들어요! 감사함미당
kimsisi52**|생각했던거 보다 길이가 짧네요.. 모델분이 키가 170이신데 무릎살짝위인줄 알아서 적당한 길이감에 샀지만 막상입어보니 저도 무릎위까지 올라오더라구요 그치만 막 엄청짧은 치마아니라 적ㅈ당히 짧아서 잘입을거같아요~
kimsisi52**|이가격에 이퀄리티는 고고싱만 될거같아요.. 배송은 2일만에 왔어요 ㅜㅜ 진짜 배송은 그 어떤 쇼핑몰보다 빨라요! 지금 고고싱코트 고고싱니트 고고싱바지 입었습니다 ㅋㅋㅋㅋ 코트적당히 두껍고 보돌보돌해용ㅎㅎ 곰털가타여...ㅎ대신 품이 좀 크게 나왔네요! 길이도 길구요! 키가 164인데 종아리까지 와요!  품이 넓어서 겨울에 안에 겹겹이 껴입어도 코트에 안낄거같아서 좋아요~ 울40에 이가격 이퀄리티 만족입니당
kimsisi52**|이뻐요! 근데 겨울에 입기엔 좀 얇고 색도 밝아요ㅠㅠ근데 신축성 좋아서 입기 편해요~ 아쉽다면 앉았다일어나면 구멍 점점 커질거 같네여..ㅜㅜ 그래도 배송도 2일만에 오고 무엇보다 너무 편합니다~~ 세미부츠컷 고르는중이시면 추천이에요!
vldzm03**|같이 주문한 원피스위에 입어봤어요ㅎㅎ언발이라 뒷 기장이 꽤 기네요~ 가성비 짱짱 좋은 제품같아요 ㅜㅜ다른색도 같이 주문했지만...품절ㅠㅠ아쉬워요 색깔별로 다 소장각ㅜ
vldzm03**|한눈에 반해서 샀어요ㅎㅎㅎ여성스럽고 하늘하늘 너무 이뻐요 끈으로 허리라인 꼭 묶어서 입으세용ㅎㅎ 너무 잘 입어질것같아요~
vldzm03**|첫번째 포토리뷰!30퍼 세일하길래 후다닥 질렀어요ㅎㅎ배송은 하루만에 왔습니다 일단 옷이 가볍고 울함량이 높아서 부들부들해요ㅎㅎ끈으로 묶고입는것보단 풀어서 입는게 더 예뻐용만족합니다! !
shcjv**|지금은 후기가 많지만 제가 처음 주문할 때는 후기가 없어서 살까 말까 엄청 고민하다가ㅜㅜ 예전부터 검정색 코트 사고 싶었는데, 가격도 괜찮고 해서 샀어요 ㅋㅋ처음에 택배 포장부터 엄청 커서 이거 완전 큰가보다 했는데 ㅋㅋ 진짜 크긴 크네요 ㅋㅋ 제가 체구가 작아서 오버핏 입으면 아빠옷 입은 애 같아 보일까봐 꺼려했었는 데 ㅋㅋ 이거는 아빠옷 입은 것처럼 크긴 큰데 ㅋㅋ 막 이상하지가 않아서 입으려고 합니다 ㅋㅋ 이 가격에 질도 진짜 좋아요 ㅋㅋ 솔직히 품질 좋아서 깜놀 ㅋㅋㅋ 배송도 하루만에 왔구요. 좀 큰거 빼고는 솔직히 다 좋아요 ㅋㅋ 입다가 정 안되면 뭐 품만 줄이던지 해야겠어요 ㅋㅋㅋ
dbstjd05**|색깔도 이쁘고 넉넉해서 아주 편해요^^
aldus06**|지금 이 가을에 정말로 필요한 가디건이에여'ㅜㅜㅜㅜㅜ' 남방이나 티 에걸치기만해도 데일리룩이에여ㅜㅜㅜㅜ 진짜 인생템입ㄴ다 다른색상도 보고 구매 할 예정이에요 두고두고 입을 수 있는 옷 이라서 더욱더 추천하구요 여름빼고 다 입으ㅡㄹ 수 있어요!!
aldus06**|레이어드 할 반팔이 필요해서 구매하ㅛ는데 길이도 적당히길고 좋습니다! 남방안에 입을 티 찾다가 ㅜㅜ 겨우 찾았네요 고고싱에ㅜ있는 옷을 이곳저곳 다찾아다녀서 고고싱이 최고인거같아요!!! 재질도 좋아서 맨투맨 안 에 입기에듀 좋습니다
aldus06**|ㅠㅠㅠ사진만큼이나 귀여워요 청바지나 청치마 캐주얼하게다 입을수 있어서 좋아요!!!!!!!!!!!! 루즈핏이라서 더 마음에 들어요!!! 가을에 입기 딱 이고 겨울이는 패딩이랑 입어도 좋을거같습니다 반팔도 이뻤는데 기대만큼 입니다!!
rmaal75**|정말 딱 허리 28입는사람까지만 맞을거 같아요!! 뒤에가 밴딩이어도 한계가 있더라구요 ㅠㅠ 제가 골반은 없는데 승마살이 많아서 체형커버하려고 산 치마인데 좋은거 같아요! 조금 들어갈때 낑기긴 하지만 그것빼고는 편하고 면도 보들보들하고 따듯하니 좋을거같아요~~~ 하지만 세트로 같이오는 벨트는 기대 하시면 안될것같아요! 쭈글쭈글하니 주름이 많이있는데 이건 뭐 다른 벨트로 대체해도 되니까 상관없을 것 같습니다~~ 배송도 정말 빨랐어요!!
rmaal75**|많이 두꺼울줄 알았는데 아니었어요! 그냥 적당한 두께의 보통 니트랑 똑같은거 같아요!! 목도 쫀쫀해요!! 머리가 커서 그런지 머리 넣을때 조금 힘들었어요 ㅎㅎㅎ^_^;; 어디에나 코디해서 입기 좋고 제가 상체가 좀 긴편이라 엉덩이 완전 다 덮지 않고 살짝만 덮었던거 같아요!! 마음에들어요! 배송도 빠르구요~~
elf11**|색 진짜 진심 예뻐요. 예쁩니다. ㅠㅠ 옘버요...... 약간 밝은 그레이인데 어두운 것보다 이 색을 찾고 있어서인지 받고 너무 즇았어요 ㅠㅠ♡ ㅠㅠ☆ 얇은 게 흠이지만... 아 생각보다 팔 길이가 조금 긴 편이에요. 제 팔이 짧은 걸 수도 있겠지만, 두 번 접어서 입고 다녀요!
elf11**|남방이나 다른 맨투맨 안에 받쳐입기 딱 좋은 템입니당 요즘 좀 추워가지고 마치 내복처럼... 입고 다녀요...ㅎ 집에서 입기 편하고 한번 빨았는데도 안 늘어났네여ㅎㅎㅎ 자주 입고 다니다가 늘어나면 하나 더 사 입을 생각입니당
rmaal75**|얇지않은 두께라서 걸치기 딱 좋아요! 하지만 어깨선이 넓어서 붕떠보이는 느낌이 조금 있지만 그래도 아무데나 코디해서 맞춰입기 편하고 좋을거 같아요!! 배송도 정말 빨랐어요! 역시 고고싱운 배송으로눈 뭐라하면 안될듯!!! 다른색상도 또 살거에요!! 그정도로 정말 좋습니다!!
elf11**|지금처럼 추워지는 계절에 입기엔 두께감이 많이 얇고, 초가을이나 늦봄 쯤에 입으면 될 것 같아요ㅎㅎㅎ 색상은 화면으로 본 것보다 조금 더 밝은 색이에요! 요즘 일교차가 너무 커서 패딩 안에 입고 다니고 있어요ㅋㅋㅋㅋ
elf11**|♡저렴한데 엄청 따둣♡ 3만 원 가격에 이정도의 따듯함을 느낄 줄이야....... 하나 더 살 예정입니다ㅠㅠ♡ 길이는 제 무릎까지 오는 게 길이감도 적당하고 품이 막 미친듯이 크지도 않아요 정말 딱 ♡적당적당 따뜻따뜻♡
elf11**|사진이랑 똑같아요. 생각보다 더 밝은 색상이어서 진한 색으로 다시 살까 고민했지만 이 색도 예뻐서 그냥 입으려구요 ㅎㅎㅎ 발목까지 떨어지는 핏이 예쁘고 키가 작아서 바지 길이 항상 짧은 걸로 구매하는 편인데, 이 바지는 제 다리길이에 딱인 것 같네용ㅋㅋㅋㅌ 굿굿 의자에 앉을 때도 편하고 아주 좋슴니다
elf11**|블랙, 그레이 코트 안에 입기 딱 좋은 템!♡! 딱 붙는 옷인데 답답함은 없고, 넥부분도 적당해서 코트에 입기 좋았어요 ㅎㅎㅎ 한 번 빨아서 입었는데 많이 늘어나지도 않고 좋아용
skwldn**|예뻐요!!! 근데 좀 얇아서 빛 비추면 안에 다리가 다 비쳐요ㅠㅠㅠ
elf11**|크다는 후기가 많아서 남자친구 사 줬는데 엄청 좋아해요 ㅋㅋㅋ 모자 작은 거는 싫은데 이 후드는 모자가 커서 좋다고 잘 샀다구 하네용 ㅎ3ㅎ 제가 입으면 엉덩이 다 가리고 품이 너무 큰데 남친(175/66)이 입으면 핏이 딱 맞게 잘 떨어져요 옷이 많이 크게 나온 듯ㅎㅎㅎ
10261386**|저렴한가격에 니트조끼 잘삿어용ㅋㅋ 근데 주름이 간게 빨아도안없어져서 ㅠㅠㅠ 니트인데 다림질좀 했어요ㅠㅠ그거빼면 이쁘고 좋아요
skysky44**|미쳣어요ㅠㅠ너무이뻐요!! 아무도 2만원대로 안봐요!!진짜 싼티 하나도 안나고 가을에 자주 입고다녔어요!!고고싱 처음 이용해봤는데 너무 이쁘고 배송도 진짜 너무너무 빨라서 놀랐어요!!앞으로 자주 자주 배송시킬게요!!사랑합닏다아!!!인스타에도 올렸어요!!아이디 02_sky.l 입니닷｡ﾟ(ﾟ´ω`ﾟ)ﾟ｡
elf11**|색감 정말 예뻐요ㅠㅠ 받은 다음날 착용하고 데이트했는데 넘나 예뻤어여... 남친도 예쁘다구 해 주고 좋았슴니다 ㅠㅠ♡ 교복처럼 보일까 봐 걱정했는데, 걱정과 다르게 깔끔해서 어두운 상의랑 자켓에 너무 잘 어울려요♡
10261386**|ㅠㅠ진짜이뻐요. 만원도 안하는데 싼티안나고 잘샀어용. 깔끔하고 반짝반짝 거리는게 계속 사고싶었던 스타일 목걸이였어요ㅜㅜㅋ
skwldn**|체크셔츠 원피스랑 같이 입으려고 삿는데 너무 예쁘고 그냥 청바지에도 입기 좋아요!! 근데 안감이 보들보들 한 편은 아니라서 좀 아쉽지만 어차피추워지면서 안에 나시티 하나 입을꺼라 상관없어요!!
