djdnehd09**|받아서 바로 입어봤는데 가벼워요!! 색상도 너무 이쁘고 니트 입고 입어도 잘 어울릴것 같고 원피스나 치마에 입어도 이쁠것 같아요~ 완전 만족합니다! 사진 보여주면 다들 이쁘다고 얘기하네요
juha12**|귀여워서 구매했는데 역시나 귀여워요.지금 아우터안에 입기딱좋은것같고포인트로 입기에도 좋네요.완전 잘산것같아요~~^^
djdnehd09**|다른 리뷰에 옷이 좀 무겁나는 글 보고 좀 걱정했는데 생각 보다 가벼웠어요!! 팔이 길어서 접어 입어야 될거 같네요 전체적으로 털이 있어서 안에 후드티 같은거 하나 입고 입어도 지금 날씨는 충분히 따듯하게 다닐수 잇을거 같아요  떡대 커보이면 어쩌나 했는데 생각 했던것 보다 커보이지 않아서 만족합니다 강추!
djdnehd09**|제가 55키로 정듀 나가서 28살까 29살까 고민했는데 엄마가 같이 입자고 해서 29샀어요!! 저한테는 조금 큰데 엄마는 딱 맞는다고 너무 편하다고 하시네요! (64키로정도됨) 밖에 있다가 집 오자마자 입었는데 정말 따듯했어요 겨울에 입어도 엄청 춥거나 하지 않을것 같아요 스판도 좋아서 활동하기 좋겠네요!
yjdj**|원피스를 평소에 좋아해서 딱보자마자 삿어요. 핏이나 색감 질적으로도 정말 좋아요! 가격도 매우 저렴한 편이고, 다만 가슴부분이 쫌 째긴 한데 불편할 정도는 아니에요! 몸에 적당히 달라붙어 움직일때 편하구요! 밑에 프릴이 맘에 들어요. 요근래 구매한 옷중에서 1순위로 성공한것같습니다...><
whthdms03**|음 레알루즈 가디건은 저번에 리뉴얼 되기 전부터 제가 많이 사랑한 옷이에요 저번엔 연분홍색을 샀었는데 연청이랑 코디해서 엄청 잘입고 다녔어요. 이번에도 엄청 구매하면서 샀는데 해상도차이 때문인지 화면과 많이 다른색이 와서 정말 실망했어요. 첨엔 카라멜라떼가 아니라 핫초코가 온줄알고 오배송으로 교환보냈는데 그게 카라멜라떼가 맞다더군요! 색이 생각보다 너무 매우 진합니다 실망했지만.. 잘입을게요!
sol13**|카라가 귀여워서 브라운이랑 블랙 두색상 구매했어요! 받아보니 역시 귀엽네요 목부분이 졸리지도 않고 딱맞아서 좋아요 잘입을게요~
whthdms03**|열심히 입고 지금은 세탁기에 들어가 있어 착샷 후기는 못남기는ㅠㅠ 옷 정말이뻐요 가격이좀 비싸서 고민했는데 그럴만한 가격이에요!! 퀄리티 정말 좋아요 아이보리 샀는데 첨에 받자마자 넘이뻐서 그날바로입음♡ 편하게입고다닐때도 이뻐보일 수 있는옷! 잘입을게요ㅎㅎㅎ
cmacmac**|일단 다른곳보다 가격이 월등히 싸서 혹해서 구입했어요. 가격에 비해서는 이쁜거같아여! 근데 제가 평소에 여성스러운걸 많이 입는편이라서 아직 한번밖에 안입고 나갔는데 벌써 추워져버렸어요 ㅠㅠ 내년봄에 더 잘 입고다니겠습니당!
whthdms03**|이뻐용 핏도 이쁘고 원단도 좋은 기본 니트 사고 싶었는데 딱 인것같아서 샀습니다ㅎㅎ 음 핏은 정말 이뻐요 편한 루즈핏 딱그대론데 조금 얇아요ㅠㅠ 이가격에 이런 퀄리티면 정말 좋은 편인데 좀 얇아서 추워지면 안에 뭐 입고 겉에 외투도 입고 니트 입어야 겠어요! 잘 입을게요 고고싱 감사해용 착샷은 많길래 구매하실때 참고하시라고 원단 사진 올려요 사진은 밝게나왔어요~
yts9**|완전 기대하고 주문한건 아니었지만 생각보다 별로였다.색상은 그냥그냥 나쁘지않음.느낌(?)이라해야되나 하여간 그건 사진 속 부드러운 느낌은 아니고 약간 부직포 느낌이 없잖아 있다.그래서 약간 싼티가 남3만원대치고는 평타.
yts9**|테니스스커트 느낌이 살짝 나네요 나쁘지 않아요 만족도 보통입니다근데 길이감이 애매한 편이고 뒤에 밴딩이 있어서 그런지 뭔가 모르게 이상하네요 울어서 그런가 그래도 그런거 저런거 감안해도 나쁘지 않은 상품입니다
sol13**|배송이 조금 느렸지만 치마는 편하고 좋아요~ 검은색 사려고 했는데 품절이 되어서 후기를 믿고 베이지색을 샀는데 이뻐요~ 지금 날씨에 입기에는 조금 추운느낌이지만 열심히 잘 입을게요!
butterfly92**|진청이랑 같이 구매했어요 진청도 예쁜데 연청도 예뻐요 제가 원하던 일자 핏이에요. 그런데 진청이랑 연청이랑 같은 사이즈로 주문했는데 왜 연청이 좀 더 작게 느껴지는걸까요?;;예쁘게 잘 입을게요~
cherry9705**|청자켓이없어서 구매했는데 이름 그대로 박시한 스타일이에요! 그렇다고 부해보이지 않고 귀여워요!!고고싱 옷은 다이뻐요
dmswl80**|예뻐요 생각보다 얇아서 놀랬어요ㅠㅜㅠ 보자마자 꽂혀서 지르긴했는데 코디하기 살짝 힘든감이 없지않아 있어요 청이랑은 살짝 안어울리는듯..? 하의를 하나 사야긔ㅣㅆ어요
dmswl80**|쫀쫀해서 좋아요 허리에도 스판끼 가득해서 허리띠없으면 흘러내리는게 아쉬워요ㅠㅠㅜㅠㅠ 신축성 좋아서 사서 다리는 엄청 편한데 입고 돌아다니다 보면 엉덩이가 밑에 쳐져있음ㅠㅜㅜ
hongkle96**|제가 원하던 색상이고 디자인이에요 넉넉히 잘맞고 핏이 너무예뻐요!! 그냥 상의로입어도 ,가디건으로 입어도 예쁘네요~~ 다른색상 더 구매하고 싶어요!! 데일리로 잘입고 있습니다!!!
abcdkk**|생각보다 이건 사이즈가 넘커여 허리도 크고 전반적으로 널널넘 질질내려가서 ㅠㅠ 기장은 괜찮고 색도이뻐서 여기저기잘어울리고 잘입어질듯함돠.
jeongyoo**|얇은데... 허리가 뒷부분이 밴딩이여서 옷을 집어넣고 입었을시 허리쪽이 안이쁘네요. 허리가 너무커서 밴딩 소용이 없어요... 두툼한 니트를 넣고 입어야 허리부분이 맞을듯하네요ㅜㅜ
abcdkk**|이뻐요사이즈 타잇하고 잘맞아여첨엔 좀 끼는거같은데 입다보면어차피늘어나서이정도 입어야될듯 ㅎㅎ좋아여 다른것도 사야지
jeongyoo**|고민하다가 샀는데 환불할려다가 말았어요. 생각보다 안이쁘네요. 팔부분도 생각했던게 아니고 끈으로 직접 넣어줘야하네요.옷이 너무펑퍼짐해요..
jeongyoo**|블랙샀는데 앞쪽만 바지에 넣어서입어도 이쁘고 안넣고입어도 이쁘네요. 목부분이 많이 짱짱해서 다소 답답한감이 없지않아있지만 만족합니다
why95**|완전두꺼워요~^^배송도 빠르구요~할인가로 샀는데 마음에 드네요~~~재질이 부드러운데 머리카락이나 먼지가 많이 묻어나는 재질이에요ㅠㅠ길이가 엉덩이 사알짝 덮어서 길이감은 조금 아쉬우어요ㅠㅠㅠㅠㅠㅠㅠㅠㅠㅠㅠㅠㅠㅠㅠ
thd01**|기본템으로 딱인것 같아요 조금 얇긴하지만 안에 히트텍 살색 입으면 안보이면서 따뜻해요 ㅎㅎ 기본이라서 뭐 청바지, 검정바지, 원피스 안에 코디용으로도 좋고 활용도가 좋은데 4500원이라서 대만족입니다.
thd01**|4500원이라고 믿어지지가 않는 가격인것 같아요~ 가격대비 최고, 민트 컬러가 흔하지도 않으면서 겨울에도 화사한 분위기를 낼수 있어서 예쁜것 같아요 아이보리색 바지가 있어서 같이 코디 했는데 찰떡이라서 자주 애용할것 같습니다! 예뻐요
fkswjd1**|친구랑 국화꽃축제 간다고 급하게 산거고 또 걍 니트는 무난히 다른 옷에다가 입을려고 산건데 걍 니트에다가 롱치마입으니깐 친구가 저보고 여리여리해 보인다고 요즘 사실 살쪘는데 그런 소리 들으니 좋더라고요 제가 봐도 여리여리해 보이는 효과있는거 같아요 저는 매우 만족해요 가격대비 짱짱맨 추천드려요!!
zfx4**|입어봤는데 두껍고 부들부들해서 좋아요. 근데 좀 넉넉하겠구나 했는데 팔도 길고 옷 길이도 허벅지 다 덮고 통도 커서 놀랐어요. 전체적으로 좀 커요 하지만 겨울에 따듯하게 입을수있을것 같아요
fkswjd1**|친구랑 같이 국화꽃축제 간다고 급하게 산건데 당일배송이라서 그런지 정말 빨리오더라고요 그리고 별 기대 없이 산건데 옷 받아보고 가격대비해서 너무 이쁘더라고요 진짜 걍 쇼핑몰에거 보는 사진보다 실제로 보는 옷이 제눈에는 더 이뻐요 강력 추천합니다!!!
wltn602**|색상 고민하다가 화이트는 때가 많이탈까봐ㅠ블랙을 언택했는데!!!너무이쁘더라구요ㅠㅠ 아 뒤에도 포인트인데ㅠ 뒷모습사진을 못찍어서 아쉽네요ㅠ 그리고 이거는 긴팔이 포인트인데 많은분들이 팔소매가 길어서 힙하다고 하시는뎅!!!그게 포인트니 ㅎㅎ잘 생각하고 구매추천드릴게요~^^
wltn602**|항상 고고싱 애용하는 1인입니다ㅎㅎ여기서 사고한번도 실패한적이 없는데 이것도 역시나 성공했네요ㅎㅎ 이게 생각보다 얇으니 지금 날씨에는 저옷안에 얇은긴팔입고 잠근후 겉옷을 하나 더입고 다니는걸 추천해드릴게용ㅎㅎ 다들 어디서 샀냐고 물어보더라구요~고고싱덕분에 가을에도 잘보낸거 같네요^^
554863428**|음,생각보다 목부분이 후줄근해요ㅠㅠ 그래도 보송보송따듯하긴한데 단독으론 목부분때문에 어려울듯해요 목폴라랑입으면 갠찬을듯해요
86245649**|진짜 편하고 이뻐요 싼맛에삿는뎁 춥지도않고 짱짱짱편함 강추~~~~~~158인데 발목위까지왓던거같아여 ㅋㅋㅋㅋㅋ
tnrudol7**|M사이즈 구매했는데 조금 크게 나온거같아서 L입으시는 분들이 입어도 괜찮을거같아요 아니면 겨울이니까 두꺼운 니트에 입어도 괜찮을거같구요 기장은 너무 짧지않은플레어라서 더 여리여리해보이고 여성스러워보이네요
tnrudol7**|많이 박시하게 나와서 남자가 입어도 낭낭한 정도! 여자가 입어도 예뻐요 근데 겨울에 단독으로 입기는 얇아요 지금도 입고있는데 편해서 만족하고있어요
97876459**|이거 진짜 강추해요!! 다른 색으로도 더 살거구 저는 분홍색으로 입었는데 노란 피부에 잘 어울리는 거 같아서 더 맘에 들어여 차분하고 무난한 핑크 그리고 기모가 짱 따뜻하고 부드러워서 입으면 기분 좋습니당 사이즈도 박시해서 편해요 그리고 목 부분은 짱짱해서 잘 안 늘어날 것 같아요 굿굿
tnrudol7**|기본 니트라서 어디든 코디하기 편하고 괜찮아요 봄 가을에는 단독으로 입을수 있고 겨울에는 아우터를 두껍게 입으면 될거같아요
97876459**|얇고 가벼운데 안에 기모가 있어서 부들부들하고 또 따뜻하네요 실용성이 좋은 것 같아요 다만 색상이 사진처럼 밝고 가벼운 느낌보단 좀 더 짙고 어두워요 엄청 어두운 건 아니지만 확실히 모델샷처럼 화사한 느낌은 없어요 예쁨무난이라기보단 ㄹㅇ무난무난...
tnrudol7**|예쁘고 잘 코디하면 더 예쁠거 같은데 코디하기가 조금 어려워요ㅠㅠ 그래도 요새 베레모가 유행이라 가격대비는 괜찮은거같아요
97876459**|그레이로 샀는데 딱 무난하게 입기 좋아요 너무 두껍지도 않아서 가볍고 위에 두터운 외투 입을때 안에 입기 좋을 것 같아요 부해보이지 않는 적당한 니트예요 다른 컬러로 구매의사도 있습니다~
yeon33**|오늘의 출근 룩이에용 여기에 코트까지 걸쳤습니당ㅎㅎ 디자인도 너무 사랑스럽고 기장, 품, 두께 다 마음에 들어요~ 너무 부해보이지도 않아서 여리여리 해 보입니당 회색이 더 예쁘지만 저는 회색과 어울리지 않기 떄문에..아이보리로 구매했어용 자주 꺼내 입을 것 같요ㅎㅎ
ysh60**|바지사면 항상 짧아서 불편했는데 170짜리로 사니까 오히려 길고 너무 편하네요~ 착용감도 좋아요. 진청인데 빨래 몇번 하면 아마 중청으로 변할것같아요~ 물빠짐만 있는것 빼고는 만족해요!
lientrangt**|배송빠르고 너무 따뜻해요.ㅎㅎㅎㅎ.그리고 색깔도 마음에 들어요. 저렴가격주무뇄으니까 너무 좋아요. 다음에도 주문할게요.
dlsenr**|항상 박시한, 여유핏의 니트들만 샀어서 이런 니트도 사 입어야겠다, 싶어서 구매했어요. 깔끔한 니트라서 좋고, 바지, 치마 상관없이 두루두루 어울릴 것 같아요.
zxc9512**|제가 생각했던 거 보다는 좀 얇은 거 같아요. 그래도 만족스러워요. 사이즈가 좀 작아서 그런지는 몰라도 기장이 짧은 거 같네요ㅠㅠ
zxc9512**|완전 좋아요! 요번에 고고싱에서 시킨 옷들 중에서 가장 맘에 드는 제품이에요!! 면이 완전 탄탄해요. 안에 바지 내장되어있어서 속바지 입을 필요도 없고 편한 거 같아요.
wonju8**|길이두 적당하구 너무 이뻐요~ 같이산 폴라랑 같이 입어도 이쁘구 원피스랑 입어도 이뻐용~~~잘입겠습니다!!!!!!!
h955**|옷이 너무 귀여워요 약간 할머니 옷 같으면서도 이런 느낌이 좋아요 브라운 사고 싶었는데 품절이라 ㅠㅠ 근데 따뜻하고 좋아요 가디건 같기도하고 셔츠같기도하고 좋아요
jsung9**|검정색으로 샀는데 무난하고 괜찮아요 길이도 마음에 들고 소재도 괜찮아요 처음에는 냄새가 좀났지만 빨아서 입으면 괜찮아요~~~~~~~~~~ 고고싱 다음에도 자주 애용할게요 많이 파세요!!!!!!!!!!!!!!!!!!!!
h955**|다른 댓글에서 보기는 했지만 비침이 엄청 심하네요.. 검정색인데도 다 비쳐요 ㅋㅋㅋㅋ... 그래도 목이 쫀쫀해서 따뜻하네요 안에 받쳐입는 옷으로 좋은 것 같아요
ssune**|따시고조아여 고고싱은 가성비갑 실패한젓리없는거깉니여배송도빠르구 저렴하구 정말저아여 잘입을기여 또살기여 ㅋㅋ
flxmfzos**|흠...퀄리티가 많이 떨어지긴해여ㅠㅠ 그래도 싼가격에 샀으니 할말은 없네요 겨울에는 못입을것같구 가을이나 봄에 입어야겠어요
flxmfzos**|완전이뻐요 색깔도 맘에 들구 레이어드해서 입기 딱 좋아요 얇긴 얇지만 그래도 이가격에 이 정도 퀄리티 만족합니당ㅎㅎㅎㅎ
minshuo**|이 맨투맨 진짜 살까말까 고민 많아 했었는데 핑크 구매했거든용 ㅎㅎㅎㅎ색도 너무너무 이쁘고 제가 생각하던 핑크랑 비슷하더라구용 ㅎㅎㅎㅎㅎ 진짜 너무너무 따뜻하기도 하고 추천핮니댱 :)
minshuo**|꾸앙 이거 코트 너무 이뻐요 ㅠㅠㅠㅠ 진짜로 길이도 딱 적당하니 너무 너무 이뿌구요 다들 이거 입고 가니까 엄청 잘어울린다고 말도 많아 해줬고 살짝 얇긴 하지만 초겨울ㅇ까지는 입을 수 있을 것 같아요 !!:)
minshuo**|우와아앗 이거 너무 귀여워요 ㅠㅠㅠㅠ 진짜 살까말까 고민하다가 구매하게 되었는데 진짜 너무 귀엽고 뭔가 귀여움이 살짝 더 첨가되는 듯한 느낌...?ㅋㅋㅋㅋㅋ이 들어용 !!:)
minshuo**|옷이 진짜 이쁘기도 한데다가 고급진 느낌이 들어서 이거 입고 가니까 언니들이 분위기 달라졌다고 어른스러워졌다고 하더라구용 ㅎㅎㅎㅎㅎ 길이도 적당하니 너무 이뿌공 좋은 것 같아요 !!:)
224229704775955**|카키라고했는데 색상이 이것도 저것도 아닌 색이었어요 뭔가 파란 빛도나는것같고 ㅠㅜㅠ 그거빼곤 핏이랑 맘에들어요 좀더 카키색이었으면 좋았을텐데 너무 ㅅ아쉬워요...
ohwani**|저대로 입을려고 니트랑 같이 샀는데 진짜 진심 완젼 예뻐요 떡대있는편인데 여리여리해보이고요진짜 후회안하고 잘입을수있을거같아요
vi10**|L사이즈로 구입했고 키는 158이에요, 너무 길진 않을까 걱정했는데 딱 롱패딩 길이라서 만족했어요, 솜이 아주 두툼하게 들어 있는 건 아니지만 따뜻하기는 해요. 시보리 처리도 잘 되어 있었구요!
drkim07**|샤랄라~나플나플~포근하고 부드러운 촉감에 어느정도 도톰한 원단..멋스러우면서 따뜻한 소재에요청바지도 스커트도 모두 어울리는 내사랑~♡♡
224229704775955**|귀걸이 너무이뻐요 ㅜㅜ하트 원래 좋아하는데 이거 이뻐서 맨날 끼고다녀요 ㅠㅠ지금도 꼈어요 사세요 ㅜㅜ 실버도 이쁠것 같은데 없어서 핑크골드샀는데 그래도 이뻐요
ohwani**|꽃원피스랑 모델분이 입으신거처럼 구매했는데 완전예뻐요 상체가 있는편있데 그렇게 부해보이지도않고 완전 예뻐요 잘입을게요
vi10**|쟁여두려고 구매했어요... 확실히 얇기때문에 물론 겨울에 입기에는 추울 수도 있지만 디자인이 예쁘기도 하고, 뒤에 밴딩 처리가 확실히 편해요, 있을 땐 잘 모르다가 다른 치마 입으니까 느껴지더라구요!
22062466**|화요일날 주문해서 바로 다음날 받았어요!! 배송도빨리오고 바지도 너무마음에들어요 스판도 짱짱좋고 바지 핏이 우선 너무이뻐요!! 항상 길이가 문제였는데 고고싱에서 주문하는 바지는 세탁소에 맡길일이 없어서 너무좋아요! 이번에 바지도 너무 만족스러워요 ! ! 키작은 저한테는 딱이랍니다! 앞으로도 바지는 고고싱에서만 살거같애요 ㅎㅎㅎ
ksooss**|하얀색상의 코트를 갖고 싶어서 알아보다가 고고싱이 가격도 착하고 이뻐서 구매했습니다ㅎㅎ 하얀색은 아니에요! 그래도 너무 하얀색이 아니라서 괜찮은것 같아요ㅎㅎ 재질을 부드럽고 두툼해서 겨울에 잘 입을것 같아요!
vi10**|괜찮았어요! 다만 길이가 조금 짧은 느낌. 제 키가 158인데 골반쪽만 살짝 덮더라구용 ㅠㅠ 그 점만 조금 아쉬웠어요., 후리스 안감이라서 일단 따뜻한 건 정말 보장!
ohwani**|원피스랑 같이입을려고 샀는데 색 진짜 예쁘네요. 상체가 있는편있데 그렇게 부해보이지도않고 좋아요예쁘게 잘입을수있을거 같네요
22062466**|화요일날 주문해서 바로 다음날 받았어요!! 배송도빨리오고 바지도 너무마음에들어요 스판도 짱짱좋고 바지 핏이 우선 너무이뻐요!! 항상 길이가 문제였는데 고고싱에서 주문하는 바지는 세탁소에 맡길일이 없어서 너무좋아요! 이번에 바지도 너무 만족스러워요 ! ! 키작은 저한테는 딱이랍니다! 앞으로도 바지는 고고싱에서만 살거같애요 ㅎㅎㅎ근데  S로 주문했는데 M으로 주문할걸 그랬어요ㅠㅠ다른바지들은 괜찮은데 이바지 허리사이즈는 약간 좀 작더라고요ㅠㅠ 그게 좀 아쉽네요
drkim07**|말 그대로 쫀쫀 날씬날씬~~^^요즘처럼 쌀쌀해진 날씨엔이너로도 딱인거같아요..타이트하지만 신축성이 뛰어나 불편함이 전혀없어요~
517308976**|사이즈 좋아 예쁜 니트예요~~~
drkim07**|말 그대로 쫀쫀 날씬날씬~~^^요즘처럼 쌀쌀해진 날씨엔이너로도 딱인거같아요..타이트하지만 신축성이 뛰어나 라인도 이쁘게 생기네요
drkim07**|저렴한 가격으로 구매해 약간의 의심도 있었지만 가격대비 넘 이쁘고 튼튼해요특유의 냄새같은것도 없고 딸아이가 넘 좋아하네요
22062466**|화요일날 주문해서 바로 다음날 받았어요!! 배송도빨리오고 바지도 너무마음에들어요 스판도 짱짱좋고 바지 핏이 우선 너무이뻐요!! 항상 길이가 문제였는데 고고싱에서 주문하는 바지는 세탁소에 맡길일이 없어서 너무좋아요! 이번에 바지도 너무 만족스러워요 ! ! 키작은 저한테는 딱이랍니다! 앞으로도 바지는 고고싱에서만 살거같애요 ㅎㅎㅎ
drkim07**|깔깔한 느낌일줄알았는데 보들보들하고 신축성도 좋아 자주 입게 되네요~^^많은 상품을 구매하진안았지만 살때마다 기쁨을 주네요
drkim07**|포근포근 따뜻하니 이뻐요~^^
fsnake**|루즈하고 진짜이뻐요 아무대나 턱 걸쳐도 스타일리쉬해 보입니다 니트도 가볍고 따가움도 없어요~ 완젼추운 겨울만 아니라면 목도리 칭칭감구 안꾸민듯 꾸민것처럼 이쁘게 입을수 있어요
11849109**|이 가격에 이정도로 질이 좋을거라고 생각못했는데 진짜 좋습니다 그리고 촉감이 진짜 좋아서 안에 뭐 입지않고 입어도 괜찮아요
sujin2233**|얇아서잘구겨져영 할인할때사서이득이긴한데 제값주고삿을지는모르겠움 하얗고 예쁨 얇아서잘구겨져영 할인할때사서이득이긴한데 제값주고삿을지는모르겠움 하얗고 예쁨
sujin2233**|얇아서잘구겨져영 할인할때사서이득이긴한데 제값주고삿을지는모르겠움 하얗고 예쁨 얇아서잘구겨져영 할인할때사서이득이긴한데 제값주고삿을지는모르겠움 하얗고 예쁨
11849109**|제가 키가 작아서 많이 크기는 한데 원래 크게 입으려고 사서 정말 만족합니다 안에 기모가 있어서 진짜 따뜻하고 크기가 커서 안에 얇은 티 껴 입으면 아우터 없이 입어도 아직까지는 따뜻해요
ey8810**|보자마자 구입했어요!! 화면은 화이트에ㅡ가까운 색상이어서 너무 밝을까봐 블랙이랑 고민했는데 아니네요!! 색깔도 너무 이쁘고 핏도 맘에들어요 울 함유도 되있어서 따뜻하게 입을 수 있을거같아용
ekfsla11**|따뜻한 느낌의 면레깅스에요 만졌을때 포근한 느낌이 있고 사계절용은 아니에요 편안하고 쫀쫀해서 잘 입을 것 깉아요 추천합니당
46832187**|생각보다 주름이 안잡혀있었구 제가 골반? 허벅지가 있어서 핏이 안이쁘네요 참고하세오ㅡ저처럼 골반있는분들은요ㅎㅎ
wlsruddl**|바지를 요즘들어 입고싶은마음이 강해져서 찾다찾다 마음에드는걸 찾아서 구매했고 배송은 엄청 빨랐어용 그리고 제 키가 작은편인데도 잘목이 보일정도라서 길이도 마음에들었어요 근데 s사이즈가 원래이렇게 작은건가요 고고싱 다른바지샀을때 항상s만 입었는데 이번꺼는 허벅지 터지는줄...그래도 디자인은 이뻐요 참고하세용
djdnehd09**|허리에 맞춰서 바지통이 좀 큰 느낌이 있지만 그래도 나쁘지 않아요!!! 다리도 길어보이는 느낌이 ㅎ 스판이 있어서 그런지 편하네용 강추합니다!!
zrzr**|친한 언니 선물해주려구 구입했어요~~~요즘같은 날씨에 입고다니기 좋다고 맘에 들어했어요 :-) 카키랑 브라운 번갈아서 입고얇기나 요즘같은 계절감에 딱인거같아요!
wlsruddl**|배송은엄청빠르게 잘 왔어요!! 대신에 생각했던거보다 먾이 얇아서 안에 히트텍입고 입으면 구냥 니트 두께정도됩니다.이거만입고 돌아다니기에는 많이추울꺼같아요 안에 티입고 입어도 부해보이지않고 몸에 달러붙어서 밥 많이먹는날에는 비추합니당
423542490**|가을에 엄청 잘 입고다녔어요너무싸게 올라와서 주문할까말까 했는데다른거 주문하는김에 배송비 안나오게 하려고 주무냏느데와 진심 ㅋㅋ엄청 비싸보이진 않지만 잘 다려입으니 싼티는 안나네요좋아요 ㅋㅋ강추
423542490**|아직도 잘쓰고다녀요얼굴도 작아보이고 너무 좋네요 ㅠㅠ
shyen**|핑크색 좋아해서 샀는데 색상도 너무 이쁘고 핏도 좋아요!후드티는 편하게 입을 수 있어서 좋은 것 같아요~ 기모라따뜻하게 겨울 날 수 있을 것 같아요!!
shyen**|목부분이 너무 넓어서 입었을 때 핏이 이상해요ㅠㅠㅠ그래도 저렴하니깐 가격대비는 괜찮은 것 같아요~코디하기 편해요~
shyen**|기본적으로 입기 너무 좋아요~ 핏도 이쁘고 품도 적당해서바지에 입기 좋은 것 같아요~ 기본템으로 가지고 있기 좋은 것 같습니당ㅎㅎ
shyen**|품이 넉넉하구 기장도 길어서 너무 귀여워요~ 기모라서 따뜻해서겨울에 자주 입을 것 같아요~편하게 츄리닝이랑 입을 수도 있어서 좋아요~ㅎㅎ
56584220**|가방 진짜 귀여워요!!!! 이런 가방 사고 싶어서 장바구니에 계속 넣어놓고 있었는데 정말 만족합니다 ㅎㅎ 졸뒤탱 강추해요!!!
shyen**|도톰해서 겨울에 이너로 넣어 입기 좋을 것 같아여~ 딱 기본적인니트이긴 하지만 코디하기 편해서 어디든 입기 좋아요~ㅎㅎ
zrzr**|생일선물사면서 겨울에 입을 남방이 필요해서 구입했는데의외로 두께감이 있어서 겨울에도 입을수있어서 좋은것같아요 :)길이감이 생각보다 초큼 짧아서 ㅠㅠ..아쉽지만 ㅎㅎ...
56584220**|깔끔하니 예뻐요 앞을 다 잠궈서 입으려고 했는데 몇몇 후기들처럼 생각보다 많이 파여있더라구요...ㅠ 계속 꾸준히 올려줘야해서 걍 풀고 입으려구요 풀고 입어도 예쁩니다
shyen**|길이도 적당하고 색상도 그렇고 진짜 예뻐요~이 날씨에 안에 이너로 넣어입으면 너무 이뻐서 계속 입게 되요~ 추천해요!!ㅎㅎ
