chsj**|수학여행때입을려구샀는데. 너무 이뻐요!!!❣️❣️전 나름만족해용~~~사이즈도 딱맞는거같아요!!고고싱
fuckoff15**|가을이라 모카라떼색상으로 구매했고요 모델사진처럼 딱 브라운색상이에요 너무클까봐 걱정했는데 막상입으니 넉넉해서 좋네요 오히려 팔부분이 통이 크고 길어서 두번 접어입어야겠어요ㅋㅋㅋ두툼해서 초겨울까지 입을수있을것같아요~ 옷 이쁩니다^^
amg3**|연청이 제 생각보다 더 밝더라구요쇼핑몰 사진보다 다른분들 상품후기 사진이 더 정확한거같아요살짝 더 어두웠으면 좋았을거같은데..ㅠㅠ그래도 핏이 너무 예뻐서 만족합니다!이런 밑단 헤짐 스커트가 너무 갖고싶었거든요허리도 딱맞아요! 굿굿
sobd**|사진으로는 얇게 안보였는데 입어보니깐 조금 비치는데 그래도 정말 예뻐용! 바람 불 때 나풀나풀거리는데 여성스럽고 맘에 드네용!! 배송도 빠랐어요~
amg3**|처음 받았을때 옷냄새가 너무 많이 났어요ㅠㅠ가격만큼 얇은 재질이긴 해요 그래서 여름에 시원하게 입을듯!워낙 무난해서 어디에나 잘 입을 수 있는거같아요만족합니다 ㅎㅎ
isj99**|아이보리라 색깔도 이쁘고 길이같은것도 딱 적당한거 같아서 치마에 잘 어울리는거 같아용 덕분에 이쁘게 잘 입고 있어요!!
fuckoff15**|단품으로 입으려고 주문했는데 진짜많이 파여서 뒤로 엄청땡겨서 입어야 단독으로 입을수있어요ㅋㅋ그냥 원피스에 입어줘도 이쁘고 기본템이라 무난합니다 촘촘하고 만원에 비해 품질이 좋아서 만족스럽네요 단점은 검은색이라 저희집댕댕이 털이붙으면 잘보인다는점입니다~
sobd**|진짜 너무 예쁜 와인색이에요!! 어떤 옷을 입어도 다 예쁘고 잘 어울릴 것 같고 에이라인이라서 다리가 더 얇아 보여요! 딱 가을이랑 어울리는 옷이에용! 배송도 빠르고 정말 만족합니당
ab57**|정말 편해요 !!!!!!!!!!!!!!!!!!!!!!!!!!!!!!!!!!!!!!!!!!!!!!!!!!!!!!!!!!!!!!!!!!!!!!!!!!!!!!!!!!!!!!!!
62287919**|생각했던 색상이랑 많이 다르네요 ㅠㅠ 사진이랑 ㅠㅠ 레드 사시는분 블랙으로 사세요 추추추춰천 합니다. ㅠㅠ 블랙으로 바꾸고 싶네요
62287919**|처음에 한개만 사다가 너무 편해서 하나둘씩 사다보니깐 3개색상이 다있네요ㅋㅋㅋㅋ 정말 추천하고여 허리 줄이 길기는 한데 짤라버리면 되고 약간 모바지? 느낌나요
leemi**|일단 스판엄청 짱짱하구요 키가 작은편이라 그냥 입어도 상관은 없는데 저는 쪼끔 자를 생각이에요 그리고 제가 41키로 인데 허리가 많이 크네요 ㅠ 25생각하고 잇엇는데 26으로 생각하시면 될거 같아요 허리가 크다보니 바지가 너무 내려가서 허리띠를 항상 해야될거같아요 자주 입을거 같아요 !
wngml05**|키큰분들은 L사이즈 추천합니당!!별기대안하고 샀는데 훨씬 만족합니닼ㅋㅋ소매부분을 꽈잡아줘서 좋더라구요!!근데 모자가 좀 작아서...  살짝 아쉽네여ㅋㅋ
wngml05**|진심 인생팬츠ㅋㅋㅋㅋ이때까지 스키니진만 입었는데 이바지는 살짝 일자더라구요ㅋㄲㅋ 와우 진심 색도 이쁘고 핏도 장난아님!!ㅋㅋ
wngml05**|M사이즈가 많이 커서 S사이즈로 교환했어요!!한사이즈차이가 차이가 많이 나더라구요ㅋㅋㅋ안에 속바지가 있어서 안심이긴한데 화장실갈때 불편해서 어떡하나요....
wngml05**|ㅋㅋㅋㅋ키큰사람들은 원피스를 입지말라는건가요ㅋㅋㅋ왜 고고싱에서 사는 원피스들은 죄다 이리 짧은것인지ㅋㅋㅋㅋ이거샀더니 티샀냐고 그러더라구요ㅋㅋㅋㅋ
wngml05**|음....어깨 넓으신분들은 비추입니다ㅋㅋㅋㅋ어까가 더 넓어보이는 효과가 납니닼ㅋㅋㅋ그래서 저는 못입고 동생주니까 여쁘더라구요ㅋㅋ
wngml05**|치마가 길이가 많이 짧은편이 아니라서 정말좋구요ㅎㅎ타이트하지않고 편해서 너무 좋아요!!허리부분이 허전해서 허리띠하고 검은티랑 입으니까 괜찮더라구요ㅎㅎ
wngml05**|진짜 심플하고 이뻐요!!!너무 딱맞아서 이상한 핏 아니고 살짝 큰느낌이여서 더이쁜옷!!소매랑 카라부분이 흰색이여서 더이뻐요ㅎㅎㅎ
wngml05**|음.... 퀄리티가 그렇게 좋은편은 아닌것 같네요ㅎㅎ그래도 싼것치고는 디자인도 괜찮고 색도 괜찮은것 같아요ㅋㅋㅋ 근데 옷 앞부분이 조끔 허전해서.... 살짝 아쉽네여..,색도 그렇고 딱 가을에 입기 좋은 옷인것 같네요ㅋㅋㅋㅋ
futurumsun**|롱패딩 살까 말까 고민하고 있었는데 고고싱에서 딱 세일하고 있길래 바로샀어요!!! 진짜 싸게 잘샀고 엄청 따뜻합니다~ 많이 파세용
futurumsun**|예쁘긴 한데 ㅠ 허벅지가 딱맞네용 ㅠㅠ 살좀 빼야겠어용... 생각한거 보다 재질이 얇아서 딱 지금 입기 좋은거 같아용그래도 싸게 잘산거같아요~~
dmsdud20**|하쿄갈때도입고그냥나갈때도입어는데데일리하게거치기좋고아무옷에다잘어우리는것같아요너무예뻐요!!
asq98**|배송오자마자 바로 입어봤는데 생각보다 많이 짧았어요ㅠㅠ 하지만 심플한 티와 코디하면 이뻐요! 그리구 다리가 이뻐보입니다! 날 따듯할때 많이 입어야겠어용~
asq98**|아이보리로 샀는데 이뻐요ㅠㅠ 주황색이 들어가있어서 귀엽구요~잘산것 같습니다!가을에 간편하게 입기에 딱인것 같아요!
asq98**|프린팅이 깔끔하고 이뻐서 슬랙스랑 같이 코디해서 입기 좋은거 같아요!! 가을에 많이 입고 다닐것 같습니다 이뻐욧~!!
seoa40**|라라체크 남방 안 샀으면 큰일날뻔 했네요. 실제 받아 보니깐 옷이 화면보다 더 예뻐요. 베이지색 남방이 없어서 고고싱에서 보고 바로 주문했어요. 배송은 빠르고 편하게 어디든 잘 입을 수 있고 소화가능한 남방이에요. 고고싱에서 구매한 치마랑 매치해서 입고 오늘 놀러갑니디!^.^
seoa40**|티셔츠 너무 예뻐요. 색상은 화이트로 샀습니다. 배송은 진짜 ㅃㅏ르고 고고싱에서 구입한 체크 남방에 입으면 너무 잘 어울리고 예뻐요! 이렇게 좋은 옷을 착한 가격에 구입해서 득템해서 너무 좋아요! 어디에든 다 잘어울리고 편하게입을 수 있는 옷! 강추합니다!^^*
sangae38**|핏이 너무너무 이쁘고 색깔도 이뻐요 단지 좀 아쉬운점이 한번 세탁하고 나면 목 쪽이 쫌 늘어나서 오랫동안은 입지못할거같아요ㅠㅠ 그래도 디자인이랑 색깔은
ghdthdud**|카키색샀는데 맘이2ㅡㄹ어요~~~세일할때사서 가격도 저렴하게 잘샀습니당ㅇㅇ길이도적당하고 괜차나여 잘입을게여
ghdthdud**|ㅠㅠㅠㅠ정말예뻐요 세일할때 산거라서 가격대비 만족합니다 검정색사고싶었는데 품절이라 버건디샀는데 나름괜찮네여~~
lyl12**|진짜 아방한 핏에 너무 기여운 핏이에요 !!!! 청바지에 입어도 잘 어울리고 치마에 입어도 잘 어울릴듯! 귀여워지고 싶으면 추천!!!
lyl12**|처음에 프린팅이랑 색 맘에 들어서 샀는데 진짜 기장도 딱 좋고 색도 너무 이뿌당 ,,,, 소매부분도 박시해서 편하고 특이해서 이뻐욥 !_!
green12**|길이가 좀 길긴 한데 이쁘고 편해요!! 청자켓안에 입기에 옷이 얇아서 불편하지않고 지금도 입어도 덥지 않을 옷이네요 추천합니다!!
eunkyeong0**|ㅋㅋㅋㅋㅋㅋㅋㅋㅋㅋㅋㅋㅋㅋㅋㅋ슬랙스 삿는데 다림선이 발목쪽으로 돌아가 있길랰ㅋㅋㅋㅋㅋㅋㅋ다림질이 잘못된건가 했는뎈ㅋㅋㅋㅋㅋㅋㅋㅋㅋㅋㅋㅋ그냥 제봉이 잘못됬네욬ㅋㅋㅋㅋㅋㅋ이미 옷을 세번이상 입어서 환불할수도 없곸ㅋㅋㅋㅋㅋㅋㅋ사람들이 골반비틀어졌냐고 다 물어봐욬ㅋㅋㅋㅋㅋㅋㅋㅋㅋㅋ걸을때마다 제봉선이 돌아가고 앞쪽 팬티라인부분이 Y자모양으로 접혀서 걸을때 팔자로 걸어야되욬ㅋㅋㅋㅋㅋㅋㅋㅋㅋ팔자로 걸으면 또 사람들이 조선시대 양반이냐고 물어봐요ㅎㅎ화가 나는게아니라 너무 어이가 없어서 웃기네욬ㅋㅋㅋㅋㅋㅋㅋㅋㅋㅋㅋㅋㅋㅋ이거 뭐 어테 좀 해주세욬ㅋㅋㅋㅋㅋㅋㅋㅋㅋㅋㅋㅋㅋㅋ진짜 젠장ㅋㅋㅋㅋㅋㅋㅋㅋㅋㅋㅋㅋㅋㅋ
jeje05**|지금같은 날씨에 입고다니기 정말 딱좋아요 얇아서 안에 옷이 살짝 비치지만 두께가 딱 적당해서 아침저녁에 쌀쌀할때 입기 좋았어요!
jeje05**|길이도 딱적당하고 핏이 예뻐요 모델이 입은거처럼 겉옷처럼 입기도 원피스로 입기도 다이뻐요 색도 화면이랑 똑같이 깔끔하고 이쁜색이라 무난한듯 안하게 잘입고다닐꺼같아요
xogml86**|여성스러운옷을 한번도 안입어봐서 도전하는 생각으로 사봤는데 너무 과하지않아서 괜찮았던거 같아요 언발이라는건 알았는데 생각보다 많이 언발이라서 조금 놀랐지만!! 그래도 예뻐요 반바지랑 입으면 더 예쁩니당ㅎㅎ
xogml86**|바지 색깔도 예쁘고 일자핏이라서 바지핏도 예뻐요!!가을에 입기 좋고 살짝 얇아서 겨울에 입기에는 추울거같아요제가 키가 작은편인데 기장은 딱 맞습니다!!
49718308**|여기 나온 코디처럼 셔츠 위에 입으려고 샀어요. 두께 얇을거 각오하고 산건데 생각보다 더 더 얇아요! 그래도 무난해서 평소에 잘 입고다닐것 같아요!
xogml86**|세탁후에도 늘어남이 없고 아주 쫀쫀해요근데 겨드랑이쪽에 너무 위쪽으로 붙어있어서 조금 불편하지만 딱히 문제될건없고 가성비가 아주 좋습니다!!
49718308**|아직 이걸 입을 날씨는 아니지만 보자마자 이뻐서 바로 샀어요!니트 종류 사면 다 팔이 짧아서 걱정했는데 팔은 엄청 길어요ㅋㅋㅋ 근데 길어서 접어입으니까 더 여리여리 이쁜느낌!
nomon**|질문!!!!옷이 미끌미끌 뭔가 전체적으로 기름이 묻어있는ㄴ 듯한 촉감이에요 왜 이러는지....ㅠㅠㅠㅠ 저한테 조금 큰데요 박시한 정도에서 조금 더 커요 근데 제가 팔이 짧은데 저한테 맞아서 핸복해요 이건 접어입을 슈도 없잖아요 근데 팔길이가 맞아요 너무신나요 옷이 미끌미끌해서 말리고있어요 왜 미끌한지는 모르겠지만 드라이클리닝하면 괜찮아질까뇨
xogml86**|가볍게 입기 좋고 소매가 널널해서 하늘하늘해보이는게 예뻐요지금날씨에 입기좋고 다른색도 사고싶습니다ㅎㅎ!!!!!
49718308**|편하게 대충 나갈때 입으려고 샀는데 청바지에 입어도 꾸민것같아요! 아무데나 다 잘 어울려서 코디하기 편하고 좋아요!!
nomon**|이거 별로 기대안하고 샀고요 그냥 편하게 입으려고 산거였어요!! 후줄근한 싸이즈 오지 않을까 했는데 입어보니까 작고 모델핏나는거에요 저는 다리가 정말 짤똥하거든요 근데 이건 엉덩이라인이 다 드러나서 다리가 예뻐보여요 최고 고마워요 아껴입을거에요 그럼 안녕
kyk73**|치마 주문하고나서 좀 기다렸어야 됬어요 ㅋㅋㅋ 그래서 배송따로받았어요! 그럴만한 이유가 있는것 같아요 엄청 편하고 뒤에 고무줄이 있어서 허리남는것도 없어요 ㅎㅎㅎ 항상 치마입으면 뒤에가 남았는데 예쁘게 맞아용~ 안에 속바지도 있어서 편한것 같아용!
kyk73**|저는 베이지색상을 주문했는데, 보자마자 너무 예뻐서... 바로 입어봤어요 ㅋㅋㅋㅋ 제가 완전 좋아하는 스타일이예요 원래 줄무늬 티셔츠를 좋아하긴 하지만.. 색상도 넘 예쁘고 제가 몸이 작아서그런지 오버핏이라 넘 맘에들어영ㅎㅎㅎ 무난해서 어디든 예쁠것 같아요!
psj84**|요가할때 레깅스만 입기 민망해서 레깅스 위에 입으려고 주문했는데 잘산 것 같아용 ㅎㅎㅎ 평소에도 입을수있고 잠옷으로도 입을수있으니 젛네욤
sksmsor**|무난무난하게 입으려곳샀어요~~~~ 교복에입든 사복에입든 너무괜찮네요 사이즈는 정사이즈샀고 딱맞아요. 자주신을것같네요^^ 역시고고싱 실망시키지않네요 예쁘게 잘 신고다닐게요~~~~!!!!!!!!수고하세용
49718308**|팔 통이 커서 펄럭이는걸 안좋아하는데 이건 적당히 퍼져있어서 너무 이뻐요! 티셔츠 이름대로 입으면 여리여리! 이뻐요~
ektha4**|치마랑 블라우스 같이 산건데 블라우스도 가격대비 만족해요! 자칫 촌스럽진않을까 생각했는데 막상입어보니 괜찮은거같아요!!!
cahmin**|처음에 받았을때 정말 정말 만족했어요~ 많이 얇지 않았고 제 키에 무릎? 정도 왔던걸로 기억해요 어깨 부분이 약간 늘어날 것 같지만 전체적으로 예쁘고 학교 교복, 데일리로도 많이 입을 것 같아요 ♥
ektha4**|치마는 화면그대로 온거같아요 색도 그렇고 재질이나 핏도 맘에들어요 !! 제가찾던 스타일의 치마라서 딱원하던거였어요 근데 치마길이가 살짝 짧은감이있어서 엉덩이 부분에 언발란스 부분이 살짝 들뜨긴해용 그래도 만족해요~~
93695744**|원래 나시 안입는데 ㅠㅠ진짜 귀엽고 잘입었어요프린팅 색도 이쁘고 제가 66반정도인데 ㅠㅠ팔뚝때문에 고민많이했는ㄷ네 물론 제팔뚝이얇아보인다거나그런건아니지만 여기에 가디건입어도 이뻤던거같아요 ㅎㅎㅎ
komh51**|배송은 입금 후 하루 걸렸어요. 택배 받자 마자 딱 열고 처음 입었을땐 뭐랄까? 아빠 정장 바지 입은 느낌?  그런 느낌이 났는데 계속 보다보면 익숙해지고 너무 예뻐요 영어캠프 갈 때 입었었는데 진짜 이뻐요 스판끼는 제로에요 허리는 좀 큰데 옷집어넣어서 입으면 예뽀오 추천해요 키 151에 몸무게 39랍니다 참고해서 옷 사세요
fbgmlduf**|밴딩이라 쪼일 줄 알았는데 생각보다 허리가 많이 남더라고요ㅠㅠ 그리고 어떤 후기에 뒤에 밴딩때문에 엉덩이 있으신 분들은 뜰거라그랬는데 정말 얖에서보면 엉덩이부분이 떠서...좀 뚱뚱해보여요..ㅎ.어벙벙하달까ㅠㅜ 반품하긴 귀찮고 그냥 수선 한번 해볼려고요ㅠㅠ 베스트상품이라 믿고 주문했는데 살짝 후회돼요 ㄹ
jhm56**|부분배송으로 며칠 늦게 도착했는데 학교다니면서 편하게 걸치기 좋은 거 같아요. 요즘 아침저녁으로 조금 쌀쌀해서 데일리로 잘 들고 다닙니당.0
jhm56**|기본 긴팔티가 필요했는데 마침 있더라구요. 잘 산거 같아요. 면재질고 부들부들하고 입기 편했어요. 흰색도 살까 고민 중!
jhm56**|이거 은근히 가슴부분이 좀 쪼여용. 일단 단추 먼저 채우고 뒤에 리본 묵는게 좋을 것 같습니다. 가슴 사이즈 작은편인데 리존 먼저 묶어놓고 단추 채우다가 너무 쪼여서 당황했어요;; 핏은 자연스럽게 A자로 퍼져서 예쁩니당.
jhm56**|카키색으로 주문했는데 이색도 예쁜거 같아요! 핏도 예쁘구 일단 입었을때 되게 가벼워서 편해요! 청바지에다 입으면 제일 예쁘다고 생각합니닿ㅎㅎ 원래는 아이보리?색 사려고 했는데 이색도 예뻐서 그냥 입고 다니려구용ㅎㅎ
xoodp**|진짜 말그대로 집에서도 밖에서도 입기 좋아요!학교에서 체육복위에 입다가 마치면 바지도 갈아입고학원가요 짱 편하고 빨간색 구매했는데 색감도 이뻐요애들이 팔부분 큰거 귀엽대요!!
choek20**|여자들이 좋아하는 핏이구 어디에 입어도 예뻐요 ㅎㅎ맘에 듭니다 뷔스티에 안에 받쳐입어도 예쁘고, 티 위에 남방이나 가디건 입어도 이뻐요
eunseo26**|여리 여리한 귀걸이를 찾다가 너무 맘에 들어서 보자마자 핑크골드색으로 샀는데 진짜 너무 이뻐요 ㅠㅠㅠ 제가 생각했던 그대로고 여리여리한 옷에 맞춰 끼면 진짜 이쁩니다 강추에요 완전 !!
eunseo26**|시원하게 입을 수 있을 것 같아서 샀는데 너무 좋고 색깔도 제가 원한 빨강이어서 좋았어요 !  길이는 좀 짧았지만 진짜 속옷도 안보이고 여름에 입기에 정말 좋은 것 같아요 !
qsz11**|면이 까슬까슬하다고해야하나? 하지만 시원한 면이에요!! 요새 점심에 햇볕 뜨겁잖아요 그때 입고가가 좋은 옷이에용 시원하고 좋아요!!
qsz11**|색 대비가 뚜렷해서 너무 이쁜 티셔츠에요! 쇄골까지 보이는 넥라인이 너무 예뻐요 브라끈이 보일수있지만 그정도는 괜찮아요! 그리고 요즘 날씨에 딱인거같아요! 추천!
kn27**|으음 애매해요 ㅠㅠ 얇긴한데 색깔이 연해서 그런가 약간 떡대있어 보이는거 같기두하고 ... 가디건 자체는 가을에 입기좋은 가디건이에욤 ..
eunyoung29**|후기가 몇개 없어서 사기전에 고민했었는데 사고나니 후회 없어요 ㅜㅜ 가격이너무 착하고 활용도가 높을것같아요!! 지금같이 아침저녁 쌀쌀할때 입기 딱 좋을것같아요 ㅋㅋㅋㅋ 브라운이랑 블랙 고민하다가 브라운 구매했는데 받아보고 블랙도 추가구매했어요!
kn27**|예뻐요 ~~  펼쳐 봤을 때 생각보다 팔 부분이 조금 짧은것 같기두 하면서도 입어보면 많이 짧지는 않아요 ! 바지에 간단하게 아우터 처럼 입어도 괜찮고  셔츠로 치마에 입어도 괜찮네요 !!  둘다 잘어울리는거 같습니다 :) :) :) 잘 입을게요 !
sm771**|색이랑 길이랑 다 맘에들고 정말 예뻐요 !!그런데 사이즈가 m치고는 살짝 큰거 같기두 합니다 !!!!그래도 짧고 그롱것보다는 확실히 좋은거같아용
junn**|주름이 쭈글쭈글 하지만 펴서 입으면 괜찮을 것 같기는 해요!! 근데 입었을때 엄마가 약간 뒤에가 비치는 것 같다고 하시네용.. 완전히 딱 달라붙으면 팬티 약간 보이는 것 같아요! 근데 뭐 헐렁헐렁하니까 잘 보이지는 않을 것 같네요ㅋㅋㅋ엄청 얇아서 여름에 입기 좋을 것 같고 시원한 바람 불면 추울 듯ㅋㅋㅋ살짝 치마 같아보이긴 하지만 확실히 실제로 보면 그냥 바지 같아요ㅎㅎ근데 핏이 좀 애매해서 약간 마실나온 아주머니 같기도 하고 이건 코디를 잘해서 입어야 할 것 같아요 그냥 싸게 사서 만족합니다
junn**|크롭티 처음 사본거라 입고 다닐 수 있을지 모르겠지만ㅋㅋㅋㅋ 그냥 레드 색이 너무 이뻐서 한번 도전해 봤네요...제가 골반이 없어서 하이웨스트 바지를 입고 티 입어봤는데 전체적인 핏은 별로지만 허리에서 잘라서 위쪽만 보면 마음에 들어요ㅋㅋㅋ이건 제 몸의 문제니깐..제품은 넘나 맘에 들어요ㅎㅎ천도 나쁘지 않고 색도 쨍하니 이뻐요! 팔 통도 적당히 넓고 길어서 좋으네요ㅎㅎ크롭티인데 하이웨스트 바지랑 입으면 거의 노출 없어서 이쁘고 손들어도 저만큼 보이는데 저정도는 괜찮을 것 같아요! 첫 크롭티 만족합니다ㅎㅎ
junn**|딱 받았는데 색이 생각보다 어두웠고 두께도 얇아서 실망했어요ㅠㅠㅠㅠㅠ 입으니까 무난하고 싸게 사서 그냥 입으려구요 못입겠다 는 아니고 그냥 제가 생각하던 느낌이 아니라서 실망한거라..실제색이 제가찍은 사진보다 조금 더 어두운 것 같아요 그래도 무난한 핏에 기본 니트로 입으면 되니까 산 걸 후회하진 않아요!
annjh**|이렇게 목이 긴 양말같은경우에는 시중에 2000윈씩 하는데 싸게 살 수 있어서 좋았어요.저번에도 사서 신어봤는데 그 때 양말 아직도 목 튼튼하게 잘 신고다녀서 좋아요!
junn**|레드나 브라운이나 블랙을 사고 싶었는데 모두 품절이라 고민하고 있었어용 근데 딱 블랙이 풀려서 그때 바로 구매!! 결론적으로 너무너무 마음에 듭니다ㅠㅠㅠㅠ팔 길고 가오리핏인걸 좋아하는데 딱 맞아요진짴ㅋㅋㅋ생각보다는 조금 크긴 했지만 뭐 어때요 이쁜데ㅎㅎㅎㅎ진짜로 다른 색도 구매하고 싶네요ㅜㅠ넘넘 편하고 이뻐서ㅠㅠㅠ 티 살때 가장 고민되는게 천 재질인데 이건 진짜 보장하는데 너무 좋아요! 부들부들하고 구김도 많이 안 갈 것 같고 싼티도 절대절대 안나요!! 구매하고 일주일동안 두번이나 입었네요ㅋㅋㅋ어디에나 잘어울리고 편하고 이쁜 옷 감사합니다!
iseul**|핏도 예쁘고 색상도 너무너무 예뻐요~모델처럼 단품으로만 입으려니 그러기엔 좀 많이 파인것같아서 안에 나시받쳐 입으려구용...ㅎㅎㅎㅎ
junn**|너무너무너무너무이뻐요 진짜 이건 사기 전에도 무슨 색으로 사야할지 고민했지 안사야겠다는 생각은 전혀 안했는데 진짜 와 할말없이 예뻐요 수납도 진짜 많이 되고 바닥도 딱 잡아주는 건 없지만 넓게 사용할 수 있어요! 이거 배송오자마자 하루정도만 혹시나 냄새날까봐 밖에 두고 그 이후부터 일주일정도 계속 사용했는데 매일매일 가방 예쁘다는 소리 빠짐없이 들었어요!! 어디 걸릴 것 같다는 후기를 보고 조심조심 사용했는데 저는 일단 어디 걸린 적은 아직 없어요! 고민하지 말고 사세요 진짜 넘넘 추천합니다ㅠㅠ 가반 커서 큰 책이나 A4파일 같은것도 쑥쑥 집어넣을 수 있고 파우치나 필통같은걸로 여러개 넣어도 밖에서 봤을 때 가방 모양 예쁘게 잡혀요ㅠㅠㅠㅠ꼭사세요진짜
chae19**|체크크기가 너무 작지않아서 촌스럽지 않고 팔길이도 적당해요.다만 아쉬웠던 부분은 밑부분이 아우터처럼 걸칠 수 있게 일자로 끝나는 줄 알았는데 U자형으로 생겨있고,어깨쪽에 실이 하나풀려있는데 복구할방법이ㅠㅠ
junn**|머스타드 색 보자마자 사고싶어서 고민도 안하고 장바구니에 넣었던 제품입니다ㅋㅋㅋㅋ색은 진짜 생각했던 색 그대로라서 일단 마음에 들었구요 길이도 적당해서 넣어입기도 좋고 편해요!! 비침이 조금 있기는 해요! 마지막 사진에서 손 비치는 거 확인해주시고 구매하세요!! 어차피 블라우스는 약간 비치기도 하고 그러니까 안에 나시 입고 입으려구용ㅎㅎ약간 얇아서 지금 입기 딱 좋은 것 같아요~ 품도 엄청 작지 않고 팔도 넉넉합니다!
junn**|옷 오자마자 입어보고 사진찍은거라서 구김이 조금 있지만 사진보다 실제로 입었을때 핏 진짜 이뻐요ㅠㅠ아이보리 살까 브라운 살까 고민하다가 브라운 샀는데 넘넘 이쁩니다ㅠㅠㅠㅠ주문량 많아서 배송 조금 오래 기다렸지만 어차피 더워서 입지는 못하니까 기다리는건 상관없었는데 진짜진짜 이뻐서 늦어도 용서됐을 것 같아요ㅋㅋㅋ넓은 팔통이 여리여리해 보이게 해주고 두께도 적당히 두꺼워서 아이보리여도 엄청 비칠 것 같지는 않아요!사알짝 무거운 느낌이 들긴 하지만 그래도 이쁘니 괜찮ㅋㅋㅋ곧 입을 수 있을 것 같아서 구김 펴서 잘 입고 다니려구요ㅎㅎㅎ가오리 핏 좋아하고 브이넥 좋아하고 니트 좋아하는데 삼박자 다갖춰서 넘 맘에 들어요!
seongh09**|코디하기 너무 좋아요 자주 애용합니당!!
alwk**|별 기대없이 구입한 블라우스 완전 예뻐요 편하고 여성여성 스럽기까지 해요 다들 예쁘다고 하네요편하게 입고있어요  추천합니다~~^^
tkatnchry**|블랙샀다가 괜찬아서 화이트긴걸로 사보는데 약간 비추는거 빼고는 쫀쫀해서 괜찮아요 잘산것 같아요가을에 입기 딱 좋아요
tjrua0**|색깔 뚜렷해서  이쁜데 생각했던 색깔과 다르게 보라빛이 더  진해서 조금 실망하고 구겨짐도 살짝 심해서 슬펐지만 싼 가격에 예쁜 옷 살 수 있게해주셔서 감사합니다♡
gfj**|요즘따라 베이지 컬러가 좀 마음에 들어서 베이지 색상 자주 사는데 딱 원하던 색은 아니지만 무난하니 잘 입을 것 같아요!ㅎㅎ
gfj**|기본아이템이라 여기저기 잘 입을 수 있을 것 같아요!고고싱 가디건 사랑해요..♡ 전에 비슷한걸로 카키 샀었는데 정말 뽕 뽑을만큼 입었거든요ㅋㅋ 얘도 그럴듯!
gfj**|사이즈 잘 맞네요! 약간 여유있는 핏이 됩니다ㅎㅎ아직은 더워서 밖에 나가보진않았는데 입을 날씨되면 맨날 입을 것 같아요ㅎㅎ
gfj**|이거 블랙도 사려고 들어왔어요ㅎㅎ짱짱하고 흐물거리지않고 각 잡아주고! 깔끔하고!진짜 마음에 들어요ㅠㅠ!! 잘 쓸게용ㅎㅎ
gfj**|좀 꼬깃꼬깃와서 다려입어야 할 것 같지만 깔끔하니 괜찮아요! 기본 아이템들 많이 많이 올려주세요! 항상 애용합니다ㅎㅎ♡
gfj**|깔끔하고 예뻐요~~ 네이비 컬러 많이 입는 편이라 저렴하기도 하고 평도 좋아 고민없이 골라담았네요ㅎㅎ 많이 파세요~!!
