chsj**|수학여행때입을려구샀는데. 너무 이뻐요!!!❣️❣️전 나름만족해용~~~사이즈도 딱맞는거같아요!!고고싱
sosik11**|겨울마다 너무 잘입고 있어요~~! 핏은 체형에맞게 약간 달라붙는 스타일입니당~! 다만 좀 아쉬운건 길이가 짧아서 바지에 넣어서 입기 힘들더라구여ㅠㅠ
hkpl**|조금 두께감이 있을거라고 생각했는데 너무 얇아서 놀랬어요ㅠㅜㅠ 엄청 비치더라구요ㅠㅠ 같이 코디되어있는 조끼도 샀는데 그거랑 같이 안입으면 진짜 다 비칠 것같아요..
hkpl**|생각보다 얇아서 당황했지만 안에 입기는 괜찮을 것같아요.. 단독으러 입기에는 조금...그렇습니다ㅠㅠ 그래도 만족해요!!!
wjjun**|첫 포토리뷰!!!신드롬 스커트랑 사서 방금 입어봤는데 진짜 개존예....!너무 기대했는데 완벽합니다!면도 좋고 진짜 마음에 쏙들어요!적립금 주세용~!~!
wjjun**|진짜 대박존예입니다방금 알바끝나고 집와서 입어보는데 좋네요ㅎㅎㅎㅎㅎ너무 예뻐요ㅠㅠㅠ 저도 이런 치마를 입어볼 수 있다니ㅠㅠㅠ길이감도 괜찮고 블라우스랑 너무 잘어울려요고고싱 핏 최고입니다!!적립금 주세용~!~!
mdok**|이거 너무너무너무너무너무너무너무너무 예뻐요 진짜!!!!! 오자마자 입고나갔었는데 제가 날씬한편이 아닌데도 핏이 진짜 예쁘게 나오고 소매부분이 엄청 예뻐서 여리여리해요!! 진짜 살때는 조금 망설였는데 재질도 좋고 받아보니까 너무 만족합니다ㅠㅠㅠㅠㅠ
mdok**|기본 면티가 필요했는데....ㅠㅠㅠㅠㅠㅠㅠ면티일줄 알았는데 뭐지 흐물흐물하고 비침도있고 꼼꼼히 안보고 사서 배송왔을때 조금 당황했지만 막상 입으니까 너무 편하고 여리여리해보여서 만족합니다ㅎㅎ 다음에는 면티로 다시 사야겠어요
mdok**|기본 맨투맨이 필요해서 검정 프리사이즈로 샀는데 일단 너무 예뻐요 근데 제가 입으면 허벅지 중간?까지 오는 길이라서 약간 원피스느낌이 들어요. 그래도 편안하게 입을 수 있고 나름 그렇게 입어도 괜찮은 것 같아요 잘 입고있습니다. 싼가격에 재질도 좋아서 만족해요
ehehlove12**|옷 너무너무 이뻐요!! 수련회 갈때 입고갔었는데 애들이 다 이쁘다고 어디서 샀냐고 물어봤었어요 ㅎㅎ 색 배치도 너무 잘 되어 있구 언발란스라서 더 유니크 했어요. 팔기장이랑 품도 넉넉해서 저같은 대왕덩치도 편하게 입었어요 ㅋㅋㅋ 진짜 제 인생템.. 너무 이쁩니다 진짜루 ㅠㅠ
ehflrha**|ㅎㅎ진청 필요해서 주문했어요!! 맘에딱들고 핏도 좋아요 언니도 날씬해보인다고 했어요 롤업해서 입으면 귀엽고 내려두 갠찬은거 같아요 착용감도 좋고 신축성 있어요 굿굿!
duswngo**|딱 생각하던대로 퍼져있고 길이도 적당한데 목부분이 너무 많이 파였네요 리본을 묶어도 원? 부분으로 보일것 같아요 그래도 조심히 잘 입으려구요. 사진보다는 보라색 입니다
ff45**|처음에 보고 너무 마음에들어서 베이지랑 블랙 두개 샀는데 저렴한거에 비해 질도 괜찮고 예뻐요~~ 바지안에 넣어입어도 예쁘고 선선한 날씨에 입기 딱 좋은거 같네요ㅎㅎ 소매도 살짝 접어입으면 더괜찮은거 같아요ㅎㅎ 베이지가 화면보다 살짝 진한? 느낌 받았어요!!ㅎㅎ 그래도 예쁩니다~~ 만족해여~~
duswngo**|재질이 다른 양말하고 같진 않지만(부들부들하고 포근하진 않음) 길이도 예쁘고 딱 원하는게 와서 좋네요 잘 신겠습니다.
ff45**|목부분은 좀넓구요!! 엄청 얇아서 안에 속옷 입는게 좋을꺼같아요ㅎㅎ 넉넉해서 입으면 여리여리 한 핏이어서 저는 만족합니다~~ 딱 지금 날씨에 입기 좋은거같아요~~ 파스텔핑큰데 사알짝 연보라? 느낌도 조금있는거 같아요~ 그래도 안이상하고 예뻐요~!!
duswngo**|다른 초커를 안 사봐서 가격대비 어떤지는 잘 모르겠지만 그냥 부직포 얇은거에 십자가 있는거에요. 어떤분은 쇠부분이 빠졌다고 해서 엄청 조심히 다루고 있습니다
duswngo**|꽃이 빨강색이에요 엄마는 일본 목욕가운 같다는데 다른 후기들은 잘 입고다니는것 같아서 우선 반품은 안해보려고요. 생각보다 목부분이 많이 파여있어요 수선도 못하게 생겼네요 허리끈은 위쪽에 있어서 다리 길어보이는것 좋아요. 치마가 엄청 짧은건 아닌데 펑퍼짐해서 바람불면 다 보일것 같고 허리 숙이는것 도 신경쓰일듯 하네요
gch024**|생각보다 셔츠가 좀 짧아서 별 하나 뺏어여..ㅎㅎ이뻐서 샀는데 제가 좀 긴걸좋아해서 어쩔수 없는데 잘입을게용ㅎㅎㅎㅎ
gch024**|전에 고고싱에서 산 청바지가 바래서 새로운 청바지를 사봤는데 전꺼보다 좀더 두껍긴 한데 스판이 있어서 불편하진 않아욯ㅎㅎ
gch024**|기본티로 샀는데 루즈티입니다 편하게 여기저기 입기 좋을 것 같고 바지나 치마나 아무데나 입어도 이뻐용 색깔별로 다사도 좋을것 같아여
awg4**|기본으로 입기 좋은 티 ㅋㅋㅋㅋㅋ슬랙스나 치마,바지 다 어울려요편하게 활용가능할것 같네요 추천 드립니당 ㅋㅋ배송도 빠른편이여ㅛ어요
awg4**|색도 무난한데 사이즈가 좀 커서...길이돜ㅋㅋㅋㄴ바꿀까하다가 수선해서 입을 생각이예요 느낌은 전체적으로 깔끔한듯합니다ㅏ
ekalaa**|기본 초록색 티 사려구 구매했습니다 딱 적당한 브이넥에 색상이 약간은 수술복? 색인거 같지만 괜찮은것같네요 무난하게 코디해서 입기 좋을것같아요
awg4**|색도 화면 그대로고 톤다운된 색이라 가을느낌도 나고사이즈도 맘에 들어요ㅋㅋ고민하신다면 와인 추천~!배송도 괜찮았고~ 좋아요
ekalaa**|제 인생바지가 될것같습니다 s사이즈인데 허리가 조금 넉넉하구요 길이감이 162인 저한테 딱 예쁜 기장이에요!!! 이런 일자바지 정말 예뻐요
awg4**|색상마다 넥모양이 좀 다른듯해요; 검정색은 일반 티같은뎊다른색은 조금 올라와있는?? 그래도 전체적으로 기본스타일로요즘 입기 좋은거 같아요 ㅋㅋ추천
ekalaa**|슬리밍 V넥 슬라브티 카멜색상으로 구입했습니다! 색상이고 디자인 너무 예쁜데 무슨 냄새가 이렇게 심한가요  ㅠㅠㅠ 너무 심해서 바로 빨았습니다 그 점 빼고는 맘에들어요ㅎㅎ
awg4**|사이즈가 걱정이였는데 허리가 살짝 큰거빼고 전체적으로 다 맞는편인거같아요ㅋㅋㅋ 보통 26입음기본이라 어디에도 잘어울릴거같아서 하나쯤 소장해도 무난무난
awg4**|귀엽고 편하고 보이는 그대로 예요ㅋㅋㅋㅋ치마보다는 바지가 잘어울리고~ 색도가을가을~ 배송도 빠르고 괜찮았어요 ㅋㅋㅋ
awg4**|무난하게 입을수 있는 스타일이라 여기저기 활용하기 좋을 듯!사이즈나 색감이나 대체적으로 만족하는 편 입니다기본 스타일 원하시는 분들이 사시면 좋을 거같아요 ㅋㅋㅋ
awg4**|보이는 그대로구요 소매가 긴게 포인트ㅋㅋㅋㅋ지금 계절에 입으면 딱좋을것 같아요편하고 길이감도 만족합니다~! 추천추천
hysung7**|구매 후기가 없어서 살까 말까 고민했었는데 너무 예뻐서 잘샀다고 생각이 드네요!!! 생각보다 더 얇아요. 요즘날씨에 입기 좋을것 같아요. 쫌 더 지나면 못입을 것 같지만... 데일리로 입기에도 좋을 것 같아요~~ 입으면 여리여리해보이고 여자여자해보여서 너무 좋은 것 같아요.매우 만족합니다 자주 입을 것 같아요!!!!!!역시 고고싱 옷은 믿고 사는것 같네요
le44**|단가라티 하나정도 잇음해서 삿는데 다른데 여기저기 봣지만 고고싱이 제일 디자인도 다양하고 질도괜찮은거같아요!!!
whalswn24**|되게 신축성이 좋아요 원단도 얇지않고 겨울까지도 입을 수 있을 것 같아요 그런데 엉덩이 부각이 좀 있는것 같아요 흠...심한것 같기도 하고.... 그래도 옷 자체가 이뻐서 좀 더 추워질때 긴 가디건이나 코트 걸쳐서 입으면 예쁠 것 같아요
hysung7**|박스핏 후드티 하나 장만하려고 샀는데 너무 크지도 않고 딱 적당한것 같아요 너무 편하고 아무때나 입어도 좋을것 같아요!!!! 색도 사진에 나온거랑 비슷한것 같아요 모자크기도 마음에들고 옷 느낌도 좋네요 요즘 날씨도 쌀쌀해서 데일리로 입기 딱 좋은것 같아요~~~~ 자주 입을 것 같아요!!!손이 자주 갈것 같네요 다른색으로 더 사서 입을 것 같아요~~~~
qkrtjddus**|박시해서 마음에 들었습니다 지금 입기에는 덥고 조금 더 서늘해지면 입기 좋을 것 같습니다!! 색상도 사진과 같고요 잘입겠습니다!
qkrtjddus**|다리 움직이는데 불편함이 없고요! 편해요! 색이 생각보다 진하긴한데 만족합니다 ㅎㅎㅎㅎ 신축성 좋고요 잘입겠습니다
qkrtjddus**|사이즈도 넉넉하고요 그냥 데일리하게 입기 좋습니다 돈만 된다면 색상별로 다 사고 싶네요! 색상은 사진과 똑같아요!!!
qkrtjddus**|완전 이뻐요!! 색상도 사진과 똑같고요 그냥 셔츠로 입어도 이쁘고 걸치는 용으로 입어도 이쁩니다 다만 어깨선이 많이 밑에 있어서 팔을 많이쓰시는 분들은 조금 불편할것같아요
qkrtjddus**|사진이랑 똑같아요!! 가디건으로 입기에도 좋고 블라우스 처럼 입어도 잘 어울려요!!!! 색상은 검정색으로 했는데 다음에는 조금 더 밝은 색상으로 살까 생각중입니다
seree24**|와...ㅎ 고고싱에서 처음 산 옷인데...진짜 사지 마세요 쇼핑몰이랑 색이 완전 달라요 뭔가 노란색이 더 강한느낌...? 그리고 무슨 질이 완전 얆아서 비치는 손수건 알아요?? 그 느낌 검은색이 비쳐서 정말 당황했습니다.반품하고싶지만 귀찮아서 걍 입어요..한 사람이라도 더 사지말라고 쓰는 후기입니다사진찍고 다시봐도 어이없다 진짴ㅋㅋㅋㅋㅋㅋ두께 보여요??요즘 시내가서 옷사도 이런재질은 아니겠다 언니가 보고 어디 5천원 주고 샀냐고 물어 볼 정도였어요 와..진짜 고고싱한테 증말 실망했습니다
seree24**|네...괜찮아요...아직 신어보지는 않았지만 정말무난무난해요...!그냥 흰 캔버스에 신을라고 산거에요! 내일 신어볼게요
samyou55**|너무 이쁘고 맘에드는데 조금크네요ㅠㅠㅠ하지만 맘에들어요!!색깔도 어둡지도않고 밝지도않아요!!!맘에들어요~~
samyou55**|클줄알았는데 딱맞구 괜찮아요!!!ㅎㅎㅎ너무이쁘고 맘에 들어요!!ㅋㅋㅋ색깔별로 사고싶어요~~돈만 있으면ㅠㅠ꼭 추천해요!!!
59001512**|154가 입기에는 너무 길어요그런데 긴게 긴것데로 이쁘네요동생이 167인데 입으니 핏이 너무 예쁘더라고요동생한테 옷을 뺏겼어요
zing98**|흰색 구매했는데 정말 무난한 흰 티 네요.. 한번 빨았는데 벌써 목이 늘어나서 좀 그래여..그래도 잘 입고 있습니당 ㅎㅎㅎ
zing98**|진짜 이뻐요 팔 길이도 딱 좋고 길이도 엉덩이 반?정도보다 살짝 더 덮어서 핏도 이쁘고 편하게 입고다닐 수 있을 거 같아요 ㅎㅎ
zing98**|완전 예뻐요 핏도 좋고 처음 입었을때 생각보다 소매가 너무 커서 당황했는데 소매가 커서 더 이쁜거 같아요 바람이 잘통해서 더 추워지면 못입을거 같고 지금이 딱 입기 좋은거 같아요
shel135**|두께감도 적당하고 요즘날씨에 입기 딱 좋은거같아요!! 색감도이쁘고 추천합니당!!~ 핏도 너무 너무 이뻐요~!!!!
annie**|생각했던것보다는 귀걸이가 큰것같아요!! 색깔있는 동그라미는 뺄수도있어서 2가지 방법으로 연출을 할수있어서 좋은것같아요!
annie**|넥라인이 독특한거같아요 그리구 사진으로만 봤을때는 잘 몰랐는데 어깨부분이 주름이잡혀있어서 뭔가 불편한 느낌이지만 성숙해보이고 일단 색깔도 예뻐요! 여성스러워보이는거같아서 좋아요 !
andanh**|지금 입기 좋은 바지입니다~ 코디하기도 무난하고 아무티나 다 잘어울리더라구요. 바지는 항상 고고싱에서 사는데 좋아요!
arl04**|요즘 가을이라 체크가 유행인것 같아서샀는데 배송도 엄청 엄청 빠르고 옷도 생각했던 것 보다 예뻐서 올 가을에 엄청 잘 입고 다닐 수 있을 것 같아요^^앞으로 많이 이용할게요~
andanh**|옷이 얇은거라 안이 비춰요. 근데 너무 예쁜 옷이에요. 치마나 바지나 흰색이라 아무데나 다 잘어울리더라구요! 사길 잘했습니다ㅠㅠ
andanh**|사진이랑 똑같아요 청바지나 스키니에 입으면 예쁠거같아요!! 요즘 날씨 오락가락해서 언제 입을까 고민인데 조만간 입고 나갈생각입니다.
andanh**|마시멜로우 색상 구매했는데 니트라 지금은 입기 좀 그렇고 좀 서늘해지면 입으려고 모셔놨습니다 ㅎㅎ 입으면 여리여리 하니 예쁠거같아요.
kkr70**|세일할 때 사서 저렴한 가격에 잘 샀어요ㅎㅎ 산 것 중에서 가장 쌌는데 가장 맘에 드네요. 가격 대비 퀄리티 좋아용 잘 입고 다닐게요
andanh**|제 키에 엉덩이 덮는 길이고 박시해요. 생각보다 두꺼워서 좀 서늘해지면 입기 딱일거 같습니다. 정말 예쁜 옷인데 뒤에 프린팅이 좀 부담스러워요. 그거 없었다면 진짜 퍼펙트한 옷이었을것 같습니다.
485575386**|무료배송 이벤트 할 때 잘 샀습니당 색깔은 사이트에 있는 것보다 밝았고요, 주름이 잘 지는 소재였어요. 리본은 머리에 묶어도 된다고 나와있지만 그러기에는 긴편이라서 허리에 묶는 게 제일 예쁩니다. 그리고 사진을 찍을 때 예쁘게 나와서 좋았어요 가을 느낌도 나고! 대신 소매 부분이 약간 예쁘지 않고, 단추 부분이 약간 허술하다고 느껴졌습니당 그래서 별점 하나 깎아용ㅎㅎ 그래도 이 가격에 산거면 잘 샀다고 생각합니다 배송은 대략 3일 걸렸던 것 같아요 고고싱 자주 이용하고 있는데 신상은 자꾸 올라오는데 맘에 드는 게 요즘은 없어서 아쉬워용 앞으로도 이런 옷 자주 올려주셨으면 하는 바람이 큽니당 감사해요 잘 입을게여
kkr70**|디자인은 괜찮은데 가방뚜껑이 좀 비뚤하게 달려있고 좀 많이 작아요ㅠ 그래도 무난무난해서 데일리로 잘 매고 다녀요~~~
andanh**|일단 옷은 사진본 그대로고요 소매끝이 커서 손씻을때 좀 많이 불편한데 예쁘니까 괜찮아요~ 바지나 치마에 빼서 입는것보가 껴서 입는게 훨씬 예쁘고 자연스러운것 같습니다.
ftpdreamw**|가격대비 편해요 약간 폼은 큰데 적당한 느낌입니다 근데 빨면 빳빳한 느낌있어요 옷 소재가 살짝....두꺼운...싼 느낌이 단점이죠ㅠ 싼거라 그렇겠지만 소재가 살짝 더 부드러워지면 좋을텐뎁ㅠ
485575386**|8월에 무료배송 이벤트 할 때 옷이랑 같이 주문했어요 컴퓨터에 즐겨찾기하면서 쿠폰도 적용 받아서 싸게 잘 산것 같습니다 단점은 가이드라인 뒤쪽에 그릴 때 아이브로우보다 좁아서 뒤쪽은 그리기 힘들다는 것 정도고, 눈썹타투팩 사서 가이드라인으로 쓰면 좋을 것 같아요 손잡이 있어서 장점은 그거, 단점은 거울이 붙어 있는 게 아니라면 손이 하나가 더 필요해서 무조건 거울이 붙어있는 곳에서 화장을 해야한다는 점입니당 그래도 1000원이면 만족해요 그치만 별은 하나 깎을게요
alsgk7**|원래 집에 있던 청치마가 짧아서 주문했는데 길이도 적당하고 좋네요~~~~~~ 다른 옷들이랑 매치해서 입기에도 좋을거 같아요ㅎㅎ
ftpdreamw**|여리한 긴팔로 완전 괜찮아요 낮에는 이거 입구 저녁이나 아침에 쌀쌀할 때는 가디건 입는데 가을에 입기 딱 좋아요 요즘 이거 항상 입고 다녀요 일할때 블랙 입구 쉴때는 연베이지 입고 다녀요
gustj23**|이거 진짜...대박적이에요 길이도 제가 원하는 정도고 양말긴거랑 같이 입으면 거의 스쉐 좋아요랑 정보좀여 백만개 받을 바지고요ㅋㅋㄱㅋㄱㅋ 색은 살짝 어두워서 뭐랑입어도 웬만하면 어울려요 잘늘어나기도 엄청 잘늘어나서 지이이이인짜 편합니다 허리도 작지도 크지도 않고 딱좋아요 근데 하이웨스트는 아닙니다 저같은 경우는 배꼽에서 4,5센티정도 아래에요 한참 고민했는데 진짜 잘산거같아요 많이 파세요~~❣❣❣
ftpdreamw**|여리한 긴팔로 완전 괜찮아요 낮에는 이거 입구 저녁이나 아침에 쌀쌀할 때는 가디건 입는데 가을에 입기 딱 좋아요 요즘 이거 항상 입고 다녀요
alsgk7**|색깔이 모니터 보단 밝긴하지만 그래도 예쁘고 좋아요~~~~~가을에도 쌀쌀할 때는 입을 수 있을거 같네요ㅎㅎ예쁘게 입겠습니다~
gii70**|진청바지 없어서 구매했는데 허리부분이 인밴딩이라 엄청 편해요 색도 진청이라 날씬해보여서 좋아요 잘입고다닐게요ㅎㅎ
gustj23**|완전 가성비 짱입니다!!! 제가 다른데에 비해 엉덩이,허벅지가 굵은편인데 M으로 샀어요!!(허벅지둘레 52,엉덩이 둘레 98) 잘맞고 모델 사진상으로 허리가 엄청작아 보이고 되게 A라인인줄 알았는데 생각보다 글케 심하진않아요 무난하고 속바지있어서 편해요❣❣고민하고 있다면 사는데 답입니당~~
guswl32**|기대를 정말  많이했는데 기대한만큼 너무너무 좋아요!! 재질도 좋구 품도 커서 딱 제가 원하던 스타일이였어요 ㅎㅎ 다른색도 구입할 생각입니다!!
ji77**|친구 생일선물로 샀어요 이 상품만 입고가 지연됐다길래 다른거 시킨거랑 따로 보내주겠다고 하셨는데 나머지 보내신지 하루만에 바로 보내주셔서 고고싱은 엄청 배송 빨리햐쥬는데 신경을 많이 쓰시는구나 하고 생각했어요:) 디자인도 유니크하고 많이 안보이는 스타일의옷이여서 친구가 좋아할거같아요
sksmsor**|회사에서치마입고싶은데너무딻으먄눈치보여서보자마자길어보이고괜찮길래구매햏어옹네이비로샀고가만색에가까운네이비라더마음에들어오이건진짜고민하지말곳사세요후회안해요항상감사합니다예쁘게잘입을게오~~~~~~
ji77**|보고 너무 예뻐서 바로 사버렸는데 실물도 예뻐여 사진으로는 재질이 되게 두꺼워 보이길래 계절감이 없을까봐 걱정했는데 생각했던것 보다는 얇아서 딱 요즘 날씨에 입기 좋아요 아 그리고 생각보다 더 야해요 같이산 치마랑 입으니까 예쁘네요 앞에는 대충가려지는데 뒤에서는 브라끈이 엄청잘보여서 튜명끈이나 끈없는겅 해야될듯여
tkrka41**|바지는 이쁜데 제가 다리가 짧아서 그런지 다리가 길어보이는 효과는 없는거 같아요그리고 사진상으로는 진청처럼 보여서 샀는데 그냥 중청 색이에요~ 사시는 분들 참고 하세요!
ji77**|안에 뭐 넣어 입을려고 l을 시켰어요 l은 엄청크다는 후기가 많길래 걱정하고 있었는데 허리가 좀 크긴한데 위에 옷 넣어입으묜 적당히 괜찮고 길이도 짧지 않고 적당해서 괜찮았어여 m사이즈 했으몀 더 핏이 예뻣을거 같긴 한데 만족해요 다만 주름이 좀 잘지네요 그래도 9900원에 이정도면 괜찮아여
mooncy05**|이렇게 이쁜 단가라티는 첨보네여~ㅎㅎ핏도 딱이구 베이지랑 같이 산 보람 있네요~ 완벽그자체 자주 입을거 같네요 완죤 대박~!!
scc13**|일단 생각보다 도톰해서 너무 맘에들어용ㅎㅎ 밑단도 너무귀엽고 마음에들어용ㅎㅎㅎ 색깔별로 소장하고싶네요...ㅎㅎㅎㅎㅎ
annie**|아이보리 색깔이라 비치는 것은 어쩔수 없는거같아요 안에 나시같은거 입고 입어야 할거같구요 그래도 쫀쫀해서 몸매라인은 잘 잡아주고 이가격에 좋은거같아요!
scc13**|밑단 돌돌이부분이 너무 이뻐영ㅎㅎㅎ 완전마음에들어용ㅎㅎ 치마에입어도 이뿌고 바지에 입어도 이뻐용ㅎㅎ 생각보다 도톰한거 같아서 만족합니당
scc13**|색깔이 너무이뻐서 샀눈데 막상받으니깐 체크디자인도 너무 이뻐여ㅠㅠㅠ 핵존예ㅎㅎ 더 추워지면 가디건입을껍니당ㅎㅎㅎㅎ빨리 가디건입고 싶네용ㅎㅎㅎ
scc13**|옷 이뻐용ㅎㅎ 근데 단추박음질이 약간 부실해서 엄마한테 부탁해서 해달라고 했어용ㅋㅋㅋㅋ 그래도 옷은 이뿜니당ㅎ 가격대비 최고인듯!!
100066407**|기대하고 구매했는데 정말 기대에 실망시키지 않은 제품 같아요! 입은 거 보고 다른사람들도 색이랑 재질이랑 다 예쁘다고 그러더라구요! 진짜루 살지 안살지 고민되신다면 바로 사시는 걸 추천드리고 싶어요!!!
scc13**|면은 괜찮은거 같아용ㅎㅎ 색깔도 딱 완전 그 베이지구용!! 한번입고나갔다와서 손세탁했더니 길이가 약간줄어든거 같긴한데 그래도 뭐 가격생각하면 이정도는 괜찮다고 생각해용ㅎㅎ 색깔이 진짜 맘에들어용!!!ㅎㅎㅎ
dbswn87**|너무이뻐뇸✉️❤️❤️❤️❤️❤️❤️❤️
dbswn87**|너무 이뻐욤✉️
38627797**|상품 받자마자 색이 너무 이뻐서 바로 입고 언니한테 자랑했어요색도 옷도 굉장히 이뻐용!!!언니가 탐난다구 자꾸 입어보고 싶어할정도?ㅋㅋ 다른색도 구매할생각이옝ㅎ
ally05**|이거 진짜 예쁩니다. 딱 떨어지는 기본핏? 얇은데 입었을때 느낌이 개인적으로 좋더라구요. 그래도 천이 잘 구겨지기는 합니다. 입을때는 한번 다려서 입어야겠어요
ally05**|M으로 사면 너무 딱 붙어서 부담스럽지 않을까해서 L로 샀는데 저한테는 허리가 살짝 크네요. 그래도 길이는 너무 짧지도 않고 마음에 듭니다! 요즘날씨에 입으면 딱 좋을듯해요 천이 얇은쪽에 가깝긴 한데 그렇다고 가을에 입으면 추울정도는 아닐것같아요
aeui03**|생각보다 두툼해서 추운날에 입으면 따뜻할거같아요!색도 이쁘고 간혹가다 까슬까슬해서 따가운니트들도 있는데 이 니트는 전혀 그렇지 않구요 길이는 살짝 짧지만 입는데 크게 불편하지는 않아요~
gpdls80**|배송은 8일날 주문했는데 오늘 11날 왔어요 난방이 많은데도 예약판매하는 남방이길래 후기도 좋은 글 많고 색상도 이쁘고 디자인도 괜찮아서 삿는데 내가 생각하는 그런 남방은 아니였지만 나름 나쁘지 않은거 같아요 지금 입어도 괜찮지만 가을에 입기 적합한거같아요 잘입을게요
dani**|일단 다른거 안보고 편한 바지에 가격이 싸서 산건데 가격 대비 갑인것같아요 정말 편한것도 편한건데 핏도 예뻐서 이 바지에 맛들이면 다른 바지는 잘 안입을것같아요
91649446**|스트라이프.셔츠랑 같이샀는데 너무이쁘지만 제가 키가 작은편인데도  치마가 좀 짧은편이라서 신경을 많이써야되는 옷이네요
aeui03**|사진은 좀 밟게 나왔지만 우선 생각했던것보다 좀 더 어두운 편이고 살짝 비칠정도로 얇아요 그래서 안에 나시를 입어야하구 여름에도 입어도 괜찮을거같다는 생각이 들어요 옷은 이쁘고 사이즈도 잘 맞는거같아요!
91649446**|스키니라해서 너무 딱 달라붙을 줄알았는데 생각보다 스판이 있고 제가 키가 작은 편인데도 살짝 한번민 접어도 될 정도로 길이가 딱좋아요
91649446**|스트라이프 셔츠가없었는데 기본 스트라이프.셔츠에 손목부분이 약간 넓기.퍼져서 여성스럽게보여서 만족합니다!
91649446**|지가 어깨가 넓어서 덩치가 좀 커보이지만 편하고 좋아요!!색깔별로 있었으면 좋겠다는 생각이들오 싼가격에 잘샀습니다
aeui03**|다른 옷들이랑 같이 주문했는데 입고가 늦어져서 늦게 배송받았어요 그런데 기다린 보람이 있는거 같아요 기대했던 것보다 실물이 더 이뻐요 생각보다 살짝 어두운 편이라 요즘같은 가을날씨에 입기에 잘 어울리는거 같아요!
ally05**|깔끔해서 코디하기도 편할것 같고 예뻐요. 박시핏으로 입는거라곤 하지만 저한테는 그래도 좀 큰 감이 있었습니다 저도 사진 찍을때는 그냥 바로 입었는데 소매 걷어입어도 좋을것같아요. 천은 딱 지금 입으면 될 정도로 얇아요
34246577**|흔한 디자인도 아니고 어떤 옷에 매치를 해도 잘 어울리고 예뻐요ㅜㅜ 너무 만족합니다! 다른 색상으로 또 구매하려구요ㅎㅎ 많이 파세용♡♡♡
