chsj**|수학여행때입을려구샀는데. 너무 이뻐요!!!❣️❣️전 나름만족해용~~~사이즈도 딱맞는거같아요!!고고싱
rla09**|좋네용 일단 편해요ㅋㅋㅋ 편하게 밖에 입고다니기 좋을거같아요 두개사길잘한듯ㅎㅎ 이제 자쥬자주 입고다녀야겠어요 잘입을게용~
kimminchae12**|좋아요 다리얇아보이네여
rla09**|레드도 같이샀는데 둘다 사길 잘한거같아요 예뻐요ㅋㅋㅋㅋ 데일리로 입기 짱좋은듯!! 아니면 잠시 어디나갈때입어도 괜찮을듯합니다
rla09**|색 진짜 예쁘네요ㅎㅎ 키가 별로안커서 너무 길까봐 걱정했는데 무릎정도까지오네요 요새 입고다니기 딱좋은듯합니다!!
rla09**|예쁘네용ㅎㅎ 약간 새거라서그런지 특유의 옷냄새가 좀나긴하는데ㅜ 그래도 그거빼고는 괜춘하네요 위에옷이 약간크니까 마르신분들은 참고해야 할듯 합니당
smink10**|검정 치마랑 검정 로퍼에 어울리는 그림없는 무난한 양말 찾다가 발견했는데 사길 정말 잘한거같아요ㅋㅋㅋ 진짜 무난하면서 이쁩니다. 4월달에 한켤레 시범적으로 샀다가 이번에 또 샀어요.
yjk98**|허리도 딱맞고 길이감도 적당하고 좋아요 재질이 보들보들해서 가을옷같아요~~ 색상도 너무이쁘고 다른색도 살까 생각중이에요 너무이쁘네요
rhdwnd**|옷 너무 예뻐요! 모델 착용에서는 무릎을 안덮는데 제 키엔 무릎을 아주 살포시 덮어버려서 수선해 입을까봐요ㅜㅜ free사이즈로 하지말고 키랑 체형 생각해서 S,M,L로 나누는게 훨씬 좋을것같아요 그리고 밑에 트여있는곳이 마감이 안되어있고 다림질만 되어있는데 원래 그런건가요 제 옷이 불량인가요ㅜㅜ 티는 안나서 그냥 입고다니려는데 그래도 구겨지면 티날까봐 이부분도 조금 수정해주세요! 옷이 좀 잘 구겨지는데 싼맛에 이정도야 뭐ㅎㅎ 아무튼 이쁘게 입을게요~
lovedongs**|겨울에입으력느 미리 구매했ㅇㆍㄱ요ㅋㅋ 이벤트해서 특가에 잘 샀습니당ㅋㅋㅋㅋ 감사합ㄴ디ㅐㅇㅋㅋㅋ 잘입을게용ㅋㅋㅋ
lovedongs**|요즘 입기에딱인거같아요ㅋㅋㅋ오늘 입고가야지 앗싸ㄲㅋㅋㅋ 잘입겠습니당ㅋㅋㅋㅋㅋㅋㅋㅋ 감사합니당ㅋㅋㅋㅋ 많이파세요
lovedongs**|예뻐요ㅋㅋ 아직 입기이른거 같아서 타이밍을 보고 있는데ㅋㅋ 환절기에 입기 딱 일것같아요ㅋㅋㅋㅋ 세일이벤틀ㆍㄷ 저렴하게 구매해서 만족합니다
sweetsky**|제가 허리 사이즈가 작아서 시중에 맞는 치마 사이즈가 별로 없어서 거의 밴딩으로 된 것만 입는데 밴딩은 항상 핏이 좀 별로더라구요. 근데 이건 밴딩인데도 핏 너무 예뻐요.ㅠㅠ 지금 입어도 예쁘지만 겨울에 좀 두꺼운 니트랑 입으면 더더 예쁠 것 같아요! 감사합니다. 잘 입을게요~^^
heseo94**|긴 박시티를 사고싶었는데 대체로 검정 흰색밖에없어서,, 막 찾다가 프린팅도 이쁘고 색도 가을이랑 어울려서 구매했는데 실물보니까 더 마음에들어요~~
485575386**|속바지가 안에 들어있어서 좋고 스판도 좋은데 굉장히 짤아요 키가 작은편인데도 짧으니까 저보다 키 크신 분은 매우 불편할거예요 그리고 걷다보면 스판때문에 조금씩 올라가서 내려줘야합니당 가격이 싼편이고 스판이 좋아서 별 3개 드려욤
wl36**|완전 가을색이예요 167인데 기장은 저정도예요 생각보다 길어요 모델분처럼 트렌치 코트랑 입어도 이쁠거 같구요 좀 두꺼운 흰티랑만 입어도 이쁠거 같아요 뭔가 살짝 엉성해보긴 하는데쨍한 빨강도 아니고 딱 가을톤이라서 이쁘네요 좋은 상품 감사합니다
sweetsky**|루즈핏은 잘못 입으면 덩치가 너무 커보이길래 원래 안 좋아하는데 이건 딱 예쁜 루즈핏 같아요.ㅎㅎ두꺼운 편이라 정말 늦가을까지도 따뜻하게 입을 수 있을 것 같아요.스트로베리밀크 색도 사고 싶었는데 일단 모카라떼 사보고 괜찮으면 사려고 보류해놨는데 너무 맘에 들어서 다음에 주문할 땐 스트로베리밀크도 살 거예요! 그만큼 너무 맘에 들어요~ 잘 입을게요!
sweetsky**|저한테 허리가 좀 커서 그런지 모르겠는데 핏이 생각보다 좀 벙벙하더라구요.ㅠ그렇다고 핏이 아주 이상한 건 아니구요!가격 고려했을 땐 괜찮아요.그냥 무난하게 입기 좋을 것 같아요.ㅎ잘 입을게요~~
sweetsky**|기장, 디자인, 색 모두  제가 너무 사고 싶던 원피스랑 딱 맞아서 신상으로 올라왔을 때  바로 고민 안 하고 주문했는데 득템한 것 같아요.ㅎ제가 사진을 잘 못 찍어서 사진에 원피스가 얼마나 예쁜지 잘 못 담아낸 것 같은데 진짜 예뻐요.ㅠㅠ한가지 아쉬운 점?이라고 하면 제가 허리가 얇은 편이라 그런지 모르겠는데 허리에 밴드 부분이 좀 흘러내리더라구요. 그래도 다른 게 다 너무 예쁘고 맘에 들어서 그런 건 1도 신경 안 쓰여요!감사합니다. 잘 입을게요~!
myboa6**|색깔이 너무 맘에 들어요!!사진 속 색깔이랑 똑같아서 넘 좋았어요~편하게 데일리로 많이 입고 다닐려구요~ 이쁘게 입고 다닐께용
myboa6**|도톰해서 역시나 무겁긴 하지만 입으면 진짜 따뜻하게 입을 수 있을 것 같아요~간편하게 입을 가디건이 필요했는데 딱 고고싱에 있어서 구매했어요~
myboa6**|요즘같은 간절기에 딱인 소재인거 같아요요즘 긴팔입기도 반팔입기도 애매했는데 소재가 딱 지금시즌에맞는 거 같아요~ 자주 입을 수 있을 거 같아요
myboa6**|네이비 색깔의 치마가 없어서 보자마자 이건 사야겠다 생각하고바로 구매했어요~ 데일리로 많이 입고 다닐 수 있을 것 같아요
myboa6**|사진에서 봤던 거랑 비슷해서 좋았어요색깔이 생각한거랑 좀 다르긴하지만 이뻐요가을에 많이 사용할 거 같아요~
mom23**|사진추가가 안되네요ㅠㅠㅠ트입이 있어서 포인트 잡아주고 색상도 머스타드라그런지가을분위기 폴폴 나구 여성해서 좋아요잘입을께요!
mom23**|사진이 추가가 안되네요ㅠㅠ정말 여리여리 딱 이뻐요!!!!!성숙미도있구여성여성해서 좋아요ㅎㅎ잘입을께요><
sweetsky**|블랙으로 살지 브라운으로 살지 고민하다가 브라운으로 구매했는데 잘한 결정인 것 같아요.ㅎ길이도 적당하고 색깔도 가을에 딱인 것 같아요.디자인도 특이하고 예뻐요.ㅎㅎ잘 입을게요~!
parissu**|젤리스커트! 처음 보자마자 너무 예뻐서 사려고 찜해놨었는데 너무 인기가 많아서 품절되어 기다렸다가 받은 제품이에요. 플레어 디자인이지만 너무 심하게 퍼지지 않고 딱! 다리가 가냘퍼 보이는 그런 A라인입니다. 색상도 정말 예쁜 브라운이고 블라우스랑 입으면 러블리하게, 또 반팔티나 맨투맨이랑 입으면 캐쥬얼하게도 입을 수 있을 것 같아요. 허리 라인도 예쁘게 잡아주고 가격마저 너무 착해서 역시 고고싱..이라는 말이 나옵니다 ㅜㅜ 가을 원피스도 꼭 여기서 구매할거에요!
sweetsky**|색도 너무 예쁘고 핏도 너무 예뻐요~~가디건이 많아서 살까말까 고민하다가 모델분이 앵두 가디건이랑 롱원피스 입으신 거 보고 너무 예뻐서 결국 따라 샀는데 진짜 만족해요!좀 두꺼운 이너처럼 단추 다 잠구고 치마 안에 넣어서도 입어봤는데 그것도 예쁘더라구요.감사합니다. 잘 입을게요~^^
sunzero**|키작은데 길이는 종아리 중간정도 옵니다 길이감 좋어요! 가을에 입으면 딱 좋을 재질입니다배송도 빨랐고 옷도 예뻤는데  보내실 때  꼼꼼하게 확인하고 보내주세요구멍...참....
tiny**|예뻐요! 베이지색샀는데 약간 카키섞인베이자라 얼굴 좀 하얀편이신분들이 더 잘 어울리실것갘아요! 저는 어깨부분이 좀 어색할까보ㅏ 걱정 고민하면서 샀는데 오히려 저한테는 애매하지 않게 내려와서 예뻤어요! 키크신분들한테 더 핏이 예쁘게 나온것 같습니다~ 구매하셔도 후화 없으실것같아용ㅎㅎ 또 이용할게요~ 가을에 입을 옷이 생겨서 기쁩니당ㅎㅎㅎㅎㅎ
gytjs2**|가격대비 짱짱 좋아요!! 가격이 싸서 재질이 얇고나 안좋을줄 알았는데 배송도 하루만에오고 지금보다는 보름정도있다가 입으면 진짜 이쁠거같아요!!
nahahaha**|사서 오늘 처음 입어봤는데 핏이 굉장히 이뻐요! 밑에 무슨 바지를 입을지 고민중이긴 한데 친구들도 괜찮다고 하네요! 잘 입을게용
wjdqls78**|옷이 많이 커요 근데 핏 진짜 이뻐요 색깔도 이쁘고 ~~ 지금 날씨에 입으면 딱 좋을거 같아요 이쁘게 입고 다닐께요 만족합니다~~
wjdqls78**|각져있어서 공간이 넓어요 그래서 물건 많이 넣을수 있을거 같네여 배송도 빨라서 좋았어요 가방 너무 이뻐여 만족합니다 잘쓸게요!
wjdqls78**|길이가 엄청 길어서 수선했는데 너무 짧아져서 망했어요ㅜ 재질은 부드럽고  핏도 진짜 이뻐요 네이비도 시켰는데 수선 안하고 그냥 입을려고여 너무이뽀용
jekim55**|저한테 클 까봐 걱정했는데 바지 길이도 적당하고 근데 밑에 바지 통이랑 위에 살짝 커서 아쉬워요 제 키가 작아서 그런거니까 그래도 디자인 등 뭐든게 다 만족스러워요  잘 입을게요 ‼️
dnwjddn32**|생각보다 별로에요ㅠ 너무 두께감도 얇고ㅠ....그리고 실밥이 너무 많아요..뜯자마자 냄새가 정말 역하게나고..ㅠ
jekim55**|진짜 길까봐 걱정했는데 딱 좋아요 편하고 !! 사실 여기서 슬렉스는 처음 사지만 앞으로도 더 자주 시야겠어요 너무 이쁘고 길이도 딱 좋고 잘 입을게요!
jekim55**|옷이 정말 예쁜데 카라가 이쁘게 잘 안되네요 그래도 디자인이랑 기장 다 좋아요! 카라만 잘 정리해서 입으면 괜찮을 것 같아요
jekim55**|진짜 검정색 정말 좋아해서 샀는데 생각보다 더 괜찮은 옷!! 더 이쁘게 잘 입을게요 진짜 가볍고 시원하고 안에 입기도 좋고 그냥 너무 좋네요 !
lgh962**|아무데나 입어도 다 잘 어울려요 사진과 실물도 거의가깝고 예뻐요! 그리고 지금 날씨에 딱 알맞는 두끠ㅣ 감이어서 잘 입을 수 있어요!!
jekim55**|구김이 많았지만 정말 예뻐요  ❤️단추 풀때 자꾸 실밥? 같이 걸리는 거 빼고는 입고 벗기 편하고 가볍고 어떤 코디에서든 잘 어울리는 것 같아요
lgh962**|허리는 좀 큰편이지만 그래도 허벅지나 종아리 부분은 딱 맞았어요. 하지만 발목이 살짝 붕뜨는 느낌이 있어서 접어 입는게 더 예쁜것 같아요
dnwjddn32**|키가 큰편인데도 사이즈가 엄청 넉넉해서 괜찮아요~!여리여리 해보이고ㅈ 좋은거같아요! 그치만 사이즈가 좀 많이 넉넉해서ㅠ..스키니에 어울릴꺼같은 느낌이에요!
lgh962**|약간 두꺼운 재질 일 줄 알았는데 굉장히 얇아요. 품이 큰 편이어서 개인적인 취향으로 맘에 들었지만 생각보다 기장이 길어 꼭 넣어 입어야할 것 같아요
haeun05**|다른 허니진도 구매해봤는데 이 바지는 생긴거부터 안들어가게 생기긴 했어요 ㅋㅋㅋ 그만큼 딱달라붙는 스키니고 발목까지 잡아줘서 좋구요 레깅스처럼 쭉쭉 늘어나고 벗으면 원래상태로 돌아와서 좋아요 근데 몸매가 너무 잘 드러나니 약간 부담스럽긴 하네요..
lgh962**|지금 입기에는 두꺼워니 조금 더운 감이 있지만 추워지면 입을 수 있을것같아요. 근데 사진처럼 새햐얗기보다 약간 크림색에 더 가까워요
haeun05**|모델이 입은 핏 그대로 나와서 좋아요! 얇기는 한데 요즘 일교차가 심해서 낮에는 더우니까 지금입기 딱 좋은거같아용 다른색상도 구입해보고싶어용
lgh962**|지금 덥지도 춥지도 않은 지금 날씨에 딱 입기 죻은 두께입니다. 기장도 적절하고 색깔도 사진과 똑같았아요 어디에나 잘 입을 수 있을 것같아요!
lgh962**|허리에 맞게 샀는데 생각보다 통이 좁아서 친구 선물 줬어요! 허벅지가 조금 통통히신분은 역시 m이 적당한것 같고 생각보다 얇ㅇㅏ서 놀랐어요 근데 친구 입은거 보니 예쁩니다
wjdqls78**|흰색 주문했는뎅 소매 길이도 적당하고 핏도 이뻐요 그리고 배송도 빨랐어영 역시 믿고 사는 고고싱 너무 좋아여 만족합니다 ~~
409926662**|오버사이즈 좋아하는 분들에겐 딱인 남방이에요!  넘나 베이직스러운것 넘나 이쁜것 넘나핏 좋은것! 지금같은 계절에 입으면 딱좋아요!!!
409926662**|접어서 입고 싶은데 키 때문에 못접어 입어서 아쉽지만 나름 만족!색깔도 딱 맘에들고 핏도 살아나서 이뻐요!! 강추!  입어보면 절대 후회안할꼬에요
dds43**|색깔이 너무 이뻐요!! 청바지나 까만 바지에 기본으로 입으면 진짜 이쁠 것 같아요. 싼 가격에 사서 기분도 좋고 행복하네요♡♡역시 고고싱입니다!!앞으로도 자주 이용할께요
dds43**|색깔이 너무 이뻐요!! 청바지나 까만 바지에 기본으로 입으면 진짜 이쁠 것 같아요. 싼 가격에 사서 기분도 좋고 행복하네요♡♡역시 고고싱입니다!!앞으로도 자주 이용할께요
409926662**|끈 길이가 길어서 리본으로 묶어도 이쁘고  셔츠나 옷에 레이어드해서 착용해도 이뻐요너무너무 이쁘고 굿굿굿 베리 굿이에요
pes232**|무난하게 들고 다니려고 검정주문!필요한 소지품 넣고 다니기에는 딱 좋은 크기에 가방이예요.굿입니당 맘에들어용
heyjin**|요즘같은 날씨에 제격!저한테는 팔길이도 많이길고 전체적으로는 좀 큰데그래도 넉넉하게입는게 좋아서 만족해요.어디에 매치해도 예쁜 라운드티셔츠! 예쁘게 잘 입을게요~
heyjin**|개인적으로 이런 소프트(?)스러운 소재 너무 좋아하는데 ㅋㅋ진짜 너무 맘에드네요~아침엔 춥고 낮엔 더운 요즘 같은 날씨에 제격인거 같아요~ 여름에 입어도 될듯... ㅎㅎ예쁘게 입을게요ㅎㅎ
heyjin**|고고싱에서 구입한 남방중에 제일 딱 맞는 남방네요ㅎ항상 길거나 크고 그랬는데 제 몸에 잘 맞아요~반말에 위에 입으려고 샀는데 맘에듭니다~
wldwldg**|저는 이 디자인이 마음에 들어서 다른 색상도 구매했어요!가격도 착하고 재질도 탄탄하고 좋아요! 그리고 팔 길이가 짧아서 활동하는데 편해요!
wldwldg**|박스티인데 칠부라서 그런지 날씬해보여요ㅋㅋㅋ디자인도 이쁘고 색상도 맘에 들어요!배송도 빨라서 다음에 다른 색으로도 구매하고 싶어요!!
wldwldg**|벨트를 사려다가 디자인이 깔끔해서 샀어요!다른 색상들도 구매하고 싶어요ㅎㅎㅎ배송도 빠르고 디자인도 심플해서 치마 바지 다 잘어울릴거 같아요~
wldwldg**|무난한 양말 찾다가 구매했어요ㅎㅎㅎ가장 기본색인 블랙 색상 구매했는데배송도 빠르고 좋아요~~다음에는 다른 색도 구매할게요!
wldwldg**|색상도 이쁘고 재질도 탄탄해서 좋아요!그리고 배송도 빨리와서 너무 좋았어요ㅎㅎㅎ저는 이 디자인이 맘에 들어서 다른 색도 구매했어요~`
dbsroffk**|타쇼핑몰에서 아이보리보고 고고싱에서 저렴하게 팔길래 사려고 했는데 품절이여서 브릭으로 구매했습니당 와우 처음에 포장 뜯고 옷을 꺼냈는데 ㅋㅋ 엄청 쭈굴쭈굴 한데다가 색도 강렬해서 촌시럽다는 느낌을 조금 받았습니다,, 그리고 가슴쪽이 좀많이 파여있네요 ,, 잘펴서 나시 받쳐입으면 예쁠거같아요 ㅎㅎ
dltnqls53**|편하게 입을 가디건 필요해서 샀는데 너무 좋은거같아요 지금같은 간절기에 입으면 완전 딱이에요!! 배송도 너무 빨랐구요 ㅎㅎㅎ 추천합니다용
xorud9**|제가 키도 작고 다리도 짧아서 이런 바지 있으면 살지 말지 엄청 고민을 많이 하는 편인데, 자꾸만 눈에 아른거려서 사버렸어요.모델분이 착용한 것처럼 길이가 짧진 않은데, 나름대로 만족합니다.스판도 제가 느끼기에는 굉장히 좋은 편이었구요. 디자인은 너무 마음에 들어요.자주자주 입을 것 같아요.^^
xorud9**|사진으로 볼 때 보다 훨씬 더 여리여리해요.그리고 생각보다 브이넥이 깊게 파져있어요.요즘같은 날씨에 입고 추울 때는 못입을 것 같아요. 딱 가을용임길이감도 적당하고 여리여리한 거 좋아해서 마음에 들어요.
ysolys**|색상이 네개인데 와인색상이 제일 예쁘길래 구매했습니당.. 와 근데 ㅜㅜㅜㅜㅜㅜ 나머지 세개도 사고 싶은 느낌? 화이트랑 블랙이랑 카키.. 재구매 의향있습니다 ㅠㅠㅠㅠㅠㅠㅠㅠ 여러분 가을에 위에 가볍게 입기론 이 티가 제일 적합합니다 구매하세요!.!
ocean12**|이틀전에 시켰는데 어제 배송와서 놀랐어요! 옷도 너무 맘에들고 이뻐요. 핏이 박시해서 체격이 있으신분들도 이쁘게 입으실 수 있을 것 같아요. 소매도 길어서 귀엽게 코디 되는 것 같기도 해요. 살까말까 고민하시는 분들 꼭 사세용❤
106203302**|너무 마음에 들어요 지금 덥긴 하지만 밤에는 추워져서  지금 입기  딱 좋은것 같아요 따뜻하고 핏도  이뻐요  예약배송이라 좀 많이  기다렸어요 그것만 빼면 좋았어요
ljy40**|귀여웠어요ㅋㅋㅋㅋㅋ 카라색이 마음에 안들긴한데 그냥 노란색이 너무 귀여워보여서 샀는데 후회는 안합니다!!그냥저냥 괜찮아요ㅎㅎ
heej1**|이 치마 완전 편해요!!! 키가 큰편인데 짧지도않고 아주 편하게 입고다니고있어요!!! 상의 아무거나입어도 무난무난하게 다 어울려요!!! 스판이라 편하기도하구요!!!!
pyieq**|사이즈표대로 삿더니..좀크긴한데 골반에 걸쳐져서 그냥입고있어서 자기 사이즈대로 사시면될꺼같아요~연청사려다가 그냥 진청삿는데 사진상 색이랑 거의 흡사해서 만족해요!!! 흥해라~~~ㅇㅅㅇ!
ljy40**|사실 디자인은 너무 기대하고 시켰어서 그런지 그저그랬어요ㅠㅠ근데 재질이 뭐랄까 음 엄청 얇아서 잠깐 입다가 못입을 그런 재질이 아니라 10월에도 든든히 입을 수 있을거같은 두ㄲ예요ㅎㅎㅎㅎ
hangaeun09**|뒷밴딩이 조금 크긴 하지만 갠적 검정 골지티나 쫄티랑 입으면 넘 잘 어울려서 좋네요 한동안 치마만 입고 다닐기세.. 밴딩이 없으면 더 예쁠 것 같네요
pyieq**|널널하게 입을수있어서 좋았어요!색특성상 약간의 비침은 있지만 속바지입을꺼라 좋았어욤~딱맞게삿으면 안에 넣어서 못입을뻔했던.쥬륵...
dbsroffk**|베이지에 체크치마 코디가 너무 예뻐서 담았는데 베이지가 품절이라 아이보리로 샀습니당 아이보리,, 덩치 엄청 커보이네여ㅠㅠ 코디대로 치마에 넣어입으니 한마리의 백곰 같네요 ㅎㅎ,, 베이지는 어떤 느낌이였을지 궁금합니다,, 꾸역꾸역 넣어입기보다는 빼서 스키니에 입는것도 괜찮을거같아요 니트 자체는 포근하고 디자인 존예입니당,,
anbb**|보통 26~27로 바지입는데 이 바지는 신축성이 너무 좋아서 M은많이 커요 사이즈 꼭 확인하고사세요!!!!!!!
dbsroffk**|예쁘고 저렴한 체크치마 나와서 바로 장바구니 담았습니당 치마가 어느정도 얇을줄은 알았어서 상관없는데 그래서 그런지 두꺼운 니트를 넣어입으면 ㅠㅠ 자국이라고 해야하나 다드러나네요.. 그리고 뭔가 두꺼운 겨울옷에 얇은 봄가을용 치마를 입은 언밸런스한 느낌도 나는거같고.. 똥배부각도 있어요 ㅎㅎ 솔직히 처음에 반품할까 했는데 얇은티에 입으면 덜해서 그냥 입어요 어째 장점보다 단점이 많은거같은데 이 가격에 잘샀다고 생각하고 디자인도 생각한대로 이쁘긴 이뻐요..ㅎㅎ
leejh67**|진짜 이뻐용! 다른데서 삼만원 넘는거 보고도 사야겠다 했는데 고고싱에서 만원대에 업댓된거보고 바로질렀는데 아 삼만원짜리살껄 이라는 생각안들게 정말 이뻐용!! 허리도 딱 잡아주고 기장도 딱좋아용
guswls7**|베이지로 샀는게 거의 아이보리 색이구생각보다 두꺼웠어요! 날씨 더 추워지면 따뜻하게입을 수 있을 것 같고 팔도 길고 길이는 엉덩이 거의 덮었어요주머니도 깊이가 깊진 않지만 작게 있어요!!잘 입겠습니다 많이 파세요~!
guswls7**|면 100퍼센트인데 생각했던 재질이 아니라서조금 당황했어요 비닐같은 느낌이 약간 났는데이상하진 않구 스판도 약간 있어서 좋았어요안에 바지라서 편하게 입을 수 있을 것 같고 길이도 키 162에 허벅지 중간 조금 안되게 와서너무 짧지 않아서  좋았어요!!
dbal11**|신축성 너무좋고 브릭레드사고 화이트도 삿는데 둘다 너무좋앗어요! 화이트라 비침은 당연히 있고 데일리로 입을려고 산거기때문에 무난무난하게 좋아요!ㅎㅎ
dbal11**|너무 이뻐서 샀는데 너무 펑퍼짐 하더라구요 입어보니..조끼를 같이 입어야 이쁜 원피스같아요! 가디건이라던지 그냥 입기엔..너무 뚱뚱해보엿어요 ㅜㅜ 그래도 니트조끼랑 입으면 정말 이쁜 원피스고 팔길이도 저한텐 딱 맞앚구요 좀 얇지않은 원피스라 지금 계절에 입기 딱 좋아요 !
dbal11**|질감은 쫌 뻣뻣한대 너무이뻐요 ㅜㅜㅜ지금날씨에 입기 딱 좋구요색상은 사진이랑 색이같고 길이도 저한텐 좋앗어요 ! ㅎㅎ요런 남방엔 여러개 코디할슈있오소 참 좋은거같아요!
ksy50**|진짜 배송 24시간도안걸렸는 것 같구욤,,이뻐요!! 오늘같은 날씨에 입기엔 더운감이있으나 저녁되면 딱 적당하궁넘 만족합니다
tlqkfdjfak**|짱짱 편한데 흰색은 아무래도 좀 얇아요ㅠㅠ 천은 맨들맨들하고 좋은데 얇은게 함정.. 제 개인적으로는 검은색이 흰색보단 활용도가 좋은 것 같아요!
42643170**|손이가요 손이가~데일리의 끝! 최고로 애장하는 벨트가 되었어요 치마던 바지던 간에 다 어울려요! 고급스러운 느낌은 없지만 저렴한티 안나고 짱짱해요거기다가 저렴하기 까지 .. 고고싱은 역시 체고bb
tlqkfdjfak**|오... 생각 없이 주문한건데 좋아요진짜. 길이 딱 적당하구 소재가 진짜 좋아요! 맨들맨들.. 이거 사고싶어서 옷을 고르고 있네요ㅋㅋㅋㅋ 이제 다른곳에서는 못살것같아요. 다음 주문할때 여러개 쟁여두려구요! 스판끼 낭낭해서 사이즈 구애 없이 입으실 수 있을것같아요.
42643170**|저는 키가 그렇게 크지도 않은데 너무 짧아서 불편해요. 짧은치마 즐겨입기는 한데 아무리 속바지가 있어도 짧아서 엉덩이가 보이더라구요 ㅠㅠ 치마가 몸에 촥! 붙게 나와서 엠을 샀어도 될거같아요 . 짧아서 한치수 큰게 좋았을듯!! 치마 자체는 스판이 좋고 핏도 예뻐요 저는 단독으로는 절대 못입겠고 (처음 입었을때 집으로 돌아가서 갈아입음 ㅠ) 자켓이나 가디건 입고 입기는 괜찮네요 제 엉덩이가 오리귱뎅이여서 그런것도 있지 않을가 싶어요. 짧은거 감안해서 구매 하세요 :-)
dlatmfrl58**|평소에 민트색 좋아해서 민트로 샀는데 이뻐요ㅠㅠ 기장감은 길지도 않고 짧지도 않은 거 같아요 .. ! 요즘 일교차가 커서 아침이나 밤에 입기 좋을거같아요 ㅎㅎ
dlatmfrl58**|그냥 딱 기본 티에요 ! 좀 루즈한 핏 원했는데 루즈하지는 않아요ㅠㅠ 제가 살이쪄서 그런거 같기도 하고 ㅎ.. 여기저기 받쳐입기 조아용
dlatmfrl58**|여리여리해보이고 이뻐요 ~~ 하얀색이라 비침 있을 줄 알았는데 생각보다 많이 없어요 ㅎㅎ 같이 온 끈은 목에 묶으라고 주신거 같은데 해도 이쁘고 안해도 이뻐요 !
dlatmfrl58**|학교 다니면서 편하게 들고 다니려고 샀는데 생각보다 좀 작아요ㅜㅜ 그리고 안에 주머니가 따로 없는게 불편합니당 ... ㅠ
yyee**|생각보다 얇고 소매길이도 길었는데 촉감이 부드럽고 여리여리해보여서 좋았어요! 핑크 색감도 이쁘게 잘 나왔구 앞으로 잘 입을거같아요ㅎㅎㅎ
rpm10**|바지는 완전 맘에드는데 몸이 맘에 안드네요 ㅎㅎ 완전 이뻐요 처음 받았을때는 이게 라지? 의아했는데 입어보니까 스판이 짱짱해서 들어가서 놀랐어요완전 강추에요 역시 고고싱
