chsj**|수학여행때입을려구샀는데. 너무 이뻐요!!!❣️❣️전 나름만족해용~~~사이즈도 딱맞는거같아요!!고고싱
wldud04**|생각했던거 보다 짧고 스판끼가 전혀 없는 면이라 당황했지만 딱 잡아주는 느낌은 있어요 근ㄷ 입다보면 속바지가 계ㅗㄱ 말려올라가서 좀 아쉬워요ㅠ
wldud04**|옴청 얇고 찰랑거리는 재질은 아니에요 가을에 입기 좋은거 같아요 치마나 청바지에도 입으면 포인트가 되는거 같아 이뻐여 단추가 진주인것도 맘에 들어요
jhl0207**|배송역시너무빨라서정말좋았어요 다만엉덩이는딱맞는데허리가너무커서핏이별로안이쁘더라구요 벨트를해야만할거같네여 그래도이가격엔혜자라너무좋네요 키가큰데도많이짧지않아서좋아요 감사합니다
wldud04**|소매트임이 포인트가 되서 이뻐요 소재도 요즘날씨에 입기 딱 좋은거 같아요 치마나 바지에 넣어입으면 핏이 이뻐서 자주입게 되네요^^
jieun98**|생각했던것보다 옷 색상이나 재질이 너무 좋아서 잘산것같아요~~~고고싱에서 옷 산적이 처음이라 걱정했는데 다행인것같아요~~다음에도 또 사야겠어용!!!
syyi**|배송도 완전 칼같이오고 매우만족해요! 이런가격에 이런퀄리티까지... 완전감동이에요 ㅠㅠ 롱패딩중에서 이렇게 저렴한가격도 찾기 어려웠고 또 전키가작아서 저한테 맞는 롱패딩두 찾기 힘들었는데 고고싱 롱패딩은 모든면에서 저와딱맞게 갖춘듯해요! 질도좋고 요즘 날씨 쌀쌀한데도 입자마자 더웠네요 그만큼 보온성도 짱인듯해요 ㅎㅎ 남자친구랑 같이샀는데 겨울에 많이 입고다닐께용
sys9508**|살까말까 고민했는데 사길 잘했어요ㅠㅠ 색도 연한 베이지라 이쁘고 길이도 딱이에요 ! 맘에드네용:) 잘입고다닐꺼같아요~~
sys9508**|요즘 치마바지가 편해서 잘 사는데 이번에도 성공했네요 아이보리색 샀는데 안에 바지가 있어서 비춤도 없고 바지덕분에 편하게 입네용
selina09**|좀 박시하기만 하고 다 괜찮은거같아요.이건 꼭 사야될거같습니다. 사서 예쁘게 코디하면 정말 잘어울릴거같아요. 완벽해요.
selina09**|화이틀를 샀는데 좀 많이 펑펑짐 하더라고요. 근데 디자인은 마음에 들었어요. 사시는걸 추천하지만  사이즈가 안맞을수도있으니 잘 선택하는것을 추천해요.
selina09**|검정을 샀는데 사진으로 보는것과 같은 비주얼이지만. 더 옷이 얇아요. 의왜로 얇은것을보고 추울수도 있다는 생각도 했어요. 근데 옷은 얇은것 빼고 다괜찮은거같아요.
selina09**|핏이 좋구요. 길이도 적당해요. 저만 그런지 몰라도 옷에서 않좋은 냄새가 나더라고요. 그거 빼고는 다 괜찮은거같아요. 배송도 빨라요. 꼭사시는걸 추천해요.
selina09**|색도이쁘고 길이도 적당해서 좋아요.사진은 없지만 모델이 입은신 핏그데로 입으니 이뻤어요.꼭 사시는게 좋을거같아요. 한번 쯤은 입는걸 추천해요.꼭 사시는게 정말 좋을거같아요.
yeryn3**|배송은 아주아주 빨랐어요!!색은 와인이랑 버건디 섞어논 딱 이쁜 색!! 색깔 너무 잘뽑았네욤 두께감도 적당해서 지금 입으면 딱 좋을거같아요 같이산 검정 스커트랑 입으면 딱 좋아요! 길이는 엉덩이 중간정도 되요 근데 팔이 좀 짧은감이 없지않아 있달까 제가 팔이 길어서..하하 그래도 괜찮아요! 어깨도 딱 맞곻ㅎ
kyj07**|완전 예뻐요 색도 이쁘고 핏도 이쁘고 딱 좋아요색이 진짜 잘 빠진거 같아서 너무 마음에 들고 사이즈는 다리는 맞는데 허리가 좀 작아서 살 좀 뺴고 입을려구요마음에 듭니당
kyj07**|우선 옷이 예뻐요조금만 더 박시했으면 딱 예쁠거같은데 그래도 완전 박시는 아니지만 어느정도 루즈핏으로 예뻐요색은 딸기우유색에서 톤다운된 색이고 오히려 더 예쁜데 질이 좀 아쉬워요ㅠㅠ 좀 까끄러운? ㅠㅠㅠ그치만 잘 입고다닙니당 예뻐요!!
kyj07**|색이 생각보다 진했지만 오히려 더 이쁘고 좋아요!가을,겨울에 신으면 딱 예쁜색이고 생각보다 너무 에뻐요잘 늘어나지도 아니지도 않은 딱 괜팒은 중간 늘어남이고 좋아용
yeryn3**|배송 정말 좋아요..하지만 저의 사이즈 미스.. 고고싱 직원분 후기 보고 나랑 사이즈 똑같은 분 있어서 그 분 믿고 L사이즈 샀는데!! 커요ㅠㅠ 허리가 주먹 하나는 들어가더라구요..길이도 제가 생각했던거보다 살짝 길었어요ㅠㅠ 근데 편하긴 편하더라구욤 여기에 벨트하고 다니거나 줄일려구용 안에 바지 달려있어서 활동하기에도 편해요 따로 속바지 안입어도되요!
seonwoo27**|재질이 빳빳하다길래 나갈때도 입을수 있겠다 싶어서 구매했는데 리본때문인가 생각보다 잠옷같네요ㅜㅠㅠㅠㅠㅠ 그래도 뭐 자주 입을려고 했는데 어머니가 탐내시는 것 같아서 어머니 드렸습니다ㅋㅋㅋㅋㅋ 저희 엄마는 되게 맘에 들어하시더라고요. 저도 가끔 입겠지만 저희 어머니가 애용하실 것 같아요. 사진은 제 사진입니다. 감사합니다 고고싱~
anatta**|3주 만에 받아서 별 하나 뺍니다일단 옷은 정말 예뻐요. 그런데 단춧구멍에 비해 단추가 작아서 맨 윗 단추가 자꾸 빠지네요...ㅠ
yeryn3**|배송 진짜 빨라요..그저께 밤에 입금했는데 다음날 바로 출고되서 오늘 땋.. 역시 고고싱 배송 너무 맘에 들어요제가 저번에 다른 쇼핑몰에서 단가라티 샀다가 실패해서 잠옷이 된 단가라가 있어서!! 다시 한번 단가라를 사봐야지 하고 샀는데 이건 어깨도 별로 안넓어보이고 핏도 너무 예뻐욤 길이가 살짝만 짧으면 좋을거가타용 너무 이쁩니다♥ 제가 키가 큰편인데도 길이감 길어서 좋아요 믿고 사는 고고싱 사랑해여♥
dhwogml**|별 기대 없이 구매했는데보니까 이뻐서 놀랐어요 ㅎㅎ핏도 줄무늬인데 어깨 넓어보이지 않구박시하긴한데 여리여리 해보여요 !색도 화면이랑 똑같아요 !!!
syyi**|실수로 모델분 키를 안보고사서 키작은 저한텐 매우 길더라구요.. 그래서 수선을 엄청 많이했다는..ㅠㅠㅠㅠ 그래도 핏도좋고 이번에 연주때 정장으로 입었는데 매우 좋고 통도 넓어서 편하규 좋았습니당ㅎㅎ 전신사진을 안찍어서 없네요 ㅠㅠ
dhwogml**|별 기대없이 구매했는데,택배 오자마자 입어봤는데 너무 이뻐서 놀랐네요 ㅠㅠ인생템 됬어요 ㅎㅎ 자주 입고 다니구요 !핏도 박시하기는 한데 적당하고 여리여리해요 !색감도 화면이랑 똑같이 이뻐요 !
seonwoo27**|그냥 기본티 하나 갖고 싶어서 구매했는데 나쁘지 않습니다. 팔소매가 약간 길어서 예쁘게 딱 떨어지네요. 근데 목 넣는 구멍이 되게 작아서 머리 넣을때 늘어날까봐 되게 조마조마 해요. 아래 입은 치마도 고고싱 상품입니다ㅎㅎㅎ 청치마랑 어울릴 것 같은데 같이 살 걸 그랬어요.
dhwogml**|가격도 저렴한데 핏도 이쁘고 ㅠㅠ질도 튼튼하고 좋아요 ! 그리고색감도 이쁘네요 ㅠㅠ치마 길이도 짧지않고 적당하구요 !왜 인기 많은지 알겠네요 ㅎㅎ
leejiso**|여기는 항상 배송이 빠르네요 목요일 입금하고 토요일에 받았습니다 그런데 실밥이랑 구겨짐이 심한 상태로 왔어요ㅜ 옷은 이쁘네요 마음에 듭니당
seonwoo27**|롱패딩 이 가격이면 꼭 사야하는거 아닙니까?!!!! F살지 L살지 일주일동안 고민하다가 결국 L로 했습니다. 길이는 만족하는데 역시 품이 많이 남네요ㅠㅠㅠㅠ 그래도 F샀으면 길이가 짧아서 아쉬웠을 테니까 그냥 이대로 입겠어욧! 저 주머니를 다 쓸지는 모르겠지만 주머니가 많아서 좋고, 겉부분이 질겨서 긁혀도 잘 안찢어질 것 같아요ㅎㅎ 손목 부분도 짱짱하게 조여서 좋네요. 단점은 이번 겨울에 입다보면 알겠지요. 싸게 롱패딩 하나 건져갑니다. 고고싱 감사해요~
dhwogml**|돈이 별로 없어서 안살려고 했는데 ,너무 이뻐서 충동해버렸네요 .., ㅎ택배 오자마자 입어봤는데화면이랑 똑같이 색감도 이쁘고핏도 이뻐요 ㅎㅎㅎ여리여리 하구여 !!
wldms40**|길이는 엉덩이를 덮진 않습니다 일반적인 평범한 니트에요 간절기에 이것만 입어도 이쁘겠네요 가격대비 질도 괜찮습니다 추천해요
wldms40**|창고방출?할 때 사서 크게 불만이 없어요..하하 일단 길이는 종아리가 보이는 길이였고 색상은 말그대도 어두운 핑크입니다 겉이 보들보들해서 감촉도 좋네요 잘 입을게요!
wldms40**|구매한지 하루만에 받았습니다 배송은 여태껏 늦은 적이 없어서 굉장히 만족해요 일단 가디건 블랙색상과 브라운색상을 샀는데 전체 길이감은 엉덩이 사알짝 덮는 길이고 소매가 어엄청 길어서 깜짝 놀랐지만ㅋㅋ접어 입거나 하면 되니 괜찮습니다 얇지않고 쌀쌀해지는 날씨에 입으면 딱이겠어요 잘 입을게요!
wlguswlgus**|역시 천국바지!! 바지는 항상 여기서 사는 고 같아요 ㅎㅎㅎㅎㅎㅎㅎㅎㅎㅎㅎ~~~~~~~~~~~~~<<<<<<<<
wlguswlgus**|좋아요 ~~~~~~두번째 구매!!!!!!!!!!!!!!!!!!!!~~~~~~~~~~~~~~~~~~
ghk18**|생각한것보다 크기가 컷어요 노트북들고다닐려구산건데 넉넉하니좋네요 하지만 끈이 생각보다 튼튼하지않앗여요 그래도 디자인은 너무 마음에 드네요
chloe0**|원래는 26사이즈 입는데 최근에 살이 찌는 바람에ㅠㅠ 고민하다가 27사이즈로 샀는데 스판끼가 좋아서 26사이즈를 골랐어도 괜찮았을꺼 같아요!!27사이즈는 살짝 허리가 남는 정도..?ㅠ 근데 진짜 짱짱 편해요!!!!색감도 진짜 너무 이쁘고 제 바지 중에 제일 애정하는 바지가 되었답니다ㅎㅅㅎ연청색인데 뭔가 흔하지않은 색깔..?!이여서 오묘한 색감이 매력적이에요! 고민하시는 분들은 무조건 꼭 사세용~!
chloe0**|이건 진짜 꼭 사세요 다들!!! 두께감도 생각보다 살짝 있어서 단독으로 입어도 요즘날씨에 딱 적당하고제 키가 작은 편이 아닌데 길이감도 적당해요! 절대 짧지 않고 딱 반바지 입었을 때 저만큼 와요!^0^그리너리 색상은 후기가 많이 없어서 조금 걱정했었는데 진짜 걱정할 필요 없었어요..색감 진짜 이쁘고 코디하기 막 엄청 어렵지는 않은 것 같아요!!전 돈을 모아서 다른 색도 꼭 사려고 합니당ㅎㅅㅎ디자인 엄청 이뻐요!! 매우추천입니다!
74772346**|오늘 배송이 왔는데 진짜 너무 예뻐요 빨리 겨울이 와서 입고 싶고 진짜 만족스럽습니다 포장도 잘 돼 있고 고고싱 배송 굉장히 빨라서 매우 만족하고요. 키가 작아서 좀 클 것 같지만은 그래도 넘 예쁘니까 됐습니다 !!  산 거 너무 만족해요
tndudtnud**|예뻐요!!! ㅎㅎ처음에는 안어울릴까봐 걱정햇는데 입어보니까 확실히 달라요 말라보이고 ㅎㅎ사길 잘햇어용 ㅎㅎㅎㅎ
ran15**|옷 재질도 맘에 들고 완전 강추입니다 ᆢ색깔별로 와인 베이지 네이비 세개 구매요청 ᆢ울애들이랑 같이 입네요 ㅎ 너무 이쁨니다
gksmf46**|길이도 딱이구 디자인도 너무 맘에들어요!!!! 배송도빠르게와서 입구 부산여행갔는데 만족했습니당!! 감사합니당!!
rkgud2**|인기가 많아서 그런가 배송이 지연됐지만 잘 받을 수 있엇어용!! 옷은 예뻐요길에서 저랑 똑같은 옷입은 사람 발견할 만큼 많이 사나봐용ㅎㅎㅎ
rms01**|옷 너무 좋아여ㅋㅋㅋㅋ 재질도 좋고 핏도 이쁘고ㅋㅋㅋㅋㅋ멜빵끈을 조절할 수 있어서 너무 편하더라구요ㅋㅋㅋㅋㅋ옷입어보고 초딩이 된 것 같아서 너무 웃기더라구요ㅋㅋㅋㅋㅋㅋㅋㅋ옷 진짜 너무 이뻐요ㅋㅋㅋㅋ 진심 핏 대박!!!!!!! 옷 짱 이쁨!!!!!!!
hongsuji**|재입고까지 된다는 문구는 있었는데 후기가 하나도 없어서 걱정을 많이 했었어요ㅠ 근데 이게 왠일인가요퓨ㅠ 너무 이뻐요 치마!! 핏도 딱 떨어지고 정말 엄청 이뻐요!! 강츄입니다!!!!
chloe0**|예전부터 항공점퍼 갖고싶어서 찜해두고 있다가 이제서야 사게 된 항공점퍼ㅠㅠ!!!검은색 반바지랑 니트입고서 그 위에 입어봤는데 길이감이 딱 적당해서 너무 좋았어요:-)긴바지랑 입어도 이쁠것 같고 이것도 핏이 워후..☆★ 완전 맘에 들어요! 검은색이 진짜 무난하게 이쁜것 같아욧
circle20**|너무 이뻐요ㅠㅠㅠ 길이도 적당하고 배송도 빠른편이였어요!! 다른색도 구매할까 생각중이에요~ 고고싱옷은 항상 좋은듯
aliceson**|학교 다니면서 쓰려구 샀는데 전공책, 노트북, 파우치 별의별 거 다 넣어도 자리가 남을 만큼 커요!! 어떤 옷이랑 매칭해도 잘 어울리고 좋아요!! 실용적이게 잘 쓸게요!!
circle20**|생각했던 대로 진짜 이뻐요!!!꼭 사세요. 벨트랑 분리 되지는 않지만 그래도 이쁘니까 좋아요 ㅋㅋㅋㅋㅋ 길이도 딱 좋네요.
dhwogml**|보자마자 너무 이뻐서 질러버렸네요 ㅠㅠ배송오자마자 뜯어서 입어봤는데 ,역시 너무 이뻐요 ㅠㅠ핏도 여리여리 해보이고질도 괜찮아요 !심플해서 데일리로 괜찮을거같구요 !!
dhwogml**|보자마자 너무 이뻐서 구매했는데구매하길 잘했네오 ㅎㅎㅎ핏도 괜찮구 색감도 이뻐요 !화면이랑 똑같아요 !심플해서 아무때나 입기도 좋을것같구요 ㅎㅎ
dhwogml**|다른분들은 어깨 넓어보이신다는데 ,그래서 고민을 많이 했다가 질렀는데 ,박시하기는한데 저는 괜찮았어요 !! 질은 두툼해서 좋았구요 ㅎㅎ가격도 이정도면 저렴하다고 생각되네요 ㅎㅎ
won35**|진짜 입고 될때까지 기다리다 바로 샀어욯ㅎ 오자마자 입었는데 너무 이쁘고요 정날 후회 안하십니다 친구들이랑 수능 끝나고 놀러 갈 때 입으려고요 너무 사랑해요 고고싱ㅠㅠ♡
tpqls7**|진짜 옷이 너무 이뻐요ㅜㅜㅜ.치마 잘 안입는데 이런 치마 사고싶어서 구매했는데.이건 진짜 꼭 사야되요!강력추천!여태까지 옷 산거 인생이라고 붙힐만한거 없었는데.이건 인생치마에요!9,900원인데 이정도 퀄리티 고고싱 사랑합니다♥♥벨트도 같이 구매했는데. 혹시 고고싱 신이세요ㅜㅜ?진짜 완전 짱!!다리도 길어보이고 짱 좋아요!!♥♥
agnes09**|친구 생일 선물로 줬는데 진짜 잘 하고 다녀요! 평소에 다른 것들로 자주 바꿔 끼고 다녔는데 최근에는 이것만 하고 다니네요. 기분이 좋습니다
108629618**|옷은 진짜 이쁜데...사이즈가 ㅜㅜ..분명 프리인데 프리가 아닌 느낌...마른분만 시켜야할거 같아요...ㅜㅜㅜ
agnes09**|친구 생일선물로 줬는데 잘 신고 다니고 있어요! 친구가 좋아하더라구요 핑크핑크한게 사진이랑 똑같아서 더욱 신뢰되는 고고싱입니다!!
dhwogml**|기대없이 구매했는데 너무 이뻐요 !!핏도 여리여리 해보이구요 !!옷 넣어서 입어도 괜찮고 ,빼고 입어도 괜찮아요 !!색깔별로 갖고 싶네요 ㅠㅠ
agnes09**|친구 선물로 줬는데 아주 잘 입고 있다고 하네요! 솔직히 받았을 때 그냥 내가 가질까 하고 생각할 만큼ㅜㅜ 이쁘다네요.. 고고싱 감사합니다!
dhwogml**|드디어 옷 왔네요 ㅠㅠ제가 구매할려고 할때마다 품절이여서 ..,그래도 이쁘니까 계속 기다렸네요 ㅎㅎ입어보니까 핏도 괜찮구 색감도 이쁘네요 ㅎㅎ기다린 보람 있어요 ㅎㅎ
won35**|제가 처음으로 고고싱에서 치마를 샀는데 뭣도 모르고 s를 사서ㅠㅠ 좀 작네여ㅠㅠㅠ 그래서 교환하려구요 근데 진짜 이뻤어요 다리도 길어보이고 고고싱 더 자주 애용하겠습니다..!!!
chloe0**|박시하고 무난한 회색 후드티를 사고 싶어서 찾던 와중에 가격도 다른곳에 비해서 저렴하고 핏도 딱 제가 원하는 핏일 것 같아서 구매했어요!!진짜 받자마자 같이 주문한 바지랑 입어봤는데 퀄리티도 너무 좋고 핏이 짱 예뻐요!!♥ 교복에도 입어봤었는데 진짜 완전 만족스러워요!!!돈생기면 다른 색깔도 주문하려고 합니다ㅎㅎ:-) 박시한 후드티 사고 싶은 분들 꼭꼭꼭 사세요!!
392877456**|브라운 색상 샀는데 너무 예버서 검정색도 샀습니다! 딱 날씬해 보이게 해주고 허벅지 두꺼운 것도 쏙 가려줘서 너무 좋네요ㅋㅋ
392877456**|너무 예뻐요.. 고고싱 옷들이 다 제 취향인데 그 중에서도 블라우스가 너무 예쁩니다.. 앞으로 블라우스 더 많이 올려 주세요ㅠㅠ
owoo**|자주이용하눙데 후기처음남겨요!너무길지않을까 걱정했는데 멜빵으로 길이조절도 되구우너무이쁘고 편해오(●__●)
gust**|키 작은 저에게 소매길이도 딱 맞고 기장도 적당했어요!여성스럽기도 하고리본카라가 달려 있어서 더더욱 귀여운 거 같아여ㅠㅠ! 어떤 코디에도 다 어울려서 자주 입을 것 같아요배송도 빠르고! 역시 믿고 이용하는 고고싱 입니다ㅎㅎ
kim40**|사실 저는 좀 불안했거든요 파는 사진이랑 실물이랑 색이좀 다를까봐요...ㅎㅎ 근데 전혀 다르지않고 똑같아요 근데 팔길이가 너무 딱맞아서 앞으로나란히만해도 좀 짧은느낌이드네요ㅠ
kim40**|색상도 딱 사진그대로이고 실물 너무이뻐요♡♡제가 사실 핑크는 잘안받는 편인데 이거는 너무 이쁘더라구요 어제 입금했는데 오늘 와서 너무 좋았어요
lld50**|너무너무너무 예뻐요 생각하던 치마 그대로에요 !! 속치마만 잘 내려서 입으면 짧지도 않아서 좋습니다배송도 한 이틀만에 된거같아요
boo**|지금 제가 s 샀는데 좀 아쉬워요, 다행히 입지 못하는 정도는 아니지만 허리가 약간 당깁니다 사이즈가 작네요 입어보니까 핏은 예쁘긴 한데, 좀 딱 떨어져요 스키니에 좀 더 가까운 핏이 나옵니다저랑 사이즈가 같으신 분들은 m 사이즈 사시는게 좀 더 넉넉한 일자핏이 나올거라고 생각해요
boo**|입었는데 세상 너무 이뻐요 옷이 사실 봄에 이 가디건 나왔을 때 색상이 스트로베리랑 화이트 두가지 뿐이여서 참 아쉬웠는데 ㅠㅠㅠ 이렇게 색상이 다양하게 나오니 너무 좋습니당단추+주머니+여리한 핏 완벽해요
boo**|제가 이 바지 살 때 사이즈가 참 애매했어요 딱 사진 모델분처럼 딱 달라붙지 않고 일자로 떨어지되 너무 통 크지도 않은 적당한 핏을 원했어서 s를 살까 m을 살까 많이 고민했던 거 같아요결론적으로 저랑 사이즈 같으신 분들은 s사시면 모델분처럼 핏이 이쁘게 나와요 다만 바지 기장이 조금 기니 접어 입어주시면 이쁘겠네요
boo**|배색이 무난하고 캐주얼하니 이뻐요 오후수업 밖에 없는 날은 이 후드티를 대충 걸치고 나가면 완---벽 그 자체편하단 얘기입니다
boo**|치마가 너무 이뻐요!! 사진 그대로이고 위에 니트도 똑같은 걸로 사서 입었는데 넘나 가을 분위기 납니다 입고 밖에 나가고 싶은데 요즘 날씨가 다시 따뜻해져서 못 나갔는데 다음주는 좀 추워지길 기대해봅니다..(간절)
guswjd31**|색이 진짜 너무너무 예쁘고 막 그렇게 흔한 니트 색도 아니여서 좋아요! 길이가 조금 짧은 감은 있지만 두꼐도 가격대에 비해 도톰하고 밑단 트임이 너무 예뻐용!!!!!!!!!!!!!!
10457177**|색깔 고민 진짜 많이 했는데 핑크 사길 잘했어요품이 좀만 작았음 더 예뻣을거 같아요저한테도 크네요ㅋㅋ디자인 예뻐요 단추있고 주머니 있고 소매 넓어서 귀여워보여요
guswjd31**|핏이 진짜 예쁘고 다들 입은 거 보고 사고싶다고 막 이야기해주니까 너무 좋네여! 소매도 막 폭이 넓지도 좁지도 않고 딱 적당하고 어깨선도 넓어버이지도 않고 애매하지도 않게 딱 좋아요! 굳이 단점을 고르자면 주름이 은근 잘 안펴지네요ㅜㅠ 이거 어떻게 꿀팁 없을까요? ㅎㅎ 여튼 구겨짐에도 불구하고 너무 예쁜 옷 이예여!
10457177**|배송 오자마자 입었더니 구김이 있네요길이감 길어서 좋구 재질도 부들부들해요약간 가오리핏이라 어깨 넓어보이는게 좀 아쉽네요..
wlgp11**|평소 하의실종 패션으로 자주 다녀서 그런가 딱 제가 찾는 그런 옷!! 진짜 예뻐요..ㅜㅜ옆이 트여있는 덕분에 바지가 보여서 더 좋구용ㅎㅎ자주자주 입을 옷이 될 거 같아요 블랙도 살까봐요ㅜㅜ
ddu**|치마가 생각보다는 많이 짧게 나온거 같아요그래도 재질도 생각보다 괜찮았고 핏도 이뻤아요~ ><조끔만 더 길면 더 만족할거같아요
10457177**|와인색 예뻐요 조명때문에 색상 잘안잡혔는데 실물 이쁩니다입을때 엉덩이에서 걸리는데ㅠ 허리짱짱해서 뱃살 다감춰줘요A라인이라 진짜 편하구요 이거 입고 외출한날 옷이쁘게입었단 얘기 들었어요~
ddu**|핏이 굉장히 여리여리하게 이쁘게 나온 것 같아요조금 박시하지만 그래서 더 이빠요><다른 색깔도 더 사려구용~~♡♡♡
10457177**|모델 코디대로 구입했어요팔길이는 팔목보다 짧아요딱 가을용인거같구요핏이 예뻐요 재질도 좋고 배송 오자마자 애용중입니다!
ruyj20**|사진 보고 너무 예뻐서 구입했습니당ㅎㅎ 일단 받고 나서 바로 확인해 보니 프린팅 아주 예쁘고요 길이도 길고요 박시하고 딱 좋아용ㅠㅠ 제가 평소 밝은 색 옷을 많이 입는 편이라 노란색 티가 많음에도 불구하고 이왕 해바라기니까 옐로우 구입 해야지 하고 옐로우 구입했는데 매우 만족합니당 색깔 고민하시는 분들께 옐로우 추천 드려용!!
116311637**|다른 사이트에서 옷을 샀는데 너무 잘 안맞길래 고고싱에서 사봤는데 세상에나..너무 편해요ㅠㅠ 정말 고무바진줄 알았습니다 스판 정말좋고, 아래 컷팅된것도 너무 예뻐요 다리가 짧은편은 아니라 롤업은 못하지만 롤업하시고 입어도 정말 예쁠것 같아요 색상이 화면보다 어두워서 아쉽지만 허벅지 안쪽살이 많은데도 그걸 커버해줍니다 앞으로 자주 이용하겠습니당❣️
dydghk07**|한사이즈크게사는것도괜찮을것같아요 단화가딱딱해서신기살짝불편한거빼고이쁘고귀여워서 또발작아보이는효과까지있어서좋아용!
10457177**|브라운인데 조명때문에 색감이 잘안잡히네요디자인 굳이예요 색상도 딱 예뻐요다만 치마길이가 저한텐 짧았어요재질이 뻣뻣해서 절대 안늘어나더라고요ㅠㅠ스판기 좀만 있었음 편했을텐데 하는 아쉬움만 살짝 있어요
flat**|고고싱 옷이 넘 좋아 구매했는데 이건 넘 실망스럽네요 올 배송 받아 낼 여행갈때 입으려구 망에 넣어 빨았는데 올이 다풀려버렸어요ㅠㅠ이걸 어찌해야할지 ㅠ 소매도 올이 다 풀려 봤더니 시접부분이 잘 되지 않았더라구요 옷은 넘이쁜데 이걸 입어야 될지 아님 교환해야할지 ?
ine08**|크롭후드랑 같이입을려고 시켰는데 ㅜㅜㅜ 왠걸 너무 찰떡입니다.. 하 진짜 이뻐요 .. ♡ 사길 잘한거같아요 ㅜㅜ 후기가 하나도 없길래 1초망설였습니다 ^^.. ㅋㅋㅋㅋㅋㅋㅋㅋ베이지 색도 같이 하나더 시킬까 했는데 ㅜㅜ 이미 베이지 바지를 사버려서 블랙으루만... 그리고! 하이웨스트라 다리도 더 길어보이고 와이드라 통도넓어서 되게 편해요!고고싱 흥해요 ♡
148026745**|안녕하세요:) 제가 진짜 엄청 고민끝에 산 치마인데 너무 예뻐요ㅠㅠ 얇기도 얇고 그렇게 짧지도 않아서 너무 딱 좋았어요! 급하게 위에 입을 옷이 없어서 입던거 재빠르게 넣고 찍은건데도 너무 예쁘네요ㅠㅠ 이번 가을때 이것만 입고 돌아다니겠어요 홍홍 그리고 제가 허리가 26인데 뒤에 밴드? 가 있어서 그런지 딱 붙어서 편하기도 편하고 다른치마는 항상 허리가 컷었는데 이건 허리걱정 안해도 되고 참 좋습니당ㅠㅠ 그리고 앉으면 치마는 저정도까지 와요! 어차피 겉옷 덮을거라서 신경 쓰이지 않아요홍 고민하시는분들 강추해요!아 그리고 양말도 고고싱 이랍니당 참 예쁘쥬♡ 고민하시는분들 꼭사세요ㅠㅠ두번사세요ㅠㅠ♡
yanbabaki**|너무 빨리 도착도했고 치마도 아주예쁘고 만족해요-!핑크색이 좀 어두운색갈이라서 진짜종말로 맘에 들었구요!!사이즈도 괜찮고! 많이 입을게요!!
