ekqls57**|저 요새 정말 거짓말아니라..맨날 이 바지만 입고다녀요ㅠ 신축성 장난아니고 핏도 정말 이쁘고..정말 핏이 너무 마음에들어요ㅠ 여기다가 슬립온 신으면 정말 이뻐요ㅠ 아무티에나 다 잘 어울리고 다들하나씩 들고있어야해요
dbrtnwjd3**|검정바지가 늘어나서 사로 산건데 역시 ㅜㅜ 넘 이쁘고 적당히 스판끼도있어서 좋아요! 다들 구매하세요..
dbrtnwjd3**|평소에 미듐을 입어서 시킨건데 생각보다 더 크네요....!! 그래도 이쁘게 입겠습니당....!
111054471**|길어요 엉덩이가 다 덮힐정도에요.그래도 색도 마음에 들고 다른점은 다 괜찮아요.4900원에 이정도 퀄리티 진짜 좋아여~
111054471**|목이 많이 다른옷에 비해 넓은것 같아요.색상도 마음에들고 사이즈도 적당해서 좋아요.길이가 엉덩이 덮힐듯말듯한 길이에요
codmsr**|워낙 기본템이고 편하고 좋으니 설명이 필요 없죠~ㅎㅎ가격이 좀 더 저렴했으면 하는 생각이 들지만 잘 신을게요!
codmsr**|아직 미착용 제품이지만 색상도 너무 예쁘고 기장도 제가 원하는 기장이라서 여름에 자주 입을 것 같아요.
codmsr**|프리사이즈이다 보니까 특히 어깨가 좀 커요.하지만 커프스 디자인이 너무 마음에 들어 치마에도 바지에도 잘 입고 있어요!
codmsr**|정사이즈 예쁜 구두예요!축제에 싸이 온 날 처음 착용하고 두 시간을 뛰었는데도 편하고 좋았어요! 가격도 괜찮고ㅎㅎ 신발도 고고싱에서 사길 잘한 것 같아요
757827740**|색깔이 생각보다 어두워서 놀랐습니다. 하지만 그것말고는 따뜻하고 입었을 때 포근한 기분이 들어서 요즘같이 오락가락한 날씨에 자주 애용하고 있어용 :)
wlgus3**|진짜진짜 편해요!!! 계단 올라갈때나 걸을때도 하나도 안불편하구요 옷자체도 두껍지않아요. 예쁘게 달라붙어서 핏이 좋게보여요!
lika1**|치마 완~~전 맘에 들어요! ㅠㅠ전에 고고싱에서 산 흑청 치마도 진짜 잘 입고 있는데 얘도 진짜 맘에 들어요. s 샀는데 사이즈도 딱 맞고 길이감도 너무 좋아요! 진짜 잘 임을 것 같아요!
wlgus3**|자켓이 박시하긴하지만 핏은 예뻤어요 근데 팔통이 많이 넓고 소매를 두번정도는 올려입어야할거같아요 참고하세요!
723930077**|집에 흰 반팔만 많아서 베이지 색 반팔티가 갖고싶어서 구매 햇어요. 흰티들은 입으면 안에 비칠까봐 많이 신경쓰이는데 베이지색은 확실히 신경이 덜 쓰이네요! 옷도 무난하고 이뻐용
723930077**|하늘하늘하고 이뻐요~근데 제가 살때는 리뷰가 1개밖에 없어서 몰랏는데 지금 올라온 리뷰들 보면 좀 작게나온것 같네요ㅠㅠ 저도 좀 작구요...살빼서 입으면 너무 이쁠것 같아요 ㅎㅎ
723930077**|귀여워요ㅠㅠㅠㅠ 근데 다른 곳에서도 많이 팔고해서 그게 좀 문제긴해도 이쁘면 끝이죠 뭐 ㅎㅎ 잘입을게용
723930077**|좀 잇으면 더워질 것 같아서 반팔삿어요!! 무난무난하게 데일리로 입기 좋고 파란색도 화면이랑 같은것 같아요.
phb97**|진짜예버요 놀러갈때 입어도 좋고 ㅎㅎ 바지 반바지 다 어울려용 가격도 저렴하구 진짜 최고에요
phb97**|가볍게걸치기예빠요근데좀어두운핑크에요딸기우유색보다는인디핑크?근뎅ㅂ긴예버용봄여름가을언제나걸칠수있을듯
2012058452393580**|데일리로 입기 너무 좋아요 치마든 바지든 다 어울리고 너무 편해요~~  흰색 샀는데 뷔스티에 원피스랑 같이 입으니까 이뻐요 완전 추천합니다ㅋㅋ
766666116**|흐아 ㅠㅠ 바지 m 으로 불렀는데 커서 이치마는 s로 불렀는데 작아요 ㅠㅠ 살빼서 이쁘게 입을게요 재질도 괜찮고 정말 이쁜데 살쪄서 못입고 있떠야 ㅠ
731833171**|옷이 생각보다 크고 팔도 길어요 엄청 박시핏입니당 전 흰색삿는데 정말 너무 하얗습니당,,,
toki06**|검정색이라 심플하고 무난한 것 같아요~ ! 어디에 입어도 어울리고 재질도 괜찮고 사이즈도 넉넉하게 잘 맞았어요!
toki06**|어느 옷에 입어도 다 잘 어울리는 것 같아요!입으면 고급스러워지고 되게 시크해 보여서 좋아요! 진짜 고민하지 말고 사세요~ 근데 요즘 날씨가 더워서 가을되면 입어야할 것같아요 아니면 좀 선선할때 입어도 덥지 않을 재질이라ㅎㅅㅎ 정말 마음에 듭니다.
394575031**|제가 엉덩이가큰건지... 저는 골반이랑 엉덩이가 넘 작아서 바꾸려구요..바지 살때 스판생각해서 작게사지 마시고한치수 크게 사세요ㅠ
738018836**|박시하고 약간 비추는게 쫌 그렇지만 그래도 뒤에 글씨 있는게 너무 이뻐용 어떤 바지에도 다 잘 어울리는 티에용!
738018836**|입어보니까 무난하게 잘 입을 수 있고 어떤 티셔츠에도 다 잘 어울리는거 같아용 지금 날씨에 입어도 좋아요!
771781949**|늦을줄 알았는데 배송도 생각보다 빨리오고 상품도 사진보다 좀더 이뻣어용!!옷도 잘 맞아용!위에옷에는 가슴 패드가 달려있어서 편하고 좋아요!데일리로도 입기 좋고 조금 꾸며야할때도 입기 딱 좋은옷인거같아요! 옷 진짜 이쁘고 좋아용!❣️
66752312**|허벅지가 종아리에 비해 많이 두꺼운 편인데 잘 맞았어요 처음 입을 땐 안 편한가? 싶었는데 하루 입고 돌아다녀보니 편한걸 알겠더라고요! 대신 허리가 좀 커서 벨트 매서 하면 예뿌게 입고 다닝 수 잇을거같아여
johee12**|너무 싸서 반신반의하면서 샀는데 생각보다 질이 너무 좋구 아무 바지에나 잘 어울려서 너무 좋아엉 ㅎㅎ 제가 마른편이여서 구멍을 뚫어야하는게 힘들지만 그래도 예뻐용 !
ish12**|44인 제동생도 겨우 입어요 그리고 허리가 진짜 한줌이어서 모델분이 정말 대단하다고 느꼈습니다
ish12**|딱 보자마자 목 부분이 잘늘어날것같았는데 한번빨았더니 바로 늘어났어요 그래도 디자인은 예뻐요
ryu35**|할인 끝나갈 쯤에 고민하다가 결국 구매했어요! ㅎㅎㅎ근데 스커트 너무 이쁘고 남친도 이쁘다고 해줘서 잘 산거같아요 ㅎㅎ 길이도 좋고 앞트임도 있어서 이쁜 포인트인거같아요. 안에 짧은 안감도 있어서 앞트임 있어도 노출 별로 신경 안쓰이고 전체적으로 여성스럽고 이쁜 치마예요. 트임 정도 보실 수 있도록 사진 올렸어요! 사실 때 참고하세요 잘입을게영 ㅎㅎ
ish12**|색감이 진짜 예뻐요 크림톤에 빨간색 그림이랑 레터링이 잘 어울려요 근데 딱 보자마자 목 부분이 잘늘어날것같았는데 한번빨았더니 바로 늘어났어요
ish12**|학교에 책 들고 다니려고 샀는데 밑에 부분이 여유 공강 없이 앞뒤 천이 딱 달라붙은것만 아니면 다 좋아요 심지어 천도 좋음
858504080982560**|무난한 줄무늬 셔츠 사고싶었는데 제가 딱 원하는 핏이라 좋았어요! 바지랑 입어도 예쁘고 치마랑 입어도 예쁘네요ㅠㅠㅠ 좋아요ㅠㅠㅠㅠ
ish12**|가슴 쪽이 아예 안잠겨서 못입어요 ,, 그래서 반품하려고 합니다 . 다른 부분은 다 괜찮은데 가슴이 크시거나 66입으시는 분들은 안될거같아요
858504080982560**|하늘하늘하고 예뻐요!! 아이보리 사길 살한거 같아요! 화사해보여요 자주입을거같아요!
hhs95**|크기도 딱 적당하고 예쁜거 같아요 가격대비 정말 좋은 제품인거 같아 저는 추천 드립니다 정말 좋아요
wlgp26**|제가 평소에 외출시 물건을 많이 들고 다니지 않아 좀 작은 사이즈의 에코백을 찾고 있었는데 너무 귀엽고 예뻐요! 아무곳에나 무난하니 예쁘게 잘 착용할 수 있을거같아용
hhs95**|제품 사이즈가 프리사이즈라서 정말정말 큽니다 면소재도 시원하고 좋은거같구요 그냥 가격대비 좋은제품입니다
sya10**|아이보리 연핑크 둘다샀는데 원피스 너무너무이뻐요!! 키작은데 길이도 딱이고 이쁘게입었어요 근데 연핑크는 좀 하얀분들이입어야 더잘어울릴것같아요!!!
hhs95**|일단 크기가 정말큽니다 그래서 여름에 입기에 더 시원할꺼같아요 가격대비 정말 좋은 제품입니다
asdfasdf**|바지 정말 편하고 밑에 부분 술처럼 짤린게 맘에들어요! 밋밋하지도 않구. 근데 핏이 A라인마냥 골반은 좁고 허벅지로 갈수록 넓어지는듯한 그런... 안예쁘진 않은데 뭔가...요상..?
hhs95**|가격대비 정말 좋은 제품인거같아요 일단 크기가 정말 넉넉합니다 저는 정말 만족하고 추천드려요
thdal54**|이것도 세일할때 사서 만원도 안했네용ㅋㅋㅋ무난해요 근데약간 어깨선이 내려와서 조금커보이긴해요.. 그거빼고는 만족합니다 괜찮아요!!!
thdal54**|세일하길래 얼른샀는데 좋아요!! 어깨가 약간큰거빼고는..근데 옆에 줄?이라고해야하나 좀 걸거치네요 ㅜ 뺄수도없고...
hhs95**|블루로 구입하였는데 색도 예쁘고 좋아요 크기도 너무 크지도않고 입기딱 적딩하게 넉넉한거같고요
thdal54**|길이 적당해요 딱원하는길이그런데 꽃패턴이 사진만큼 안밝고 좀 탁해서...처음봤을때 약간촌스럽다는 느낌 받았어요 ㅠ ㅜ.. 잘보시고 구매하시길..
hhs95**|깔끔하고 가격대비 정말 좋은상품이에요 사이지가 정말 넉넉해서 누구든 입을수있을것 같아요 추천합니다
hhs95**|배송이 휴일이랑 주말이 겹쳐서 늦어지긴했지만 제품을 받아보니 예뻐서 좋았어요 사이즈는 프리사이즈라서 엄청크네요
wjdgus2**|어제받았는데 배송완료가 안떠서 오늘에야 후기올려요보라색 남방이 가지고싶었는데 착한가격에 올라와서 바로 주문했어요!우선 색은 뭔가 진한듯 안진한거 같은데 모델분 사진이랑 비슷하구요린넨이라서 많이 얇을까 걱정했는데 생각보다 비침이 심하지는 않아요!짧을거라고 약간 예상하고 사서 길이는 괜찮구요 아쉬운게 있다면 단추가 아래에 하나만 더 달려있으면 좋겠다고 생각되네요!보라색 남방 찾으시는 분은 가격도 착하고 여름에 가볍게 걸칠 수 있으니까 사셔도 후회는 없을거라고 생각됩니다
716580845**|음 생각보다는 별론데 그래도 편하게 입을수있을거같아요신축성이 있더라구요
716580845**|편하고 슬림해보여서 좋아요                              비침은 있는 편이에요
jay6950**|옷이 너무 파이고 부해보이는데 그것보다도 가운데 가슴 쪽이 트여있어서 안에 옷을 안입고 입으면 옆에서 보면 가슴이 다 보이구요 어깨를 피거나 가슴을 내밀면 시상식 드레스 마냥 가슴 골이랑 다 보입니다 그런데 상품정보에는 상세하게 옷이 저렇다는게 나와있지도 않고 이게 불량인 상품인지 정상적인 상품인지 모르겠네요.. 이거 정상적인 상품 맞나요? 이 옷 사신 분들도 이렇게 왔는지 답글 달아주시면 좋겠네요ㅠㅠ
716580845**|44하면 작을까걱정했었는데 44도 안끼이고 딱맞게 입겠네요위에 옷은 뽕도 들어가있더라구요
716580845**|155에 딱맞는기장이라는데 저는153인데 크롭기장이욤...              그래도 핏은 좋고 이뻐요
jiho**|인기제품이길래 보고 구매했는데 여리여리하고 너무 예뻐요!! 팔부분만 시스루인것도 매력적이에요! 키가 작은데도 괜찮은 길이감 이에요 예쁘게 입겠습니다^^
kimsj4**|100사이즈 덩치인데도 딱 맞아요 바지보다는 치마에 더 잘어울려요!
716580845**|허리부분에 고무밴딩인거같은데 좀 헐렁해서 자꾸내려가요랩이라 움직일때 너무벌어져서 가슴부분 티안나게 꼬매야겠네요
kimsj4**|블랙에 이어서 카키까지 정말 최고인거 같아요 베이지도 살까 고민중이에요
kimsj4**|ㅎㅎ정말 기본 벨트 가성비 굳 좋아요 좋아요
esder11**|아무 상의랑 매치하기 좋은 롱스커트네요~ 예뻐요 ㅎㅎ 다른 색상으로도 더 살 의향있습니다! ㅎㅎ
dnjsrud42**|인터넷 쇼핑몰에서 바지 구입하는건 처음이라 사이즈랑 길이때문에 걱정많았는데 제품받자마자 입어보고 만족했어요! 바지길이에 놀랐고 입었을때 편해서 더 놀랐어요!! 저같이 키가 작은 분들이 입으면 정말 만족하실것 같아용!
woxodrn**|고민고민하다가 결국 질렀어요 사진그대로네요 예뻐요제가 팔이 긴편이 아닌지 소매가 길었어요 원래 자켓사도한반접는편이라 그건 상관없을듯해요 ! 봄 가을에 검정자켓필요했었는데 예쁘게 잘입어질꺼같네요  인에 입을 반팔이랑치마랑 바지 원피스도 구매해야겠어요 아무꺼나 입어도 잘어울릴까같아서살께많아졌네여 ^^ 고민하시는분들은  구매추천드려요^^
bluekm**|슬랙스를 너무 사고싶어서 샀는데 사이즈도 딱 원하던 사이즈고 허리도 밴딩이라서 너무 편하구 좋아요!
woxodrn**|이런 핏 바지를원했는데 캔버스화랑 신으면 너무예쁠꺼 같네요길이가 조금길긴한데 요새 그런게 유행이라서 괜찮을꺼같아요ㄱ얇아서 여름에도 많이입을수있을꺼같애요
57430939**|요새 기본티셔츠가 필요해서 몇개 같이 구매했는데 깔끔하고 청바지랑 같이 입고 있어요! 사이즈도 적당하구요 몇개 더 구매할까 생각하고있습니다~
luna56**|와...이렇게 예쁜 스커트 첨 봤어요ㅠㅠㅠ 고고싱 앞으로 사랑해야겠어요. 고민말고 바로 사야해요ㅠㅠ 친구들도 다 이쁘다 하고 이거 입고 나갔더니 다 이쁘대요! 터질거같다는 분들 계시는데 내가 좀 말랐다 하면 바로 사시는게 옳은거 같아요!걸을때마다 팔랑팔랑하고 그냥 조녜입니다 고고싱 고마워요^^
best**|연핑크가 촌스럽지않은 예쁜 핑크에다가 길이도키작녀들한테 딱 좋은 기장이라서 너무 좋구요,그래서 요즘 자주 입게 되네요 : )
best**|컬러 고민하다가 결국 두개다 주문해버렸는데,잘한거 같아요, 어떤컬러를 고르던 다 예뻐요!속안감 속치마도 좋네요! 잘입을께요 : )
best**|받아보고 생각보다 퀄리티도 좋고 예뻐서 놀랐어요! 키 156에 길이도 적당하고 예쁘네요! 만족합니당!! : )
dmsdla**|엄청 예쁜데 면이 얇은 면? 이고 탄탄한 면 재질은 아니라서 그게 좀 아쉬웠어요ㅠ 근데 엄청 예뻐요 진짜.. 아 그리고 냄새가 엄청 심해요. 이틀정도는 냄새를 빼야 할것같아요.. 그래도 예뻐서 용서가 되네요.
dmsdla**|색상은 화면이랑 비슷하고 품이 그리 크지는 않은데 몸집이 작은 저한테는 조금 크게 느껴졌어요. 팔 길이가 좀 길긴하지만 어차피 접어입을거니까요. 그리고 옷이 많이 얇아요. 정말 많이.. 이 점 감안하시고 구매하셔야할것같아요.
dmsdla**|편해요! 재질이 생각한 면은 아니였는데 봄,가을에 입기 딱 좋은 재질인것 같아요. 키 작은 저한테도 많이 길지 않아 좋았습니다.
ha**|너무 예뻐요 일단 제 키가 169인데 길이가 딱 맞아요 ! 얇아서 여름에도 입을 수 있을 거 같아요 만족합니다
haa56**|생각했던 것 보다 색이 더 밝고 톡톡 튀어요ㅛ~예쁘게 잘 입을 수 있을 것 같네요 재질도 좋구
1501758136572076**|이쁘네용! 어깨가 좀 넓으신분들은 피하셔야할것같아요!
kecw123**|진짜 이뻐요 여성스럽고 여리여리하고 편하고 꾸민듯 안꾸민듯 입을 수 있어요 청바지에 입으면 진짜 이쁠 것 같아요
1501758136572076**|허리가 상당히 남네요....
1501758136572076**|너뮤이뻐요ㅠㅠ 되게 쫀쫀하게 고무 잘되있어서 꼭 오프숄더로 안입어도 될거같기도하고! 무튼 마음에듭니당ㅎㅎ
kecw123**|진짜 이뻐요 사진이랑 핏 똑같아요 그리고 여름에 되게 시원하게 입을 수 있을 것 같아요 편하게 잘 입을 것 같아요
1501758136572076**|이쁜데 왜 구멍이 깊게있지 않죠ㅠㅠ! 새로 구멍 뚫어야할판이네요
kecw123**|진짜 이뻐요 사진이랑 핏도 색깔도 똑같아요 그리고 파이지도않아소 편하게 입을 수 있고 여리여리해보이고 안에 나시라인이 비춰서 더 이쁜 것 같아요
mehyunje**|예쁘고 스판끼도 있습니다.목부분이 답답하다하신분들도 계시지만 그건 충분히 조절가능하다 봅니다.속에입는 검은나시의 길이가 조금만 길었으면 하는 상품평들을 봤는데 왜 그런 아쉬움을 남겼는지 알것같아요.^^다른분들 참고하시라고 길이를 재어본 사진 올립니다.참고하세요~ ^^저는 집에있는 다른 나시들로 입으려 합니다.블라우스 정말 예쁘고 편하답니다.
skdms39**|예상했던 것보다 잘 늘어나지 않아서 놀랐지만 그 외에는 정말 좋고 편했어요 검정색 샀는데 너무 좋아요 ㅠㅠ
skdms39**|샀는데 생각보다 엄청 편하고 활동하기도 좋았어요!! 검정색 샀는데 먼지 같은것도 생각보다는 많이 묻지도 않고 좋아요!!
45216058**|너무너무 이쁘네요 솔직히 고고싱에서 산것중에 젤루 맘에 들어요! 속옷이 비치지도 않고 꾸미고싶은날 입으면 딱일것같아요
45216058**|너무얇아서 처음엔 좀 그랬는데 긍정적으로 생각하면 얇으니까 여름까지도 시원하게 입을것같아서 그냥 입으려규요
mehyunje**|다양한 꽃무늬와 다양한색상의 블라우스들중에 정말 득템한 아이템 입니다.피부톤이 살짝 그을린 검은톤인데 생각만큼 꽃무늬블라우스가 어울리지 않아서 속상했는데 이번상품은 제 피부톤에도 너무나 잘 어울려서 기분 최고였슴다. ^^*어깨선 패임정도는 머리카락이 가려서 잘 보이지는 않지만 여성들 브라끈부터 오픈되어 있답니다.머리카락을 늘어트렸을때와 살짝 넘겼을때 느낌이 참 여성스러움을 더해주는것 같아요.포토후기가 꺼내입은것 없는것같아서 저는 하의속에 넣지않고 꺼내서 입어보았습니다. 구입시 다른평들과 잘 참고해서 구매하시길 바랍니다.예쁘게 잘 입겠습니다.참! 옷감도 후회없을거라 봅니다.
thdal54**|기존에 벨트가 낡아서..비슷한거 사려고봤는데 가격도 저렴하고 괜찮아서 구매했어요 튀지도 않고 무난합니다..
ksr**|좋아요 핏 괜찮아요 위에 아무반팔입어도 잘어울리고 접어서 입을수있어서 더 실용적이에요 추천드려요
64616940**|진짜 색감 분홍분홍 하고 예뻐요날좋을 때 나들이 옷으로 입으면 좋을 것 같아요~많이 파세요
64616940**|요즘 롱 원피스가 많아서이런 길이의 원피스 찾고 있었는데길이, 핏 정말 다 좋고 이뻐요~
yejin45**|벨트 너무 이쁘고 깔끔해서 어떤 바지든 잘 어울리고 허전한걸 꽉꽉 채워주는 느낌이에요  !!  아쉬운점은 벨트 구멍이 너무 크게 나와서 허리사이즈로는 거의 29~30 그정도인거같아요  ㅠㅠ
64616940**|후기에  스판적고 타이트 하단 말이 많아서고민하다 샀는데 생각보다 저한텐 넉넉하고 컸어요기장 딱 맞아서수선할 필요 없고 좋은 것 같습니당
yejin45**|제가 반팔이나 목폴라 , 맨투맨 그런 옷에 꼭 목걸이를 매요  !! 이 실버목걸이도 심플하고 빛나서 어디에든 너무 잘어울리네요  ㅠㅠㅠ
star456**|예뻐요! 저는 벨트해야지 예쁜 것 같은데 엄마는 없는게 더 예쁘다고 하시더라구요 어쨌든 길이도 좋아요
yejin45**|제가 키가 큰편인데 기장도 딱 이쁘게 잘 맞고 색도 촌스럽지않은 센치한 중청이라 너무 이뻐요  ㅠㅠㅠ 일자바지라 허벅지안쪽살도 커버해주는데 정말 좋아요  !!  강추합니당
gkdud17**|키가 큰편이 아니라 바지 살때마다 접어 입거나 수선해입어야 됬는데이건 딱 좋은거 같아요! 편하고 좋아요!
star456**|하늘색.. 처음엔 예쁘다고 생각했는데 음.. 좀 빛바랜 색? 오래된 옷 같은 느낌이 들어서 쫌 후회해요..
star456**|진짜 만족스러워요 사이즈도 딱 맞고 색도 예쁘고 길이도 딱 좋고 다음에 다른 색상도 사고 싶어요
gkdud17**|바지 색이 딱 제가 원하는 색으로 되있어 자주 입을거 같아요!!길이도 생각했던 길이라 좋은것 같아요!
star456**|오 예뻐요 근데 하루 입었는데 벌써 무릎이 나온 것 같은 느낌이 들어서 읭 스럽긴해요.. 그래도 예쁩니다.ㅈ
444511438**|이거 완전 가볍고 이뻐요! 제가 상체가 마른편이라 딱붙는 반팔티랑 입으면 허리가 커서 치마가 내려가는데 좀 여유있는 반팔티와 입으면 완전 예쁜핏입니다!! 특히 사진찍을때 예쁘니 참고해주세용
775646825918522**|배송이 좀오래걸려서 필요한날 신지는못했지만 너무이뻐요ㅎㅎ 일단 굽높이가 제일맘에들어서 다른곳말고 고고싱에서 구매했는데 정말 딱이에요! 너무높지도 낮지도않은걸 찾고있었어서 ! 발볼이좁고 운동화는 220신는데 구두는 항상 225이여서 225구매했는데 발볼도 길이도 너무 잘맞아요!
minsu45**|제가 뚱뚱해서 생각보다 딱 맞았지만 그래도 원래 딱맞게 입는거처럼 생겨서 나름대로 또 이쁘네요 ㅎㅎㅎㅎ
dlalstj01**|원래제가하비라서 바지를인터넷에서 사면 망해서잘안사는데 이바지는다들후기가좋다고하길래 사봤어요 또 마침 세일하길래 짱싸게샀어요!옷진짜완전예뻐요ㅠ 가성비짱이에요♥ 다리도얇아보이고 코디도아무거나다잘어울려요 진짜살까말까고민하시는분들은 그저시간낭비하시는거에요 ㅎㅎ 완전
66752312**|잘 늘어나서 허리가 편하긴한데 대신 라인을 예쁘게 잡아주는 건 없어요 그냥 내 원래 라인 그대로 보여줘요 치마가 약간 정사각형 모양이라 당황스러웠어요 허리크고 짧은 치마
qortp**|완전 얇아요 단점은 돌돌 말린다는 것그외에는모ㄷ 만족 검정색 삿는데 잘 신을거가태요 로퍼에 ㅋㅋ
qortp**|ㅛ사이즈 딱 좋고 길이감도 좋으며 편해요 색상 회색도 살걸 그랫다구요 ㅋㅋ 너무 만족 합니당
qortp**|사이즈 딱 좋고 길이감도 좋으며 편해요 색상 회색도 살걸 그랫다구요 ㅋㅋ 너무 만족 합니당
66752312**|163인데 기장 적당해서 다리 짧아보이지도 않고 핏이 아방해서 여리해보여요! 까슬거리는 재질일 줄 알았는데 부드러워서 반팔티 위에 입어도 편했어요 불편한 옷 절대 안 입는 타입이라 잘 입고 다닐 것 같아요..!
qortp**|이거 너무 이버요 길이는 종아리 중간바로 위?정도 오고 날씬해보이고 리본이라 뒷모습도 센스잇고 이뿜니다 결혼식장에 입엇는데 안에 검정티랑 잘 어울리거라구용 (*ૂ❛ᴗ❛*ૂ)
hbojta08**|다른 사이트에서 파는거 보고 사려고 했었는데 고고싱에서 마침 같은걸 팔길래 사봤어요! 색상 생각보다 탁하다고 하시는 분들 많았던 것 같은데 저는 딱 생각했던 색상이었어요 진짜 흔치 않고 예쁜 색상입니다! 무늬도 촌스럽지 않고 예뻐요 다만 살은 좀 더 빼서 입어야 더 예쁠 것 같습니당
41802954**|사이즈도 잘맞고 배송이 빨라요재질도 괜찮고 가격도 착해서 자주 이용 할게용다음에도 주문할게용!!!!
41802954**|사이즈도 잘맞고 배송이 빨라요재질도 괜찮고 가격도 착해서 자주 이용 할게용다음에도 주문할게용!!!!
41802954**|사이즈도 잘맞고 배송이 빨라요재질도 괜찮고 가격도 착해서 자주 이용 할게용다음에도 주문할게용!!!!
tjsgml08**|바지 장난아니네얌ㅜㅜㅜㅜ완잔 젛아요 엠사이즈 사긴했는데 살짝 허리가 큰 거 빼거는 다 젛습니다!!
tjsgml08**|소재 너무 좋아용 검은색이랑 흰색 샀는데 여름내내 잘 입을꺼같애영 고고싱 감사합니다~~소재 너무 좋아용 검은색이랑 흰색 샀는데 여름내내 잘 입을꺼같애영 고고싱 감사합니다~~!
tjsgml08**|소재 너무 좋아용 검은색이랑 흰색 샀는데 여름내내 잘 입을꺼같애영 고고싱 감사합니다~~! 소재 너무 좋아용 검은색이랑 흰색 샀는데 여름내내 잘 입을꺼같애영 고고싱 감사합니다~~! 소재 너무 좋아용 검은색이랑 흰색 샀는데 여름내내 잘 입을꺼같애영 고고싱 감사합니다~~!
dmsthf11**|찢청바지 사고싶어서 둘러보던중에 예쁘게 찢어지고 색상도 마음에 들어서 구입했는데 역시 너무 마음에들어요 ㅠ정말 예쁩니다!!요즘 살이 좀 빠져서 s에 도전해봤는데 사이즈가 아주 딱 맞아용!너무 좋아요 ㅠㅠ맨날 입고싶은 바지에용
