150063834**|키가 작은데도 길이가 조금 짧긴 하지만 안에 검은 반바지 입고 입으면 딱 이쁠것같아요 !!!! 이 가격에 이쁜 옷 살 수 있어서 넘무 좋습니다 ㅠ.ㅠ 고고싱 자주 올게욥 ♥️♥️
jg0412**|배송은 빨리 왓구요기본 가디건 사고 싶엇는데 디자인이 맘에들어서 삿는데 살짝 두께감이 잇엇어요적당히 몸에 붙어서 깔끔한 거 같아요
clam**|흰색롱치마를 갖고싶었는데 찾다가 저렴한 제품을 발견해서 사게되었는데생각했던것보다 더 이뻐서 만족합니다통통이인 저에게는 조금 딱맞는 느낌이 있긴하지만 불편하지않아서 만족합니다친구들도 이쁘다고 많이 그러네요~~~ 너무 이뻐서 자주입고다니고 있어요 코디하기에도 쉽고 너무 이쁩니다 만족합니다~
jg0412**|배송은 빨랏어요이건 진짜 보자마자존예이러면서 바로질럿는데색깔도 그렇고 디자인도 그렇고진짜 후회안할거같아요
jg0412**|백송은 빨리왓어요보자마자 구매햇는데 직접 받아보니까진짜 후회안할거같아요길이도 적당하고 얇아서 좀 조심히 입어야할거같아요
jg0412**|배송은 빨리왓구요가디건 사고싶엇는데 할인한다고해서바로 삿어요브라운으로 삿는데 어디에도 잘 어울릴 거같아요
genial04**|세일하는 김에 하나 구매했습니다!!코디처럼 실제 가디건으로의 용도보다는 니트로 입는 것이 훨씬 예뻐요!!안에 시스루 블라우스를 매치해서 입었고 A라인 검정색 치마와 코디하였습니다제 체형에는 몸통 쪽이 조금 넉넉한 감이있었어요 조금만 더 품이 작았더라면 더 좋았을것같아요!! 전반적으로 만족스러웠고 어디에나 매치하기쉬울것같아 그레이색상으로 구입하였습니다
rrg1**|여리여리하고 예뻐용 검정색이지만 프린팅이 화려해서 그런가 점 화사해 보이고 근데 옷감이 앞은 색이 쨍한데 뒤는 색이 흐리멍탕하다 해야하나 그래서 프릴쪽이 바람때문에 뒤집어지거나 그러면 약간 흐리멍텅한 그 느낌때문에 살짝 저렴해보이는거 같아요 하지만 자렴하니깐 전 만족합니당
rrg1**|스판이 아주 좋진않고 조금 있네용 제가 살도 좀 쪘지만.. 피가 조금 안통하는 느낌이랄까.. 디자인은 예뻐요!! 길이도 괜찮구
rrg1**|기장감이나 디자인 다 맘에들어용 근데 옷감 소재가 살짝 무거운느낌? 팔부분은 시스루라 괜찮은데 몸쪽이 소재가 도톰해서 그런지 날씨 더운날에 입으면 좀 답답할꺼 같아용
rrg1**|길이가 쪼끔! 길긴한데 이정도는 사이즈 안줄이거 입어도 될꺼같아서 그냥 입으려고용 스판도 짱짱하고 만족스럽습니당
rrg1**|원래 사이즈가220이라 혹시나 했지만 역시나 크네요ㅠㅠ 뒤에 뭐 붙이고 신어야 겠어용ㅠㅠㅠ 사이즈 말곤 다 맘에 듭니당!!
gdongwon1**|지이이이인짜예뻐요베이지구매했는데 모카도구매하려구요치마에입으면정말예쁘고여리여리해보여요재질은 까끌까끌한재질입니다
gdongwon1**|약간 큰편입니다입으면 핏이 a라인으로 떨어져서 딱 예뻐요다른색도 있었으면 구매했을텐데 살짝아쉽네요밑단헤짐만 조금 정리하면될것같아요
rkdms02**|제가 꽃무늬 원피스가 없어서 처음으로 사봤는데 진짜 맘에 들어요!! 특히 허리 밴딩에 끈이 있어서 당겨서 묶으면 허리라인 이쁘게 나오구 밑에 치마단이 살랑살랑? 이쁘게 퍼져요!  무늬도 실물로 봐두 존예입니당♡
ekgp**|일단 디자인이 너무 예뻐요! 깔끔하구 예뻐요ㅎㅎ 핏도 정말 예쁘게 딱 떨어져서 너무 만족하고 있어요!
dbfla91**|사진하고 하나도 안다르고 핏이 개이쁨ㅋㅋ입으면 개청초 여신이 될 수 있음 그대신 얼굴이 이뻐야됨 봄가을에 딱 어울림
thfquf**|핏도 완전 짱이에여 ㅎㅎ 스판도 있어서 입기편해요
dbfla91**|평소에 밖에 나갈 때 간단히 걸치고 나감루즈핏이고 모자 있는게 이쁜데 계속 떨어짐ㅡㅡ 그래서 걍 빼고 다님
dladpfls1**|진짜예뻐요ㅜㅜㅜㅜㅜ 색이 저렇게 갯노란 색이 아니라 겨자색이러 좀 실망햇어요ㅠㅠㅠ 그리고 가슴이 진짜 보일거같아서ㅜ전 클립으로 고정시켜서 입엇는데 그래도 이뻐서 좋아오ㅠㅠ
dladpfls1**|색이 어떻게 보면 톤 다운된 빨강인데 예뻐요! 바지치마 다잘어울리구 길이감도 잇어서 전 좋았어요! 길이는 161기준 허벅지 삼분의 일 만큼 오는거같아요!!! 편하게 입기조ㅗ아오 ㅎㅎ
clickab**|리뷰가 많은데는 이유가 있는 것 같아용 속바지가 딸려있어서 완전 편하고 생각보다 주름 지는 건 안 심해요
clickab**|데일리로 입을 검정양말 필요했는데 저렴하게 잘 산 것 같아요 다음에는 흰색으로 또 사야겠어용
clickab**|수학여행 때 입으려고 시켰는데 배송 빠르게 와서 잘입었어용 오프숄더는 처음인데 어깨만 나와서 딱 이뻤던 것 같아용
26567795**|이런 블라우스 반팔이 있는데 얘가 훨씬 예뻐요 얘는 레이스 카라도 있고 리본끈도 있어서! 밝은 치마에 잘 어울리네용 근데 팔은 긴팔인데 외투없이 입으면 좀 추워요...거의 민소매나 마찬가지 ㅋㅋㅋ
26567795**|넘 예쁘네요,,, 세일해서 샀는데 만원대 초반 실화? 리본 예쁘게 묶는게 어렵고 리본에 구김이 잘 가긴 하는데 블라우스 너무 예뻐요 다른거 다 품절되고 레드만 남았는데 왜지?? 레드가 젤 예쁜데... 완전 기본템인 검정 치마에 코디하기 딱! 다른 블라우스는 어울리는 치마가 없어서 고민인데 얜 그냥 기본 검정치마에 잘 어울리니까 좋네요 ㅎㅎㅎ
girl23**|여리여리하고 이뻐요ㅎㅎㅎㅎ오프숄더로 입어도되고 구냥 올려입어도 되지만오프숄더로입는게 훨씬이쁜것같아요!얼른 날씨가 더따뜻해져서 입고싶어요오오옹
26567795**|여기서 산 블라우스랑 같이 코디했는데 예쁘네요 이 가격에 이 퀄이라니...! 귀찌라고 추가 가격도 안 붙고... 귀찌 많이 팔아주세요♥♥ 근데 약간 조이는 것 같긴 한데 예뻐욤
qbxl06**|이거 진짜 예뻐요ㅠㅠㅠ 이거 입고 데이트한 날 남자친구가 진짜 예쁘다고 해줬어요!!! 구김이 잘 가서 한번 입을 때마다 다리미질을 해야하긴 하지만 그 귀찮음 덮을 만큼 예뻐욬ㅋㅋ 재질도 얇고 헤지는 그런 거 아니고 꽤 좋고 허리끈 묶으면 진짜 예뻐용 다른 색도 품절 아니었으면 샀을 거예요ㅠㅠ 고민하는 분들 걱정말고 질러요~~~~~ 159에 무릎정도 왔어용!!
wkddkfma74**|다른 분들 후기대로 예상은 했지만 처음에 구김이 너무 심해서 그냥 바로 입지는 못했어요.. 꼭 다려서 입으시길 추천하구요. 생각했던 것보다 훨씬 흐물흐물한 느낌이라서 잘 다리셔야 자켓 느낌이 나요. 길이는 엉덩이 덮는 정도로 적당했고 소재도 흐물흐물한 만큼 시원해서 한여름이 아닌 이상 초여름까지는 입고 다닐 수 있을 것 같아요. 색상도 맘에 들고 가격 대비 만족합니다.
girl23**|이뻐요ㅎㅎㅎㅎㅎ근데 엄청얇아서 잘못힘주면 찢어질것같은느낌...?그래서 조심조심 입어야할것같아요ㅋㅋㅋ얇아서 그런지 정전기도 잘나서 팔에 달라붙는게 좀 있지만 여름에는습해서 괜찮을것같네용
wkddkfma74**|일단 색상은 정말 잘 빠졌고 왜 인기 있는지 알겠더라구요. 보이핏으로 넉넉하게 입고 싶어서 L 사이즈 주문했는데 키가 많이 작은 저에게도 그렇게 길지 않아서 한번 가볍게 롤업해주면 딱 좋았어요! 하이웨스트이지만 많이 부담스럽지 않은 정도로 올라오고 신축성이 좋은 편은 아니지만 사이즈가 넉넉해서 편하게 입을 수 있어요!! 진짜 강추템입니당~
wkddkfma74**|벨트를 고를 때 얼마나 탄탄한지 구멍 갯수가 적당히 많이 있는지를 중요하게 보는데요. 굉장히 튼튼한 소재였고 구멍도 충분히 많이 있어서 만족해요~
wkddkfma74**|키가 많이 작은 편이라서 길이를 중요하게 보는데 키작녀인 저에게는 엉덩이 반 정도로 적당한 길이였어요. 소재도 탄탄한 느낌보다는 약간의 흐물한 느낌이 있었고 흰색이라서 비침도 있어서 안에 나시티는 입어줘야 해요! 저렴한 가격 대비 많이 만족했습니당:)
girl23**|사이즈에 왜 25-26인치가 적혀있는지알았어요....그 이상이면 팬티까지 다보일것같아요ㅋㅋㅋㅋㅋㅋㅋ전 27정도되는데 살을 좀 빼고입어야겠어요..ㅎㅎㅎ근데 진짜 치마는 이뻐요!!
girl23**|정사이즈 샀는데 하나크게살걸그랬어요ㅠㅠㅠㅠ여름에 발에 땀날텐데 딱맞아서 좀 답답할수도있을것같아서..그래도 딱 잘맞아서 괜찮아요ㅋㅋㅋㅋㅋㅋ청바지에도잘어울리고 모든옷에 이쁘게 신고다닐수있을것같네용
girl23**|이뻐요!!!!키가160이라서 발목에서 반뼘정도 보이는것같아요ㅎㅎㅎㅎ안에속치마도 적당히길어서 이쁘고 여름에 시원하게 잘입고 다닐것같아용다른 롱치마보다 이게 진짜이쁩니당!!!!
sloved11**|그냥 기본 블랙스키니에요ㅎ  허리가 커서 뒤에가뜨네요ㅠㅠ 요바지도 벨트하고입어야 할거같아요ㅜㅜ그거빼곤 무난해요!
sloved11**|레드색상.화이트색상구입햇어요ㅎ 레드 너무이쁩니다ㅠㅠ화이트는 뭔가..음...세탁한번하니 목이 훅늘어나서...아쉽습니다ㅠ
sloved11**|깔끔하고 좋아용ㅎ 박시하지않아서좋앗습니다.아쉬운점은...세탁기한번돌리고나니 목이 늘어나서...잘때나입어야할거같아요..ㅠ
kkoo**|접착력 좋고 편해요 오프숄더 입을때 안에 입으면 좋을 것 같아요 생각보다 편하고 괜찮습니다!!
sloved11**|화이트색상 구입햇구요 좋습니다ㅎ 깔끔하고 이뻐요:)제주도가려고 구매한건데 빠른배송감사해용!
kkoo**|재질도 괜찮고 핏도 이뻐요 냄새가 좀 안 좋긴한데 빨아서 입으니까 별 문제 없었습니다 싸게 잘 구매했어요
sloved11**|s사이즈 구매햇구용 기장 너무좋아요 딱원하던 기장이였습니다ㅎ아쉬운점은 허리가커요ㅠㅠ 그래도 벨트하면되니! 암튼 너무이쁘고좋아용ㅎ
kjh33**|짱이뻐요ㅠㅠㅠ기대안하고 시켰는데 입기 딱 좋은 날씨인거 같아요살집 있는편이라 안맞을줄 알았는데 맞아서 좋아요ㅠㅠㅠ 짱짱 고고싱
gwonju43**|일단 색이 너무 이쁘구요 박시한 가디건인데도 원래 가디건이 너무 부해보여서 잘 안입는데 이건 막 부해보이지도 않고 적당히 딱 이쁘게 박시해서 좋아요 잘 입고 다니고 있어요 구매추천합니다
gwonju43**|옷이 되게 이쁘구 색상도 아이보리색 그자체로 이쁘구 핏도 모델분처럼은 아니지만 좋아요 길이도 짧지도 않고 길지도 않고 적당하구요 밴딩위치도 모델분 보고 너무 위는 아닌거 같아서 구매했는데 나름 괜찮긴 햇어요 패턴도 보기 그대로구요
lalara**|무난하게 입으려고 화이트 주문했어요! 굉장히 박시하고 데일리하게 입기 너무 좋습니다ㅎㅎ 요즘 티 하나입고 남방 걸치면 딱이에요
lalara**|머스타드랑 고민하다가 무난하게 그린으로 주문했는데, 색상이나 질감은 괜찮아요! 근데 생각보다 약간 얇은 느낌이 들었어요
gkdl09**|빨아도 목이 안늘어나고 좋았어요!!흰 바지에 입으면 진짜 잘어울려용ㅎㅎㅎ남색 티가 없어서 샀는데 색상도 이쁘구용ㅎㅎㅎㅎ품도 적당해서 완전 마음에 들었습니당!!!다른 색도 사고싶어요오오오!!!
lalara**|길이도 괜찮고 무난하게 이옷저옷에 다 어울리는데, 입고 벗을때 골반에서 쫌 걸려서 힘등어요, 입고나면 허리는 남고ㅠㅠ
gkdl09**|진짜아 이뻐요오!!!제주도 갈 때 입으려고 샀어용ㅋㅋㅋㅋㅋㅋ제주도랑 분위기가 잘 어울려서 더 좋았던거 같아요!!!!!좀 크기는 한데 그래도 옷이 안달라붙고 시원했어요!!너무너무 마음에 듭니당!!’
lalara**|밀크티랑 고민하다가 얼그레이 샀는데 색상 너무 이뻐요!요즘같이 약간 바람불어서 선선할때 걸치면 딱이에요ㅎㅎ
ha52**|같이 산 치마랑 코디해서 입어봤는데 정말 예뻐요~! 데일리로 입기 좋고 여성스러운 느낌도 드네용ㅎㅎ 남친이 예쁘다고 해줬어요 잘 입을게용
ha52**|편하게 직장다닐 때 입으려고 산건데 괜찮네요ㅎㅎ 옆구리쪽이 살짝 붕 뜨는 감은 있는데 데일리로 입기 좋은 것 같아요~
81894771**|색깔이 너무 예뻐요!!!! 길이감도 적당하고 재질도 부드러워서 자주 입을것같아요ㅎㅎ 어디든 잘어울려서 입기 편할듯합니당
ha52**|역시 통통인 저에겐 모델핏은 나지 않았지만 옷은 정말정말 예뻐요! 속치마가 조금 짧아서 아쉽긴 한데 나름 짧은 것도 예쁜 것 같아요ㅎㅎ
usskim**|쓸데없이 너무 큰 사이즈를 샀아요 제가 30 정도입는디 엑스라지면 될줄알랐는데 너무커서ㅜㅜ 반품하기도스렇고 대충 바짓단이랑 허리 살짝 꼬매서입었어요 색감은 장난아닙니다
ha52**|결혼식 때 입으려고 산건데 색도 너무 예쁘고 같이 산 블라우스랑 코디해서 입었어요ㅎㅎ 길이도 너무 짧지 않고 딱 좋았어요!
usskim**|진짜 너무이뻐요 지금 입기엔 이젠 좀 덥지만 가을에 입으면 진짜 최고일것같아요 제거 77사이즌데 팔뚝이며 가슴이며 너무잘맞습니다!
codms6**|진짜이뻐요! 길이가 가장마음에들어여 짧으면 어쩌나 걱정했는데 다행이에요! 원피스라 바람불때는 좀뜨지만 속에 검은반바지입고 입으면될거같아여  살랑살랑될때 진짜이뻐요 얇아서 지금입기딱좋아여
60704847**|.
zxc9512**|너무 이뿌고 마음에 들어요!!!!!! 와인보다는 약간 붉지만 그래도 만족합니다 핏도 이쁘고 좋습니다 약간 배에 힘줘야 되지만 ㅜㅜ 그래도 전체적으로 만족해요~~~~!!!!이뻐요~~~~
spacelog**|엄청 팔랑팔랑해요옷은 이쁜데 잘 입어야 할 것 같아요너무 팔랑팔랑 하늘거려서......검은색이 더 나을 것 같아요
spacelog**|재질이 특이하다는 후기가 많았는데받아보니 알겠더라구요특이한 재질이구요.. 여름엔 못입겠어요짧은편이에요
sbsm09**|굳
spacelog**|속치마가 없어요...ㅜㅜ벙벙한 편이구.. 소매에 있는 고무줄이 엄청엄청 짱짱해요한철입기 괜첞아요
spacelog**|베이지 샀는데 블랙도 예쁠 것 같아요요즘엔 더워서 못입겠지만 부들부들하고촤르르하고 예뻐요!
hyk6**|롱원피스 입고 싶었는데 진짜 이뻐요! 하늘 하늘하고 부해보이지도 않는 것 같아요. 색깔두 넘 이뻐요. 봄 가을에 잘 입고 다닐게요~!
hyk6**|오프숄더로 입어도 이쁘고 위로 올려도 이뻐용검정색이지만 재질도 시원해서 여름에도 이쁘게 입을 수 있을 것 같아요^*^!
aclover49**|시원한 재질이라 여름에 딱일것같아요
aclover49**|재질자체가 시원한 재질이에요~~
aclover49**|예뻐요! 색상! 품절빨리되고 입고가 느려서 ㅠㅠㅠ 아쉽긴했지만
aclover49**|예뻐요~ 약간 빳빳한느낌이긴하지만 시원한 느낌이기도하고!
84906876**|배송은 너무나도 늦게 왔지만 (ㅠㅠ) 사이즈는 잘맞아요! 치마 핏이 예뻐요 ㅠㅠ 물론 밴딩이라 뒷부분이 주름진 건 아쉽지만... 그리고 뷔스티에 끈이 너무 길어서 이건 수선 맡기려구요! 이 가격에 이 정도 핏이면 정말 모두들 사세요..... 넘 예쁩니다~
gajis**|사진이랑 색이 많이 다를까 걱정했는데 괜한 기우였네요재질도 보드랍고 꽤 얇아서 여름 초까지 입을 수 있을 것 같아요대신 세탁할 때 손 빨래 하시는 걸 추천드립니다만족스러운 상품이라 한장 더 살까 말까 고민이네요ㅎㅎ
scp**|전 이런재질좋아하는데 잘못하면질이안좋아서고민하다샀는데 마음에듭니다. 질도좋구 후회안하실거에요
scp**|흰색살지 초록살지고민하다가 흰색샀는데 질도좋구 마음에듭니다. 초록색하나더사려고 지금생각중입니다.
scp**|너무이뻐요!! 생각외로 질도좋구 핑크삿는데 우유핑크색깔이라 촌스럽지않고 이뻐요!! 입어보세요
hyjeon02**|L인데도 작게 나온거 같아요,,,!?? 조금 ㅇ널널하게 입고 싶었는데 딱맞는거 같아여,, 그래도 이쁘게 딱맞아서 좋아요!!
hyjeon02**|너무 이뻐요!!!! 블루가 촌스러운 블루가 아니어서 좋아요!! 길이도 길지도 않고 짧지도 않아서 바지나 치마 안에 넣어 입으면 이뻐욧!!
ksh0401**|붉은악마 같다는 소리를 좀 듣기는 하는데 검은치마랑 입으면 짱예뻐여 고고싱 늘 믿고 삽니다♡♡
ksh0401**|티는 예쁜데 목이 넘 잘늘어나여ㅠㅠ 그래도 5천원에 이정도면 가성비 괜찮다고 생각합니다...!
ksh0401**|고고싱에거 산 티셔츠 중에 이게 젤 맘에 들었어요 반팔치고 두툼해서 목도 안늘어나고 좋아요♡♡
ksh0401**|진짜 이가방 다들 예쁘다고 난라났어요 생각보다 크기가 크긴한데 진짜 예뻐요 다들 꼭 사세요 저는 학원책까지 들어갔어요!!
ksh0401**|예뻐요 근데 롤업해서 입으면 롤업이 깔끔하게 안되고 그렇다고 안하자니 길이가 애매해여.. 다른바지 사는걸 추천합니다
676608349208841**|진짜짱입니다갠차나용 짱짱짱..........  ..     ...................
676608349208841**|별로입니다 반품하려구요많이크고요 진짜별로입니다....이번엔 망햇어요 다음엔 성공하겟죠...
676608349208841**|별로하늘색이보이고얇고진짜 뭐....색상관없어도.이상해여 600원이아까울만큼........
676608349208841**|??????왜 하늘색일까요 화이트시켯는데정말  600원싸서 산건데 100원이어야 살것같은 기분입니다.100원이라도살라나...엄청얇아서 발가락이다보여요 메니큐어 바른색도 티가나고..
jkop34**|하얀색 1개 검은색 1개샀는데 검은색은 딱 새탁했을때 물빠짐이..!그래도 색안빠지고 둘다 재질이랑 스판끼가 너무좋았어요! 하얀색3개 더 시키려고요♡
kty13**|4900원 반팔티치고는 엄청 엄청 좋아요 진심 이건 대박템이다싶을 정도예요 체육복 위에 입어도 좋고 사복 위에 입어도 매치가 잘 어울려요 진짜 디자인도 너무 예쁘고 품질도 엄청 좋아요 4900원이라는 가격에 이런 티셔츠를 살 수 있다는 게 진심 나 자신 너무 행운아,,, 여러분 꼭 사세요 ㅇ건 고민할 문제가 아닙니다 저 믿고 사십쇼 ㅈ정말 좋습니다 짱짱 안 사면 제가 한 벌 더 사죠 머,,,
susiej**|눈으로 보는 것 보다 착용한게 더 예뻐요~ 캐주얼한 옷에도 안어색하게 잘 어울리고 치마 입고 착용해도 잘 어울려요!!
yiy04**|너무 이쁘고 핑크 하늘 색조합이 잘 맞아서 더욱 더 좋았습니다다음에는 노랑색으로 나오면 다시 구입하고 싶네요
yiy04**|레옹!제가 제일 좋아하는 영화 주인공이 여서 샀는데 너무너무 그림이랑 색이 예쁘게 나와서 좋았습니다
yiy04**|수학여행 갈 때 입을려고 샀는데 예뻐서 지금도 입고있습니다사이즈가 하나 밖에 없어서 많이 실망했어요ㅜㅜ
yiy04**|노란색을 시켰는데 갈색 줄무늬가 나와서 색 매치도 잘맞고 흑청이랑 같이 입으면 예쁘더라구요나중에 가을쯤 되서 긴팔로 나오면 한번 더 구매할꺼에요
yiy04**|색깔도 예쁘고 그림도 예쁘고 좀 커서 아쉽네요ㅜㅜ티 길이를 좀 짧게 해주시면 좋겠습니다!!
yiy04**|220이 225 시켰는데 적당히 발이 남아서 좋았어요굽도 좀 높아서 좋았습니다깨끗하게 와서 더욱 더 좋았습니다
yiy04**|너무너무 예쁘구요 가격에 비해서 제품 제질도 좋아요이런 싸고 예쁜 상품 많이많이 나왔으면 좋겠습니다
teletobi**|니트 자체는 굉장히 보들보들 해요! 옐로우가 쨍한 옐로우 색상이라서 처음에 좀 당황했지만, 청 뷔스티에 원피스랑 같이 코디해서 입으니까 괜찮았어요!
teletobi**|사진이랑 색상은 똑같아요! 모델이 입은 사진보고 꽂혀서 구매했는데, 사진에서도 보이다 싶이 나시가 많이 파져 있어서 그 부분은 감안해야 할 거 같아요! 신경써서 올려줘야하지만, 옷 자체는 굉장히 맘에 듭니다! 가디건은 팔부분이 딱 붙기는 해요
cy0207**|레터링도 맘에들구 노랑색이 환해서 예버용 ㅍㅠㅠㅠㅠㅠㅠㅠ근데 팔길이가 원래 긴거같긴한데 접어주는게 더 이쁜거같아용 지금 이 날씨에 입기 적당한거같구 자주자주 입을거같아요!!
3806443**|발목을 진짜 쫀쫀하게 잡아줘요색은 사진보다 연하지만 정말 시원해보이구인생 스키니진입니다ㅠㅠ
cy0207**|간단하게 반팔입고 이 목걸이만 해도 넘 예쁘구요ㅠㅠㅜㅜ 목걸이 하나하나 따로 착용이 가능하니깐 활용도도 높고 이가격에 이 퀄리티라니..너무 만족해요!!!!!♡♡♡이정도 가격에 3개파는곳은 진심 여기밖에 없습니다 혹시 고민하신다면 고민하지 마시고 어서 사세용
cacao**|옷진짜이브네여. 두께가좀 있고 완전한여름엔 못입을거같아요 색상도 어두워서 근데 진짜 분위기갑.... 존예. 이가격에 이옷이라니 쫄어욬ㅋㅋㅋㅋ 글구저는 리본떼고입움... 없운게 더 분위기있어보이고 고급시려보임
sieunc**|진짜 색깔이 예뻐요! 손목에 트임이있어서 뭔가 더 예쁜것같아요다 잠궈서 입기엔 뭔가 브이넥이 좀 파여있긴한데 잘 신경쓰고다니면 별 문제없을 것 같아요 추천해요
sieunc**|앞 뒤 트임?있는거 확인하세욥! 이뻐요ㅎㅎ걸쳐도 예쁘고 그냥 다 잠가서 입어도 괜찮아요! 추천합니당
hywo**|이거 저한테는 발목정도 와요 조금길어서수선해서 입으려구요 163이상인분들은 딱 예쁘고 좋을것같아요
sieunc**|예뻐욥!!! 재질이 그 부드러운 뭔가 실카한 그런 블라우스 재질은 아니에욥겨울엔 못입을것같고, 봄 가을 초여름까진 입을수있을것같아요! 이쁘네용
hywo**|오오 이거이뻐요 저는 입고서 위에 가디건입어주고입었네요아직단독으로는 쌀쌀해서 여름되면 물론 단독으로 입을것같고일단 너무편해옇ㅎㅎ
hywo**|생각보다 예뻐서 다른 색상두 사고 싶어요청바지나 치마에 하나만 입어두 이쁘고 뭔가 꾸미지않았는데포인트되고 좋아요ㅎ
hywo**|니트예쁘고 좋은데 생각보다 커서 반바지나치마에 넣어입는게 좋을것같아요 그래두 시원해보이고해변갈때나 이럴때 입으면 딱좋을것같아용
rhdudrud**|진짜 이쁜거 같아여!!색깔도 이쁘고 되게 여리여리해 보여서 좋아요!!잘 입고다닐거 같아요!!!
52702288**|신발 편하고 색도 예뻐요 밝은 색의 구두를 찾는게 아니라 조금 어듀운 색찾고있어서 더 예ㅓㅂ요 베이지색보다 이런 핑크있는게 더 이쁜거 같네요
lky31**|딱달라붙어서 너무이뻐용 잘입을게여!
mh9805**|고민하시는 분들은 정말 사도 후회 안하실 것 같아요!! 평소 사이즈보다 허리가 조금 큰 것 같지만 벨트로 예쁘게 고정해줘서 부담없이 입을 수 있는 것 같아요..! 깔끔한 옷 단정된 옷 좋아하시는 분에게 적극 추천해용:) 예쁘게 입겠습니다~~
tjd73**|가볍게 입을려고 구매했는데 정말 예뻐요. 기장도 너무 맘에 드네요. 처음에 올 때 약간 냄새가 나서 한번 세탁 후 입어야 될 것 같아요!!
rkdms2**|널널하게 입을려고 크게 샀는데 종아리 부분이 너무 많이 남드라구요 그래도 이쁘고 가격대비 완전 좋습니다!!!!! 그리고 안에 옷도 안비쳐서 좋았어요 ㅎㅎ
vhzkfl10**|제가 생각했던 하늘하늘한 꽃무늬의 치마을 칮아서 기뻐용 근데 키가 167 이라 살짝 짧아요 ㅠㅠ 길이가 아쉬워요 ㅠㅠ
rhdwnd**|제가 키가 작아서 그런지 로브가 조금 커요ㅋㅋㄱ근데 재질은 좋아요! 단추가 있어서 원피스로도 입을수 있는 것 같은데 엉덩이쪽 트임이 너무 트여서 원피스로는 조금 무리일 것 같네요ㅎㅎ 잘 입을게요!
rhdwnd**|청반바지인데 하이웨스트에요! 길이도 적당해요 근데 반바지가 많이 얇고 잘 늘어나서 살이 조금 있는 사람은 가랑이가 조금 민망쓰..ㅎㅎㅎ
jini58**|사알짝 작기는 한데 완전 만족띠 ღ'ᴗ'ღ
