ddungya**|모델분은 날씬하고 후기 올라오신 여러 구매자님들도 날씬해서 이게 저한테 맞을지 안맞을지 좀 걱정되더라구요 그런데도 디자인이 너무 이뻐서 눈 딱 감고 구매 했어요. 배송은 좀 늦어서 지금 입기에는 애매하지만 선선할때 입으면 정말 좋을 것 같구, 사이즈는 잘 맞아요! 대신 목 부분이 답답하더라구요ㅜㅜ 그리고 어깨 트임부분이 좀 넓다고 해야하나? 그래서 속옷 끈도 다 보일 것 같구ㅜㅜㅋㅋㅋ 뭐 검정 브라자 차면 되겠죠ㅎㅎ 암튼 이거 14,000원에 개이득 했습니다.. 망설이시는 분들 얼른 ㅅㅏ세요 더 더워지기 전에 ㅠㅠ
hjswltn04**|색깔이 어둡단 소리를 많이 들었는데 저는 갠적으로 좋았어요 그리고 베이지색 치마랑 입으면 진짜 예쁩니당
hjswltn04**|사진이 실물을 안따라주네요 ㅠㅠ 실제로 입으면 핏 더 이쁘고 색깔도 사진이랑 똑같아요 여리여리해 보일수있습니당
heain3**|실물이 훨 .. 예뻐요 진짜 얇지도 않고 두껍지도 않고 여름이 입기 딱 좋은 거 같아요..! 레터링도 예쁘고 싼 가격에 너무너무 잘 샀어요!! ㄹㄹ
heain3**|남방 하나 사고 싶어서 뭘 살지 고민중에 제눈에 들어와서 구매했는데 너무 마음에 들어요! 색상도 실물이 훨 예쁘고 싼 가격에 잘 산거 같아요 ~~ ㅎㅎ
o0onop**|같이 주문했던 상품이 입고지연 되는 바람에 배송은 다른 때 보다 많이 늦어서 화가났지만 그래도 예쁜옷 보니깐 기분이 좋네요 ㅋㅋㅋ감사합니다
wlgus123**|좀 늦게 왔는데 옷이쁘니까봐쥴개요 어깨뽕이좀있는게 단점이고 딴거 다좋아요 시원한 재질이고 브이넥때문인지 은근 날씬해보이고 어떻게 입냐에따라 정장스럽기도하고 캐쥬얼해보이기도햐요
hmg4**|정장 바지같은데는 잘어울려요 부드럽긴한데 생각보다 색이 짙어요
wlgus123**|무난무난하면사 드로잉이 안심심하게 해주네요 오히려 이런 그림이 더 날씬해보이기더 하네요 테니스치마나 청바지랑 입어도 예뻐요 자주 손이 갈거같아요
jisu00**|이 셔츠 ㅠ 너무 이쁘죵 ㅠ 이거랑 같이 코디 되엇던 반바지도 삿답다~ 완벽하게 이쁘고 디게 여름여름하구 저런 스타일 좋아하는데 마침 고고싱에도 잇어서 바루 주문 햇엇용~><
wlgus123**|넘나리 예쁘네요 보통 뷔스티레 원치스 입으면 임산부같이 부해보이는대 뒤에 리본이 딱잡아줘서 넘나리 예뻐요 면도 얇아서 여름에 입기 딱좋아요 어넓이 한덩치하시는분들도 입으면 좋을거갗어요
jisu00**|보라색 완전 좋아하는데 이 보라 정말 이쁜 보라색이고 이쁘고 가격대비 완존 좋고 ㅎ 흰바지랑 긴바지 산거에 같이 입으면 짱일 것 같아용!
jisu00**|이 원피스는 정말.. 저는 아마 신상 업데이트 되고 그 다음날인가 삿는데 빨리 사길 잘햇네옹 ㅠㅠ 벌싸 품절이라니... 이 원피스는 정말 제가 원히던 스타일 옷이고 여름에 입기에도 좋고 그냥. 좋아요 이쁘고 ㅠ
wlgus123**|린넨인데 조금 두꺼운 린넨이라서 지금 입기는 덥구요 봄에 입으면 좋았을거같아요 연두색상도 너무 예뻐서 딱 봄스타일이네요 블랙샀으면 가을에 입어도 됐을거 같아요 그리고 어깨뽕이 있는편이라서 조금 아쉽네요
jisu00**|바지 처음에 M으로 햇다가 s로바궜는데 바꾸길 잘햇어용~~ 바지가 너무 이쁘고 화면보다는 밝은 색상이긴한ㄷ 그래도 이뻐요 조금 두꺼울수 잇겟지만 그래도 이뻐요!!
jisu00**|바지 s사이즈 살라했는데 품절이어서 M으로 삿는데 조금 크긴 하지만 그래도 종말 이뻐요 불편하지도 않고 입을때도 편하구 제질은 얇아 보여도 비침도 없구 암튼 이번 여름에는 이 바지로 맨날 입어도 문제 없을것같은 바지예용! 다들 꼭 사세용!!! 품절되기전에!!!
wlgus123**|편안하게 입고나가도 예쁘고 청바지나 청치마랑 입어도 예쁘네요 적당히 박시하고 편해서 자주 손이가는 친구에요 뒷프린팅도 너무 예쁘고요 목부붐도 너무늘어나는 소재가 아닌거같아요
js6**|초록색으로 샀는데 색감이 진해서 좋아요 쫀쫀한 편이구요 아이보리색 부분도 색감 이뻐요 길이도 적당하게 맞는 편이에요~
js6**|길이 발목 조금 넘게 닿고요 통도 많이 안좁고 넓지도 않고 적당해서 좋아요 색깔이 약간 청바지색보단 초록빛이 나는 것 같긴한데 별로 티 안나요~
js6**|가디건 아이보리로 샀는데 적당하게 맞아요 키가 158정도 되는데 골반좀 넘는 길이 같아요 색깔도 이뻐요! 보풀도 많이 안일어나서 좋아요
wow41**|검정 반바지가 필요해서 구입했어요너무 짧으면 어쩌나 했는데 아주 짧지도 않고 무난해서 자주 입을거같아요
ewon35**|옷은 정말 예쁜데 제가 골반이 넓어서 되게 부해보여요ㅠㅠ 그리고 고무줄이 허리를 안잡아줘서 아쉬워요ㅠㅠ
js6**|통이 생각보다 넓긴했어요 ㅜ허리 사이즈도 다른 고고싱 바지 s보다도 크더라고여 벨트하면 괜찮긴해요 ㅜ밑위길이도 짧은편이고 통풍도 잘되는 편은 아니에요 ㅠ바지가 무거워요
kite4**|이거슨..좀애매..디자인이 ㅠㅠ 막상입어보니까 엄청여리하고 마른핏아니먄 좀 안예쁠거같아요ㅠㅠ 잘 참고하세요 디자인도 잘 보시구 ... 살집이 좀 있으면 쉽게 부해보일거같네용 ㅠㅠ
kite4**|소매가 조금... 힘들어요 예쁘긴한데 잘묶어야되고 끈이 자꾸 풀러져서 ㅠㅠㅠ 힘들어요 자칫잘못하면 엄청 부해보이니까 참고하세용 되게 하늘하늘하고 밑엔 별로 안 깁니당 소매가 묶기가좀힘들고 잘풀려서 계속 묶어줘야된다는점말고는 맘에들어용
kite4**|이거너무맘에들어요ㅠㅠㅠㅠㅠ 재질도 잘 안늘어나는재질같고 가볍고 시원하고 아아아 맘에들어요 꼭 사길 ㅠㅠㅠ 진짜 추천 얇고가볍고 여름에딱이에요 이런재질로 또 사고싶음. ㅠㅠㅠ 추천합니다
tmzhffk**|진짜 너무이뻐요 제가 승모근도좀 잇고 어깨도 넓고 목이 짧은편이라 홀터넥 부담스럽고 처음 도전해봣는데 트임이 앞어깨만잇어서 승모근을 가려주고요 진짜 어깨라인 진심 너무 이뻐보여요 이거 입고 옷이쁘다고 엄청 소리 많이 들었어요!진심 진짜 사길 너무 잘햇고 다음주에 놀러가는데 이거 또입을거에요!!!
syh08**|검정색 박시한 옷 찾고 있었는데 생각보다 커서 맘에 들어요. 그리고 디자인도 이뻐욧 ㅠㅠ 잘 입고 다닐게요!!
syh08**|색깔도 여리여리하고 화면보다 보라색이 더 보여서 예뻐요! 그리고 얇아서 여름에 입어도 좋을 것 같아여~
saea19**|진짜 여름에 입기 이쁘네요 ㅎㅎ 밑에도 완전 퍼지는 형식이 아니라 더 이쁜거 같아요 다만 목있는데가 좀 허전하다는 느낌이 들어서 목걸이 이런거랑 차면 이쁠거 같습니다
ewon35**|예전부터 테니스 치마를 살까말까 고민하다가 후기가 좋아서 사게 되었는데 역시 후기대로 튼튼하고 핏도 예뻐요 그리고 다른 테니스 치마 정말 짧은데 이거는 길이가 딱 적당해서 좋아요! 허리가 조금 크긴한데 허리부분을 잘 잡아줘서 날씬해보여요 좋아용
ewon35**|색이 너무 예뻐서 사게 되었는데 화면 색과 똑같아요! 그리고 재질도 얇고 시원한 재질인데 튼튼해서 좋아용!테니스 치마랑 입으니까 너무 예뻐서 정말 자주입을거 같아요!!!
gmldiqk**|와정말 맘에드는 상품이었어요~~ 여름가디건사고싶었는데 사진만보고 너무예뻐서 바로 구매했는데 역시 구매하길 잘했어요ㅠㅠ 진짜 고고싱 7년째 이용중인데 매년 예쁜옷 구매하게해주셔서 감사합니다♡ 레드컬러도 구매하러 들어왔는데 품절이네요ㅠㅠ 다음에 꼭..!
erhe**|배송이 조금 걸렸지만 다행이 잘 도착했구요 슬리퍼 신고다니기 좀 그럴때 신으려고 보다가 디자인이 너무 맘에들어 구매하게됐어요 신발 디자인이 너무 귀여우며 사이즈는 잘 맞고 블랙색상으로할까 고민하다가 샀는데 베이지색상도 너무 잘어울리는거같아요 놀러갈때나 데일리로 자주 신을거같아요 이쁘게잘신을게요 감사합니다~♡
o6o**|진짜이뻐요ㅠㅠ 맨날 치마주문시키면 핏어쩡쩡해서 실패하구 인터넷으로안시켜야지했는데 역시고고싱!! 짱이뿝니다.. 저는 딱 보통 평균체형이구용 !!진짜추천해요ㅠㅠㅠㅠㅠㅠ오랜만에ㅜ득템했습당
hyejeong77**|생애 첫 롱스커트 구매에요!여리여리하게 흩날리는 모델컷이 넘 이뻐서 샀는데실제로도 똑같이 가볍게 살랑살랑움직이는게 너무 맘에든답니다.두번째 사진은 겉 스커트 비치는정도구요세번째는 속안감 비침정도랑 재질 참고하시라고 올렸어요! 안감있어서 더우면 어쩔까 걱정했는데 생각보다 얇아서 여름에도 입을 수 있을것같아요무난하게 블랙샀는데 4계절내내 무난하게 입을 수 있을것같구요~ 생각보다 퀄리티 너무 좋아서 흰색이나 소라색으로 재구매할 예정입니다!ㅎㅎ 많이파세용~~
my97778**|엄..제가키가큰편이아닌데쫌 짧다고느껴졋어요요새배나와서그런가ㅋㅋ근데색은이쁘고 고무줄이라 늘어나서 오래잘입을거같습니다
my97778**|지금바로입어야될얇음입니다시스루라서이쁘구요좀할머니같을까햇는데마니이쁩니다하나정도는 사서입고다니면좋을거같아용ㅎ
my97778**|"진짜 가슴크신분들은 사실때주의하세요ㅠㅠ고무줄이라그래서늘어날거같아서 삿는데 (가슴치수는 확인안하고ㅠ)다른곳은다맞는데가슴이 ""나여기있소""하듯이 너무가슴부분이 조이고 작습니다ㅠ가슴크신분들한번쯤은꼭고민해보세요색은이뻐요ㅠㅠ"
say01**|반팔티 4장을샀는데 재입고때문에 늦어서 2주넘어서받은것도있음ㅠ근데 진짜 싸게사서 좋아요 괜차늠 다른데에서는 이 티한장에 6900원 이렇게팔더라구여 그거생각하면 개꿀임 이것도 입을꺼없을때 입기좋아욤
say01**|블루색인가샀는데 생각보다 색이 독특해서 당황스러웠습니담 그런데 보다보니입을만하네요 그냥입을거엊ㅅ늘때 가볍게걸치기좋음 진짜 걍 기본티예욤
vkeh05**|생각보다 노란끼 있는 아이보리인거엍아요조금 아쉽긴하지만 그래도 이쁩니다많이사세염~~~~~
vkeh05**|예쁩니당 맘에들오용사이즈도 괜찮구요! 고민하시는 분들은 고민 말구 꼭 사세요 추천!!!!
sr9612**|배송이 빨라서 좋았어요 티는 저한테는 안어울려서..ㅠㅠㅠ 아쉽네요 그래도 배송은 좋았습니당~
sr9612**|보통이에요 ㅠㅠ 허리라임이 조금만 슬림했으면 좋겠어요. 그냥 무난하게 입기 좋은 것 같아요!!
62409860**|저 후기 진짜 잘 안쓰는데 이거 너무 예뻐요ㅠㅠ완전 여리여리해요 꼭사세여!!친구들도 다 예쁘대요ㅎㅎㅎ
chldms**|치마는 진짜 이쁜데 프리사이즈인데 골반이 걸려서 안올라가서 못 입을거 같아요 이건 진짜 마른사람만 입을 수 있는거 같네요
chldms**|이거는 보자마자 이뻐서 바로 샀는데 진짜 이뻐요 하늘하늘거리고 언발이라 더 이쁜 거 같아요
chldms**|이거 진짜 너무 이뻐요 키가 큰편이라 걱정했는데 무릎아래로 내려와서 너무 좋아요 근데 목부분에 있는 끈이 조금 아쉬워요
chldms**|쓰던 벨트가 망가져서 산건데 가격대비 이쁜 거 같아요 흰색이라 깔끔하고 바지나 치마 어디든 잘어울려요
chldms**|핑크색 진짜 좋아하는데 이 옷은 연한핑크라 너무 마음에 들어요 치마나 바지 아무거나하고 잘어울려서 좋은 거 같아요
chldms**|보통 m사이즈 입는데 고고싱치마는 거의s가 맞아서 s샀더니 허리가 조금 남네요 그래도 벨트가 있어서 진짜 이뻐요
jsy923**|밴딩처리 되있어서 편하구요~ 깔끔해요! 처음 입어봤을땐 별론가? 싶었는데 ㅋㅋㅋ 마음에 드네요~
chldms**|원래 바지가 불편해서 잘 안입는데 후기보고 샀는데 진짜 편하고 이뻐요 아무옷에나 입어도 어울리고 데일리로 잘 입을거 같아요
jsy923**|음... 저랑은 별로 안어울리는거같아요...ㅠㅠ 저렴해서 걍 반품안하구 입긴할껀데 음.... 그렇네요
chldms**|이거랑 비슷한 가디건이 있어서 살까말까 엄청 고민하다 산건데 비슷한 가디건보다 더 이쁜 거 같아서 엄청 만족해요 팔부분이 좀 길지만 접어입으면 되니까 상관없어요
chldms**|화면에서 보는 것처럼 진짜 이쁘고 데일리로 입을 수 있을 거 같아요 근데 지금은 좀 더워서 봄가을에 입으면 진짜 이쁠거 같아요
dbtls20**|조금 파였지먼 너무 이뻐용.. ❂‿❂  맘에 쏘오옥 듭니다 역시 믿고 사는 최애 쇼핑몰 고고싱 .. ❤️
dbtls20**|사진 그대로에용 ㅎ 근데 좀 작게 나온 거 같아요 163인데 적당합니다 길이!!!! 역시 믿고 사는 고고싱 ㅜㅜ
dbtls20**|짧은 걸 부단스러워하는 저에게 딱 .. (｡♥‿♥｡)  안성 맞춤이었어요!!!! + 여유도 있고 적당히 길어서 이쁘고 ~~~
dbtls20**|이뻐요;;;;ㅠㅠ 색감 조굼 다르다고 다둘 그러시길래 별 기대안했는데 사진이랑 꽤 비슷해요!!!! 넘나 이뿌ㅁ니다 잘 입을게용 기장도 적당해용
78155075**|화이트, 검정 샀어요. 무난한 양말 어디든 매치하기 좋아요
354598658254777**|ㅋㅎ냘ㄴ96ㅅ뇨ㅐㄹ먛ㅊ냫ㅌㄴㅁㅊ묘ㅐㅊ묯매ㅛ멜메ㅛㅊ묘ㅐㅊ묘ㅐㅊ뫛캋뫛몿및녀ㅣㄹ재ㅛㄹ배ㅛㅂ애ㅛㅂ엄한차놔쿜
354598658254777**|어어어ㅓ터터ㅓㅌㅌ터ㅓㅌ터ㅓ터텉터터ㅓㅌ토넡ㅓ엉ㅇㅇㄴㄴㅎ뇨ㅑㄹㅁㅁ5ㄴㄹㄴ8ㄹㄴㄹㅋ7ㄹㅋ9쿌쿌쿄ㅐㄹ쿄ㅐㄹ쿄ㅐㅋ96ㄹ
146033442**|사이즈 딱 좋아요 너무 크지도 않고 적당해요 여름에 입기 시원할 것 같아요 배송도 빠르고 많이 파세용
19034241**|키작은 저에게는 길이가 아주 딱이에요!키크신 분들한테는 넘 짧을 듯 하네요안감이 없어서 조금 아쉬웠지만 엄청 얇은 재질은 아니라괜찮은거 같아요게다가 가격도 완전 저렴인기있는 이유가 있네요
19034241**|검정 블라우스가 하나 필요했는데 저렴한 가격에 잘 산거 같아요치마, 바지 둘 다 잘어울리는거 같아요심플하게 입을 때 추천추천
endendcjs**|제가 노랑색을 좋아해서 잠옷으로 입을려고 사봤는데 완전 만족해요!! 색도 엄청 이뻐요ㅠㅠ 진짜 색깔별로 다 사고 싶네요.. 옷도 너무 편하고 시원하니 좋네요ㅎㅎ 이쁘게 잘 입을게요^^
endendcjs**|제가 갑자기 초록색에 꽂혀서 한번 사봤는데 역시 대만족입니다!! 집에서 잠옷으로 입을 생각으로 산건데 완전 편하고 허리도 별로 안조이고 너무 좋아요~ 잘 입을게요^^
endendcjs**|옷 이뻐요!! 근데 생각보다 가슴쪽이 많이 파인거 같은데 또 리본을 메면 그 부분이 싹 가려져서 좋은거같아요~ 사실 가격이 착해서 한번 사봤는데 만족합니다^^ 잘 입을게요~
apky**|와 진짜 감탄 이가격에 이렇게 인생 원피스를 건지다니 ㅠㅠㅠ 심지어 잘어울린다고 해서 기분 좋네요 ㅋㅋㅋ 뱃살도 가려주고 이쁘도 넘 좋아요 베이지도 사야하나 고민되네요 ㅋㅋㅋㅋ
apky**|지퍼가 뻑뻑하다는 후기가 많길래 에이 뻑뻑하길래 얼마나 뻑뻑하겠어 했는데 진짜로 넘 뻑뻑하네요  ㅠㅠㅠ 올릴때 너무 힘듬 혼자서는 못올려요... 근데 옷은 날씬해보이고 진짜 이뻐요 재질이 생각보다 좀 더 두꺼워서 가을에 입어야 할듯 하네요 ‭ 그래도 이뻐서 만족!!
yujin52**|1.소재: 면임, 면이라고 명시 되어 있지만 이런 소재일줄 몰랐음! 블라우스 같은 재질이 아니라 정말 일반 면티에 프릴이 마구 달려있는 티셔츠임! 그래서 그런지 금세 늘어날 거 같음!2.색: 생각보다 무난한 보라색임! 연보라색에서 약간 톤다운 된 정도? 쇼핑몰 사진보단 살짝 어두운것 같음3.디자인: 프릴이 많이 달려 있어서 화려한 옷 좋아하는 사람들이 좋아할만한 옷임! 그리고 이거 입고가면 너무 튀어서 다들 어디서 샀냐고 물어봄! ++그리고 목부분이 생각보다 더더더더 많이 파여 있음! 최대한 등쪽으로 넘겨서 입으면 등쪽이 많이 파이고 그 부분이 좀 아쉬움 ㅠ전체적으로 너무 이뻐서 만족하는 옷!
kap**|너무맘에들어요 몸매보정도되고 진짜 길이도 원하는길이라소 블랙도 주문하려구요!! 입어보자마자 재주문해야겠다고 생각했어요
jang0000**|바지 스판으로 진짜 짱짱짱 편해요!! 그리고 반하이라서 다리도 길어보이고 색감은 화면이랑 똑같아서 완전 추천해요.
738445878**|아직 옷을 입고 밖에 나가보지는 않았지만, 집에서 사이즈 본다고 입었는데 딱좋네요 ㅎㅎ 대신 안에 이너로 하나 입어줘야 되네요 ㅠ 옷은 이쁜데 생각보다 기장이 많이 길어서 놀랬어요....ㅋㅋㅋ 일단 이너로 입을거 산다음에 정식으로 입어봐야겠어요 ㅋㅋ
738445878**|이 원피스 정말 이뻐요 ㅎㅎ 결혼식 하객룩으로도 좋구 평소에 입기에도 과하지 않아서 좋아요. 거기에 안감까지 있어서 비침걱정없이 잘 입고 있어요:) 고고싱은 언제나 만족입니당 ㅎㅎㅎ
738445878**|주문한지 쫌 됐는데 ㅎㅎ 늦은후기 올려요~날이 꽤 쌀쌀할때 주문해서 너무너무 잘 입었어요. 새하얀색이 아니고 아이보리라서 어떤 옷에 입어도 잘 어울리더라구요 :) 저는 주로 원피스와 함께 입었습니다 ㅎ
410197535**|아이보리가 생각보다 비침이 심해서 나시랑 같이 입어야 될것같아요. 그거외에는 핏도이쁘고 비치는만큼시원해서 여름에도 입을수있을거같네요ㅎ
hannah23**|나름 이뻐요 그냥 무난하게 적당히 치마에 입고 나가기 좋아요딱히 불편하지도않고 괜찮네요:)
hannah23**|너무 어깨쪽이 많이 파여있어서 부담스러운감이 어느정도 없지않아 있네요 ㅠㅠㅠ손목 묶는 부분도 별로 이쁘게 묶이지도 않아요 ㅠㅠㅠㅠㅠ산거 조금 후회 ㅠㅠ
kjh12**|뱃살 때문에 다이어트 하고 입어야 할거같아요 ㅠㅠ 밴딩있어서 짱 편하고 좋은거 같아요 사이즈도 잘 나온거같아요 다음엔 더 빼서 s 입어야겠어요 고고싱 짱 짱 ❣
kjh12**|색 짱 예뻐요 ㅠㅠㅠ 역시 믿고 사는 고고싱  색 짱 예쁘고 박시해서 좋아요 ㅠㅠ 얇아서 봄 여름 가을 에 입기도 좋은거같아요 짱 짱 배송도 엄청 빨라요 고고싱 최고 #♡#
tngus67**|제가 원하던 보라색이여욯ㅎㅎㅎ ㅎ요즘 퍼플이 유행해서 한번 사봣는데 완전 만족!! 이뿨여 ㅎㅎ
81060174**|흰색 비침도 그리 심하지 않고 예쁘게 잘 입고다녀요!!그래도 흰색이라서 속옷 색깔만 잘 골라입고 나가면 될거같아요 잘입고다닐게요!!!
81060174**|이번에 산거중에 제일 마음에 들어요! 구두를 처음사봤는데 생각보다 발도 편하고 잘신고다녀요 근데 밑창?부분이 벌써 떨어져나갈려고하네요 원래 이런건지 잘 모르겠어요ㅠㅠ
81060174**|색이 조금 짙어요 잘못 건들이면 쉽게 늘어날거같은 재질이라 조심스럽게 입고있어요 ㅋㅋㅋ그래도 만족스럽게 입고있습니당
81060174**|엄청 예뻐요!! 생각보다 색이 조금 짙다? 싶긴한데 데이트할때 잘입고 다녔어요 ㅋㅋㅋ 포토 후기 남기고 싶은만큼 만족스러운데 사진을 잘못찍어서 그냥 후기만 남겨요 ㅋㅋㅋ 정말예뻐요!! 사이즈는 저한테 살짝은 큰거같아요
776097514**|신축성 엄청 좋아여 색상도 맑은 화이트고 길이도 적당하고 하자 난 부분도 없이 좋았어요!!
776097514**|하트 진짜 꿀귀ㅠㅠ 사진에선 하트모양이 선명?하지는 않은데 받으니까 더 괜찮더라구여 가격대비 만족해요!!
776097514**|고고싱 양말은 다 좋은거같아요! 이것도 잘 늘어나고 심플하면서 시크? 해서 검정색 치마나 바지 입을때 매치하면 좋을거같네염
776097514**|생각했던 그대로 색상이었고 잘 늘어나서 좋은거같아요! 심플하고 가격도 다른데랑 비슷하긴해도 싸서 좋았어요 사실 배송비 붙을까봐 산거였는데 좋더라구여!
yyll22**|핏이랑 색이 진짜 이쁜 것 같아요~! 처음 배송 왔을 때 냄새가 조금 났지만 잘 빨면 냄새 바로 빠질 것 같아요! 엄청 튀는 디자인이나 색이 아니어서 편하고 이쁘게 봄 여름 가을에 자주 입고 다닐 예정입니다ㅎ 이쁜 셔츠 감사합니다^^
lsh74**|흑흑 너무 이뻐요 뿌엥ㅜㅜㅜㅜ 저 161/55(요즘살쪄서 더나갈수도)나가는데 뚱뚱인데 이뻐요 뿌엥ㅜㅜㅜㅜ바람불면 앞에 갈라져서 노출되지만 조심하면되요헤헤 팔부분 낑겨서 밥먹다가 머리묶으려고 손들었는데 안되길래 그냥 머리넘기는ㅊㆍㄱ했어요ㅎㅎㅎㅎ헤헤
yyll22**|길이도 딱 맞고, 허리도 짱짱해서 넘 좋습니다!! 그리고 재질이 대박인 것 같아요!! 안 입은 것처럼 편하고 잘 늘어나는데 구김이 없는ㅎ 얇아서 시원하기도 하고 여러모로 운동복이나 편하게 입기에 딱인 것 같습니다! 2개 사길 잘 한 것 같아요ㅎ 있을 때 많이 구비해놔야할 아이템인 것 같습니당^^
yyll22**|품이나 모자 크기 모양도 너무 맘에 들고, 길이랑 색감 재질 다 짱짱입니다ㅎ 남은 색이 라벤더 밖에 안 남아서 라벤더로 구입했는데 너무 이쁜 것 같아욤^^ 기회가 된다면 다른 색들도 사고 싶네요!! 강추입니다ㅎ
yyll22**|이뻐요~!! 길이도 엉덩이를 덮는 딱 좋은 길이이고, 팔도 길어서 좋아요^^ 재질도 두께도 다 맘에 듭니다ㅎ 이쁘고 재질 좋은 운동복 많이 많이 만들어주세요ㅎ 자주 애용하게 될 것 같아욤~!!^^
yyll22**|길이도 딱 좋고 재질도 너무 좋고 가격대비 완전완전 맘에 듭니다!!ㅎ 색깔별로 사야겠다는 생각이 드네요~!!
haeun03**|쇼핑물 사진과 색감이나 핏이 비슷합니당 거의 같아요 입고 나가자마자 다 이쁘다는 소리 들었구영 키 작으면 못입을거 같다는 소리도 들었어요 질질 끌릴거 같다고..ㅋㅋ 그건 길이 잘 재봐서 구매 결정하시면 될거같구 길이나 색감 핏 가격 모두 마음에 듭니당 다만 사고 처음에 입고나가자마자 끈을 잃어버린게 너무 속상하네요ㅜㅜ 끈 달고있으면 조금 여리여리한 느낌이 있는데 아쉽네용..ㅠㅠ
pjh275**|바지 기장은 짧아서 아슬아슬 하지만 예쁩니당!!! 사이즈도 딱 맞구 좋아요!!! 색상도 똑같습니당!!!
kosh19**|딱붙는 재질이 아니어서 좋아요 얇아서 여름에 시원하게 입을수 있을것 같습니다~ 가격대비 잘 산것 같아요~!
pjh275**|진짜진짜 강추요ㅠㅠㅠ 완전 사람 여리여리하게 이뿝니다!!!! 시원하구요 목에있는 리본이 약간 조여보이지만 예뻐요 사세요
kosh19**|옷이 디게 이뻐요^^  그냥 티만 입어도 이쁘고 위에 뷔스티에랑 입어도 이뻐요~! 잘산 것 같습니당!
pjh275**|156키에는 종아리 거의 다 가려지는 기장이예요!! 처음에는 약간 한국무용춰야할 것같지만 ㄷ잘 코디해서 입으면 완전 여자여자 여리여리 합니다 바람 불때마다 샤라락 해서 더더 이뿝니다 강츄!!!!
rhdkfk33**|와서 보니까 생각보다 목부분이 늘어날 걱정 안해도 될 것 같고 또한 크긴하지만 제가 큰걸 좋아하다 보니 괜찮네요!! 잘 입을게요!
57430939**|이번에 청자켓을 사야되겠다고 생각이 들어서 주문하게 됐는데요 생각보다 넉넉하고 처음에 올때 새옷이라서 냄새가 조금 났어요 한두번 세탁하고나서 입으셔야될것같습니다~
57430939**|옷을 살때 가슴둘레를 보고사는데 저한테 사이즈는 맞구요 주변 지인분들이 여성스럽다고 많이 말씀해주셨어요~ 운동화에 같이 코디해서 입어봤는데 이뻐요~
benitov**|부담스럽지 않은 오프숄더에요! 전 검은색 샀는데 튀지도 않고 기본템으로 무난무난하게 잘 입고있어요!
benitov**|검은색 구매했는데 베이직하니 매일 입기 좋아요ㅎㅎ 레터링도 마음에 들어요!! 오프숄더로 입기에 부담스럽지 않구요~
benitov**|고무패드 덕분에 흘러내리지 않아서 좋아요~~~  단화나 운동화 속에 신기 편해서 매일 신고 있어용!!
