smfgk57**|저번에 한번 검은색 구매한적있는데 얇지도 않고 딱 요즘같은 날씨에 입기 좋아서 이번엔 다른색으로 구매할려고 했는데 마침 소라색이 매진이여서 좌절하고 있었는데 문의하니까 다행이도 소량의 재고가 남아있어서 얼른 겟 했습니다!! 인생니트 찾은거같아용^*^
smfgk57**|바지길이가 길줄알았는데 생각했던거보다 제 다리랑 딱 맞아서 좋아요!!고민하고 계신분들은 매진되기전에 얼른 사시는게 나을듯!!!상품평들보고 작을까봐 걱정했는데 딱 맞고 좋아용 항상 인터넷에서 검은색바지 사면 사이즈를 잘못골라서 2개나 실패한적있었는데 앞으로 바지는 고고싱에서 구매할려구요 불편하지도 않고 딱 맞아서 마음에 듭니다!^)^
wyj06**|예쁘고 아주 좋아요~~~봄가을용으로 딱이예요!!그레이 말고 다른 색상들도 구입하고 싶어요!!
nate87**|청치마 사고 싶어서 이곳저곳 다봤는데 맘에 드는게 없더라구요 핏이 맘에 들면 색깔이 맘에 안들고 그랬었는데 고고싱 청치마가 딱 제가 원하는 핏에 색깔이였어요 !! 연청 치고 좀 짙은 감이 있지만 그래도 예뻐요 ㅎㅎ
wldms89**|산책이나 운동할 때 입을 용도로 주문했어요 아직 입어보진 않았지만 무난해서 좋아보이네요~
wldms89**|틔기는 하지만 그만큼 예뻐서 주문했어요! 실제로 봐도 예뻐요 특히 싼 가격에 만족합니다!
wldms89**|옆트임을 포인트로 하는게 마음에 들어서 주문했어요~ 입어보니 편하고 좋아요 만족합니다!
wldms89**|색상보고 주문했어요! 프린트도 틜 정도는 아니라서 만족해요 실제 색상은 사진보단 살짝 진한거같네요
wldms89**|사진 색상만큼 청량함?은 아니지만 만족해요 그보다는 살짝 어두운 민트색이예요 근데 제게는 아빠잠옷같아보일정도로 크긴해요..
wldms89**|스판이 잘되있어서 움직이고 편하고 쫙쫙 늘어나서 좋았어요 다리가 길어보이는 것 같고 좋아요!
wldms89**|입어보니 움직이기도 편하고 색도 사진과 비슷해서 좋았어요 무엇보다도 s샀는데 잘 맞아서 만족해요!
697958651**|실물이랑 다른 옷들이 많은데 같아서 좋았어요 실물도 예뻐요~아쉬운 점이 있다면 속이 비쳐서 속치마 구입했어요ㅎㅎ
eday**|스판이 좋아서 편하게 입기 좋은 스키니임~~무난무난하게 입기 좋을것 같고 생각한것보다 밝긴하지만 정말 무난하게 데일리로 입기 좋아요~스키니 핏도 좋음!
697958651**|다른 속바지와는 다르게 딱 잡아주는 느낌이 있어서 좋았어요 !원피스 속에 입으려고 구입했는데 만족해요ㅎㅎ
755380529**|이뻐요
755380529**|이뻐여
755380529**|조아여
467501075**|제가 보라색을 엄청 좋아하는게 딱 제가 원하는 진보라색입니닿ㅎ 역시나 짧은건 마찬가지... 그래도 색이 이뿌니깐 입을거에요 너무 엉덩이 크지 않으면 웬만하면 맞긴 맞읅듯여
72306080**|보자마자 꽂혀서 샀는데 너무 예뻐요!!!진짜 하나도 안 저렴해보이고 은근 고급져보이기도하고 하여튼 진짜 이뻐요! 어깨는 거의 홀터넥이라 생각하심 될 것 같은데 그것마저 저는 너무 취향저격이라 좋았어용
467501075**|제가 생각한 핏이 딱 나와서 너무 좋았어요!! 팔 길이도 너무 길지도 짧지도 않은 길이고 상체 길이도 그래요!! 옷이 너무 이뻐서 편하게 잘 입을 수 있을것같아요~ 디자인도 이쁩니당ㅎㅎ
dekuu12**|친구랑 같이 구매를 했는데 친구도 너무 이쁘다고 맘에 든다고 하고 고고싱에서 구매 하길 잘했다고 해요! 항상 감사합니다.
dekuu12**|친구랑 같이 구매하는 티예요! 너무 이쁘고 디자인도 너무 맘에 들어요! 올 여름도 고고싱 믿고 삽니다
467501075**|일단 엄청 짧다는 거 아셔야됩니다 엄청 짧아요 이건 거의 뭐 속바지로 입어야될 정도에욬ㅋㅋㅋㅋㅋ제가 운동을 해서 엉덩이가 많이 올라가있는데 이 바지 입으니깐 딱 엉덩이만 가려져요.. 허벅지로 내려오는 천이 거의 없어..암튼 무난하게 좋아요
dekuu12**|소라색은 왠만해서는 안사는데 디자인이 맘에 들어서 구매를 했는데 역시 구매 하기를 잘했어요!
dekuu12**|사진 보다 실물이 더 이뻐요 무난하게 입을수 있는 오프숄더라서 좋고 리본이 포인트! 너무 이뻐요
dekuu12**|반바지 진짜 계속 애용하고 있어요! 너무 맘에 들고 편하고 올 여름에 계속 찾을 반바지예요 반바지도 역시 믿고 사는 고고싱
467501075**|운동할 때 편하게 입으려고 저렴하길래 샀는데 괜찮아요!! 레깅스에 반바지 입으면 이쁠것같아요!! 이 가격에 이정도 레깅스면 살만 합니당ㅎㅎ 걸을때도 편하두 좋아요~
dekuu12**|진짜 실물 갑! 베이비돌은 잘 안사는덴 이뻐서 구매를 했는데 구매 하길 잘한거 같아요! 고고싱 항상 감사합니다.
dekuu12**|진짜 실물 갑! 너무 이쁘고 맘에 들어요! 제가 원하는 스타일의 뷔스티에 투피스를 찾아서 너무 좋아요 역시 믿고 사는 고고싱
467501075**|배송은 되게 늦게 와서 속상했어요.. 상품을 딱 봤을때 구김이 상당히 심해서 좀 놀랬어요 다림질을 해야되나 싶었는데 엄마가 린넨 소재는 원래 그런 느낌으로 입는거래서 그냥 입을려구용 실제로 입어보니깐 자켓느낌보다는 그냥 어깨쪽이 각진 남방느낌..? 솔직히 이 가격이 이 옷을 사는건.. 좀...? 사진같은 옷의 느낌은 안난다고 보시면 되용
aofurw**|오래입을 수 있는 티는 아니에요. 몇번빨면 늘어날 것 같아요. 그냥 가격만큼 입을 수 있는???그리고 냄새 완전심해서 빨아서 입어야해용.. 다른건 안그러던데 이 티만 유독 냄새가 심하더라구요.
aofurw**|ㅅ색도 너무 이쁘고, 핏도 원하던 느낌이라 너무 좋아요. 확실히 레드계열이라 많이 싼티나지도 않고  슬랙스에 입어도 캐주얼핏으로 딱
aofurw**|저의 개인적인생각으로는... 바스트가 없으신 분들에게는 권장드리지 않습니다....ㅜㅜ 완전 마르핏이고 아담하시면 다르겠지만..바스트가 눌려보인다랄까요? 큰사람도 부해보이지않고 좀 눌려보이는 느낌이에요... 표현하기 그렇지만.. 그래서 바스트사이즈가 좀 있는 친구에게 줘버렸습니다...ㅜㅜ슬프네요. 옷은 화면과 같고 여름에 입기 시원한 그런 느낌이에요.
cglov**|예쁘고 말라보야요 블랙샀는데 예뻐요여름에 예쁠듯 ㅠㅠ 소매도 짱짱해요다른색도 사고싶어요~~~~ 시원한 재질이에요
tmfrl07**|너무짤벵여 ㅋㅋㅋㅋㅋㅋㅋㅋ이쁘긴한긋 ㅎㅎㅎㅎ 엠치곤좀작게나온거같아요 ㅋㅋㅋ이뻐요 ㅋㅋㅋㅋㅋㅋㅋ
tmfrl07**|하냔색필요해서삿습미다 ㅋㅋㅋㅋ이쁩니다 ㅋㅋㅋㅋㅋㅋㅋㅋㅋㅋㅋㅋㅋㅋㅋㅋㅋㅋ구겨졋네요좀ㅋㅋ이뻐요
tmfrl07**|ㅋㅋㅋㅋㅋㅋㅋ레깅스필요해서삿느네너무조아욮ㅋㅋㅋㅋㅋㅋㅋ길이도딱이에요좋습니닼ㅋㅋㅋㅋㅋㅋㅋㅋㅋㅋ
tmfrl07**|E기본단가라ㅝㄹ여해서삿는데 조아요 ㅋㅋㅋ근데너무얇네요 여름에입기보아욬ㅋㅋㅋㅋㅋㅋㅋㅋㅋㅋㅋㅋ
56976080**|가슴 쪽이 좀 끼고 확실히 팔 움직이기 불편하긴 하더라구요 길이도 딱맞고 다 좋은데 확실히 상체가 불편해요. 조심해서 입어야겠고 생각보다 많이 파였어요. 후크 걸어도 벌어지는것도 있고 진짜 마른사람이 입으면 좀 편하게 입지 않을까 싶어요.
56976080**|초여름까지 ㅇ입을 수 있는 두께이긴 한데 색감은 가을가을해요 그래도 이 가격에 나름 무난하게 입을 수 있는 옷이라 괜찮은것같아요. 막 예쁘다거나 그렇진 않고 그냥 사진대론데 사진으로 볼때보다 좀 더 흐물거리는 느낌이 있었어요
56976080**|허리선이 조금 높이있고 리본은 타이트하게 꽉묶는게 예뻐요! 사진으로 보면 쨍하게 예쁜 빨간색같은데 아니고 진짜 그냥 와인색이구요 빨때 주의하실점은 반드시 단독세탁 해주세요! 흰옷이랑 같이 빨았더니 물빠짐 너무 심해서 다 물들었어요,,
kna12**|니트라고해서 보풀 일어날까 걱정했는데 생각보다 탄탄한 느낌입니당 비침이 생각보다 적어서 좋고 요즘 날씨에 입기 딱 좋을 것 같습니다ㅎ 이 옷 때문에 배송이 좀 늦어졌는데 예뻐서 너무 만족합니다
kna12**|처음에 뒤에 지퍼있는줄 모르고 바보같이 낑낑대면서 입었네용ㅋㅋ 색도 마음에 들고 하늘하늘해서 예쁜데 허리가 뭔가 부해보여요 마른 분들이 입으면 정말 예쁠 것 같습니다ㅎ 원피스 평소에 잘 안입어서 살까말까 했는데 사길 잘한 것 같아요!
linda0**|제가 키가 작아서 길이 적당한 원피스 찾기가 쉽지 않은데 이건 딱 적당하고 좋아요!! 그리고 사이즈도 편하게 잘 맞아서 아주 잘 입고 다닐 것 같아요♥ 한 가지 아쉬운 점은, 제가 뱃살이 많은데 허리끈이 가슴 바로 밑에 있어서 그런지 뱃살이 더 돋보이는 것 같아요....ㅠㅠㅠ허리끈이 조금만 더 아래쪽에 있었으면 좋았을텐데ㅠㅠㅠ 그래두 고고싱에서 같이 산 가디건이랑 입으니까 뱃살도 가려주고 맘에 들어요♥
kna12**|올드해보일까 걱정하면서 살까말까 고민했는데 기대 이상으로 예쁩니다 이번에 옷 많이 샀는데 제일 마음에 들어요! 하늘하늘해서 여름에 시원하게 입을 것 같네용 도트가 꽃무늬같으면서 은근 귀여워용
kna12**|앞에 조그만 프린트도 귀엽고 뒤에도 귀엽습니당  어깨부분이 신경쓰인다는 후기를 봤는데 뭔가 뾰족하다고 해야되나 그런 느낌이긴한데 옷이 너무 커서 뒤로 밀려가서 그럼 것 같네용 그래도 너무 마음에 들고 프린팅 안 없어지게 등 기댈 때 조심해야할 것 같습니다~
jsua09**|가격에비해 완전 예뻐요
jsua09**|맘에들어욤
jsua09**|색감이 좀 별로였자만 괜찮았어여
candy0305**|사진그대로 똑같이 생겼어용 평범한티에 입어도 멜빵으로 포인트를 줄수있어서 너무좋은거같아요 귀여워보이고활기발랄해보인답니당:)
jsua09**|예뻐용
ppp51**|밑단이 설명할 수 없게 좀 뭐랄까 .. 덜 헤졌다고 해야할까 .. 그래도 색이 이뻐서 잘 입을 것 같아요 ㅎㅎ♡
candy0305**|진짜 이 원피스 여성스러워보이고 귀여워보여요 시원해보이고 중간에 허리끈으로리본맬수있어서 허리도슬림해보이게입을수있어요얼굴도 화사래보이고 팔부분이 여리여리해서 팔뚝살도얇아보여용특별한날놀러갈때입기좋은것같습니당
haaaa**|딱 보자마자 색도 예쁘고 해서 샀는데 실물이 더 예뻐요 레터링도 과하지 않아서 잘 입고 다일듯 합니다
haaaa**|그냥 예뻐요 편해 보기이기도 하고 너무 심플하지도 않아서 딱 좋아요 잘 입고 돌아다닐듯 해요
linda0**|아이보리 계열 가디건이 갖고 싶었는데 마침 고고싱에서 세일하길래 저렴하게 장만했어요♥색상,핏,길이 다 진짜 완전 마음에 들어요!!! 색상이 너무 하얀색이면 뭐 묻을까봐 부담스러워서 잘 못입고 다니는데 이건 아이보리와 베이지 사이랄까 그래서 밝지만 입고 다니기에 부담스럽지 않은 색이라서 좋았어요! 단추 풀고 입어도 예쁘고 잠그고 입어도 예뻐요~~ 꽈배기 패턴이라서 심심해 보이지도 않고 특히 원피스에 걸쳐 입으면 어디든 무난하게 다 잘 어울릴 것 같아요!
haaaa**|존예 보스 다행히 입고가 빨리 되어서 빨리 받았는데 걍 세상 예쁨 다른색 있었으면 샀을거예여
haaaa**|세상편한거 인정이예요 진짜 여름에 어디 잠깐 외출할땨 완전 편하게 입을 수 있는 바지에요 주름은 좀 가지만
haaaa**|저한테는 좀 컸어요~~ 그래더 색도 예쁘고 보라색이라서 잘 산것 같아요 흔하지 않은 느낌입나다
smile**|길이가 길까봐 많이 걱정했는데 딱 이쁜길이고 150대부터 160대까지 이쁘게 입을 수 있을거 같습니다! 색깔도 이쁘고 지금 날씨에 입기 딱 좋아요ㅎㅎ 찢어져서 교환요청했었는데 빠르게해결해주셔서 감사합니다~ 앞으로도 자주애용하겠습니다ㅎㅎ
ppindo**|조금 짧은감이 있긴 하지만 좋아요~ 시원한재질이라서 좋네요레드랑 베이지 고민했는데 하나 더살까 고민중입니다
dms58**|옷 너무너무 이쁩니다~~ 기장은 약간 짧을 수 있는데 알고 산거라서 괜찮아요ㅎㅎ 처음 시켰을 때 실밥이 풀려있어수 교환 요청했는데 정말 빠르고 친절하게 교환해주셨습니다 완전 만족해용!!
rainnyb**|좋아좋아좋아요 이뼈요 가격에 비해 찐자 좋아요 ㅎㅎㅎㅎ 디자인도 만족합니다 ^^  다음에도 고고싱  이용하겠습니다
heo05**|브라운 색상이 품절되가지고 아이보리 색 샀는데 너무 이뻐요~지금 날씨에 입기 딱 좋아요~~~
heo05**|허리 사이즈가 약간 크기는 한데 기장이랑 폭이랑 딱 원하던 핏이여서 좋아오~~얇아서 지금 입기 좋아요!
heo05**|색깔이 사진에서 나온 것처럼 예뻐용~~~약간 사이즈가 크기는 한데 널널하게 입기 좋아요!!!!
23625788**|이뻐요!! 상체가 66이아 어깨선이 아래인 셔츠 잘못 입으면 더 부해보일수도 있는데 이건 어깨선도 적당하고 이뻐요^^
23625788**|완전 싸게 잘 산거 같아요^^  초여름까지 입을수있을거 같아요^^ 가격비해 품질이 정말 좋은거 같아요.  사이즈가 66인데 넉넉하게 입을수 있어요.
23625788**|완전 이뻐요ㅠㅠ 언발이라 더이쁜거 같아요^^ 여름만 되면 뷔스테에 원피스가 생각나서 자주 입게 될거 같아요
25219115**|진짜 정말 예뻐요 길이도 예쁜 롱기장이고  상채쪽이 조금 터이트래서 라인잡아줘서 예뻐요
fkdk06**|왔을때는 너무 작아보여서 안맞을것같았는데 입어보니까 이게 왠걸 너무 이뻐요!! 딱 적당히 무릎 아래까지 내려오는데 비치는 재질이라 너무 길어보이지도 않고 팔부분하고 아래쪽만 시스루라 피마에 신경안쓸정도에요! 강추!!
rudal55**|M사이즈만 구매해서 맞겠거니하고 배송시켰더니 아주 딱맞습니다. 엉덩이가 부담스러울 정도로 딱맞네요 그래도 살 주름은 안집니다. 이쁘게 딱맞아요 입고 다니다보니 그렇게 편할 수 없어요 그냥 사서 입어보세요 후회안합니다
kimhy11**|가방이 가벼워서 ㅈ들고 다니기 편했어요
minglee**|핏도 적당하고 길이도 적당해서 여름에 입고 다니기 좋을것 같아요! 점점 날도 더워지고있는데 자주 입고 다닐것 같아요. 이뻐요!
rudal55**|바지가 공기청정기마냥 먼지를 빨아들이는것 같습니다. 사이즈도 스판도 핏도 다 맘에 드는데 먼지가 많이 붙는 재질인거같은데 제 기분탓일수도 있습니다. 그 외엔 좋습니다. 잘 입고 있어요~
rudal55**|저는 솔직히 별로입니다...허리 밴드에서부터 차르륵 자연스럽게 떨어지는 치마를 원했는데 제가 입으니 부해보이더군요.. 그렇다고 코디를 이상하게 한것도 아닌데 상의를 몇번이나 바꿔입었는데도 모델핏은 커녕 구린핏입니다ㅜ 사놓고 안입고 있어요 이 제품말고 다른 롱스커트 많습니다. 다른예쁜제품 구매하세요
rudal55**|다른옷 구매한김에 중목양말도 샀는데 발목을 감싸는 느낌이 좋습니다. 너무 타이트하지도 않고 그렇다고 쉽게 늘어나는 것도 아닙니다. 중목양말 필요하시면 여기서 한번에 사세요
tsuki04**|지금 입기 딱 좋아요~!~!~!~!~! 라임색도 사진이랑 똑같구화사해서 봄 그 자체예요! 역시 니트는 고고씽!!!!!!! 만족합니다
kkkyhs9**|허리에 밴딩이 있어서 입기 넘 편하고 재질도 보들보들해서 정말 딱 좋아요!좀 얇은 감이 있어서 여름에 입기도 딱이네요 ㅎㅎ
flowerhj**|사진에서 보는거랑 똑같습니다~이뻐요! 요즘 날씨에 입기딱 인거 같습니다청바지랑 잘 어울려요
flowerhj**|사진에서 보는거랑 똑같습니다 만족스러워요 ㅎㅎ스트라이프라서 어느 옷이랑코디도 쉬워서 좋습니다~
flowerhj**|너무 이뻐요~사진에서 보는거 그대로 입니다!지금 날씨에 입으면 딱일거 같아요 ㅎ코디도 매우 쉬워서 좋습니다
jeje05**|생각보다 길고 두께가 있었는데 아이보리라기보다는 흰색같았어요 그래서 두께살짝 잇으니깐 속옷 비추는것도 덜할꺼같고 두께가 더울정도의 두께는 아니여서 요즘날씨에 입기좋을꺼같아요
jeje05**|생각보다 더 부츠컷이라 놀랐는데 입어보니 괜찮았어요! 스판도 적당해서 입기편하고 긴바지여도 연청이라 요즘날씨에도 계속 입기 좋을거같아요
jeje05**|블루색상으로 구매했는데 색도 예쁘고 핏도 예뻐여!!무난하게 기본템으로 입고다니기 편할꺼같아요~
jeje05**|요즘같이 애매한 날씨에 저녁에 입으려고 깔끔한색으로 샀어요!!! 핏도 예쁘고 두께도 적당해서 가을까지도 계속 입을수있을거같아요~
jeje05**|지금은 더워서 못입고 가을쯤에 입으려고 미리 샀어요!! 생각보다 길이가 짧았는데 입어보니깐 이상할정도는 아니고 예뻐요!!
jeje05**|아이보리색상으로 구매했는데 가죽냄새도 아니고 이상한 냄새가 너무많이나서 베락다에 널어뒀어요.. 하루지났는데도 냄새는 아직 하나도 안바졌구요.. 크기나 색상은 사진그대로 똑같습니다
jeje05**|라이트베이지로 구매했는데 색상도 이쁘고 핏도 예뻤지만 주름이 장난아니네요... 린넨이라서 충분히 주름 잘생기는건 알지만 입기도전에 완전 쭈글쭈글.... 택배받자말자 새거인데도 입으려면 다리미질 필수에요!!!!
olxmro**|가격이 착해서 원단이 안좋을줄 알았는데 엄청 고급스럽고 촘촘해요!!!기장도 너무 길지 않아서 아무 옷이나 코디해도 괜찮을것 같아요 ㅎㅎ간절기에 입기 딱이라 검정도 같이 구매했는데 ㅎㅎ 잘입고 다닐것 같아용
772457274**|옷 싸게 잘샀고 무난하게 입을 수 있는것 같아요~ 옷도 얇아서 시원해서 맘에 들어요
olxmro**|다른건 세탁을 하게 되면 흘러내리고 신발안에 있고 그런데 이건 세탁해도 흘러내리지 않아서 다른분들한테도 추천 해드려서 더 구매하게 됬어요 ㅎㅎ추천 받으신분들도 더 사다달라고 부탁하시더라구요 ㅎㅎ
olxmro**|와 바지 너무 이뻐영리뷰가 하나도 없어서 망설였는데 스판도 되게 좋고 찢어진게 딱 제스타일이에요!!167에 52키로인데 기장도 길지도 짧지도 않은 기장이라 제맘에 쏙 들어요!!고고싱에서 산 티셔츠랑 가디건이랑 코디했어용!!연청바지 사고 싶어서 보다가 이게 딱 맘에 들어서 구매 했는데 구매하길 잘했네요약간 하이스타일이구요 제가 바지를 사면 허리만 큰데 이건 허리도 딱 맞고 좋아요!색상이 그래이 처럼 나왔는데 연청 맞아용!!
772457274**|스판없어요ㅠ 여름에 입을려고 산 바지인데 겨울용 같아요 진짜 너무 더워요 오늘 입고 왔는데 더워 죽겠어욥ㅋㅋㅋㅋㅋ
glwlw**|친구가 제꺼 보고 똑같은 거 시켰어요  검은색도 살 예정이예요 ㅎㅎ
397595409**|한달만에 받아본것같아요 기다린만큼 너무이뻐요 ㅠㅠ
jojo01**|오아시스 그린으로 샀는데 색깔 진짜 너무이뻐여ㅠㅠㅠㅠㅠㅠ기장도 딱이고 품도딱입니당!! 더워져서 못입겠지만....또르르... 얼른 가을이 오길 바래봅니다 ㅎㅎㅎ다들 그린사세요 ㅠㅠㅠㅠ
7586208**|고고싱에서 처음사요 좋아요 놀러가려고 샀어요~~~~키가작아서 길이감은 적당한것 같아요키크신분은  짧다고 느껴지실듯
laln0621**|후기가 좋아서 샀는데 허리가 조금 작아서 살좀더 빼고 입어야되요 근데 색은 정말 이뻐요!! 중간에 찢어진 것도 이쁘고요 길이는 좀 짧은감이 있어서 여름에 입는게 좋을것같아요
17702467**|티셔츠 재질인데 앞이 다 단추였네요잘 안보여서 몰랐는데 ㅎㅎ그래도 맘에 들어요! 잘입을게요~
17702467**|허리가 살짝 작네요제가 워낙 하비라...살을 빼고 입든지 해야할 것 같아요재질은 맘에 듭니다
17702467**|살짝 커요그래도 바스락바스락 재질도 시원하고맘에 들어요가격대비 맘에 듭니다!잘입을게요
2056918154597022**|싸고 예뻐보여서 배송비 없애려고 고른건데 의외의 대박템ㅇㅂ니다..! 지금 학교가는데 교복 안에 입었어요! 밖에 나갈때 청바지에 입어도 예쁘고. 치마에 입어도 예뻐요❤️
twtwlo**|티가 안크고 적당하게 나와서 좋아요!!! 잘 입을께요
twtwlo**|밑단이 넉넉하게 나와서 좋아요!! 롤업해서 입어도 예쁘고 그냥 입어도 예뻐요ㅎㅎ
twtwlo**|화면에서 보는 그대로에요ㅎㅎ 연청색바지랑 입으니까 진짜 화사해보이고 좋아요
twtwlo**|세일해서 산건데 생각보다 괜찮아요. 색도 예쁘구요. 더운여름에 입기 딱이네요
twtwlo**|색도 예쁘고 티도 너무 안커서 좋아요~ 잘 입을께요
twtwlo**|티가 넘넘 귀여워요ㅎㅎ 입으니까 발랄한 느낌도 나구요ㅎㅎ
twtwlo**|화면에서 보는 그대로에요~ 잘입을께요
lhj06**|기본양말이 필요했었는데 너무 저렴한 가격에 잘 산거같아요.고고싱에서 옷살때마다 하나씩 살예정입니다 !
lhj06**|팔통이생각했던 것 보다 컸는데 잘 조절해서 입으니까 이쁜 여리핏이에요 ! 네이비색 넘 이쁘구 슬랙스에다 입으니까 이쁘더라구요. 마른편이라 너무 크면 어쩌나 걱정했는데 막상 입어보니까 제가 좋아하는 박시하면서 여리여리한느낌이었어요
lhj06**|제가 좀 많이 마른편이라서 s랑xs중에 뭘 살지 고민많이했었는데 xs사니까 너무 예쁜 슬림핏이에요 !
wide4**|생각보다 짧지도 않고 색감도 이쁘네요 편하게 입을 수잇구 자연스런 코디도 할 수잇을것 같아요!! 이뻐요 다른색도 살까 고민중이에요
34649682**|색상도 너무 이쁘고 리본이 포인트가 되서 너무 귀여워요 데이트할때 입어야겠어요!!~~~~~
34649682**|면도 괜찮구 핏도 이쁘고 편히게 자주 입을것같아요!!~~
id05**|이거늘어나는재질절대아니고탄탸튼튼 베이직티입니당 길이도살짝박스티예쁜핏어따 다입어도 그런티  진짜이뿜 블랙삿는데 화이트도살걸..데일리로암곳어나어울리는티 이뻐여 시워나게입을수잇어용
yeahe**|색상도 이쁘고 소매도 이쁜데 단추부분이 아쉬워요 세탁을 잘 못해서 그런지는 몰라도 입으니까 단추부분이 울어요... 마치 꽉 끼는 옷입은거처럼요... ㅇ...왜죠...?ㅠ그리고 저같이 어깨없는분들은 흘러내리는거 감안하고 사셔야할 것 같아요ㅠ 옷이 액체처럼 줄줄 흘러내려요....
yeahe**|이런류 원피스가 이미 많은데 나오자마자 뭐에 이끌린듯이 샀네용ㅋㅋ본거랑 똑같이 입은거도 예뻐요. 앞이 좀 많이 파지긴 했는데 체구가 작아서 그런가 딱히 벌어지거나 하지도 않고 볼륨감 있어보이는 핏이어서 좋아요. 다만 허리부분이 좀 여유가 있어서 허리를 조이는 핏을 원하는 분들은 따로 고정하고 입어야 할듯해요. 일단 무늬가 넘 예뻐서 그거 하나만으로도 살 가치가 있는 옷!!!
yeahe**|비치는 얇은 여름용 블라우스 입을때 안에 입기에 좋아요두께감이나 착용감도 좋은거같아요근데 길이가 좀 길은면이 없지 않아 있어요ㅠ 제가 키가 작아서 그런걸 수도 있지만요...ㅠ
dndb62**|완전 기본 티에요 ! 기장도 괜찮은 것 같아요 ㅎ 저는 기본티가 없어서 맨날 사야지 사야지 했는데 이제서야 사네용 ㅠ 이뻐욤 !
dndb62**|색 진짜 잘 빠졌어요 택배가 일찍 와서 나갈때 입고 나갔는데 다들 이쁘다고 잘 샀다고 했어요 ㅎㅎㅎ 추천추천
dndb62**|사진 보고 이뻐서 샀는데 제가 생각했던 핏은 제대로 안나오는 것 같아요ㅠㅠㅠ 그래도 색도 잘 빠지고 사이즈도 잘 맞아서 이쁘게 매치해서 입을려구용 !
dndb62**|연청이 되게 이뻐요 ! 사이즈도 딱 맞고 허리 잘 잡아줘서 좋은 것 같아요 ㅎ 근데 키가 작은 저에게도 좀 짧아서 잘 가리고 입어야겠어오ㅠㅠㅠ
opop88**|저렴하고 코디 다 잘어울려서 좋아요!근데 어깨뽕이 없었으면 더 좋았을거같아요ㅠㅠ
